{
  "address": "0xEB50F151484A64b972747f31E6483C6463e32cc1",
  "abi": [
    {
      "anonymous": false,
      "inputs": [
        {
          "indexed": true,
          "internalType": "address",
          "name": "owner",
          "type": "address"
        },
        {
          "indexed": true,
          "internalType": "address",
          "name": "spender",
          "type": "address"
        },
        {
          "indexed": false,
          "internalType": "uint256",
          "name": "value",
          "type": "uint256"
        }
      ],
      "name": "Approval",
      "type": "event"
    },
    {
      "anonymous": false,
      "inputs": [
        {
          "indexed": true,
          "internalType": "address",
          "name": "authorizer",
          "type": "address"
        },
        {
          "indexed": true,
          "internalType": "bytes32",
          "name": "nonce",
          "type": "bytes32"
        }
      ],
      "name": "AuthorizationCanceled",
      "type": "event"
    },
    {
      "anonymous": false,
      "inputs": [
        {
          "indexed": true,
          "internalType": "address",
          "name": "authorizer",
          "type": "address"
        },
        {
          "indexed": true,
          "internalType": "bytes32",
          "name": "nonce",
          "type": "bytes32"
        }
      ],
      "name": "AuthorizationUsed",
      "type": "event"
    },
    {
      "anonymous": false,
      "inputs": [
        {
          "indexed": true,
          "internalType": "address",
          "name": "_account",
          "type": "address"
        }
      ],
      "name": "Blacklisted",
      "type": "event"
    },
    {
      "anonymous": false,
      "inputs": [
        {
          "indexed": true,
          "internalType": "address",
          "name": "newBlacklister",
          "type": "address"
        }
      ],
      "name": "BlacklisterChanged",
      "type": "event"
    },
    {
      "anonymous": false,
      "inputs": [
        {
          "indexed": true,
          "internalType": "address",
          "name": "burner",
          "type": "address"
        },
        {
          "indexed": false,
          "internalType": "uint256",
          "name": "amount",
          "type": "uint256"
        }
      ],
      "name": "Burn",
      "type": "event"
    },
    {
      "anonymous": false,
      "inputs": [
        {
          "indexed": true,
          "internalType": "address",
          "name": "newMasterMinter",
          "type": "address"
        }
      ],
      "name": "MasterMinterChanged",
      "type": "event"
    },
    {
      "anonymous": false,
      "inputs": [
        {
          "indexed": true,
          "internalType": "address",
          "name": "minter",
          "type": "address"
        },
        {
          "indexed": true,
          "internalType": "address",
          "name": "to",
          "type": "address"
        },
        {
          "indexed": false,
          "internalType": "uint256",
          "name": "amount",
          "type": "uint256"
        }
      ],
      "name": "Mint",
      "type": "event"
    },
    {
      "anonymous": false,
      "inputs": [
        {
          "indexed": true,
          "internalType": "address",
          "name": "minter",
          "type": "address"
        },
        {
          "indexed": false,
          "internalType": "uint256",
          "name": "minterAllowedAmount",
          "type": "uint256"
        }
      ],
      "name": "MinterConfigured",
      "type": "event"
    },
    {
      "anonymous": false,
      "inputs": [
        {
          "indexed": true,
          "internalType": "address",
          "name": "oldMinter",
          "type": "address"
        }
      ],
      "name": "MinterRemoved",
      "type": "event"
    },
    {
      "anonymous": false,
      "inputs": [
        {
          "indexed": false,
          "internalType": "address",
          "name": "previousOwner",
          "type": "address"
        },
        {
          "indexed": false,
          "internalType": "address",
          "name": "newOwner",
          "type": "address"
        }
      ],
      "name": "OwnershipTransferred",
      "type": "event"
    },
    {
      "anonymous": false,
      "inputs": [],
      "name": "Pause",
      "type": "event"
    },
    {
      "anonymous": false,
      "inputs": [
        {
          "indexed": true,
          "internalType": "address",
          "name": "newAddress",
          "type": "address"
        }
      ],
      "name": "PauserChanged",
      "type": "event"
    },
    {
      "anonymous": false,
      "inputs": [
        {
          "indexed": true,
          "internalType": "address",
          "name": "newRescuer",
          "type": "address"
        }
      ],
      "name": "RescuerChanged",
      "type": "event"
    },
    {
      "anonymous": false,
      "inputs": [
        {
          "indexed": true,
          "internalType": "address",
          "name": "from",
          "type": "address"
        },
        {
          "indexed": true,
          "internalType": "address",
          "name": "to",
          "type": "address"
        },
        {
          "indexed": false,
          "internalType": "uint256",
          "name": "value",
          "type": "uint256"
        }
      ],
      "name": "Transfer",
      "type": "event"
    },
    {
      "anonymous": false,
      "inputs": [
        {
          "indexed": true,
          "internalType": "address",
          "name": "_account",
          "type": "address"
        }
      ],
      "name": "UnBlacklisted",
      "type": "event"
    },
    {
      "anonymous": false,
      "inputs": [],
      "name": "Unpause",
      "type": "event"
    },
    {
      "inputs": [],
      "name": "CANCEL_AUTHORIZATION_TYPEHASH",
      "outputs": [
        {
          "internalType": "bytes32",
          "name": "",
          "type": "bytes32"
        }
      ],
      "stateMutability": "view",
      "type": "function"
    },
    {
      "inputs": [],
      "name": "CLAIM_AMOUNT",
      "outputs": [
        {
          "internalType": "uint256",
          "name": "",
          "type": "uint256"
        }
      ],
      "stateMutability": "view",
      "type": "function"
    },
    {
      "inputs": [],
      "name": "DOMAIN_SEPARATOR",
      "outputs": [
        {
          "internalType": "bytes32",
          "name": "",
          "type": "bytes32"
        }
      ],
      "stateMutability": "view",
      "type": "function"
    },
    {
      "inputs": [],
      "name": "OWNER",
      "outputs": [
        {
          "internalType": "address",
          "name": "",
          "type": "address"
        }
      ],
      "stateMutability": "view",
      "type": "function"
    },
    {
      "inputs": [],
      "name": "PERMIT_TYPEHASH",
      "outputs": [
        {
          "internalType": "bytes32",
          "name": "",
          "type": "bytes32"
        }
      ],
      "stateMutability": "view",
      "type": "function"
    },
    {
      "inputs": [],
      "name": "RECEIVE_WITH_AUTHORIZATION_TYPEHASH",
      "outputs": [
        {
          "internalType": "bytes32",
          "name": "",
          "type": "bytes32"
        }
      ],
      "stateMutability": "view",
      "type": "function"
    },
    {
      "inputs": [],
      "name": "TRANSFER_WITH_AUTHORIZATION_TYPEHASH",
      "outputs": [
        {
          "internalType": "bytes32",
          "name": "",
          "type": "bytes32"
        }
      ],
      "stateMutability": "view",
      "type": "function"
    },
    {
      "inputs": [
        {
          "internalType": "address",
          "name": "_to",
          "type": "address"
        },
        {
          "internalType": "uint256",
          "name": "_amount",
          "type": "uint256"
        }
      ],
      "name": "allocateTo",
      "outputs": [],
      "stateMutability": "nonpayable",
      "type": "function"
    },
    {
      "inputs": [
        {
          "internalType": "address",
          "name": "owner",
          "type": "address"
        },
        {
          "internalType": "address",
          "name": "spender",
          "type": "address"
        }
      ],
      "name": "allowance",
      "outputs": [
        {
          "internalType": "uint256",
          "name": "",
          "type": "uint256"
        }
      ],
      "stateMutability": "view",
      "type": "function"
    },
    {
      "inputs": [
        {
          "internalType": "address",
          "name": "spender",
          "type": "address"
        },
        {
          "internalType": "uint256",
          "name": "value",
          "type": "uint256"
        }
      ],
      "name": "approve",
      "outputs": [
        {
          "internalType": "bool",
          "name": "",
          "type": "bool"
        }
      ],
      "stateMutability": "nonpayable",
      "type": "function"
    },
    {
      "inputs": [
        {
          "internalType": "address",
          "name": "authorizer",
          "type": "address"
        },
        {
          "internalType": "bytes32",
          "name": "nonce",
          "type": "bytes32"
        }
      ],
      "name": "authorizationState",
      "outputs": [
        {
          "internalType": "bool",
          "name": "",
          "type": "bool"
        }
      ],
      "stateMutability": "view",
      "type": "function"
    },
    {
      "inputs": [
        {
          "internalType": "address",
          "name": "account",
          "type": "address"
        }
      ],
      "name": "balanceOf",
      "outputs": [
        {
          "internalType": "uint256",
          "name": "",
          "type": "uint256"
        }
      ],
      "stateMutability": "view",
      "type": "function"
    },
    {
      "inputs": [
        {
          "internalType": "address",
          "name": "_account",
          "type": "address"
        }
      ],
      "name": "blacklist",
      "outputs": [],
      "stateMutability": "nonpayable",
      "type": "function"
    },
    {
      "inputs": [],
      "name": "blacklister",
      "outputs": [
        {
          "internalType": "address",
          "name": "",
          "type": "address"
        }
      ],
      "stateMutability": "view",
      "type": "function"
    },
    {
      "inputs": [
        {
          "internalType": "uint256",
          "name": "_amount",
          "type": "uint256"
        }
      ],
      "name": "burn",
      "outputs": [],
      "stateMutability": "nonpayable",
      "type": "function"
    },
    {
      "inputs": [
        {
          "internalType": "address",
          "name": "authorizer",
          "type": "address"
        },
        {
          "internalType": "bytes32",
          "name": "nonce",
          "type": "bytes32"
        },
        {
          "internalType": "uint8",
          "name": "v",
          "type": "uint8"
        },
        {
          "internalType": "bytes32",
          "name": "r",
          "type": "bytes32"
        },
        {
          "internalType": "bytes32",
          "name": "s",
          "type": "bytes32"
        }
      ],
      "name": "cancelAuthorization",
      "outputs": [],
      "stateMutability": "nonpayable",
      "type": "function"
    },
    {
      "inputs": [
        {
          "internalType": "address",
          "name": "",
          "type": "address"
        }
      ],
      "name": "claimed",
      "outputs": [
        {
          "internalType": "bool",
          "name": "",
          "type": "bool"
        }
      ],
      "stateMutability": "view",
      "type": "function"
    },
    {
      "inputs": [
        {
          "internalType": "address",
          "name": "minter",
          "type": "address"
        },
        {
          "internalType": "uint256",
          "name": "minterAllowedAmount",
          "type": "uint256"
        }
      ],
      "name": "configureMinter",
      "outputs": [
        {
          "internalType": "bool",
          "name": "",
          "type": "bool"
        }
      ],
      "stateMutability": "nonpayable",
      "type": "function"
    },
    {
      "inputs": [],
      "name": "currency",
      "outputs": [
        {
          "internalType": "string",
          "name": "",
          "type": "string"
        }
      ],
      "stateMutability": "view",
      "type": "function"
    },
    {
      "inputs": [],
      "name": "decimals",
      "outputs": [
        {
          "internalType": "uint8",
          "name": "",
          "type": "uint8"
        }
      ],
      "stateMutability": "view",
      "type": "function"
    },
    {
      "inputs": [
        {
          "internalType": "address",
          "name": "spender",
          "type": "address"
        },
        {
          "internalType": "uint256",
          "name": "decrement",
          "type": "uint256"
        }
      ],
      "name": "decreaseAllowance",
      "outputs": [
        {
          "internalType": "bool",
          "name": "",
          "type": "bool"
        }
      ],
      "stateMutability": "nonpayable",
      "type": "function"
    },
    {
      "inputs": [
        {
          "internalType": "address",
          "name": "spender",
          "type": "address"
        },
        {
          "internalType": "uint256",
          "name": "increment",
          "type": "uint256"
        }
      ],
      "name": "increaseAllowance",
      "outputs": [
        {
          "internalType": "bool",
          "name": "",
          "type": "bool"
        }
      ],
      "stateMutability": "nonpayable",
      "type": "function"
    },
    {
      "inputs": [
        {
          "internalType": "string",
          "name": "tokenName",
          "type": "string"
        },
        {
          "internalType": "string",
          "name": "tokenSymbol",
          "type": "string"
        },
        {
          "internalType": "string",
          "name": "tokenCurrency",
          "type": "string"
        },
        {
          "internalType": "uint8",
          "name": "tokenDecimals",
          "type": "uint8"
        },
        {
          "internalType": "address",
          "name": "newMasterMinter",
          "type": "address"
        },
        {
          "internalType": "address",
          "name": "newPauser",
          "type": "address"
        },
        {
          "internalType": "address",
          "name": "newBlacklister",
          "type": "address"
        },
        {
          "internalType": "address",
          "name": "newOwner",
          "type": "address"
        }
      ],
      "name": "initialize",
      "outputs": [],
      "stateMutability": "nonpayable",
      "type": "function"
    },
    {
      "inputs": [
        {
          "internalType": "string",
          "name": "newName",
          "type": "string"
        }
      ],
      "name": "initializeV2",
      "outputs": [],
      "stateMutability": "nonpayable",
      "type": "function"
    },
    {
      "inputs": [
        {
          "internalType": "address",
          "name": "lostAndFound",
          "type": "address"
        }
      ],
      "name": "initializeV2_1",
      "outputs": [],
      "stateMutability": "nonpayable",
      "type": "function"
    },
    {
      "inputs": [
        {
          "internalType": "address",
          "name": "_account",
          "type": "address"
        }
      ],
      "name": "isBlacklisted",
      "outputs": [
        {
          "internalType": "bool",
          "name": "",
          "type": "bool"
        }
      ],
      "stateMutability": "view",
      "type": "function"
    },
    {
      "inputs": [
        {
          "internalType": "address",
          "name": "account",
          "type": "address"
        }
      ],
      "name": "isMinter",
      "outputs": [
        {
          "internalType": "bool",
          "name": "",
          "type": "bool"
        }
      ],
      "stateMutability": "view",
      "type": "function"
    },
    {
      "inputs": [],
      "name": "masterMinter",
      "outputs": [
        {
          "internalType": "address",
          "name": "",
          "type": "address"
        }
      ],
      "stateMutability": "view",
      "type": "function"
    },
    {
      "inputs": [
        {
          "internalType": "address",
          "name": "_to",
          "type": "address"
        },
        {
          "internalType": "uint256",
          "name": "_amount",
          "type": "uint256"
        }
      ],
      "name": "mint",
      "outputs": [
        {
          "internalType": "bool",
          "name": "",
          "type": "bool"
        }
      ],
      "stateMutability": "nonpayable",
      "type": "function"
    },
    {
      "inputs": [
        {
          "internalType": "address",
          "name": "minter",
          "type": "address"
        }
      ],
      "name": "minterAllowance",
      "outputs": [
        {
          "internalType": "uint256",
          "name": "",
          "type": "uint256"
        }
      ],
      "stateMutability": "view",
      "type": "function"
    },
    {
      "inputs": [],
      "name": "name",
      "outputs": [
        {
          "internalType": "string",
          "name": "",
          "type": "string"
        }
      ],
      "stateMutability": "view",
      "type": "function"
    },
    {
      "inputs": [
        {
          "internalType": "address",
          "name": "owner",
          "type": "address"
        }
      ],
      "name": "nonces",
      "outputs": [
        {
          "internalType": "uint256",
          "name": "",
          "type": "uint256"
        }
      ],
      "stateMutability": "view",
      "type": "function"
    },
    {
      "inputs": [],
      "name": "owner",
      "outputs": [
        {
          "internalType": "address",
          "name": "",
          "type": "address"
        }
      ],
      "stateMutability": "view",
      "type": "function"
    },
    {
      "inputs": [],
      "name": "pause",
      "outputs": [],
      "stateMutability": "nonpayable",
      "type": "function"
    },
    {
      "inputs": [],
      "name": "paused",
      "outputs": [
        {
          "internalType": "bool",
          "name": "",
          "type": "bool"
        }
      ],
      "stateMutability": "view",
      "type": "function"
    },
    {
      "inputs": [],
      "name": "pauser",
      "outputs": [
        {
          "internalType": "address",
          "name": "",
          "type": "address"
        }
      ],
      "stateMutability": "view",
      "type": "function"
    },
    {
      "inputs": [
        {
          "internalType": "address",
          "name": "owner",
          "type": "address"
        },
        {
          "internalType": "address",
          "name": "spender",
          "type": "address"
        },
        {
          "internalType": "uint256",
          "name": "value",
          "type": "uint256"
        },
        {
          "internalType": "uint256",
          "name": "deadline",
          "type": "uint256"
        },
        {
          "internalType": "uint8",
          "name": "v",
          "type": "uint8"
        },
        {
          "internalType": "bytes32",
          "name": "r",
          "type": "bytes32"
        },
        {
          "internalType": "bytes32",
          "name": "s",
          "type": "bytes32"
        }
      ],
      "name": "permit",
      "outputs": [],
      "stateMutability": "nonpayable",
      "type": "function"
    },
    {
      "inputs": [
        {
          "internalType": "address",
          "name": "from",
          "type": "address"
        },
        {
          "internalType": "address",
          "name": "to",
          "type": "address"
        },
        {
          "internalType": "uint256",
          "name": "value",
          "type": "uint256"
        },
        {
          "internalType": "uint256",
          "name": "validAfter",
          "type": "uint256"
        },
        {
          "internalType": "uint256",
          "name": "validBefore",
          "type": "uint256"
        },
        {
          "internalType": "bytes32",
          "name": "nonce",
          "type": "bytes32"
        },
        {
          "internalType": "uint8",
          "name": "v",
          "type": "uint8"
        },
        {
          "internalType": "bytes32",
          "name": "r",
          "type": "bytes32"
        },
        {
          "internalType": "bytes32",
          "name": "s",
          "type": "bytes32"
        }
      ],
      "name": "receiveWithAuthorization",
      "outputs": [],
      "stateMutability": "nonpayable",
      "type": "function"
    },
    {
      "inputs": [
        {
          "internalType": "address",
          "name": "minter",
          "type": "address"
        }
      ],
      "name": "removeMinter",
      "outputs": [
        {
          "internalType": "bool",
          "name": "",
          "type": "bool"
        }
      ],
      "stateMutability": "nonpayable",
      "type": "function"
    },
    {
      "inputs": [
        {
          "internalType": "contract IERC20",
          "name": "tokenContract",
          "type": "address"
        },
        {
          "internalType": "address",
          "name": "to",
          "type": "address"
        },
        {
          "internalType": "uint256",
          "name": "amount",
          "type": "uint256"
        }
      ],
      "name": "rescueERC20",
      "outputs": [],
      "stateMutability": "nonpayable",
      "type": "function"
    },
    {
      "inputs": [],
      "name": "rescuer",
      "outputs": [
        {
          "internalType": "address",
          "name": "",
          "type": "address"
        }
      ],
      "stateMutability": "view",
      "type": "function"
    },
    {
      "inputs": [],
      "name": "symbol",
      "outputs": [
        {
          "internalType": "string",
          "name": "",
          "type": "string"
        }
      ],
      "stateMutability": "view",
      "type": "function"
    },
    {
      "inputs": [],
      "name": "totalSupply",
      "outputs": [
        {
          "internalType": "uint256",
          "name": "",
          "type": "uint256"
        }
      ],
      "stateMutability": "view",
      "type": "function"
    },
    {
      "inputs": [
        {
          "internalType": "address",
          "name": "to",
          "type": "address"
        },
        {
          "internalType": "uint256",
          "name": "value",
          "type": "uint256"
        }
      ],
      "name": "transfer",
      "outputs": [
        {
          "internalType": "bool",
          "name": "",
          "type": "bool"
        }
      ],
      "stateMutability": "nonpayable",
      "type": "function"
    },
    {
      "inputs": [
        {
          "internalType": "address",
          "name": "from",
          "type": "address"
        },
        {
          "internalType": "address",
          "name": "to",
          "type": "address"
        },
        {
          "internalType": "uint256",
          "name": "value",
          "type": "uint256"
        }
      ],
      "name": "transferFrom",
      "outputs": [
        {
          "internalType": "bool",
          "name": "",
          "type": "bool"
        }
      ],
      "stateMutability": "nonpayable",
      "type": "function"
    },
    {
      "inputs": [
        {
          "internalType": "address",
          "name": "newOwner",
          "type": "address"
        }
      ],
      "name": "transferOwnership",
      "outputs": [],
      "stateMutability": "nonpayable",
      "type": "function"
    },
    {
      "inputs": [
        {
          "internalType": "address",
          "name": "from",
          "type": "address"
        },
        {
          "internalType": "address",
          "name": "to",
          "type": "address"
        },
        {
          "internalType": "uint256",
          "name": "value",
          "type": "uint256"
        },
        {
          "internalType": "uint256",
          "name": "validAfter",
          "type": "uint256"
        },
        {
          "internalType": "uint256",
          "name": "validBefore",
          "type": "uint256"
        },
        {
          "internalType": "bytes32",
          "name": "nonce",
          "type": "bytes32"
        },
        {
          "internalType": "uint8",
          "name": "v",
          "type": "uint8"
        },
        {
          "internalType": "bytes32",
          "name": "r",
          "type": "bytes32"
        },
        {
          "internalType": "bytes32",
          "name": "s",
          "type": "bytes32"
        }
      ],
      "name": "transferWithAuthorization",
      "outputs": [],
      "stateMutability": "nonpayable",
      "type": "function"
    },
    {
      "inputs": [
        {
          "internalType": "address",
          "name": "_account",
          "type": "address"
        }
      ],
      "name": "unBlacklist",
      "outputs": [],
      "stateMutability": "nonpayable",
      "type": "function"
    },
    {
      "inputs": [],
      "name": "unpause",
      "outputs": [],
      "stateMutability": "nonpayable",
      "type": "function"
    },
    {
      "inputs": [
        {
          "internalType": "address",
          "name": "_newBlacklister",
          "type": "address"
        }
      ],
      "name": "updateBlacklister",
      "outputs": [],
      "stateMutability": "nonpayable",
      "type": "function"
    },
    {
      "inputs": [
        {
          "internalType": "address",
          "name": "_newMasterMinter",
          "type": "address"
        }
      ],
      "name": "updateMasterMinter",
      "outputs": [],
      "stateMutability": "nonpayable",
      "type": "function"
    },
    {
      "inputs": [
        {
          "internalType": "address",
          "name": "_newPauser",
          "type": "address"
        }
      ],
      "name": "updatePauser",
      "outputs": [],
      "stateMutability": "nonpayable",
      "type": "function"
    },
    {
      "inputs": [
        {
          "internalType": "address",
          "name": "newRescuer",
          "type": "address"
        }
      ],
      "name": "updateRescuer",
      "outputs": [],
      "stateMutability": "nonpayable",
      "type": "function"
    },
    {
      "inputs": [],
      "name": "version",
      "outputs": [
        {
          "internalType": "string",
          "name": "",
          "type": "string"
        }
      ],
      "stateMutability": "pure",
      "type": "function"
    }
  ],
  "transactionHash": "0xcfe58d7e547a689d9650c8d1ffa61f13897cee4b31b93fbb64421963922ab412",
  "receipt": {
    "to": null,
    "from": "0xAE4bdBb0824C9B602589a5DaD2aD96C8A2AcC607",
    "contractAddress": "0xEB50F151484A64b972747f31E6483C6463e32cc1",
    "transactionIndex": 43,
    "gasUsed": "3762264",
    "logsBloom": "0x00000000000000000000000000000000000000000000000000000000000000000000000000000000000000000000000000000000000000000000000000000000000000000000000000000000000000000000000000000000000000000000000000000000000000000000000000000000000000000000000000000000000000000000000000000000000000000000000000000000000000000000000000000000000000000000000000000000000000000000000000000000000000000000000000000000000000000000000000000000000000000000000000000000000000000000000000000000000000000000000000000000000000000000000000000000",
    "blockHash": "0xefd7fb55e0f8d9441bc58c98e0b7901fa492eb107a17664f11bd0f8784823de1",
    "transactionHash": "0xcfe58d7e547a689d9650c8d1ffa61f13897cee4b31b93fbb64421963922ab412",
    "logs": [],
    "blockNumber": 3275194,
    "cumulativeGasUsed": "14653213",
    "status": 1,
    "byzantium": true
  },
  "args": [],
  "numDeployments": 1,
  "solcInputHash": "7231e19b1c88c866e006a31fdd6ab4e0",
  "metadata": "{\"compiler\":{\"version\":\"0.6.12+commit.27d51765\"},\"language\":\"Solidity\",\"output\":{\"abi\":[{\"anonymous\":false,\"inputs\":[{\"indexed\":true,\"internalType\":\"address\",\"name\":\"owner\",\"type\":\"address\"},{\"indexed\":true,\"internalType\":\"address\",\"name\":\"spender\",\"type\":\"address\"},{\"indexed\":false,\"internalType\":\"uint256\",\"name\":\"value\",\"type\":\"uint256\"}],\"name\":\"Approval\",\"type\":\"event\"},{\"anonymous\":false,\"inputs\":[{\"indexed\":true,\"internalType\":\"address\",\"name\":\"authorizer\",\"type\":\"address\"},{\"indexed\":true,\"internalType\":\"bytes32\",\"name\":\"nonce\",\"type\":\"bytes32\"}],\"name\":\"AuthorizationCanceled\",\"type\":\"event\"},{\"anonymous\":false,\"inputs\":[{\"indexed\":true,\"internalType\":\"address\",\"name\":\"authorizer\",\"type\":\"address\"},{\"indexed\":true,\"internalType\":\"bytes32\",\"name\":\"nonce\",\"type\":\"bytes32\"}],\"name\":\"AuthorizationUsed\",\"type\":\"event\"},{\"anonymous\":false,\"inputs\":[{\"indexed\":true,\"internalType\":\"address\",\"name\":\"_account\",\"type\":\"address\"}],\"name\":\"Blacklisted\",\"type\":\"event\"},{\"anonymous\":false,\"inputs\":[{\"indexed\":true,\"internalType\":\"address\",\"name\":\"newBlacklister\",\"type\":\"address\"}],\"name\":\"BlacklisterChanged\",\"type\":\"event\"},{\"anonymous\":false,\"inputs\":[{\"indexed\":true,\"internalType\":\"address\",\"name\":\"burner\",\"type\":\"address\"},{\"indexed\":false,\"internalType\":\"uint256\",\"name\":\"amount\",\"type\":\"uint256\"}],\"name\":\"Burn\",\"type\":\"event\"},{\"anonymous\":false,\"inputs\":[{\"indexed\":true,\"internalType\":\"address\",\"name\":\"newMasterMinter\",\"type\":\"address\"}],\"name\":\"MasterMinterChanged\",\"type\":\"event\"},{\"anonymous\":false,\"inputs\":[{\"indexed\":true,\"internalType\":\"address\",\"name\":\"minter\",\"type\":\"address\"},{\"indexed\":true,\"internalType\":\"address\",\"name\":\"to\",\"type\":\"address\"},{\"indexed\":false,\"internalType\":\"uint256\",\"name\":\"amount\",\"type\":\"uint256\"}],\"name\":\"Mint\",\"type\":\"event\"},{\"anonymous\":false,\"inputs\":[{\"indexed\":true,\"internalType\":\"address\",\"name\":\"minter\",\"type\":\"address\"},{\"indexed\":false,\"internalType\":\"uint256\",\"name\":\"minterAllowedAmount\",\"type\":\"uint256\"}],\"name\":\"MinterConfigured\",\"type\":\"event\"},{\"anonymous\":false,\"inputs\":[{\"indexed\":true,\"internalType\":\"address\",\"name\":\"oldMinter\",\"type\":\"address\"}],\"name\":\"MinterRemoved\",\"type\":\"event\"},{\"anonymous\":false,\"inputs\":[{\"indexed\":false,\"internalType\":\"address\",\"name\":\"previousOwner\",\"type\":\"address\"},{\"indexed\":false,\"internalType\":\"address\",\"name\":\"newOwner\",\"type\":\"address\"}],\"name\":\"OwnershipTransferred\",\"type\":\"event\"},{\"anonymous\":false,\"inputs\":[],\"name\":\"Pause\",\"type\":\"event\"},{\"anonymous\":false,\"inputs\":[{\"indexed\":true,\"internalType\":\"address\",\"name\":\"newAddress\",\"type\":\"address\"}],\"name\":\"PauserChanged\",\"type\":\"event\"},{\"anonymous\":false,\"inputs\":[{\"indexed\":true,\"internalType\":\"address\",\"name\":\"newRescuer\",\"type\":\"address\"}],\"name\":\"RescuerChanged\",\"type\":\"event\"},{\"anonymous\":false,\"inputs\":[{\"indexed\":true,\"internalType\":\"address\",\"name\":\"from\",\"type\":\"address\"},{\"indexed\":true,\"internalType\":\"address\",\"name\":\"to\",\"type\":\"address\"},{\"indexed\":false,\"internalType\":\"uint256\",\"name\":\"value\",\"type\":\"uint256\"}],\"name\":\"Transfer\",\"type\":\"event\"},{\"anonymous\":false,\"inputs\":[{\"indexed\":true,\"internalType\":\"address\",\"name\":\"_account\",\"type\":\"address\"}],\"name\":\"UnBlacklisted\",\"type\":\"event\"},{\"anonymous\":false,\"inputs\":[],\"name\":\"Unpause\",\"type\":\"event\"},{\"inputs\":[],\"name\":\"CANCEL_AUTHORIZATION_TYPEHASH\",\"outputs\":[{\"internalType\":\"bytes32\",\"name\":\"\",\"type\":\"bytes32\"}],\"stateMutability\":\"view\",\"type\":\"function\"},{\"inputs\":[],\"name\":\"CLAIM_AMOUNT\",\"outputs\":[{\"internalType\":\"uint256\",\"name\":\"\",\"type\":\"uint256\"}],\"stateMutability\":\"view\",\"type\":\"function\"},{\"inputs\":[],\"name\":\"DOMAIN_SEPARATOR\",\"outputs\":[{\"internalType\":\"bytes32\",\"name\":\"\",\"type\":\"bytes32\"}],\"stateMutability\":\"view\",\"type\":\"function\"},{\"inputs\":[],\"name\":\"OWNER\",\"outputs\":[{\"internalType\":\"address\",\"name\":\"\",\"type\":\"address\"}],\"stateMutability\":\"view\",\"type\":\"function\"},{\"inputs\":[],\"name\":\"PERMIT_TYPEHASH\",\"outputs\":[{\"internalType\":\"bytes32\",\"name\":\"\",\"type\":\"bytes32\"}],\"stateMutability\":\"view\",\"type\":\"function\"},{\"inputs\":[],\"name\":\"RECEIVE_WITH_AUTHORIZATION_TYPEHASH\",\"outputs\":[{\"internalType\":\"bytes32\",\"name\":\"\",\"type\":\"bytes32\"}],\"stateMutability\":\"view\",\"type\":\"function\"},{\"inputs\":[],\"name\":\"TRANSFER_WITH_AUTHORIZATION_TYPEHASH\",\"outputs\":[{\"internalType\":\"bytes32\",\"name\":\"\",\"type\":\"bytes32\"}],\"stateMutability\":\"view\",\"type\":\"function\"},{\"inputs\":[{\"internalType\":\"address\",\"name\":\"_to\",\"type\":\"address\"},{\"internalType\":\"uint256\",\"name\":\"_amount\",\"type\":\"uint256\"}],\"name\":\"allocateTo\",\"outputs\":[],\"stateMutability\":\"nonpayable\",\"type\":\"function\"},{\"inputs\":[{\"internalType\":\"address\",\"name\":\"owner\",\"type\":\"address\"},{\"internalType\":\"address\",\"name\":\"spender\",\"type\":\"address\"}],\"name\":\"allowance\",\"outputs\":[{\"internalType\":\"uint256\",\"name\":\"\",\"type\":\"uint256\"}],\"stateMutability\":\"view\",\"type\":\"function\"},{\"inputs\":[{\"internalType\":\"address\",\"name\":\"spender\",\"type\":\"address\"},{\"internalType\":\"uint256\",\"name\":\"value\",\"type\":\"uint256\"}],\"name\":\"approve\",\"outputs\":[{\"internalType\":\"bool\",\"name\":\"\",\"type\":\"bool\"}],\"stateMutability\":\"nonpayable\",\"type\":\"function\"},{\"inputs\":[{\"internalType\":\"address\",\"name\":\"authorizer\",\"type\":\"address\"},{\"internalType\":\"bytes32\",\"name\":\"nonce\",\"type\":\"bytes32\"}],\"name\":\"authorizationState\",\"outputs\":[{\"internalType\":\"bool\",\"name\":\"\",\"type\":\"bool\"}],\"stateMutability\":\"view\",\"type\":\"function\"},{\"inputs\":[{\"internalType\":\"address\",\"name\":\"account\",\"type\":\"address\"}],\"name\":\"balanceOf\",\"outputs\":[{\"internalType\":\"uint256\",\"name\":\"\",\"type\":\"uint256\"}],\"stateMutability\":\"view\",\"type\":\"function\"},{\"inputs\":[{\"internalType\":\"address\",\"name\":\"_account\",\"type\":\"address\"}],\"name\":\"blacklist\",\"outputs\":[],\"stateMutability\":\"nonpayable\",\"type\":\"function\"},{\"inputs\":[],\"name\":\"blacklister\",\"outputs\":[{\"internalType\":\"address\",\"name\":\"\",\"type\":\"address\"}],\"stateMutability\":\"view\",\"type\":\"function\"},{\"inputs\":[{\"internalType\":\"uint256\",\"name\":\"_amount\",\"type\":\"uint256\"}],\"name\":\"burn\",\"outputs\":[],\"stateMutability\":\"nonpayable\",\"type\":\"function\"},{\"inputs\":[{\"internalType\":\"address\",\"name\":\"authorizer\",\"type\":\"address\"},{\"internalType\":\"bytes32\",\"name\":\"nonce\",\"type\":\"bytes32\"},{\"internalType\":\"uint8\",\"name\":\"v\",\"type\":\"uint8\"},{\"internalType\":\"bytes32\",\"name\":\"r\",\"type\":\"bytes32\"},{\"internalType\":\"bytes32\",\"name\":\"s\",\"type\":\"bytes32\"}],\"name\":\"cancelAuthorization\",\"outputs\":[],\"stateMutability\":\"nonpayable\",\"type\":\"function\"},{\"inputs\":[{\"internalType\":\"address\",\"name\":\"\",\"type\":\"address\"}],\"name\":\"claimed\",\"outputs\":[{\"internalType\":\"bool\",\"name\":\"\",\"type\":\"bool\"}],\"stateMutability\":\"view\",\"type\":\"function\"},{\"inputs\":[{\"internalType\":\"address\",\"name\":\"minter\",\"type\":\"address\"},{\"internalType\":\"uint256\",\"name\":\"minterAllowedAmount\",\"type\":\"uint256\"}],\"name\":\"configureMinter\",\"outputs\":[{\"internalType\":\"bool\",\"name\":\"\",\"type\":\"bool\"}],\"stateMutability\":\"nonpayable\",\"type\":\"function\"},{\"inputs\":[],\"name\":\"currency\",\"outputs\":[{\"internalType\":\"string\",\"name\":\"\",\"type\":\"string\"}],\"stateMutability\":\"view\",\"type\":\"function\"},{\"inputs\":[],\"name\":\"decimals\",\"outputs\":[{\"internalType\":\"uint8\",\"name\":\"\",\"type\":\"uint8\"}],\"stateMutability\":\"view\",\"type\":\"function\"},{\"inputs\":[{\"internalType\":\"address\",\"name\":\"spender\",\"type\":\"address\"},{\"internalType\":\"uint256\",\"name\":\"decrement\",\"type\":\"uint256\"}],\"name\":\"decreaseAllowance\",\"outputs\":[{\"internalType\":\"bool\",\"name\":\"\",\"type\":\"bool\"}],\"stateMutability\":\"nonpayable\",\"type\":\"function\"},{\"inputs\":[{\"internalType\":\"address\",\"name\":\"spender\",\"type\":\"address\"},{\"internalType\":\"uint256\",\"name\":\"increment\",\"type\":\"uint256\"}],\"name\":\"increaseAllowance\",\"outputs\":[{\"internalType\":\"bool\",\"name\":\"\",\"type\":\"bool\"}],\"stateMutability\":\"nonpayable\",\"type\":\"function\"},{\"inputs\":[{\"internalType\":\"string\",\"name\":\"tokenName\",\"type\":\"string\"},{\"internalType\":\"string\",\"name\":\"tokenSymbol\",\"type\":\"string\"},{\"internalType\":\"string\",\"name\":\"tokenCurrency\",\"type\":\"string\"},{\"internalType\":\"uint8\",\"name\":\"tokenDecimals\",\"type\":\"uint8\"},{\"internalType\":\"address\",\"name\":\"newMasterMinter\",\"type\":\"address\"},{\"internalType\":\"address\",\"name\":\"newPauser\",\"type\":\"address\"},{\"internalType\":\"address\",\"name\":\"newBlacklister\",\"type\":\"address\"},{\"internalType\":\"address\",\"name\":\"newOwner\",\"type\":\"address\"}],\"name\":\"initialize\",\"outputs\":[],\"stateMutability\":\"nonpayable\",\"type\":\"function\"},{\"inputs\":[{\"internalType\":\"string\",\"name\":\"newName\",\"type\":\"string\"}],\"name\":\"initializeV2\",\"outputs\":[],\"stateMutability\":\"nonpayable\",\"type\":\"function\"},{\"inputs\":[{\"internalType\":\"address\",\"name\":\"lostAndFound\",\"type\":\"address\"}],\"name\":\"initializeV2_1\",\"outputs\":[],\"stateMutability\":\"nonpayable\",\"type\":\"function\"},{\"inputs\":[{\"internalType\":\"address\",\"name\":\"_account\",\"type\":\"address\"}],\"name\":\"isBlacklisted\",\"outputs\":[{\"internalType\":\"bool\",\"name\":\"\",\"type\":\"bool\"}],\"stateMutability\":\"view\",\"type\":\"function\"},{\"inputs\":[{\"internalType\":\"address\",\"name\":\"account\",\"type\":\"address\"}],\"name\":\"isMinter\",\"outputs\":[{\"internalType\":\"bool\",\"name\":\"\",\"type\":\"bool\"}],\"stateMutability\":\"view\",\"type\":\"function\"},{\"inputs\":[],\"name\":\"masterMinter\",\"outputs\":[{\"internalType\":\"address\",\"name\":\"\",\"type\":\"address\"}],\"stateMutability\":\"view\",\"type\":\"function\"},{\"inputs\":[{\"internalType\":\"address\",\"name\":\"_to\",\"type\":\"address\"},{\"internalType\":\"uint256\",\"name\":\"_amount\",\"type\":\"uint256\"}],\"name\":\"mint\",\"outputs\":[{\"internalType\":\"bool\",\"name\":\"\",\"type\":\"bool\"}],\"stateMutability\":\"nonpayable\",\"type\":\"function\"},{\"inputs\":[{\"internalType\":\"address\",\"name\":\"minter\",\"type\":\"address\"}],\"name\":\"minterAllowance\",\"outputs\":[{\"internalType\":\"uint256\",\"name\":\"\",\"type\":\"uint256\"}],\"stateMutability\":\"view\",\"type\":\"function\"},{\"inputs\":[],\"name\":\"name\",\"outputs\":[{\"internalType\":\"string\",\"name\":\"\",\"type\":\"string\"}],\"stateMutability\":\"view\",\"type\":\"function\"},{\"inputs\":[{\"internalType\":\"address\",\"name\":\"owner\",\"type\":\"address\"}],\"name\":\"nonces\",\"outputs\":[{\"internalType\":\"uint256\",\"name\":\"\",\"type\":\"uint256\"}],\"stateMutability\":\"view\",\"type\":\"function\"},{\"inputs\":[],\"name\":\"owner\",\"outputs\":[{\"internalType\":\"address\",\"name\":\"\",\"type\":\"address\"}],\"stateMutability\":\"view\",\"type\":\"function\"},{\"inputs\":[],\"name\":\"pause\",\"outputs\":[],\"stateMutability\":\"nonpayable\",\"type\":\"function\"},{\"inputs\":[],\"name\":\"paused\",\"outputs\":[{\"internalType\":\"bool\",\"name\":\"\",\"type\":\"bool\"}],\"stateMutability\":\"view\",\"type\":\"function\"},{\"inputs\":[],\"name\":\"pauser\",\"outputs\":[{\"internalType\":\"address\",\"name\":\"\",\"type\":\"address\"}],\"stateMutability\":\"view\",\"type\":\"function\"},{\"inputs\":[{\"internalType\":\"address\",\"name\":\"owner\",\"type\":\"address\"},{\"internalType\":\"address\",\"name\":\"spender\",\"type\":\"address\"},{\"internalType\":\"uint256\",\"name\":\"value\",\"type\":\"uint256\"},{\"internalType\":\"uint256\",\"name\":\"deadline\",\"type\":\"uint256\"},{\"internalType\":\"uint8\",\"name\":\"v\",\"type\":\"uint8\"},{\"internalType\":\"bytes32\",\"name\":\"r\",\"type\":\"bytes32\"},{\"internalType\":\"bytes32\",\"name\":\"s\",\"type\":\"bytes32\"}],\"name\":\"permit\",\"outputs\":[],\"stateMutability\":\"nonpayable\",\"type\":\"function\"},{\"inputs\":[{\"internalType\":\"address\",\"name\":\"from\",\"type\":\"address\"},{\"internalType\":\"address\",\"name\":\"to\",\"type\":\"address\"},{\"internalType\":\"uint256\",\"name\":\"value\",\"type\":\"uint256\"},{\"internalType\":\"uint256\",\"name\":\"validAfter\",\"type\":\"uint256\"},{\"internalType\":\"uint256\",\"name\":\"validBefore\",\"type\":\"uint256\"},{\"internalType\":\"bytes32\",\"name\":\"nonce\",\"type\":\"bytes32\"},{\"internalType\":\"uint8\",\"name\":\"v\",\"type\":\"uint8\"},{\"internalType\":\"bytes32\",\"name\":\"r\",\"type\":\"bytes32\"},{\"internalType\":\"bytes32\",\"name\":\"s\",\"type\":\"bytes32\"}],\"name\":\"receiveWithAuthorization\",\"outputs\":[],\"stateMutability\":\"nonpayable\",\"type\":\"function\"},{\"inputs\":[{\"internalType\":\"address\",\"name\":\"minter\",\"type\":\"address\"}],\"name\":\"removeMinter\",\"outputs\":[{\"internalType\":\"bool\",\"name\":\"\",\"type\":\"bool\"}],\"stateMutability\":\"nonpayable\",\"type\":\"function\"},{\"inputs\":[{\"internalType\":\"contract IERC20\",\"name\":\"tokenContract\",\"type\":\"address\"},{\"internalType\":\"address\",\"name\":\"to\",\"type\":\"address\"},{\"internalType\":\"uint256\",\"name\":\"amount\",\"type\":\"uint256\"}],\"name\":\"rescueERC20\",\"outputs\":[],\"stateMutability\":\"nonpayable\",\"type\":\"function\"},{\"inputs\":[],\"name\":\"rescuer\",\"outputs\":[{\"internalType\":\"address\",\"name\":\"\",\"type\":\"address\"}],\"stateMutability\":\"view\",\"type\":\"function\"},{\"inputs\":[],\"name\":\"symbol\",\"outputs\":[{\"internalType\":\"string\",\"name\":\"\",\"type\":\"string\"}],\"stateMutability\":\"view\",\"type\":\"function\"},{\"inputs\":[],\"name\":\"totalSupply\",\"outputs\":[{\"internalType\":\"uint256\",\"name\":\"\",\"type\":\"uint256\"}],\"stateMutability\":\"view\",\"type\":\"function\"},{\"inputs\":[{\"internalType\":\"address\",\"name\":\"to\",\"type\":\"address\"},{\"internalType\":\"uint256\",\"name\":\"value\",\"type\":\"uint256\"}],\"name\":\"transfer\",\"outputs\":[{\"internalType\":\"bool\",\"name\":\"\",\"type\":\"bool\"}],\"stateMutability\":\"nonpayable\",\"type\":\"function\"},{\"inputs\":[{\"internalType\":\"address\",\"name\":\"from\",\"type\":\"address\"},{\"internalType\":\"address\",\"name\":\"to\",\"type\":\"address\"},{\"internalType\":\"uint256\",\"name\":\"value\",\"type\":\"uint256\"}],\"name\":\"transferFrom\",\"outputs\":[{\"internalType\":\"bool\",\"name\":\"\",\"type\":\"bool\"}],\"stateMutability\":\"nonpayable\",\"type\":\"function\"},{\"inputs\":[{\"internalType\":\"address\",\"name\":\"newOwner\",\"type\":\"address\"}],\"name\":\"transferOwnership\",\"outputs\":[],\"stateMutability\":\"nonpayable\",\"type\":\"function\"},{\"inputs\":[{\"internalType\":\"address\",\"name\":\"from\",\"type\":\"address\"},{\"internalType\":\"address\",\"name\":\"to\",\"type\":\"address\"},{\"internalType\":\"uint256\",\"name\":\"value\",\"type\":\"uint256\"},{\"internalType\":\"uint256\",\"name\":\"validAfter\",\"type\":\"uint256\"},{\"internalType\":\"uint256\",\"name\":\"validBefore\",\"type\":\"uint256\"},{\"internalType\":\"bytes32\",\"name\":\"nonce\",\"type\":\"bytes32\"},{\"internalType\":\"uint8\",\"name\":\"v\",\"type\":\"uint8\"},{\"internalType\":\"bytes32\",\"name\":\"r\",\"type\":\"bytes32\"},{\"internalType\":\"bytes32\",\"name\":\"s\",\"type\":\"bytes32\"}],\"name\":\"transferWithAuthorization\",\"outputs\":[],\"stateMutability\":\"nonpayable\",\"type\":\"function\"},{\"inputs\":[{\"internalType\":\"address\",\"name\":\"_account\",\"type\":\"address\"}],\"name\":\"unBlacklist\",\"outputs\":[],\"stateMutability\":\"nonpayable\",\"type\":\"function\"},{\"inputs\":[],\"name\":\"unpause\",\"outputs\":[],\"stateMutability\":\"nonpayable\",\"type\":\"function\"},{\"inputs\":[{\"internalType\":\"address\",\"name\":\"_newBlacklister\",\"type\":\"address\"}],\"name\":\"updateBlacklister\",\"outputs\":[],\"stateMutability\":\"nonpayable\",\"type\":\"function\"},{\"inputs\":[{\"internalType\":\"address\",\"name\":\"_newMasterMinter\",\"type\":\"address\"}],\"name\":\"updateMasterMinter\",\"outputs\":[],\"stateMutability\":\"nonpayable\",\"type\":\"function\"},{\"inputs\":[{\"internalType\":\"address\",\"name\":\"_newPauser\",\"type\":\"address\"}],\"name\":\"updatePauser\",\"outputs\":[],\"stateMutability\":\"nonpayable\",\"type\":\"function\"},{\"inputs\":[{\"internalType\":\"address\",\"name\":\"newRescuer\",\"type\":\"address\"}],\"name\":\"updateRescuer\",\"outputs\":[],\"stateMutability\":\"nonpayable\",\"type\":\"function\"},{\"inputs\":[],\"name\":\"version\",\"outputs\":[{\"internalType\":\"string\",\"name\":\"\",\"type\":\"string\"}],\"stateMutability\":\"pure\",\"type\":\"function\"}],\"devdoc\":{\"kind\":\"dev\",\"methods\":{\"allocateTo(address,uint256)\":{\"details\":\"Function to mint tokens\",\"params\":{\"_amount\":\"The amount of tokens to mint. Must be less than or equal to the minterAllowance of the caller.\",\"_to\":\"The address that will receive the minted tokens.\"}},\"allowance(address,address)\":{\"params\":{\"owner\":\"Token owner's address\",\"spender\":\"Spender's address\"},\"returns\":{\"_0\":\"Allowance amount\"}},\"approve(address,uint256)\":{\"params\":{\"spender\":\"Spender's address\",\"value\":\"Allowance amount\"},\"returns\":{\"_0\":\"True if successful\"}},\"authorizationState(address,bytes32)\":{\"details\":\"Nonces are randomly generated 32-byte data unique to the authorizer's address\",\"params\":{\"authorizer\":\"Authorizer's address\",\"nonce\":\"Nonce of the authorization\"},\"returns\":{\"_0\":\"True if the nonce is used\"}},\"balanceOf(address)\":{\"details\":\"Get token balance of an account\",\"params\":{\"account\":\"address The account\"}},\"blacklist(address)\":{\"details\":\"Adds account to blacklist\",\"params\":{\"_account\":\"The address to blacklist\"}},\"burn(uint256)\":{\"details\":\"allows a minter to burn some of its own tokens Validates that caller is a minter and that sender is not blacklisted amount is less than or equal to the minter's account balance\",\"params\":{\"_amount\":\"uint256 the amount of tokens to be burned\"}},\"cancelAuthorization(address,bytes32,uint8,bytes32,bytes32)\":{\"details\":\"Works only if the authorization is not yet used.\",\"params\":{\"authorizer\":\"Authorizer's address\",\"nonce\":\"Nonce of the authorization\",\"r\":\"r of the signature\",\"s\":\"s of the signature\",\"v\":\"v of the signature\"}},\"configureMinter(address,uint256)\":{\"details\":\"Function to add/update a new minter\",\"params\":{\"minter\":\"The address of the minter\",\"minterAllowedAmount\":\"The minting amount allowed for the minter\"},\"returns\":{\"_0\":\"True if the operation was successful.\"}},\"decreaseAllowance(address,uint256)\":{\"params\":{\"decrement\":\"Amount of decrease in allowance\",\"spender\":\"Spender's address\"},\"returns\":{\"_0\":\"True if successful\"}},\"increaseAllowance(address,uint256)\":{\"params\":{\"increment\":\"Amount of increase in allowance\",\"spender\":\"Spender's address\"},\"returns\":{\"_0\":\"True if successful\"}},\"initializeV2(string)\":{\"params\":{\"newName\":\"New token name\"}},\"initializeV2_1(address)\":{\"params\":{\"lostAndFound\":\"The address to which the locked funds are sent\"}},\"isBlacklisted(address)\":{\"details\":\"Checks if account is blacklisted\",\"params\":{\"_account\":\"The address to check\"}},\"isMinter(address)\":{\"details\":\"Checks if account is a minter\",\"params\":{\"account\":\"The address to check\"}},\"mint(address,uint256)\":{\"details\":\"Function to mint tokens\",\"params\":{\"_amount\":\"The amount of tokens to mint. Must be less than or equal to the minterAllowance of the caller.\",\"_to\":\"The address that will receive the minted tokens.\"},\"returns\":{\"_0\":\"A boolean that indicates if the operation was successful.\"}},\"minterAllowance(address)\":{\"details\":\"Get minter allowance for an account\",\"params\":{\"minter\":\"The address of the minter\"}},\"nonces(address)\":{\"params\":{\"owner\":\"Token owner's address (Authorizer)\"},\"returns\":{\"_0\":\"Next nonce\"}},\"owner()\":{\"details\":\"Tells the address of the owner\",\"returns\":{\"_0\":\"the address of the owner\"}},\"pause()\":{\"details\":\"called by the owner to pause, triggers stopped state\"},\"permit(address,address,uint256,uint256,uint8,bytes32,bytes32)\":{\"params\":{\"deadline\":\"Expiration time, seconds since the epoch\",\"owner\":\"Token owner's address (Authorizer)\",\"r\":\"r of the signature\",\"s\":\"s of the signature\",\"spender\":\"Spender's address\",\"v\":\"v of the signature\",\"value\":\"Amount of allowance\"}},\"receiveWithAuthorization(address,address,uint256,uint256,uint256,bytes32,uint8,bytes32,bytes32)\":{\"details\":\"This has an additional check to ensure that the payee's address matches the caller of this function to prevent front-running attacks.\",\"params\":{\"from\":\"Payer's address (Authorizer)\",\"nonce\":\"Unique nonce\",\"r\":\"r of the signature\",\"s\":\"s of the signature\",\"to\":\"Payee's address\",\"v\":\"v of the signature\",\"validAfter\":\"The time after which this is valid (unix time)\",\"validBefore\":\"The time before which this is valid (unix time)\",\"value\":\"Amount to be transferred\"}},\"removeMinter(address)\":{\"details\":\"Function to remove a minter\",\"params\":{\"minter\":\"The address of the minter to remove\"},\"returns\":{\"_0\":\"True if the operation was successful.\"}},\"rescueERC20(address,address,uint256)\":{\"params\":{\"amount\":\"Amount to withdraw\",\"to\":\"Recipient address\",\"tokenContract\":\"ERC20 token contract address\"}},\"rescuer()\":{\"returns\":{\"_0\":\"Rescuer's address\"}},\"totalSupply()\":{\"details\":\"Get totalSupply of token\"},\"transfer(address,uint256)\":{\"params\":{\"to\":\"Payee's address\",\"value\":\"Transfer amount\"},\"returns\":{\"_0\":\"True if successful\"}},\"transferFrom(address,address,uint256)\":{\"params\":{\"from\":\"Payer's address\",\"to\":\"Payee's address\",\"value\":\"Transfer amount\"},\"returns\":{\"_0\":\"True if successful\"}},\"transferOwnership(address)\":{\"details\":\"Allows the current owner to transfer control of the contract to a newOwner.\",\"params\":{\"newOwner\":\"The address to transfer ownership to.\"}},\"transferWithAuthorization(address,address,uint256,uint256,uint256,bytes32,uint8,bytes32,bytes32)\":{\"params\":{\"from\":\"Payer's address (Authorizer)\",\"nonce\":\"Unique nonce\",\"r\":\"r of the signature\",\"s\":\"s of the signature\",\"to\":\"Payee's address\",\"v\":\"v of the signature\",\"validAfter\":\"The time after which this is valid (unix time)\",\"validBefore\":\"The time before which this is valid (unix time)\",\"value\":\"Amount to be transferred\"}},\"unBlacklist(address)\":{\"details\":\"Removes account from blacklist\",\"params\":{\"_account\":\"The address to remove from the blacklist\"}},\"unpause()\":{\"details\":\"called by the owner to unpause, returns to normal state\"},\"updatePauser(address)\":{\"details\":\"update the pauser role\"},\"updateRescuer(address)\":{\"params\":{\"newRescuer\":\"New rescuer's address\"}},\"version()\":{\"returns\":{\"_0\":\"Version string\"}}},\"title\":\"FiatToken V2.1\",\"version\":1},\"userdoc\":{\"kind\":\"user\",\"methods\":{\"allowance(address,address)\":{\"notice\":\"Amount of remaining tokens spender is allowed to transfer on behalf of the token owner\"},\"approve(address,uint256)\":{\"notice\":\"Set spender's allowance over the caller's tokens to be a given value.\"},\"authorizationState(address,bytes32)\":{\"notice\":\"Returns the state of an authorization\"},\"cancelAuthorization(address,bytes32,uint8,bytes32,bytes32)\":{\"notice\":\"Attempt to cancel an authorization\"},\"decreaseAllowance(address,uint256)\":{\"notice\":\"Decrease the allowance by a given decrement\"},\"increaseAllowance(address,uint256)\":{\"notice\":\"Increase the allowance by a given increment\"},\"initializeV2(string)\":{\"notice\":\"Initialize v2\"},\"initializeV2_1(address)\":{\"notice\":\"Initialize v2.1\"},\"nonces(address)\":{\"notice\":\"Nonces for permit\"},\"permit(address,address,uint256,uint256,uint8,bytes32,bytes32)\":{\"notice\":\"Update allowance with a signed permit\"},\"receiveWithAuthorization(address,address,uint256,uint256,uint256,bytes32,uint8,bytes32,bytes32)\":{\"notice\":\"Receive a transfer with a signed authorization from the payer\"},\"rescueERC20(address,address,uint256)\":{\"notice\":\"Rescue ERC20 tokens locked up in this contract.\"},\"rescuer()\":{\"notice\":\"Returns current rescuer\"},\"transfer(address,uint256)\":{\"notice\":\"Transfer tokens from the caller\"},\"transferFrom(address,address,uint256)\":{\"notice\":\"Transfer tokens by spending allowance\"},\"transferWithAuthorization(address,address,uint256,uint256,uint256,bytes32,uint8,bytes32,bytes32)\":{\"notice\":\"Execute a transfer with a signed authorization\"},\"updateRescuer(address)\":{\"notice\":\"Assign the rescuer role to a given address.\"},\"version()\":{\"notice\":\"Version string for the EIP712 domain separator\"}},\"notice\":\"ERC20 Token backed by fiat reserves, version 2.1\",\"version\":1}},\"settings\":{\"compilationTarget\":{\"contracts/test/USDC.sol\":\"FiatTokenV2_1\"},\"evmVersion\":\"istanbul\",\"libraries\":{},\"metadata\":{\"bytecodeHash\":\"ipfs\",\"useLiteralContent\":true},\"optimizer\":{\"enabled\":true,\"runs\":200},\"remappings\":[]},\"sources\":{\"contracts/test/USDC.sol\":{\"content\":\"/**\\n *Submitted for verification at Etherscan.io on 2021-04-17\\n */\\n\\n// File: @openzeppelin/contracts/math/SafeMath.sol\\n\\n// SPDX-License-Identifier: MIT\\n\\npragma solidity ^0.6.0;\\n\\n/**\\n * @dev Wrappers over Solidity's arithmetic operations with added overflow\\n * checks.\\n *\\n * Arithmetic operations in Solidity wrap on overflow. This can easily result\\n * in bugs, because programmers usually assume that an overflow raises an\\n * error, which is the standard behavior in high level programming languages.\\n * `SafeMath` restores this intuition by reverting the transaction when an\\n * operation overflows.\\n *\\n * Using this library instead of the unchecked operations eliminates an entire\\n * class of bugs, so it's recommended to use it always.\\n */\\nlibrary SafeMath {\\n    /**\\n     * @dev Returns the addition of two unsigned integers, reverting on\\n     * overflow.\\n     *\\n     * Counterpart to Solidity's `+` operator.\\n     *\\n     * Requirements:\\n     *\\n     * - Addition cannot overflow.\\n     */\\n    function add(uint256 a, uint256 b) internal pure returns (uint256) {\\n        uint256 c = a + b;\\n        require(c >= a, \\\"SafeMath: addition overflow\\\");\\n\\n        return c;\\n    }\\n\\n    /**\\n     * @dev Returns the subtraction of two unsigned integers, reverting on\\n     * overflow (when the result is negative).\\n     *\\n     * Counterpart to Solidity's `-` operator.\\n     *\\n     * Requirements:\\n     *\\n     * - Subtraction cannot overflow.\\n     */\\n    function sub(uint256 a, uint256 b) internal pure returns (uint256) {\\n        return sub(a, b, \\\"SafeMath: subtraction overflow\\\");\\n    }\\n\\n    /**\\n     * @dev Returns the subtraction of two unsigned integers, reverting with custom message on\\n     * overflow (when the result is negative).\\n     *\\n     * Counterpart to Solidity's `-` operator.\\n     *\\n     * Requirements:\\n     *\\n     * - Subtraction cannot overflow.\\n     */\\n    function sub(uint256 a, uint256 b, string memory errorMessage) internal pure returns (uint256) {\\n        require(b <= a, errorMessage);\\n        uint256 c = a - b;\\n\\n        return c;\\n    }\\n\\n    /**\\n     * @dev Returns the multiplication of two unsigned integers, reverting on\\n     * overflow.\\n     *\\n     * Counterpart to Solidity's `*` operator.\\n     *\\n     * Requirements:\\n     *\\n     * - Multiplication cannot overflow.\\n     */\\n    function mul(uint256 a, uint256 b) internal pure returns (uint256) {\\n        // Gas optimization: this is cheaper than requiring 'a' not being zero, but the\\n        // benefit is lost if 'b' is also tested.\\n        // See: https://github.com/OpenZeppelin/openzeppelin-contracts/pull/522\\n        if (a == 0) {\\n            return 0;\\n        }\\n\\n        uint256 c = a * b;\\n        require(c / a == b, \\\"SafeMath: multiplication overflow\\\");\\n\\n        return c;\\n    }\\n\\n    /**\\n     * @dev Returns the integer division of two unsigned integers. Reverts on\\n     * division by zero. The result is rounded towards zero.\\n     *\\n     * Counterpart to Solidity's `/` operator. Note: this function uses a\\n     * `revert` opcode (which leaves remaining gas untouched) while Solidity\\n     * uses an invalid opcode to revert (consuming all remaining gas).\\n     *\\n     * Requirements:\\n     *\\n     * - The divisor cannot be zero.\\n     */\\n    function div(uint256 a, uint256 b) internal pure returns (uint256) {\\n        return div(a, b, \\\"SafeMath: division by zero\\\");\\n    }\\n\\n    /**\\n     * @dev Returns the integer division of two unsigned integers. Reverts with custom message on\\n     * division by zero. The result is rounded towards zero.\\n     *\\n     * Counterpart to Solidity's `/` operator. Note: this function uses a\\n     * `revert` opcode (which leaves remaining gas untouched) while Solidity\\n     * uses an invalid opcode to revert (consuming all remaining gas).\\n     *\\n     * Requirements:\\n     *\\n     * - The divisor cannot be zero.\\n     */\\n    function div(uint256 a, uint256 b, string memory errorMessage) internal pure returns (uint256) {\\n        require(b > 0, errorMessage);\\n        uint256 c = a / b;\\n        // assert(a == b * c + a % b); // There is no case in which this doesn't hold\\n\\n        return c;\\n    }\\n\\n    /**\\n     * @dev Returns the remainder of dividing two unsigned integers. (unsigned integer modulo),\\n     * Reverts when dividing by zero.\\n     *\\n     * Counterpart to Solidity's `%` operator. This function uses a `revert`\\n     * opcode (which leaves remaining gas untouched) while Solidity uses an\\n     * invalid opcode to revert (consuming all remaining gas).\\n     *\\n     * Requirements:\\n     *\\n     * - The divisor cannot be zero.\\n     */\\n    function mod(uint256 a, uint256 b) internal pure returns (uint256) {\\n        return mod(a, b, \\\"SafeMath: modulo by zero\\\");\\n    }\\n\\n    /**\\n     * @dev Returns the remainder of dividing two unsigned integers. (unsigned integer modulo),\\n     * Reverts with custom message when dividing by zero.\\n     *\\n     * Counterpart to Solidity's `%` operator. This function uses a `revert`\\n     * opcode (which leaves remaining gas untouched) while Solidity uses an\\n     * invalid opcode to revert (consuming all remaining gas).\\n     *\\n     * Requirements:\\n     *\\n     * - The divisor cannot be zero.\\n     */\\n    function mod(uint256 a, uint256 b, string memory errorMessage) internal pure returns (uint256) {\\n        require(b != 0, errorMessage);\\n        return a % b;\\n    }\\n}\\n\\n// File: @openzeppelin/contracts/token/ERC20/IERC20.sol\\n\\npragma solidity ^0.6.0;\\n\\n/**\\n * @dev Interface of the ERC20 standard as defined in the EIP.\\n */\\ninterface IERC20 {\\n    /**\\n     * @dev Returns the amount of tokens in existence.\\n     */\\n    function totalSupply() external view returns (uint256);\\n\\n    /**\\n     * @dev Returns the amount of tokens owned by `account`.\\n     */\\n    function balanceOf(address account) external view returns (uint256);\\n\\n    /**\\n     * @dev Moves `amount` tokens from the caller's account to `recipient`.\\n     *\\n     * Returns a boolean value indicating whether the operation succeeded.\\n     *\\n     * Emits a {Transfer} event.\\n     */\\n    function transfer(address recipient, uint256 amount) external returns (bool);\\n\\n    /**\\n     * @dev Returns the remaining number of tokens that `spender` will be\\n     * allowed to spend on behalf of `owner` through {transferFrom}. This is\\n     * zero by default.\\n     *\\n     * This value changes when {approve} or {transferFrom} are called.\\n     */\\n    function allowance(address owner, address spender) external view returns (uint256);\\n\\n    /**\\n     * @dev Sets `amount` as the allowance of `spender` over the caller's tokens.\\n     *\\n     * Returns a boolean value indicating whether the operation succeeded.\\n     *\\n     * IMPORTANT: Beware that changing an allowance with this method brings the risk\\n     * that someone may use both the old and the new allowance by unfortunate\\n     * transaction ordering. One possible solution to mitigate this race\\n     * condition is to first reduce the spender's allowance to 0 and set the\\n     * desired value afterwards:\\n     * https://github.com/ethereum/EIPs/issues/20#issuecomment-263524729\\n     *\\n     * Emits an {Approval} event.\\n     */\\n    function approve(address spender, uint256 amount) external returns (bool);\\n\\n    /**\\n     * @dev Moves `amount` tokens from `sender` to `recipient` using the\\n     * allowance mechanism. `amount` is then deducted from the caller's\\n     * allowance.\\n     *\\n     * Returns a boolean value indicating whether the operation succeeded.\\n     *\\n     * Emits a {Transfer} event.\\n     */\\n    function transferFrom(address sender, address recipient, uint256 amount) external returns (bool);\\n\\n    /**\\n     * @dev Emitted when `value` tokens are moved from one account (`from`) to\\n     * another (`to`).\\n     *\\n     * Note that `value` may be zero.\\n     */\\n    event Transfer(address indexed from, address indexed to, uint256 value);\\n\\n    /**\\n     * @dev Emitted when the allowance of a `spender` for an `owner` is set by\\n     * a call to {approve}. `value` is the new allowance.\\n     */\\n    event Approval(address indexed owner, address indexed spender, uint256 value);\\n}\\n\\n// File: contracts/v1/AbstractFiatTokenV1.sol\\n\\n/**\\n * Copyright (c) 2018-2020 CENTRE SECZ\\n *\\n * Permission is hereby granted, free of charge, to any person obtaining a copy\\n * of this software and associated documentation files (the \\\"Software\\\"), to deal\\n * in the Software without restriction, including without limitation the rights\\n * to use, copy, modify, merge, publish, distribute, sublicense, and/or sell\\n * copies of the Software, and to permit persons to whom the Software is\\n * furnished to do so, subject to the following conditions:\\n *\\n * The above copyright notice and this permission notice shall be included in\\n * copies or substantial portions of the Software.\\n *\\n * THE SOFTWARE IS PROVIDED \\\"AS IS\\\", WITHOUT WARRANTY OF ANY KIND, EXPRESS OR\\n * IMPLIED, INCLUDING BUT NOT LIMITED TO THE WARRANTIES OF MERCHANTABILITY,\\n * FITNESS FOR A PARTICULAR PURPOSE AND NONINFRINGEMENT. IN NO EVENT SHALL THE\\n * AUTHORS OR COPYRIGHT HOLDERS BE LIABLE FOR ANY CLAIM, DAMAGES OR OTHER\\n * LIABILITY, WHETHER IN AN ACTION OF CONTRACT, TORT OR OTHERWISE, ARISING FROM,\\n * OUT OF OR IN CONNECTION WITH THE SOFTWARE OR THE USE OR OTHER DEALINGS IN THE\\n * SOFTWARE.\\n */\\n\\npragma solidity 0.6.12;\\n\\nabstract contract AbstractFiatTokenV1 is IERC20 {\\n    function _approve(address owner, address spender, uint256 value) internal virtual;\\n\\n    function _transfer(address from, address to, uint256 value) internal virtual;\\n}\\n\\n// File: contracts/v1/Ownable.sol\\n\\n/**\\n * Copyright (c) 2018 zOS Global Limited.\\n * Copyright (c) 2018-2020 CENTRE SECZ\\n *\\n * Permission is hereby granted, free of charge, to any person obtaining a copy\\n * of this software and associated documentation files (the \\\"Software\\\"), to deal\\n * in the Software without restriction, including without limitation the rights\\n * to use, copy, modify, merge, publish, distribute, sublicense, and/or sell\\n * copies of the Software, and to permit persons to whom the Software is\\n * furnished to do so, subject to the following conditions:\\n *\\n * The above copyright notice and this permission notice shall be included in\\n * copies or substantial portions of the Software.\\n *\\n * THE SOFTWARE IS PROVIDED \\\"AS IS\\\", WITHOUT WARRANTY OF ANY KIND, EXPRESS OR\\n * IMPLIED, INCLUDING BUT NOT LIMITED TO THE WARRANTIES OF MERCHANTABILITY,\\n * FITNESS FOR A PARTICULAR PURPOSE AND NONINFRINGEMENT. IN NO EVENT SHALL THE\\n * AUTHORS OR COPYRIGHT HOLDERS BE LIABLE FOR ANY CLAIM, DAMAGES OR OTHER\\n * LIABILITY, WHETHER IN AN ACTION OF CONTRACT, TORT OR OTHERWISE, ARISING FROM,\\n * OUT OF OR IN CONNECTION WITH THE SOFTWARE OR THE USE OR OTHER DEALINGS IN THE\\n * SOFTWARE.\\n */\\npragma solidity 0.6.12;\\n\\n/**\\n * @notice The Ownable contract has an owner address, and provides basic\\n * authorization control functions\\n * @dev Forked from https://github.com/OpenZeppelin/openzeppelin-labs/blob/3887ab77b8adafba4a26ace002f3a684c1a3388b/upgradeability_ownership/contracts/ownership/Ownable.sol\\n * Modifications:\\n * 1. Consolidate OwnableStorage into this contract (7/13/18)\\n * 2. Reformat, conform to Solidity 0.6 syntax, and add error messages (5/13/20)\\n * 3. Make public functions external (5/27/20)\\n */\\ncontract Ownable {\\n    // Owner of the contract\\n    address private _owner;\\n\\n    /**\\n     * @dev Event to show ownership has been transferred\\n     * @param previousOwner representing the address of the previous owner\\n     * @param newOwner representing the address of the new owner\\n     */\\n    event OwnershipTransferred(address previousOwner, address newOwner);\\n\\n    /**\\n     * @dev The constructor sets the original owner of the contract to the sender account.\\n     */\\n    constructor() public {\\n        setOwner(msg.sender);\\n    }\\n\\n    /**\\n     * @dev Tells the address of the owner\\n     * @return the address of the owner\\n     */\\n    function owner() external view returns (address) {\\n        return _owner;\\n    }\\n\\n    /**\\n     * @dev Sets a new owner address\\n     */\\n    function setOwner(address newOwner) internal {\\n        _owner = newOwner;\\n    }\\n\\n    /**\\n     * @dev Throws if called by any account other than the owner.\\n     */\\n    modifier onlyOwner() {\\n        require(msg.sender == _owner, \\\"Ownable: caller is not the owner\\\");\\n        _;\\n    }\\n\\n    /**\\n     * @dev Allows the current owner to transfer control of the contract to a newOwner.\\n     * @param newOwner The address to transfer ownership to.\\n     */\\n    function transferOwnership(address newOwner) external onlyOwner {\\n        require(newOwner != address(0), \\\"Ownable: new owner is the zero address\\\");\\n        emit OwnershipTransferred(_owner, newOwner);\\n        setOwner(newOwner);\\n    }\\n}\\n\\n// File: contracts/v1/Pausable.sol\\n\\n/**\\n * Copyright (c) 2016 Smart Contract Solutions, Inc.\\n * Copyright (c) 2018-2020 CENTRE SECZ0\\n *\\n * Permission is hereby granted, free of charge, to any person obtaining a copy\\n * of this software and associated documentation files (the \\\"Software\\\"), to deal\\n * in the Software without restriction, including without limitation the rights\\n * to use, copy, modify, merge, publish, distribute, sublicense, and/or sell\\n * copies of the Software, and to permit persons to whom the Software is\\n * furnished to do so, subject to the following conditions:\\n *\\n * The above copyright notice and this permission notice shall be included in\\n * copies or substantial portions of the Software.\\n *\\n * THE SOFTWARE IS PROVIDED \\\"AS IS\\\", WITHOUT WARRANTY OF ANY KIND, EXPRESS OR\\n * IMPLIED, INCLUDING BUT NOT LIMITED TO THE WARRANTIES OF MERCHANTABILITY,\\n * FITNESS FOR A PARTICULAR PURPOSE AND NONINFRINGEMENT. IN NO EVENT SHALL THE\\n * AUTHORS OR COPYRIGHT HOLDERS BE LIABLE FOR ANY CLAIM, DAMAGES OR OTHER\\n * LIABILITY, WHETHER IN AN ACTION OF CONTRACT, TORT OR OTHERWISE, ARISING FROM,\\n * OUT OF OR IN CONNECTION WITH THE SOFTWARE OR THE USE OR OTHER DEALINGS IN THE\\n * SOFTWARE.\\n */\\n\\npragma solidity 0.6.12;\\n\\n/**\\n * @notice Base contract which allows children to implement an emergency stop\\n * mechanism\\n * @dev Forked from https://github.com/OpenZeppelin/openzeppelin-contracts/blob/feb665136c0dae9912e08397c1a21c4af3651ef3/contracts/lifecycle/Pausable.sol\\n * Modifications:\\n * 1. Added pauser role, switched pause/unpause to be onlyPauser (6/14/2018)\\n * 2. Removed whenNotPause/whenPaused from pause/unpause (6/14/2018)\\n * 3. Removed whenPaused (6/14/2018)\\n * 4. Switches ownable library to use ZeppelinOS (7/12/18)\\n * 5. Remove constructor (7/13/18)\\n * 6. Reformat, conform to Solidity 0.6 syntax and add error messages (5/13/20)\\n * 7. Make public functions external (5/27/20)\\n */\\ncontract Pausable is Ownable {\\n    event Pause();\\n    event Unpause();\\n    event PauserChanged(address indexed newAddress);\\n\\n    address public pauser;\\n    bool public paused = false;\\n\\n    /**\\n     * @dev Modifier to make a function callable only when the contract is not paused.\\n     */\\n    modifier whenNotPaused() {\\n        require(!paused, \\\"Pausable: paused\\\");\\n        _;\\n    }\\n\\n    /**\\n     * @dev throws if called by any account other than the pauser\\n     */\\n    modifier onlyPauser() {\\n        require(msg.sender == pauser, \\\"Pausable: caller is not the pauser\\\");\\n        _;\\n    }\\n\\n    /**\\n     * @dev called by the owner to pause, triggers stopped state\\n     */\\n    function pause() external onlyPauser {\\n        paused = true;\\n        emit Pause();\\n    }\\n\\n    /**\\n     * @dev called by the owner to unpause, returns to normal state\\n     */\\n    function unpause() external onlyPauser {\\n        paused = false;\\n        emit Unpause();\\n    }\\n\\n    /**\\n     * @dev update the pauser role\\n     */\\n    function updatePauser(address _newPauser) external onlyOwner {\\n        require(_newPauser != address(0), \\\"Pausable: new pauser is the zero address\\\");\\n        pauser = _newPauser;\\n        emit PauserChanged(pauser);\\n    }\\n}\\n\\n// File: contracts/v1/Blacklistable.sol\\n\\n/**\\n * Copyright (c) 2018-2020 CENTRE SECZ\\n *\\n * Permission is hereby granted, free of charge, to any person obtaining a copy\\n * of this software and associated documentation files (the \\\"Software\\\"), to deal\\n * in the Software without restriction, including without limitation the rights\\n * to use, copy, modify, merge, publish, distribute, sublicense, and/or sell\\n * copies of the Software, and to permit persons to whom the Software is\\n * furnished to do so, subject to the following conditions:\\n *\\n * The above copyright notice and this permission notice shall be included in\\n * copies or substantial portions of the Software.\\n *\\n * THE SOFTWARE IS PROVIDED \\\"AS IS\\\", WITHOUT WARRANTY OF ANY KIND, EXPRESS OR\\n * IMPLIED, INCLUDING BUT NOT LIMITED TO THE WARRANTIES OF MERCHANTABILITY,\\n * FITNESS FOR A PARTICULAR PURPOSE AND NONINFRINGEMENT. IN NO EVENT SHALL THE\\n * AUTHORS OR COPYRIGHT HOLDERS BE LIABLE FOR ANY CLAIM, DAMAGES OR OTHER\\n * LIABILITY, WHETHER IN AN ACTION OF CONTRACT, TORT OR OTHERWISE, ARISING FROM,\\n * OUT OF OR IN CONNECTION WITH THE SOFTWARE OR THE USE OR OTHER DEALINGS IN THE\\n * SOFTWARE.\\n */\\n\\npragma solidity 0.6.12;\\n\\n/**\\n * @title Blacklistable Token\\n * @dev Allows accounts to be blacklisted by a \\\"blacklister\\\" role\\n */\\ncontract Blacklistable is Ownable {\\n    address public blacklister;\\n    mapping(address => bool) internal blacklisted;\\n\\n    event Blacklisted(address indexed _account);\\n    event UnBlacklisted(address indexed _account);\\n    event BlacklisterChanged(address indexed newBlacklister);\\n\\n    /**\\n     * @dev Throws if called by any account other than the blacklister\\n     */\\n    modifier onlyBlacklister() {\\n        require(msg.sender == blacklister, \\\"Blacklistable: caller is not the blacklister\\\");\\n        _;\\n    }\\n\\n    /**\\n     * @dev Throws if argument account is blacklisted\\n     * @param _account The address to check\\n     */\\n    modifier notBlacklisted(address _account) {\\n        require(!blacklisted[_account], \\\"Blacklistable: account is blacklisted\\\");\\n        _;\\n    }\\n\\n    /**\\n     * @dev Checks if account is blacklisted\\n     * @param _account The address to check\\n     */\\n    function isBlacklisted(address _account) external view returns (bool) {\\n        return blacklisted[_account];\\n    }\\n\\n    /**\\n     * @dev Adds account to blacklist\\n     * @param _account The address to blacklist\\n     */\\n    function blacklist(address _account) external onlyBlacklister {\\n        blacklisted[_account] = true;\\n        emit Blacklisted(_account);\\n    }\\n\\n    /**\\n     * @dev Removes account from blacklist\\n     * @param _account The address to remove from the blacklist\\n     */\\n    function unBlacklist(address _account) external onlyBlacklister {\\n        blacklisted[_account] = false;\\n        emit UnBlacklisted(_account);\\n    }\\n\\n    function updateBlacklister(address _newBlacklister) external onlyOwner {\\n        require(_newBlacklister != address(0), \\\"Blacklistable: new blacklister is the zero address\\\");\\n        blacklister = _newBlacklister;\\n        emit BlacklisterChanged(blacklister);\\n    }\\n}\\n\\n// File: contracts/v1/FiatTokenV1.sol\\n\\n/**\\n *\\n * Copyright (c) 2018-2020 CENTRE SECZ\\n *\\n * Permission is hereby granted, free of charge, to any person obtaining a copy\\n * of this software and associated documentation files (the \\\"Software\\\"), to deal\\n * in the Software without restriction, including without limitation the rights\\n * to use, copy, modify, merge, publish, distribute, sublicense, and/or sell\\n * copies of the Software, and to permit persons to whom the Software is\\n * furnished to do so, subject to the following conditions:\\n *\\n * The above copyright notice and this permission notice shall be included in\\n * copies or substantial portions of the Software.\\n *\\n * THE SOFTWARE IS PROVIDED \\\"AS IS\\\", WITHOUT WARRANTY OF ANY KIND, EXPRESS OR\\n * IMPLIED, INCLUDING BUT NOT LIMITED TO THE WARRANTIES OF MERCHANTABILITY,\\n * FITNESS FOR A PARTICULAR PURPOSE AND NONINFRINGEMENT. IN NO EVENT SHALL THE\\n * AUTHORS OR COPYRIGHT HOLDERS BE LIABLE FOR ANY CLAIM, DAMAGES OR OTHER\\n * LIABILITY, WHETHER IN AN ACTION OF CONTRACT, TORT OR OTHERWISE, ARISING FROM,\\n * OUT OF OR IN CONNECTION WITH THE SOFTWARE OR THE USE OR OTHER DEALINGS IN THE\\n * SOFTWARE.\\n */\\n\\npragma solidity 0.6.12;\\n\\n/**\\n * @title FiatToken\\n * @dev ERC20 Token backed by fiat reserves\\n */\\ncontract FiatTokenV1 is AbstractFiatTokenV1, Ownable, Pausable, Blacklistable {\\n    using SafeMath for uint256;\\n\\n    string public name;\\n    string public symbol;\\n    uint8 public decimals;\\n    string public currency;\\n    address public masterMinter;\\n    bool internal initialized;\\n\\n    mapping(address => uint256) internal balances;\\n    mapping(address => mapping(address => uint256)) internal allowed;\\n    uint256 internal totalSupply_ = 0;\\n    mapping(address => bool) internal minters;\\n    mapping(address => uint256) internal minterAllowed;\\n\\n    event Mint(address indexed minter, address indexed to, uint256 amount);\\n    event Burn(address indexed burner, uint256 amount);\\n    event MinterConfigured(address indexed minter, uint256 minterAllowedAmount);\\n    event MinterRemoved(address indexed oldMinter);\\n    event MasterMinterChanged(address indexed newMasterMinter);\\n\\n    function initialize(\\n        string memory tokenName,\\n        string memory tokenSymbol,\\n        string memory tokenCurrency,\\n        uint8 tokenDecimals,\\n        address newMasterMinter,\\n        address newPauser,\\n        address newBlacklister,\\n        address newOwner\\n    ) public {\\n        require(!initialized, \\\"FiatToken: contract is already initialized\\\");\\n        require(newMasterMinter != address(0), \\\"FiatToken: new masterMinter is the zero address\\\");\\n        require(newPauser != address(0), \\\"FiatToken: new pauser is the zero address\\\");\\n        require(newBlacklister != address(0), \\\"FiatToken: new blacklister is the zero address\\\");\\n        require(newOwner != address(0), \\\"FiatToken: new owner is the zero address\\\");\\n\\n        name = tokenName;\\n        symbol = tokenSymbol;\\n        currency = tokenCurrency;\\n        decimals = tokenDecimals;\\n        masterMinter = newMasterMinter;\\n        pauser = newPauser;\\n        blacklister = newBlacklister;\\n        setOwner(newOwner);\\n        initialized = true;\\n    }\\n\\n    /**\\n     * @dev Throws if called by any account other than a minter\\n     */\\n    modifier onlyMinters() {\\n        require(minters[msg.sender], \\\"FiatToken: caller is not a minter\\\");\\n        _;\\n    }\\n\\n    /**\\n     * @dev Function to mint tokens\\n     * @param _to The address that will receive the minted tokens.\\n     * @param _amount The amount of tokens to mint. Must be less than or equal\\n     * to the minterAllowance of the caller.\\n     * @return A boolean that indicates if the operation was successful.\\n     */\\n    function mint(\\n        address _to,\\n        uint256 _amount\\n    ) external whenNotPaused onlyMinters notBlacklisted(msg.sender) notBlacklisted(_to) returns (bool) {\\n        require(_to != address(0), \\\"FiatToken: mint to the zero address\\\");\\n        require(_amount > 0, \\\"FiatToken: mint amount not greater than 0\\\");\\n\\n        uint256 mintingAllowedAmount = minterAllowed[msg.sender];\\n        require(_amount <= mintingAllowedAmount, \\\"FiatToken: mint amount exceeds minterAllowance\\\");\\n\\n        totalSupply_ = totalSupply_.add(_amount);\\n        balances[_to] = balances[_to].add(_amount);\\n        minterAllowed[msg.sender] = mintingAllowedAmount.sub(_amount);\\n        emit Mint(msg.sender, _to, _amount);\\n        emit Transfer(address(0), _to, _amount);\\n        return true;\\n    }\\n\\n    /**\\n     * @dev Throws if called by any account other than the masterMinter\\n     */\\n    modifier onlyMasterMinter() {\\n        require(msg.sender == masterMinter, \\\"FiatToken: caller is not the masterMinter\\\");\\n        _;\\n    }\\n\\n    /**\\n     * @dev Get minter allowance for an account\\n     * @param minter The address of the minter\\n     */\\n    function minterAllowance(address minter) external view returns (uint256) {\\n        return minterAllowed[minter];\\n    }\\n\\n    /**\\n     * @dev Checks if account is a minter\\n     * @param account The address to check\\n     */\\n    function isMinter(address account) external view returns (bool) {\\n        return minters[account];\\n    }\\n\\n    /**\\n     * @notice Amount of remaining tokens spender is allowed to transfer on\\n     * behalf of the token owner\\n     * @param owner     Token owner's address\\n     * @param spender   Spender's address\\n     * @return Allowance amount\\n     */\\n    function allowance(address owner, address spender) external view override returns (uint256) {\\n        return allowed[owner][spender];\\n    }\\n\\n    /**\\n     * @dev Get totalSupply of token\\n     */\\n    function totalSupply() external view override returns (uint256) {\\n        return totalSupply_;\\n    }\\n\\n    /**\\n     * @dev Get token balance of an account\\n     * @param account address The account\\n     */\\n    function balanceOf(address account) external view override returns (uint256) {\\n        return balances[account];\\n    }\\n\\n    /**\\n     * @notice Set spender's allowance over the caller's tokens to be a given\\n     * value.\\n     * @param spender   Spender's address\\n     * @param value     Allowance amount\\n     * @return True if successful\\n     */\\n    function approve(\\n        address spender,\\n        uint256 value\\n    ) external override whenNotPaused notBlacklisted(msg.sender) notBlacklisted(spender) returns (bool) {\\n        _approve(msg.sender, spender, value);\\n        return true;\\n    }\\n\\n    /**\\n     * @dev Internal function to set allowance\\n     * @param owner     Token owner's address\\n     * @param spender   Spender's address\\n     * @param value     Allowance amount\\n     */\\n    function _approve(address owner, address spender, uint256 value) internal override {\\n        require(owner != address(0), \\\"ERC20: approve from the zero address\\\");\\n        require(spender != address(0), \\\"ERC20: approve to the zero address\\\");\\n        allowed[owner][spender] = value;\\n        emit Approval(owner, spender, value);\\n    }\\n\\n    /**\\n     * @notice Transfer tokens by spending allowance\\n     * @param from  Payer's address\\n     * @param to    Payee's address\\n     * @param value Transfer amount\\n     * @return True if successful\\n     */\\n    function transferFrom(\\n        address from,\\n        address to,\\n        uint256 value\\n    )\\n        external\\n        override\\n        whenNotPaused\\n        notBlacklisted(msg.sender)\\n        notBlacklisted(from)\\n        notBlacklisted(to)\\n        returns (bool)\\n    {\\n        require(value <= allowed[from][msg.sender], \\\"ERC20: transfer amount exceeds allowance\\\");\\n        _transfer(from, to, value);\\n        allowed[from][msg.sender] = allowed[from][msg.sender].sub(value);\\n        return true;\\n    }\\n\\n    /**\\n     * @notice Transfer tokens from the caller\\n     * @param to    Payee's address\\n     * @param value Transfer amount\\n     * @return True if successful\\n     */\\n    function transfer(\\n        address to,\\n        uint256 value\\n    ) external override whenNotPaused notBlacklisted(msg.sender) notBlacklisted(to) returns (bool) {\\n        _transfer(msg.sender, to, value);\\n        return true;\\n    }\\n\\n    /**\\n     * @notice Internal function to process transfers\\n     * @param from  Payer's address\\n     * @param to    Payee's address\\n     * @param value Transfer amount\\n     */\\n    function _transfer(address from, address to, uint256 value) internal override {\\n        require(from != address(0), \\\"ERC20: transfer from the zero address\\\");\\n        require(to != address(0), \\\"ERC20: transfer to the zero address\\\");\\n        require(value <= balances[from], \\\"ERC20: transfer amount exceeds balance\\\");\\n\\n        balances[from] = balances[from].sub(value);\\n        balances[to] = balances[to].add(value);\\n        emit Transfer(from, to, value);\\n    }\\n\\n    /**\\n     * @dev Function to add/update a new minter\\n     * @param minter The address of the minter\\n     * @param minterAllowedAmount The minting amount allowed for the minter\\n     * @return True if the operation was successful.\\n     */\\n    function configureMinter(\\n        address minter,\\n        uint256 minterAllowedAmount\\n    ) external whenNotPaused onlyMasterMinter returns (bool) {\\n        minters[minter] = true;\\n        minterAllowed[minter] = minterAllowedAmount;\\n        emit MinterConfigured(minter, minterAllowedAmount);\\n        return true;\\n    }\\n\\n    /**\\n     * @dev Function to remove a minter\\n     * @param minter The address of the minter to remove\\n     * @return True if the operation was successful.\\n     */\\n    function removeMinter(address minter) external onlyMasterMinter returns (bool) {\\n        minters[minter] = false;\\n        minterAllowed[minter] = 0;\\n        emit MinterRemoved(minter);\\n        return true;\\n    }\\n\\n    /**\\n     * @dev allows a minter to burn some of its own tokens\\n     * Validates that caller is a minter and that sender is not blacklisted\\n     * amount is less than or equal to the minter's account balance\\n     * @param _amount uint256 the amount of tokens to be burned\\n     */\\n    function burn(uint256 _amount) external whenNotPaused onlyMinters notBlacklisted(msg.sender) {\\n        uint256 balance = balances[msg.sender];\\n        require(_amount > 0, \\\"FiatToken: burn amount not greater than 0\\\");\\n        require(balance >= _amount, \\\"FiatToken: burn amount exceeds balance\\\");\\n\\n        totalSupply_ = totalSupply_.sub(_amount);\\n        balances[msg.sender] = balance.sub(_amount);\\n        emit Burn(msg.sender, _amount);\\n        emit Transfer(msg.sender, address(0), _amount);\\n    }\\n\\n    function updateMasterMinter(address _newMasterMinter) external onlyOwner {\\n        require(_newMasterMinter != address(0), \\\"FiatToken: new masterMinter is the zero address\\\");\\n        masterMinter = _newMasterMinter;\\n        emit MasterMinterChanged(masterMinter);\\n    }\\n}\\n\\n// File: @openzeppelin/contracts/utils/Address.sol\\n\\npragma solidity ^0.6.2;\\n\\n/**\\n * @dev Collection of functions related to the address type\\n */\\nlibrary Address {\\n    /**\\n     * @dev Returns true if `account` is a contract.\\n     *\\n     * [IMPORTANT]\\n     * ====\\n     * It is unsafe to assume that an address for which this function returns\\n     * false is an externally-owned account (EOA) and not a contract.\\n     *\\n     * Among others, `isContract` will return false for the following\\n     * types of addresses:\\n     *\\n     *  - an externally-owned account\\n     *  - a contract in construction\\n     *  - an address where a contract will be created\\n     *  - an address where a contract lived, but was destroyed\\n     * ====\\n     */\\n    function isContract(address account) internal view returns (bool) {\\n        // According to EIP-1052, 0x0 is the value returned for not-yet created accounts\\n        // and 0xc5d2460186f7233c927e7db2dcc703c0e500b653ca82273b7bfad8045d85a470 is returned\\n        // for accounts without code, i.e. `keccak256('')`\\n        bytes32 codehash;\\n\\n        bytes32 accountHash = 0xc5d2460186f7233c927e7db2dcc703c0e500b653ca82273b7bfad8045d85a470;\\n        // solhint-disable-next-line no-inline-assembly\\n        assembly {\\n            codehash := extcodehash(account)\\n        }\\n        return (codehash != accountHash && codehash != 0x0);\\n    }\\n\\n    /**\\n     * @dev Replacement for Solidity's `transfer`: sends `amount` wei to\\n     * `recipient`, forwarding all available gas and reverting on errors.\\n     *\\n     * https://eips.ethereum.org/EIPS/eip-1884[EIP1884] increases the gas cost\\n     * of certain opcodes, possibly making contracts go over the 2300 gas limit\\n     * imposed by `transfer`, making them unable to receive funds via\\n     * `transfer`. {sendValue} removes this limitation.\\n     *\\n     * https://diligence.consensys.net/posts/2019/09/stop-using-soliditys-transfer-now/[Learn more].\\n     *\\n     * IMPORTANT: because control is transferred to `recipient`, care must be\\n     * taken to not create reentrancy vulnerabilities. Consider using\\n     * {ReentrancyGuard} or the\\n     * https://solidity.readthedocs.io/en/v0.5.11/security-considerations.html#use-the-checks-effects-interactions-pattern[checks-effects-interactions pattern].\\n     */\\n    function sendValue(address payable recipient, uint256 amount) internal {\\n        require(address(this).balance >= amount, \\\"Address: insufficient balance\\\");\\n\\n        // solhint-disable-next-line avoid-low-level-calls, avoid-call-value\\n        (bool success, ) = recipient.call{ value: amount }(\\\"\\\");\\n        require(success, \\\"Address: unable to send value, recipient may have reverted\\\");\\n    }\\n\\n    /**\\n     * @dev Performs a Solidity function call using a low level `call`. A\\n     * plain`call` is an unsafe replacement for a function call: use this\\n     * function instead.\\n     *\\n     * If `target` reverts with a revert reason, it is bubbled up by this\\n     * function (like regular Solidity function calls).\\n     *\\n     * Returns the raw returned data. To convert to the expected return value,\\n     * use https://solidity.readthedocs.io/en/latest/units-and-global-variables.html?highlight=abi.decode#abi-encoding-and-decoding-functions[`abi.decode`].\\n     *\\n     * Requirements:\\n     *\\n     * - `target` must be a contract.\\n     * - calling `target` with `data` must not revert.\\n     *\\n     * _Available since v3.1._\\n     */\\n    function functionCall(address target, bytes memory data) internal returns (bytes memory) {\\n        return functionCall(target, data, \\\"Address: low-level call failed\\\");\\n    }\\n\\n    /**\\n     * @dev Same as {xref-Address-functionCall-address-bytes-}[`functionCall`], but with\\n     * `errorMessage` as a fallback revert reason when `target` reverts.\\n     *\\n     * _Available since v3.1._\\n     */\\n    function functionCall(\\n        address target,\\n        bytes memory data,\\n        string memory errorMessage\\n    ) internal returns (bytes memory) {\\n        return _functionCallWithValue(target, data, 0, errorMessage);\\n    }\\n\\n    /**\\n     * @dev Same as {xref-Address-functionCall-address-bytes-}[`functionCall`],\\n     * but also transferring `value` wei to `target`.\\n     *\\n     * Requirements:\\n     *\\n     * - the calling contract must have an ETH balance of at least `value`.\\n     * - the called Solidity function must be `payable`.\\n     *\\n     * _Available since v3.1._\\n     */\\n    function functionCallWithValue(address target, bytes memory data, uint256 value) internal returns (bytes memory) {\\n        return functionCallWithValue(target, data, value, \\\"Address: low-level call with value failed\\\");\\n    }\\n\\n    /**\\n     * @dev Same as {xref-Address-functionCallWithValue-address-bytes-uint256-}[`functionCallWithValue`], but\\n     * with `errorMessage` as a fallback revert reason when `target` reverts.\\n     *\\n     * _Available since v3.1._\\n     */\\n    function functionCallWithValue(\\n        address target,\\n        bytes memory data,\\n        uint256 value,\\n        string memory errorMessage\\n    ) internal returns (bytes memory) {\\n        require(address(this).balance >= value, \\\"Address: insufficient balance for call\\\");\\n        return _functionCallWithValue(target, data, value, errorMessage);\\n    }\\n\\n    function _functionCallWithValue(\\n        address target,\\n        bytes memory data,\\n        uint256 weiValue,\\n        string memory errorMessage\\n    ) private returns (bytes memory) {\\n        require(isContract(target), \\\"Address: call to non-contract\\\");\\n\\n        // solhint-disable-next-line avoid-low-level-calls\\n        (bool success, bytes memory returndata) = target.call{ value: weiValue }(data);\\n        if (success) {\\n            return returndata;\\n        } else {\\n            // Look for revert reason and bubble it up if present\\n            if (returndata.length > 0) {\\n                // The easiest way to bubble the revert reason is using memory via assembly\\n\\n                // solhint-disable-next-line no-inline-assembly\\n                assembly {\\n                    let returndata_size := mload(returndata)\\n                    revert(add(32, returndata), returndata_size)\\n                }\\n            } else {\\n                revert(errorMessage);\\n            }\\n        }\\n    }\\n}\\n\\n// File: @openzeppelin/contracts/token/ERC20/SafeERC20.sol\\n\\npragma solidity ^0.6.0;\\n\\n/**\\n * @title SafeERC20\\n * @dev Wrappers around ERC20 operations that throw on failure (when the token\\n * contract returns false). Tokens that return no value (and instead revert or\\n * throw on failure) are also supported, non-reverting calls are assumed to be\\n * successful.\\n * To use this library you can add a `using SafeERC20 for IERC20;` statement to your contract,\\n * which allows you to call the safe operations as `token.safeTransfer(...)`, etc.\\n */\\nlibrary SafeERC20 {\\n    using SafeMath for uint256;\\n    using Address for address;\\n\\n    function safeTransfer(IERC20 token, address to, uint256 value) internal {\\n        _callOptionalReturn(token, abi.encodeWithSelector(token.transfer.selector, to, value));\\n    }\\n\\n    function safeTransferFrom(IERC20 token, address from, address to, uint256 value) internal {\\n        _callOptionalReturn(token, abi.encodeWithSelector(token.transferFrom.selector, from, to, value));\\n    }\\n\\n    /**\\n     * @dev Deprecated. This function has issues similar to the ones found in\\n     * {IERC20-approve}, and its usage is discouraged.\\n     *\\n     * Whenever possible, use {safeIncreaseAllowance} and\\n     * {safeDecreaseAllowance} instead.\\n     */\\n    function safeApprove(IERC20 token, address spender, uint256 value) internal {\\n        // safeApprove should only be called when setting an initial allowance,\\n        // or when resetting it to zero. To increase and decrease it, use\\n        // 'safeIncreaseAllowance' and 'safeDecreaseAllowance'\\n        // solhint-disable-next-line max-line-length\\n        require(\\n            (value == 0) || (token.allowance(address(this), spender) == 0),\\n            \\\"SafeERC20: approve from non-zero to non-zero allowance\\\"\\n        );\\n        _callOptionalReturn(token, abi.encodeWithSelector(token.approve.selector, spender, value));\\n    }\\n\\n    function safeIncreaseAllowance(IERC20 token, address spender, uint256 value) internal {\\n        uint256 newAllowance = token.allowance(address(this), spender).add(value);\\n        _callOptionalReturn(token, abi.encodeWithSelector(token.approve.selector, spender, newAllowance));\\n    }\\n\\n    function safeDecreaseAllowance(IERC20 token, address spender, uint256 value) internal {\\n        uint256 newAllowance = token.allowance(address(this), spender).sub(\\n            value,\\n            \\\"SafeERC20: decreased allowance below zero\\\"\\n        );\\n        _callOptionalReturn(token, abi.encodeWithSelector(token.approve.selector, spender, newAllowance));\\n    }\\n\\n    /**\\n     * @dev Imitates a Solidity high-level call (i.e. a regular function call to a contract), relaxing the requirement\\n     * on the return value: the return value is optional (but if data is returned, it must not be false).\\n     * @param token The token targeted by the call.\\n     * @param data The call data (encoded using abi.encode or one of its variants).\\n     */\\n    function _callOptionalReturn(IERC20 token, bytes memory data) private {\\n        // We need to perform a low level call here, to bypass Solidity's return data size checking mechanism, since\\n        // we're implementing it ourselves. We use {Address.functionCall} to perform this call, which verifies that\\n        // the target address contains contract code and also asserts for success in the low-level call.\\n\\n        bytes memory returndata = address(token).functionCall(data, \\\"SafeERC20: low-level call failed\\\");\\n        if (returndata.length > 0) {\\n            // Return data is optional\\n            // solhint-disable-next-line max-line-length\\n            require(abi.decode(returndata, (bool)), \\\"SafeERC20: ERC20 operation did not succeed\\\");\\n        }\\n    }\\n}\\n\\n// File: contracts/v1.1/Rescuable.sol\\n\\n/**\\n * Copyright (c) 2018-2020 CENTRE SECZ\\n *\\n * Permission is hereby granted, free of charge, to any person obtaining a copy\\n * of this software and associated documentation files (the \\\"Software\\\"), to deal\\n * in the Software without restriction, including without limitation the rights\\n * to use, copy, modify, merge, publish, distribute, sublicense, and/or sell\\n * copies of the Software, and to permit persons to whom the Software is\\n * furnished to do so, subject to the following conditions:\\n *\\n * The above copyright notice and this permission notice shall be included in\\n * copies or substantial portions of the Software.\\n *\\n * THE SOFTWARE IS PROVIDED \\\"AS IS\\\", WITHOUT WARRANTY OF ANY KIND, EXPRESS OR\\n * IMPLIED, INCLUDING BUT NOT LIMITED TO THE WARRANTIES OF MERCHANTABILITY,\\n * FITNESS FOR A PARTICULAR PURPOSE AND NONINFRINGEMENT. IN NO EVENT SHALL THE\\n * AUTHORS OR COPYRIGHT HOLDERS BE LIABLE FOR ANY CLAIM, DAMAGES OR OTHER\\n * LIABILITY, WHETHER IN AN ACTION OF CONTRACT, TORT OR OTHERWISE, ARISING FROM,\\n * OUT OF OR IN CONNECTION WITH THE SOFTWARE OR THE USE OR OTHER DEALINGS IN THE\\n * SOFTWARE.\\n */\\n\\npragma solidity 0.6.12;\\n\\ncontract Rescuable is Ownable {\\n    using SafeERC20 for IERC20;\\n\\n    address private _rescuer;\\n\\n    event RescuerChanged(address indexed newRescuer);\\n\\n    /**\\n     * @notice Returns current rescuer\\n     * @return Rescuer's address\\n     */\\n    function rescuer() external view returns (address) {\\n        return _rescuer;\\n    }\\n\\n    /**\\n     * @notice Revert if called by any account other than the rescuer.\\n     */\\n    modifier onlyRescuer() {\\n        require(msg.sender == _rescuer, \\\"Rescuable: caller is not the rescuer\\\");\\n        _;\\n    }\\n\\n    /**\\n     * @notice Rescue ERC20 tokens locked up in this contract.\\n     * @param tokenContract ERC20 token contract address\\n     * @param to        Recipient address\\n     * @param amount    Amount to withdraw\\n     */\\n    function rescueERC20(IERC20 tokenContract, address to, uint256 amount) external onlyRescuer {\\n        tokenContract.safeTransfer(to, amount);\\n    }\\n\\n    /**\\n     * @notice Assign the rescuer role to a given address.\\n     * @param newRescuer New rescuer's address\\n     */\\n    function updateRescuer(address newRescuer) external onlyOwner {\\n        require(newRescuer != address(0), \\\"Rescuable: new rescuer is the zero address\\\");\\n        _rescuer = newRescuer;\\n        emit RescuerChanged(newRescuer);\\n    }\\n}\\n\\n// File: contracts/v1.1/FiatTokenV1_1.sol\\n\\n/**\\n * Copyright (c) 2018-2020 CENTRE SECZ\\n *\\n * Permission is hereby granted, free of charge, to any person obtaining a copy\\n * of this software and associated documentation files (the \\\"Software\\\"), to deal\\n * in the Software without restriction, including without limitation the rights\\n * to use, copy, modify, merge, publish, distribute, sublicense, and/or sell\\n * copies of the Software, and to permit persons to whom the Software is\\n * furnished to do so, subject to the following conditions:\\n *\\n * The above copyright notice and this permission notice shall be included in\\n * copies or substantial portions of the Software.\\n *\\n * THE SOFTWARE IS PROVIDED \\\"AS IS\\\", WITHOUT WARRANTY OF ANY KIND, EXPRESS OR\\n * IMPLIED, INCLUDING BUT NOT LIMITED TO THE WARRANTIES OF MERCHANTABILITY,\\n * FITNESS FOR A PARTICULAR PURPOSE AND NONINFRINGEMENT. IN NO EVENT SHALL THE\\n * AUTHORS OR COPYRIGHT HOLDERS BE LIABLE FOR ANY CLAIM, DAMAGES OR OTHER\\n * LIABILITY, WHETHER IN AN ACTION OF CONTRACT, TORT OR OTHERWISE, ARISING FROM,\\n * OUT OF OR IN CONNECTION WITH THE SOFTWARE OR THE USE OR OTHER DEALINGS IN THE\\n * SOFTWARE.\\n */\\n\\npragma solidity 0.6.12;\\n\\n/**\\n * @title FiatTokenV1_1\\n * @dev ERC20 Token backed by fiat reserves\\n */\\ncontract FiatTokenV1_1 is FiatTokenV1, Rescuable {\\n\\n}\\n\\n// File: contracts/v2/AbstractFiatTokenV2.sol\\n\\n/**\\n * Copyright (c) 2018-2020 CENTRE SECZ\\n *\\n * Permission is hereby granted, free of charge, to any person obtaining a copy\\n * of this software and associated documentation files (the \\\"Software\\\"), to deal\\n * in the Software without restriction, including without limitation the rights\\n * to use, copy, modify, merge, publish, distribute, sublicense, and/or sell\\n * copies of the Software, and to permit persons to whom the Software is\\n * furnished to do so, subject to the following conditions:\\n *\\n * The above copyright notice and this permission notice shall be included in\\n * copies or substantial portions of the Software.\\n *\\n * THE SOFTWARE IS PROVIDED \\\"AS IS\\\", WITHOUT WARRANTY OF ANY KIND, EXPRESS OR\\n * IMPLIED, INCLUDING BUT NOT LIMITED TO THE WARRANTIES OF MERCHANTABILITY,\\n * FITNESS FOR A PARTICULAR PURPOSE AND NONINFRINGEMENT. IN NO EVENT SHALL THE\\n * AUTHORS OR COPYRIGHT HOLDERS BE LIABLE FOR ANY CLAIM, DAMAGES OR OTHER\\n * LIABILITY, WHETHER IN AN ACTION OF CONTRACT, TORT OR OTHERWISE, ARISING FROM,\\n * OUT OF OR IN CONNECTION WITH THE SOFTWARE OR THE USE OR OTHER DEALINGS IN THE\\n * SOFTWARE.\\n */\\n\\npragma solidity 0.6.12;\\n\\nabstract contract AbstractFiatTokenV2 is AbstractFiatTokenV1 {\\n    function _increaseAllowance(address owner, address spender, uint256 increment) internal virtual;\\n\\n    function _decreaseAllowance(address owner, address spender, uint256 decrement) internal virtual;\\n}\\n\\n// File: contracts/util/ECRecover.sol\\n\\n/**\\n * Copyright (c) 2016-2019 zOS Global Limited\\n * Copyright (c) 2018-2020 CENTRE SECZ\\n *\\n * Permission is hereby granted, free of charge, to any person obtaining a copy\\n * of this software and associated documentation files (the \\\"Software\\\"), to deal\\n * in the Software without restriction, including without limitation the rights\\n * to use, copy, modify, merge, publish, distribute, sublicense, and/or sell\\n * copies of the Software, and to permit persons to whom the Software is\\n * furnished to do so, subject to the following conditions:\\n *\\n * The above copyright notice and this permission notice shall be included in\\n * copies or substantial portions of the Software.\\n *\\n * THE SOFTWARE IS PROVIDED \\\"AS IS\\\", WITHOUT WARRANTY OF ANY KIND, EXPRESS OR\\n * IMPLIED, INCLUDING BUT NOT LIMITED TO THE WARRANTIES OF MERCHANTABILITY,\\n * FITNESS FOR A PARTICULAR PURPOSE AND NONINFRINGEMENT. IN NO EVENT SHALL THE\\n * AUTHORS OR COPYRIGHT HOLDERS BE LIABLE FOR ANY CLAIM, DAMAGES OR OTHER\\n * LIABILITY, WHETHER IN AN ACTION OF CONTRACT, TORT OR OTHERWISE, ARISING FROM,\\n * OUT OF OR IN CONNECTION WITH THE SOFTWARE OR THE USE OR OTHER DEALINGS IN THE\\n * SOFTWARE.\\n */\\n\\npragma solidity 0.6.12;\\n\\n/**\\n * @title ECRecover\\n * @notice A library that provides a safe ECDSA recovery function\\n */\\nlibrary ECRecover {\\n    /**\\n     * @notice Recover signer's address from a signed message\\n     * @dev Adapted from: https://github.com/OpenZeppelin/openzeppelin-contracts/blob/65e4ffde586ec89af3b7e9140bdc9235d1254853/contracts/cryptography/ECDSA.sol\\n     * Modifications: Accept v, r, and s as separate arguments\\n     * @param digest    Keccak-256 hash digest of the signed message\\n     * @param v         v of the signature\\n     * @param r         r of the signature\\n     * @param s         s of the signature\\n     * @return Signer address\\n     */\\n    function recover(bytes32 digest, uint8 v, bytes32 r, bytes32 s) internal pure returns (address) {\\n        // EIP-2 still allows signature malleability for ecrecover(). Remove this possibility and make the signature\\n        // unique. Appendix F in the Ethereum Yellow paper (https://ethereum.github.io/yellowpaper/paper.pdf), defines\\n        // the valid range for s in (281): 0 < s < secp256k1n \\u00f7 2 + 1, and for v in (282): v \\u2208 {27, 28}. Most\\n        // signatures from current libraries generate a unique signature with an s-value in the lower half order.\\n        //\\n        // If your library generates malleable signatures, such as s-values in the upper range, calculate a new s-value\\n        // with 0xFFFFFFFFFFFFFFFFFFFFFFFFFFFFFFFEBAAEDCE6AF48A03BBFD25E8CD0364141 - s1 and flip v from 27 to 28 or\\n        // vice versa. If your library also generates signatures with 0/1 for v instead 27/28, add 27 to v to accept\\n        // these malleable signatures as well.\\n        if (uint256(s) > 0x7FFFFFFFFFFFFFFFFFFFFFFFFFFFFFFF5D576E7357A4501DDFE92F46681B20A0) {\\n            revert(\\\"ECRecover: invalid signature 's' value\\\");\\n        }\\n\\n        if (v != 27 && v != 28) {\\n            revert(\\\"ECRecover: invalid signature 'v' value\\\");\\n        }\\n\\n        // If the signature is valid (and not malleable), return the signer address\\n        address signer = ecrecover(digest, v, r, s);\\n        require(signer != address(0), \\\"ECRecover: invalid signature\\\");\\n\\n        return signer;\\n    }\\n}\\n\\n// File: contracts/util/EIP712.sol\\n\\n/**\\n * Copyright (c) 2018-2020 CENTRE SECZ\\n *\\n * Permission is hereby granted, free of charge, to any person obtaining a copy\\n * of this software and associated documentation files (the \\\"Software\\\"), to deal\\n * in the Software without restriction, including without limitation the rights\\n * to use, copy, modify, merge, publish, distribute, sublicense, and/or sell\\n * copies of the Software, and to permit persons to whom the Software is\\n * furnished to do so, subject to the following conditions:\\n *\\n * The above copyright notice and this permission notice shall be included in\\n * copies or substantial portions of the Software.\\n *\\n * THE SOFTWARE IS PROVIDED \\\"AS IS\\\", WITHOUT WARRANTY OF ANY KIND, EXPRESS OR\\n * IMPLIED, INCLUDING BUT NOT LIMITED TO THE WARRANTIES OF MERCHANTABILITY,\\n * FITNESS FOR A PARTICULAR PURPOSE AND NONINFRINGEMENT. IN NO EVENT SHALL THE\\n * AUTHORS OR COPYRIGHT HOLDERS BE LIABLE FOR ANY CLAIM, DAMAGES OR OTHER\\n * LIABILITY, WHETHER IN AN ACTION OF CONTRACT, TORT OR OTHERWISE, ARISING FROM,\\n * OUT OF OR IN CONNECTION WITH THE SOFTWARE OR THE USE OR OTHER DEALINGS IN THE\\n * SOFTWARE.\\n */\\n\\npragma solidity 0.6.12;\\n\\n/**\\n * @title EIP712\\n * @notice A library that provides EIP712 helper functions\\n */\\nlibrary EIP712 {\\n    /**\\n     * @notice Make EIP712 domain separator\\n     * @param name      Contract name\\n     * @param version   Contract version\\n     * @return Domain separator\\n     */\\n    function makeDomainSeparator(string memory name, string memory version) internal view returns (bytes32) {\\n        uint256 chainId;\\n        assembly {\\n            chainId := chainid()\\n        }\\n        return\\n            keccak256(\\n                abi.encode(\\n                    // keccak256(\\\"EIP712Domain(string name,string version,uint256 chainId,address verifyingContract)\\\")\\n                    0x8b73c3c69bb8fe3d512ecc4cf759cc79239f7b179b0ffacaa9a75d522b39400f,\\n                    keccak256(bytes(name)),\\n                    keccak256(bytes(version)),\\n                    chainId,\\n                    address(this)\\n                )\\n            );\\n    }\\n\\n    /**\\n     * @notice Recover signer's address from a EIP712 signature\\n     * @param domainSeparator   Domain separator\\n     * @param v                 v of the signature\\n     * @param r                 r of the signature\\n     * @param s                 s of the signature\\n     * @param typeHashAndData   Type hash concatenated with data\\n     * @return Signer's address\\n     */\\n    function recover(\\n        bytes32 domainSeparator,\\n        uint8 v,\\n        bytes32 r,\\n        bytes32 s,\\n        bytes memory typeHashAndData\\n    ) internal pure returns (address) {\\n        bytes32 digest = keccak256(abi.encodePacked(\\\"\\\\x19\\\\x01\\\", domainSeparator, keccak256(typeHashAndData)));\\n        return ECRecover.recover(digest, v, r, s);\\n    }\\n}\\n\\n// File: contracts/v2/EIP712Domain.sol\\n\\n/**\\n * Copyright (c) 2018-2020 CENTRE SECZ\\n *\\n * Permission is hereby granted, free of charge, to any person obtaining a copy\\n * of this software and associated documentation files (the \\\"Software\\\"), to deal\\n * in the Software without restriction, including without limitation the rights\\n * to use, copy, modify, merge, publish, distribute, sublicense, and/or sell\\n * copies of the Software, and to permit persons to whom the Software is\\n * furnished to do so, subject to the following conditions:\\n *\\n * The above copyright notice and this permission notice shall be included in\\n * copies or substantial portions of the Software.\\n *\\n * THE SOFTWARE IS PROVIDED \\\"AS IS\\\", WITHOUT WARRANTY OF ANY KIND, EXPRESS OR\\n * IMPLIED, INCLUDING BUT NOT LIMITED TO THE WARRANTIES OF MERCHANTABILITY,\\n * FITNESS FOR A PARTICULAR PURPOSE AND NONINFRINGEMENT. IN NO EVENT SHALL THE\\n * AUTHORS OR COPYRIGHT HOLDERS BE LIABLE FOR ANY CLAIM, DAMAGES OR OTHER\\n * LIABILITY, WHETHER IN AN ACTION OF CONTRACT, TORT OR OTHERWISE, ARISING FROM,\\n * OUT OF OR IN CONNECTION WITH THE SOFTWARE OR THE USE OR OTHER DEALINGS IN THE\\n * SOFTWARE.\\n */\\n\\npragma solidity 0.6.12;\\n\\n/**\\n * @title EIP712 Domain\\n */\\ncontract EIP712Domain {\\n    /**\\n     * @dev EIP712 Domain Separator\\n     */\\n    bytes32 public DOMAIN_SEPARATOR;\\n}\\n\\n// File: contracts/v2/EIP3009.sol\\n\\n/**\\n * Copyright (c) 2018-2020 CENTRE SECZ\\n *\\n * Permission is hereby granted, free of charge, to any person obtaining a copy\\n * of this software and associated documentation files (the \\\"Software\\\"), to deal\\n * in the Software without restriction, including without limitation the rights\\n * to use, copy, modify, merge, publish, distribute, sublicense, and/or sell\\n * copies of the Software, and to permit persons to whom the Software is\\n * furnished to do so, subject to the following conditions:\\n *\\n * The above copyright notice and this permission notice shall be included in\\n * copies or substantial portions of the Software.\\n *\\n * THE SOFTWARE IS PROVIDED \\\"AS IS\\\", WITHOUT WARRANTY OF ANY KIND, EXPRESS OR\\n * IMPLIED, INCLUDING BUT NOT LIMITED TO THE WARRANTIES OF MERCHANTABILITY,\\n * FITNESS FOR A PARTICULAR PURPOSE AND NONINFRINGEMENT. IN NO EVENT SHALL THE\\n * AUTHORS OR COPYRIGHT HOLDERS BE LIABLE FOR ANY CLAIM, DAMAGES OR OTHER\\n * LIABILITY, WHETHER IN AN ACTION OF CONTRACT, TORT OR OTHERWISE, ARISING FROM,\\n * OUT OF OR IN CONNECTION WITH THE SOFTWARE OR THE USE OR OTHER DEALINGS IN THE\\n * SOFTWARE.\\n */\\n\\npragma solidity 0.6.12;\\n\\n/**\\n * @title EIP-3009\\n * @notice Provide internal implementation for gas-abstracted transfers\\n * @dev Contracts that inherit from this must wrap these with publicly\\n * accessible functions, optionally adding modifiers where necessary\\n */\\nabstract contract EIP3009 is AbstractFiatTokenV2, EIP712Domain {\\n    // keccak256(\\\"TransferWithAuthorization(address from,address to,uint256 value,uint256 validAfter,uint256 validBefore,bytes32 nonce)\\\")\\n    bytes32 public constant TRANSFER_WITH_AUTHORIZATION_TYPEHASH =\\n        0x7c7c6cdb67a18743f49ec6fa9b35f50d52ed05cbed4cc592e13b44501c1a2267;\\n\\n    // keccak256(\\\"ReceiveWithAuthorization(address from,address to,uint256 value,uint256 validAfter,uint256 validBefore,bytes32 nonce)\\\")\\n    bytes32 public constant RECEIVE_WITH_AUTHORIZATION_TYPEHASH =\\n        0xd099cc98ef71107a616c4f0f941f04c322d8e254fe26b3c6668db87aae413de8;\\n\\n    // keccak256(\\\"CancelAuthorization(address authorizer,bytes32 nonce)\\\")\\n    bytes32 public constant CANCEL_AUTHORIZATION_TYPEHASH =\\n        0x158b0a9edf7a828aad02f63cd515c68ef2f50ba807396f6d12842833a1597429;\\n\\n    /**\\n     * @dev authorizer address => nonce => bool (true if nonce is used)\\n     */\\n    mapping(address => mapping(bytes32 => bool)) private _authorizationStates;\\n\\n    event AuthorizationUsed(address indexed authorizer, bytes32 indexed nonce);\\n    event AuthorizationCanceled(address indexed authorizer, bytes32 indexed nonce);\\n\\n    /**\\n     * @notice Returns the state of an authorization\\n     * @dev Nonces are randomly generated 32-byte data unique to the\\n     * authorizer's address\\n     * @param authorizer    Authorizer's address\\n     * @param nonce         Nonce of the authorization\\n     * @return True if the nonce is used\\n     */\\n    function authorizationState(address authorizer, bytes32 nonce) external view returns (bool) {\\n        return _authorizationStates[authorizer][nonce];\\n    }\\n\\n    /**\\n     * @notice Execute a transfer with a signed authorization\\n     * @param from          Payer's address (Authorizer)\\n     * @param to            Payee's address\\n     * @param value         Amount to be transferred\\n     * @param validAfter    The time after which this is valid (unix time)\\n     * @param validBefore   The time before which this is valid (unix time)\\n     * @param nonce         Unique nonce\\n     * @param v             v of the signature\\n     * @param r             r of the signature\\n     * @param s             s of the signature\\n     */\\n    function _transferWithAuthorization(\\n        address from,\\n        address to,\\n        uint256 value,\\n        uint256 validAfter,\\n        uint256 validBefore,\\n        bytes32 nonce,\\n        uint8 v,\\n        bytes32 r,\\n        bytes32 s\\n    ) internal {\\n        _requireValidAuthorization(from, nonce, validAfter, validBefore);\\n\\n        bytes memory data = abi.encode(\\n            TRANSFER_WITH_AUTHORIZATION_TYPEHASH,\\n            from,\\n            to,\\n            value,\\n            validAfter,\\n            validBefore,\\n            nonce\\n        );\\n        require(EIP712.recover(DOMAIN_SEPARATOR, v, r, s, data) == from, \\\"FiatTokenV2: invalid signature\\\");\\n\\n        _markAuthorizationAsUsed(from, nonce);\\n        _transfer(from, to, value);\\n    }\\n\\n    /**\\n     * @notice Receive a transfer with a signed authorization from the payer\\n     * @dev This has an additional check to ensure that the payee's address\\n     * matches the caller of this function to prevent front-running attacks.\\n     * @param from          Payer's address (Authorizer)\\n     * @param to            Payee's address\\n     * @param value         Amount to be transferred\\n     * @param validAfter    The time after which this is valid (unix time)\\n     * @param validBefore   The time before which this is valid (unix time)\\n     * @param nonce         Unique nonce\\n     * @param v             v of the signature\\n     * @param r             r of the signature\\n     * @param s             s of the signature\\n     */\\n    function _receiveWithAuthorization(\\n        address from,\\n        address to,\\n        uint256 value,\\n        uint256 validAfter,\\n        uint256 validBefore,\\n        bytes32 nonce,\\n        uint8 v,\\n        bytes32 r,\\n        bytes32 s\\n    ) internal {\\n        require(to == msg.sender, \\\"FiatTokenV2: caller must be the payee\\\");\\n        _requireValidAuthorization(from, nonce, validAfter, validBefore);\\n\\n        bytes memory data = abi.encode(\\n            RECEIVE_WITH_AUTHORIZATION_TYPEHASH,\\n            from,\\n            to,\\n            value,\\n            validAfter,\\n            validBefore,\\n            nonce\\n        );\\n        require(EIP712.recover(DOMAIN_SEPARATOR, v, r, s, data) == from, \\\"FiatTokenV2: invalid signature\\\");\\n\\n        _markAuthorizationAsUsed(from, nonce);\\n        _transfer(from, to, value);\\n    }\\n\\n    /**\\n     * @notice Attempt to cancel an authorization\\n     * @param authorizer    Authorizer's address\\n     * @param nonce         Nonce of the authorization\\n     * @param v             v of the signature\\n     * @param r             r of the signature\\n     * @param s             s of the signature\\n     */\\n    function _cancelAuthorization(address authorizer, bytes32 nonce, uint8 v, bytes32 r, bytes32 s) internal {\\n        _requireUnusedAuthorization(authorizer, nonce);\\n\\n        bytes memory data = abi.encode(CANCEL_AUTHORIZATION_TYPEHASH, authorizer, nonce);\\n        require(EIP712.recover(DOMAIN_SEPARATOR, v, r, s, data) == authorizer, \\\"FiatTokenV2: invalid signature\\\");\\n\\n        _authorizationStates[authorizer][nonce] = true;\\n        emit AuthorizationCanceled(authorizer, nonce);\\n    }\\n\\n    /**\\n     * @notice Check that an authorization is unused\\n     * @param authorizer    Authorizer's address\\n     * @param nonce         Nonce of the authorization\\n     */\\n    function _requireUnusedAuthorization(address authorizer, bytes32 nonce) private view {\\n        require(!_authorizationStates[authorizer][nonce], \\\"FiatTokenV2: authorization is used or canceled\\\");\\n    }\\n\\n    /**\\n     * @notice Check that authorization is valid\\n     * @param authorizer    Authorizer's address\\n     * @param nonce         Nonce of the authorization\\n     * @param validAfter    The time after which this is valid (unix time)\\n     * @param validBefore   The time before which this is valid (unix time)\\n     */\\n    function _requireValidAuthorization(\\n        address authorizer,\\n        bytes32 nonce,\\n        uint256 validAfter,\\n        uint256 validBefore\\n    ) private view {\\n        require(now > validAfter, \\\"FiatTokenV2: authorization is not yet valid\\\");\\n        require(now < validBefore, \\\"FiatTokenV2: authorization is expired\\\");\\n        _requireUnusedAuthorization(authorizer, nonce);\\n    }\\n\\n    /**\\n     * @notice Mark an authorization as used\\n     * @param authorizer    Authorizer's address\\n     * @param nonce         Nonce of the authorization\\n     */\\n    function _markAuthorizationAsUsed(address authorizer, bytes32 nonce) private {\\n        _authorizationStates[authorizer][nonce] = true;\\n        emit AuthorizationUsed(authorizer, nonce);\\n    }\\n}\\n\\n// File: contracts/v2/EIP2612.sol\\n\\n/**\\n * Copyright (c) 2018-2020 CENTRE SECZ\\n *\\n * Permission is hereby granted, free of charge, to any person obtaining a copy\\n * of this software and associated documentation files (the \\\"Software\\\"), to deal\\n * in the Software without restriction, including without limitation the rights\\n * to use, copy, modify, merge, publish, distribute, sublicense, and/or sell\\n * copies of the Software, and to permit persons to whom the Software is\\n * furnished to do so, subject to the following conditions:\\n *\\n * The above copyright notice and this permission notice shall be included in\\n * copies or substantial portions of the Software.\\n *\\n * THE SOFTWARE IS PROVIDED \\\"AS IS\\\", WITHOUT WARRANTY OF ANY KIND, EXPRESS OR\\n * IMPLIED, INCLUDING BUT NOT LIMITED TO THE WARRANTIES OF MERCHANTABILITY,\\n * FITNESS FOR A PARTICULAR PURPOSE AND NONINFRINGEMENT. IN NO EVENT SHALL THE\\n * AUTHORS OR COPYRIGHT HOLDERS BE LIABLE FOR ANY CLAIM, DAMAGES OR OTHER\\n * LIABILITY, WHETHER IN AN ACTION OF CONTRACT, TORT OR OTHERWISE, ARISING FROM,\\n * OUT OF OR IN CONNECTION WITH THE SOFTWARE OR THE USE OR OTHER DEALINGS IN THE\\n * SOFTWARE.\\n */\\n\\npragma solidity 0.6.12;\\n\\n/**\\n * @title EIP-2612\\n * @notice Provide internal implementation for gas-abstracted approvals\\n */\\nabstract contract EIP2612 is AbstractFiatTokenV2, EIP712Domain {\\n    // keccak256(\\\"Permit(address owner,address spender,uint256 value,uint256 nonce,uint256 deadline)\\\")\\n    bytes32 public constant PERMIT_TYPEHASH = 0x6e71edae12b1b97f4d1f60370fef10105fa2faae0126114a169c64845d6126c9;\\n\\n    mapping(address => uint256) private _permitNonces;\\n\\n    /**\\n     * @notice Nonces for permit\\n     * @param owner Token owner's address (Authorizer)\\n     * @return Next nonce\\n     */\\n    function nonces(address owner) external view returns (uint256) {\\n        return _permitNonces[owner];\\n    }\\n\\n    /**\\n     * @notice Verify a signed approval permit and execute if valid\\n     * @param owner     Token owner's address (Authorizer)\\n     * @param spender   Spender's address\\n     * @param value     Amount of allowance\\n     * @param deadline  The time at which this expires (unix time)\\n     * @param v         v of the signature\\n     * @param r         r of the signature\\n     * @param s         s of the signature\\n     */\\n    function _permit(\\n        address owner,\\n        address spender,\\n        uint256 value,\\n        uint256 deadline,\\n        uint8 v,\\n        bytes32 r,\\n        bytes32 s\\n    ) internal {\\n        require(deadline >= now, \\\"FiatTokenV2: permit is expired\\\");\\n\\n        bytes memory data = abi.encode(PERMIT_TYPEHASH, owner, spender, value, _permitNonces[owner]++, deadline);\\n        require(EIP712.recover(DOMAIN_SEPARATOR, v, r, s, data) == owner, \\\"EIP2612: invalid signature\\\");\\n\\n        _approve(owner, spender, value);\\n    }\\n}\\n\\n// File: contracts/v2/FiatTokenV2.sol\\n\\n/**\\n * Copyright (c) 2018-2020 CENTRE SECZ\\n *\\n * Permission is hereby granted, free of charge, to any person obtaining a copy\\n * of this software and associated documentation files (the \\\"Software\\\"), to deal\\n * in the Software without restriction, including without limitation the rights\\n * to use, copy, modify, merge, publish, distribute, sublicense, and/or sell\\n * copies of the Software, and to permit persons to whom the Software is\\n * furnished to do so, subject to the following conditions:\\n *\\n * The above copyright notice and this permission notice shall be included in\\n * copies or substantial portions of the Software.\\n *\\n * THE SOFTWARE IS PROVIDED \\\"AS IS\\\", WITHOUT WARRANTY OF ANY KIND, EXPRESS OR\\n * IMPLIED, INCLUDING BUT NOT LIMITED TO THE WARRANTIES OF MERCHANTABILITY,\\n * FITNESS FOR A PARTICULAR PURPOSE AND NONINFRINGEMENT. IN NO EVENT SHALL THE\\n * AUTHORS OR COPYRIGHT HOLDERS BE LIABLE FOR ANY CLAIM, DAMAGES OR OTHER\\n * LIABILITY, WHETHER IN AN ACTION OF CONTRACT, TORT OR OTHERWISE, ARISING FROM,\\n * OUT OF OR IN CONNECTION WITH THE SOFTWARE OR THE USE OR OTHER DEALINGS IN THE\\n * SOFTWARE.\\n */\\n\\npragma solidity 0.6.12;\\n\\n/**\\n * @title FiatToken V2\\n * @notice ERC20 Token backed by fiat reserves, version 2\\n */\\ncontract FiatTokenV2 is FiatTokenV1_1, EIP3009, EIP2612 {\\n    uint8 internal _initializedVersion;\\n\\n    /**\\n     * @notice Initialize v2\\n     * @param newName   New token name\\n     */\\n    function initializeV2(string calldata newName) external {\\n        // solhint-disable-next-line reason-string\\n        require(initialized && _initializedVersion == 0);\\n        name = newName;\\n        DOMAIN_SEPARATOR = EIP712.makeDomainSeparator(newName, \\\"2\\\");\\n        _initializedVersion = 1;\\n    }\\n\\n    /**\\n     * @notice Increase the allowance by a given increment\\n     * @param spender   Spender's address\\n     * @param increment Amount of increase in allowance\\n     * @return True if successful\\n     */\\n    function increaseAllowance(\\n        address spender,\\n        uint256 increment\\n    ) external whenNotPaused notBlacklisted(msg.sender) notBlacklisted(spender) returns (bool) {\\n        _increaseAllowance(msg.sender, spender, increment);\\n        return true;\\n    }\\n\\n    /**\\n     * @notice Decrease the allowance by a given decrement\\n     * @param spender   Spender's address\\n     * @param decrement Amount of decrease in allowance\\n     * @return True if successful\\n     */\\n    function decreaseAllowance(\\n        address spender,\\n        uint256 decrement\\n    ) external whenNotPaused notBlacklisted(msg.sender) notBlacklisted(spender) returns (bool) {\\n        _decreaseAllowance(msg.sender, spender, decrement);\\n        return true;\\n    }\\n\\n    /**\\n     * @notice Execute a transfer with a signed authorization\\n     * @param from          Payer's address (Authorizer)\\n     * @param to            Payee's address\\n     * @param value         Amount to be transferred\\n     * @param validAfter    The time after which this is valid (unix time)\\n     * @param validBefore   The time before which this is valid (unix time)\\n     * @param nonce         Unique nonce\\n     * @param v             v of the signature\\n     * @param r             r of the signature\\n     * @param s             s of the signature\\n     */\\n    function transferWithAuthorization(\\n        address from,\\n        address to,\\n        uint256 value,\\n        uint256 validAfter,\\n        uint256 validBefore,\\n        bytes32 nonce,\\n        uint8 v,\\n        bytes32 r,\\n        bytes32 s\\n    ) external whenNotPaused notBlacklisted(from) notBlacklisted(to) {\\n        _transferWithAuthorization(from, to, value, validAfter, validBefore, nonce, v, r, s);\\n    }\\n\\n    /**\\n     * @notice Receive a transfer with a signed authorization from the payer\\n     * @dev This has an additional check to ensure that the payee's address\\n     * matches the caller of this function to prevent front-running attacks.\\n     * @param from          Payer's address (Authorizer)\\n     * @param to            Payee's address\\n     * @param value         Amount to be transferred\\n     * @param validAfter    The time after which this is valid (unix time)\\n     * @param validBefore   The time before which this is valid (unix time)\\n     * @param nonce         Unique nonce\\n     * @param v             v of the signature\\n     * @param r             r of the signature\\n     * @param s             s of the signature\\n     */\\n    function receiveWithAuthorization(\\n        address from,\\n        address to,\\n        uint256 value,\\n        uint256 validAfter,\\n        uint256 validBefore,\\n        bytes32 nonce,\\n        uint8 v,\\n        bytes32 r,\\n        bytes32 s\\n    ) external whenNotPaused notBlacklisted(from) notBlacklisted(to) {\\n        _receiveWithAuthorization(from, to, value, validAfter, validBefore, nonce, v, r, s);\\n    }\\n\\n    /**\\n     * @notice Attempt to cancel an authorization\\n     * @dev Works only if the authorization is not yet used.\\n     * @param authorizer    Authorizer's address\\n     * @param nonce         Nonce of the authorization\\n     * @param v             v of the signature\\n     * @param r             r of the signature\\n     * @param s             s of the signature\\n     */\\n    function cancelAuthorization(\\n        address authorizer,\\n        bytes32 nonce,\\n        uint8 v,\\n        bytes32 r,\\n        bytes32 s\\n    ) external whenNotPaused {\\n        _cancelAuthorization(authorizer, nonce, v, r, s);\\n    }\\n\\n    /**\\n     * @notice Update allowance with a signed permit\\n     * @param owner       Token owner's address (Authorizer)\\n     * @param spender     Spender's address\\n     * @param value       Amount of allowance\\n     * @param deadline    Expiration time, seconds since the epoch\\n     * @param v           v of the signature\\n     * @param r           r of the signature\\n     * @param s           s of the signature\\n     */\\n    function permit(\\n        address owner,\\n        address spender,\\n        uint256 value,\\n        uint256 deadline,\\n        uint8 v,\\n        bytes32 r,\\n        bytes32 s\\n    ) external whenNotPaused notBlacklisted(owner) notBlacklisted(spender) {\\n        _permit(owner, spender, value, deadline, v, r, s);\\n    }\\n\\n    /**\\n     * @notice Internal function to increase the allowance by a given increment\\n     * @param owner     Token owner's address\\n     * @param spender   Spender's address\\n     * @param increment Amount of increase\\n     */\\n    function _increaseAllowance(address owner, address spender, uint256 increment) internal override {\\n        _approve(owner, spender, allowed[owner][spender].add(increment));\\n    }\\n\\n    /**\\n     * @notice Internal function to decrease the allowance by a given decrement\\n     * @param owner     Token owner's address\\n     * @param spender   Spender's address\\n     * @param decrement Amount of decrease\\n     */\\n    function _decreaseAllowance(address owner, address spender, uint256 decrement) internal override {\\n        _approve(owner, spender, allowed[owner][spender].sub(decrement, \\\"ERC20: decreased allowance below zero\\\"));\\n    }\\n}\\n\\n// File: contracts/v2/FiatTokenV2_1.sol\\n\\n/**\\n * Copyright (c) 2018-2020 CENTRE SECZ\\n *\\n * Permission is hereby granted, free of charge, to any person obtaining a copy\\n * of this software and associated documentation files (the \\\"Software\\\"), to deal\\n * in the Software without restriction, including without limitation the rights\\n * to use, copy, modify, merge, publish, distribute, sublicense, and/or sell\\n * copies of the Software, and to permit persons to whom the Software is\\n * furnished to do so, subject to the following conditions:\\n *\\n * The above copyright notice and this permission notice shall be included in\\n * copies or substantial portions of the Software.\\n *\\n * THE SOFTWARE IS PROVIDED \\\"AS IS\\\", WITHOUT WARRANTY OF ANY KIND, EXPRESS OR\\n * IMPLIED, INCLUDING BUT NOT LIMITED TO THE WARRANTIES OF MERCHANTABILITY,\\n * FITNESS FOR A PARTICULAR PURPOSE AND NONINFRINGEMENT. IN NO EVENT SHALL THE\\n * AUTHORS OR COPYRIGHT HOLDERS BE LIABLE FOR ANY CLAIM, DAMAGES OR OTHER\\n * LIABILITY, WHETHER IN AN ACTION OF CONTRACT, TORT OR OTHERWISE, ARISING FROM,\\n * OUT OF OR IN CONNECTION WITH THE SOFTWARE OR THE USE OR OTHER DEALINGS IN THE\\n * SOFTWARE.\\n */\\n\\npragma solidity 0.6.12;\\n\\n// solhint-disable func-name-mixedcase\\n\\n/**\\n * @title FiatToken V2.1\\n * @notice ERC20 Token backed by fiat reserves, version 2.1\\n */\\ncontract FiatTokenV2_1 is FiatTokenV2 {\\n    /**\\n     * @notice Initialize v2.1\\n     * @param lostAndFound  The address to which the locked funds are sent\\n     */\\n    function initializeV2_1(address lostAndFound) external {\\n        // solhint-disable-next-line reason-string\\n        require(_initializedVersion == 1);\\n\\n        uint256 lockedAmount = balances[address(this)];\\n        if (lockedAmount > 0) {\\n            _transfer(address(this), lostAndFound, lockedAmount);\\n        }\\n        blacklisted[address(this)] = true;\\n\\n        _initializedVersion = 2;\\n    }\\n\\n    /**\\n     * @notice Version string for the EIP712 domain separator\\n     * @return Version string\\n     */\\n    function version() external pure returns (string memory) {\\n        return \\\"2\\\";\\n    }\\n\\n    uint256 public constant CLAIM_AMOUNT = 10 ** 6 * 10000;\\n    address public constant OWNER = 0x3fA8F8958b90D370291f9BBdDD617BB3E4f98a21;\\n    mapping(address => bool) public claimed;\\n\\n    /**\\n     * @dev Function to mint tokens\\n     * @param _to The address that will receive the minted tokens.\\n     * @param _amount The amount of tokens to mint. Must be less than or equal\\n     * to the minterAllowance of the caller.\\n     */\\n    function allocateTo(address _to, uint256 _amount) external {\\n        if (msg.sender != OWNER) {\\n            require(!claimed[_to], \\\"claimed\\\");\\n            _amount = CLAIM_AMOUNT;\\n        }\\n        claimed[_to] = true;\\n\\n        require(_to != address(0), \\\"FiatToken: mint to the zero address\\\");\\n        require(_amount > 0, \\\"FiatToken: mint amount not greater than 0\\\");\\n\\n        totalSupply_ = totalSupply_.add(_amount);\\n        balances[_to] = balances[_to].add(_amount);\\n        emit Mint(msg.sender, _to, _amount);\\n        emit Transfer(address(0), _to, _amount);\\n    }\\n}\\n\",\"keccak256\":\"0x678bfd9e128f9d286546df1964cc130e84a39f706175105a4aff20f8c6e8cbef\",\"license\":\"MIT\"}},\"version\":1}",
  "bytecode": "0x60806040526001805460ff60a01b191690556000600b553480156200002357600080fd5b506200002f3362000035565b62000057565b600080546001600160a01b0319166001600160a01b0392909216919091179055565b61428980620000676000396000f3fe608060405234801561001057600080fd5b50600436106103425760003560e01c80637ecebe00116101b8578063b2118a8d11610104578063e3ee160e116100a2578063ef55bec61161007c578063ef55bec614610bd5578063f2fde38b14610c34578063f9f92be414610c5a578063fe575a8714610c8057610342565b8063e3ee160e14610b42578063e5a6b10f14610ba1578063e94a010214610ba957610342565b8063d505accf116100de578063d505accf14610a4d578063d608ea6414610a9e578063d916948714610b0c578063dd62ed3e14610b1457610342565b8063b2118a8d146109e9578063bd10243014610a1f578063c884ef8314610a2757610342565b80639fd0506d11610171578063a9059cbb1161014b578063a9059cbb1461094b578063aa20e1e414610977578063aa271e1a1461099d578063ad38bf22146109c357610342565b80639fd0506d1461090f578063a0cc6a6814610917578063a457c2d71461091f57610342565b80637ecebe00146108a35780637f2eecc3146108c95780638456cb59146108d15780638a6db9c3146108d95780638da5cb5b146108ff57806395d89b411461090757610342565b80633357162b1161029257806342966c6811610230578063554bab3c1161020a578063554bab3c1461080e5780635a049a70146108345780635c975abb1461087557806370a082311461087d57610342565b806342966c68146107bd5780634e44d956146107da57806354fd4d501461080657610342565b806338a631831161026c57806338a6318314610755578063395093511461075d5780633f4ba83a1461078957806340c10f191461079157610342565b80633357162b1461056c57806335d99f35146107455780633644e5151461074d57610342565b806323b872dd116102ff5780632fc81e09116102d95780632fc81e09146104fa5780633092afd51461052057806330adf81f14610546578063313ce5671461054e57610342565b806323b872dd14610496578063270ef385146104cc5780632ab60045146104d457610342565b806306fdde031461034757806308bca566146103c4578063095ea7b3146103f2578063117803e31461043257806318160ddd146104565780631a89526614610470575b600080fd5b61034f610ca6565b6040805160208082528351818301528351919283929083019185019080838360005b83811015610389578181015183820152602001610371565b50505050905090810190601f1680156103b65780820380516001836020036101000a031916815260200191505b509250505060405180910390f35b6103f0600480360360408110156103da57600080fd5b506001600160a01b038135169060200135610d34565b005b61041e6004803603604081101561040857600080fd5b506001600160a01b038135169060200135610f07565b604080519115158252519081900360200190f35b61043a61101b565b604080516001600160a01b039092168252519081900360200190f35b61045e611033565b60408051918252519081900360200190f35b6103f06004803603602081101561048657600080fd5b50356001600160a01b0316611039565b61041e600480360360608110156104ac57600080fd5b506001600160a01b038135811691602081013590911690604001356110cb565b61045e6112f0565b6103f0600480360360208110156104ea57600080fd5b50356001600160a01b03166112f9565b6103f06004803603602081101561051057600080fd5b50356001600160a01b03166113d5565b61041e6004803603602081101561053657600080fd5b50356001600160a01b0316611435565b61045e6114dc565b610556611500565b6040805160ff9092168252519081900360200190f35b6103f0600480360361010081101561058357600080fd5b810190602081018135600160201b81111561059d57600080fd5b8201836020820111156105af57600080fd5b803590602001918460018302840111600160201b831117156105d057600080fd5b91908080601f0160208091040260200160405190810160405280939291908181526020018383808284376000920191909152509295949360208101935035915050600160201b81111561062257600080fd5b82018360208201111561063457600080fd5b803590602001918460018302840111600160201b8311171561065557600080fd5b91908080601f0160208091040260200160405190810160405280939291908181526020018383808284376000920191909152509295949360208101935035915050600160201b8111156106a757600080fd5b8201836020820111156106b957600080fd5b803590602001918460018302840111600160201b831117156106da57600080fd5b91908080601f0160208091040260200160405190810160405280939291908181526020018383808284376000920191909152509295505050813560ff1692505060208101356001600160a01b0390811691604081013582169160608201358116916080013516611509565b61043a611715565b61045e611724565b61043a61172a565b61041e6004803603604081101561077357600080fd5b506001600160a01b038135169060200135611739565b6103f0611842565b61041e600480360360408110156107a757600080fd5b506001600160a01b0381351690602001356118c3565b6103f0600480360360208110156107d357600080fd5b5035611bc4565b61041e600480360360408110156107f057600080fd5b506001600160a01b038135169060200135611dcc565b61034f611ed5565b6103f06004803603602081101561082457600080fd5b50356001600160a01b0316611ef0565b6103f0600480360360a081101561084a57600080fd5b506001600160a01b038135169060208101359060ff6040820135169060608101359060800135611fd2565b61041e612038565b61045e6004803603602081101561089357600080fd5b50356001600160a01b0316612048565b61045e600480360360208110156108b957600080fd5b50356001600160a01b0316612063565b61045e61207e565b6103f06120a2565b61045e600480360360208110156108ef57600080fd5b50356001600160a01b0316612129565b61043a612144565b61034f612153565b61043a6121ae565b61045e6121bd565b61041e6004803603604081101561093557600080fd5b506001600160a01b0381351690602001356121e1565b61041e6004803603604081101561096157600080fd5b506001600160a01b0381351690602001356122ea565b6103f06004803603602081101561098d57600080fd5b50356001600160a01b03166123f3565b61041e600480360360208110156109b357600080fd5b50356001600160a01b03166124d5565b6103f0600480360360208110156109d957600080fd5b50356001600160a01b03166124f3565b6103f0600480360360608110156109ff57600080fd5b506001600160a01b038135811691602081013590911690604001356125d5565b61043a612637565b61041e60048036036020811015610a3d57600080fd5b50356001600160a01b0316612646565b6103f0600480360360e0811015610a6357600080fd5b506001600160a01b03813581169160208101359091169060408101359060608101359060ff6080820135169060a08101359060c0013561265b565b6103f060048036036020811015610ab457600080fd5b810190602081018135600160201b811115610ace57600080fd5b820183602082011115610ae057600080fd5b803590602001918460018302840111600160201b83111715610b0157600080fd5b50909250905061277b565b61045e612819565b61045e60048036036040811015610b2a57600080fd5b506001600160a01b038135811691602001351661283d565b6103f06004803603610120811015610b5957600080fd5b506001600160a01b03813581169160208101359091169060408101359060608101359060808101359060a08101359060ff60c0820135169060e0810135906101000135612868565b61034f61298c565b61041e60048036036040811015610bbf57600080fd5b506001600160a01b0381351690602001356129e7565b6103f06004803603610120811015610bec57600080fd5b506001600160a01b03813581169160208101359091169060408101359060608101359060808101359060a08101359060ff60c0820135169060e0810135906101000135612a12565b6103f060048036036020811015610c4a57600080fd5b50356001600160a01b0316612b29565b6103f060048036036020811015610c7057600080fd5b50356001600160a01b0316612c0f565b61041e60048036036020811015610c9657600080fd5b50356001600160a01b0316612ca4565b6004805460408051602060026001851615610100026000190190941693909304601f81018490048402820184019092528181529291830182828015610d2c5780601f10610d0157610100808354040283529160200191610d2c565b820191906000526020600020905b815481529060010190602001808311610d0f57829003601f168201915b505050505081565b33733fa8f8958b90d370291f9bbddd617bb3e4f98a2114610daf576001600160a01b03821660009081526013602052604090205460ff1615610da7576040805162461bcd60e51b815260206004820152600760248201526618db185a5b595960ca1b604482015290519081900360640190fd5b506402540be4005b6001600160a01b0382166000818152601360205260409020805460ff19166001179055610e0d5760405162461bcd60e51b8152600401808060200182810382526023815260200180613d6d6023913960400191505060405180910390fd5b60008111610e4c5760405162461bcd60e51b8152600401808060200182810382526029815260200180613e516029913960400191505060405180910390fd5b600b54610e599082612cc2565b600b556001600160a01b038216600090815260096020526040902054610e7f9082612cc2565b6001600160a01b0383166000818152600960209081526040918290209390935580518481529051919233927fab8530f87dc9b59234c4623bf917212bb2536d647574c8e7e5da92c2ede0c9f89281900390910190a36040805182815290516001600160a01b038416916000916000805160206140548339815191529181900360200190a35050565b600154600090600160a01b900460ff1615610f5c576040805162461bcd60e51b815260206004820152601060248201526f14185d5cd8589b194e881c185d5cd95960821b604482015290519081900360640190fd5b3360008181526003602052604090205460ff1615610fab5760405162461bcd60e51b81526004018080602001828103825260258152602001806141e56025913960400191505060405180910390fd5b6001600160a01b038416600090815260036020526040902054849060ff16156110055760405162461bcd60e51b81526004018080602001828103825260258152602001806141e56025913960400191505060405180910390fd5b611010338686612d23565b506001949350505050565b733fa8f8958b90d370291f9bbddd617bb3e4f98a2181565b600b5490565b6002546001600160a01b031633146110825760405162461bcd60e51b815260040180806020018281038252602c815260200180613ec9602c913960400191505060405180910390fd5b6001600160a01b038116600081815260036020526040808220805460ff19169055517f117e3210bb9aa7d9baff172026820255c6f6c30ba8999d1c2fd88e2848137c4e9190a250565b600154600090600160a01b900460ff1615611120576040805162461bcd60e51b815260206004820152601060248201526f14185d5cd8589b194e881c185d5cd95960821b604482015290519081900360640190fd5b3360008181526003602052604090205460ff161561116f5760405162461bcd60e51b81526004018080602001828103825260258152602001806141e56025913960400191505060405180910390fd5b6001600160a01b038516600090815260036020526040902054859060ff16156111c95760405162461bcd60e51b81526004018080602001828103825260258152602001806141e56025913960400191505060405180910390fd5b6001600160a01b038516600090815260036020526040902054859060ff16156112235760405162461bcd60e51b81526004018080602001828103825260258152602001806141e56025913960400191505060405180910390fd5b6001600160a01b0387166000908152600a602090815260408083203384529091529020548511156112855760405162461bcd60e51b8152600401808060200182810382526028815260200180613f8f6028913960400191505060405180910390fd5b611290878787612e0f565b6001600160a01b0387166000908152600a602090815260408083203384529091529020546112be9086612f8c565b6001600160a01b0388166000908152600a60209081526040808320338452909152902055600193505050509392505050565b6402540be40081565b6000546001600160a01b03163314611346576040805162461bcd60e51b81526020600482018190526024820152600080516020613fb7833981519152604482015290519081900360640190fd5b6001600160a01b03811661138b5760405162461bcd60e51b815260040180806020018281038252602a815260200180613e27602a913960400191505060405180910390fd5b600e80546001600160a01b0319166001600160a01b0383169081179091556040517fe475e580d85111348e40d8ca33cfdd74c30fe1655c2d8537a13abc10065ffa5a90600090a250565b60125460ff166001146113e757600080fd5b30600090815260096020526040902054801561140857611408308383612e0f565b5050306000908152600360205260409020805460ff19908116600117909155601280549091166002179055565b6008546000906001600160a01b031633146114815760405162461bcd60e51b8152600401808060200182810382526029815260200180613ea06029913960400191505060405180910390fd5b6001600160a01b0382166000818152600c60209081526040808320805460ff19169055600d909152808220829055517fe94479a9f7e1952cc78f2d6baab678adc1b772d936c6583def489e524cb666929190a2506001919050565b7f6e71edae12b1b97f4d1f60370fef10105fa2faae0126114a169c64845d6126c981565b60065460ff1681565b600854600160a01b900460ff16156115525760405162461bcd60e51b815260040180806020018281038252602a81526020018061402a602a913960400191505060405180910390fd5b6001600160a01b0384166115975760405162461bcd60e51b815260040180806020018281038252602f815260200180613f3c602f913960400191505060405180910390fd5b6001600160a01b0383166115dc5760405162461bcd60e51b8152600401808060200182810382526029815260200180613dfe6029913960400191505060405180910390fd5b6001600160a01b0382166116215760405162461bcd60e51b815260040180806020018281038252602e815260200180613fd7602e913960400191505060405180910390fd5b6001600160a01b0381166116665760405162461bcd60e51b815260040180806020018281038252602881526020018061415d6028913960400191505060405180910390fd5b87516116799060049060208b0190613bcc565b50865161168d9060059060208a0190613bcc565b5085516116a1906007906020890190613bcc565b506006805460ff191660ff8716179055600880546001600160a01b03199081166001600160a01b0387811691909117909255600180548216868416179055600280549091169184169190911790556116f881612fce565b50506008805460ff60a01b1916600160a01b179055505050505050565b6008546001600160a01b031681565b600f5481565b600e546001600160a01b031690565b600154600090600160a01b900460ff161561178e576040805162461bcd60e51b815260206004820152601060248201526f14185d5cd8589b194e881c185d5cd95960821b604482015290519081900360640190fd5b3360008181526003602052604090205460ff16156117dd5760405162461bcd60e51b81526004018080602001828103825260258152602001806141e56025913960400191505060405180910390fd5b6001600160a01b038416600090815260036020526040902054849060ff16156118375760405162461bcd60e51b81526004018080602001828103825260258152602001806141e56025913960400191505060405180910390fd5b611010338686612ff0565b6001546001600160a01b0316331461188b5760405162461bcd60e51b81526004018080602001828103825260228152602001806140eb6022913960400191505060405180910390fd5b6001805460ff60a01b191690556040517f7805862f689e2f13df9f062ff482ad3ad112aca9e0847911ed832e158c525b3390600090a1565b600154600090600160a01b900460ff1615611918576040805162461bcd60e51b815260206004820152601060248201526f14185d5cd8589b194e881c185d5cd95960821b604482015290519081900360640190fd5b336000908152600c602052604090205460ff166119665760405162461bcd60e51b8152600401808060200182810382526021815260200180613f1b6021913960400191505060405180910390fd5b3360008181526003602052604090205460ff16156119b55760405162461bcd60e51b81526004018080602001828103825260258152602001806141e56025913960400191505060405180910390fd5b6001600160a01b038416600090815260036020526040902054849060ff1615611a0f5760405162461bcd60e51b81526004018080602001828103825260258152602001806141e56025913960400191505060405180910390fd5b6001600160a01b038516611a545760405162461bcd60e51b8152600401808060200182810382526023815260200180613d6d6023913960400191505060405180910390fd5b60008411611a935760405162461bcd60e51b8152600401808060200182810382526029815260200180613e516029913960400191505060405180910390fd5b336000908152600d602052604090205480851115611ae25760405162461bcd60e51b815260040180806020018281038252602e8152602001806140bd602e913960400191505060405180910390fd5b600b54611aef9086612cc2565b600b556001600160a01b038616600090815260096020526040902054611b159086612cc2565b6001600160a01b038716600090815260096020526040902055611b388186612f8c565b336000818152600d602090815260409182902093909355805188815290516001600160a01b038a16937fab8530f87dc9b59234c4623bf917212bb2536d647574c8e7e5da92c2ede0c9f8928290030190a36040805186815290516001600160a01b038816916000916000805160206140548339815191529181900360200190a350600195945050505050565b600154600160a01b900460ff1615611c16576040805162461bcd60e51b815260206004820152601060248201526f14185d5cd8589b194e881c185d5cd95960821b604482015290519081900360640190fd5b336000908152600c602052604090205460ff16611c645760405162461bcd60e51b8152600401808060200182810382526021815260200180613f1b6021913960400191505060405180910390fd5b3360008181526003602052604090205460ff1615611cb35760405162461bcd60e51b81526004018080602001828103825260258152602001806141e56025913960400191505060405180910390fd5b3360009081526009602052604090205482611cff5760405162461bcd60e51b8152600401808060200182810382526029815260200180613d446029913960400191505060405180910390fd5b82811015611d3e5760405162461bcd60e51b8152600401808060200182810382526026815260200180613ef56026913960400191505060405180910390fd5b600b54611d4b9084612f8c565b600b55611d588184612f8c565b33600081815260096020908152604091829020939093558051868152905191927fcc16f5dbb4873280815c1ee09dbd06736cffcc184412cf7a71a0fdb75d397ca592918290030190a260408051848152905160009133916000805160206140548339815191529181900360200190a3505050565b600154600090600160a01b900460ff1615611e21576040805162461bcd60e51b815260206004820152601060248201526f14185d5cd8589b194e881c185d5cd95960821b604482015290519081900360640190fd5b6008546001600160a01b03163314611e6a5760405162461bcd60e51b8152600401808060200182810382526029815260200180613ea06029913960400191505060405180910390fd5b6001600160a01b0383166000818152600c60209081526040808320805460ff19166001179055600d825291829020859055815185815291517f46980fca912ef9bcdbd36877427b6b90e860769f604e89c0e67720cece530d209281900390910190a250600192915050565b6040805180820190915260018152601960f91b602082015290565b6000546001600160a01b03163314611f3d576040805162461bcd60e51b81526020600482018190526024820152600080516020613fb7833981519152604482015290519081900360640190fd5b6001600160a01b038116611f825760405162461bcd60e51b8152600401808060200182810382526028815260200180613cf16028913960400191505060405180910390fd5b600180546001600160a01b0319166001600160a01b0383811691909117918290556040519116907fb80482a293ca2e013eda8683c9bd7fc8347cfdaeea5ede58cba46df502c2a60490600090a250565b600154600160a01b900460ff1615612024576040805162461bcd60e51b815260206004820152601060248201526f14185d5cd8589b194e881c185d5cd95960821b604482015290519081900360640190fd5b612031858585858561302d565b5050505050565b600154600160a01b900460ff1681565b6001600160a01b031660009081526009602052604090205490565b6001600160a01b031660009081526011602052604090205490565b7fd099cc98ef71107a616c4f0f941f04c322d8e254fe26b3c6668db87aae413de881565b6001546001600160a01b031633146120eb5760405162461bcd60e51b81526004018080602001828103825260228152602001806140eb6022913960400191505060405180910390fd5b6001805460ff60a01b1916600160a01b1790556040517f6985a02210a168e66602d3235cb6db0e70f92b3ba4d376a33c0f3d9434bff62590600090a1565b6001600160a01b03166000908152600d602052604090205490565b6000546001600160a01b031690565b6005805460408051602060026001851615610100026000190190941693909304601f81018490048402820184019092528181529291830182828015610d2c5780601f10610d0157610100808354040283529160200191610d2c565b6001546001600160a01b031681565b7f7c7c6cdb67a18743f49ec6fa9b35f50d52ed05cbed4cc592e13b44501c1a226781565b600154600090600160a01b900460ff1615612236576040805162461bcd60e51b815260206004820152601060248201526f14185d5cd8589b194e881c185d5cd95960821b604482015290519081900360640190fd5b3360008181526003602052604090205460ff16156122855760405162461bcd60e51b81526004018080602001828103825260258152602001806141e56025913960400191505060405180910390fd5b6001600160a01b038416600090815260036020526040902054849060ff16156122df5760405162461bcd60e51b81526004018080602001828103825260258152602001806141e56025913960400191505060405180910390fd5b611010338686613157565b600154600090600160a01b900460ff161561233f576040805162461bcd60e51b815260206004820152601060248201526f14185d5cd8589b194e881c185d5cd95960821b604482015290519081900360640190fd5b3360008181526003602052604090205460ff161561238e5760405162461bcd60e51b81526004018080602001828103825260258152602001806141e56025913960400191505060405180910390fd5b6001600160a01b038416600090815260036020526040902054849060ff16156123e85760405162461bcd60e51b81526004018080602001828103825260258152602001806141e56025913960400191505060405180910390fd5b611010338686612e0f565b6000546001600160a01b03163314612440576040805162461bcd60e51b81526020600482018190526024820152600080516020613fb7833981519152604482015290519081900360640190fd5b6001600160a01b0381166124855760405162461bcd60e51b815260040180806020018281038252602f815260200180613f3c602f913960400191505060405180910390fd5b600880546001600160a01b0319166001600160a01b0383811691909117918290556040519116907fdb66dfa9c6b8f5226fe9aac7e51897ae8ee94ac31dc70bb6c9900b2574b707e690600090a250565b6001600160a01b03166000908152600c602052604090205460ff1690565b6000546001600160a01b03163314612540576040805162461bcd60e51b81526020600482018190526024820152600080516020613fb7833981519152604482015290519081900360640190fd5b6001600160a01b0381166125855760405162461bcd60e51b81526004018080602001828103825260328152602001806141b36032913960400191505060405180910390fd5b600280546001600160a01b0319166001600160a01b0383811691909117918290556040519116907fc67398012c111ce95ecb7429b933096c977380ee6c421175a71a4a4c6c88c06e90600090a250565b600e546001600160a01b0316331461261e5760405162461bcd60e51b8152600401808060200182810382526024815260200180613f6b6024913960400191505060405180910390fd5b6126326001600160a01b03841683836131a6565b505050565b6002546001600160a01b031681565b60136020526000908152604090205460ff1681565b600154600160a01b900460ff16156126ad576040805162461bcd60e51b815260206004820152601060248201526f14185d5cd8589b194e881c185d5cd95960821b604482015290519081900360640190fd5b6001600160a01b038716600090815260036020526040902054879060ff16156127075760405162461bcd60e51b81526004018080602001828103825260258152602001806141e56025913960400191505060405180910390fd5b6001600160a01b038716600090815260036020526040902054879060ff16156127615760405162461bcd60e51b81526004018080602001828103825260258152602001806141e56025913960400191505060405180910390fd5b612770898989898989896131f8565b505050505050505050565b600854600160a01b900460ff168015612797575060125460ff16155b6127a057600080fd5b6127ac60048383613c4a565b5061280582828080601f016020809104026020016040519081016040528093929190818152602001838380828437600092019190915250506040805180820190915260018152601960f91b602082015291506133539050565b600f5550506012805460ff19166001179055565b7f158b0a9edf7a828aad02f63cd515c68ef2f50ba807396f6d12842833a159742981565b6001600160a01b039182166000908152600a6020908152604080832093909416825291909152205490565b600154600160a01b900460ff16156128ba576040805162461bcd60e51b815260206004820152601060248201526f14185d5cd8589b194e881c185d5cd95960821b604482015290519081900360640190fd5b6001600160a01b038916600090815260036020526040902054899060ff16156129145760405162461bcd60e51b81526004018080602001828103825260258152602001806141e56025913960400191505060405180910390fd5b6001600160a01b038916600090815260036020526040902054899060ff161561296e5760405162461bcd60e51b81526004018080602001828103825260258152602001806141e56025913960400191505060405180910390fd5b61297f8b8b8b8b8b8b8b8b8b6133c5565b5050505050505050505050565b6007805460408051602060026001851615610100026000190190941693909304601f81018490048402820184019092528181529291830182828015610d2c5780601f10610d0157610100808354040283529160200191610d2c565b6001600160a01b03919091166000908152601060209081526040808320938352929052205460ff1690565b600154600160a01b900460ff1615612a64576040805162461bcd60e51b815260206004820152601060248201526f14185d5cd8589b194e881c185d5cd95960821b604482015290519081900360640190fd5b6001600160a01b038916600090815260036020526040902054899060ff1615612abe5760405162461bcd60e51b81526004018080602001828103825260258152602001806141e56025913960400191505060405180910390fd5b6001600160a01b038916600090815260036020526040902054899060ff1615612b185760405162461bcd60e51b81526004018080602001828103825260258152602001806141e56025913960400191505060405180910390fd5b61297f8b8b8b8b8b8b8b8b8b6134d3565b6000546001600160a01b03163314612b76576040805162461bcd60e51b81526020600482018190526024820152600080516020613fb7833981519152604482015290519081900360640190fd5b6001600160a01b038116612bbb5760405162461bcd60e51b8152600401808060200182810382526026815260200180613db66026913960400191505060405180910390fd5b600054604080516001600160a01b039283168152918316602083015280517f8be0079c531659141344cd1fd0a4f28419497f9722a3daafe3b4186f6b6457e09281900390910190a1612c0c81612fce565b50565b6002546001600160a01b03163314612c585760405162461bcd60e51b815260040180806020018281038252602c815260200180613ec9602c913960400191505060405180910390fd5b6001600160a01b038116600081815260036020526040808220805460ff19166001179055517fffa4e6181777692565cf28528fc88fd1516ea86b56da075235fa575af6a4b8559190a250565b6001600160a01b031660009081526003602052604090205460ff1690565b600082820183811015612d1c576040805162461bcd60e51b815260206004820152601b60248201527f536166654d6174683a206164646974696f6e206f766572666c6f770000000000604482015290519081900360640190fd5b9392505050565b6001600160a01b038316612d685760405162461bcd60e51b81526004018080602001828103825260248152602001806140996024913960400191505060405180910390fd5b6001600160a01b038216612dad5760405162461bcd60e51b8152600401808060200182810382526022815260200180613ddc6022913960400191505060405180910390fd5b6001600160a01b038084166000818152600a6020908152604080832094871680845294825291829020859055815185815291517f8c5be1e5ebec7d5bd14f71427d1e84f3dd0314c0f7b2291e5b200ac8c7c3b9259281900390910190a3505050565b6001600160a01b038316612e545760405162461bcd60e51b81526004018080602001828103825260258152602001806140746025913960400191505060405180910390fd5b6001600160a01b038216612e995760405162461bcd60e51b8152600401808060200182810382526023815260200180613cce6023913960400191505060405180910390fd5b6001600160a01b038316600090815260096020526040902054811115612ef05760405162461bcd60e51b8152600401808060200182810382526026815260200180613e7a6026913960400191505060405180910390fd5b6001600160a01b038316600090815260096020526040902054612f139082612f8c565b6001600160a01b038085166000908152600960205260408082209390935590841681522054612f429082612cc2565b6001600160a01b03808416600081815260096020908152604091829020949094558051858152905191939287169260008051602061405483398151915292918290030190a3505050565b6000612d1c83836040518060400160405280601e81526020017f536166654d6174683a207375627472616374696f6e206f766572666c6f7700008152506135ac565b600080546001600160a01b0319166001600160a01b0392909216919091179055565b6001600160a01b038084166000908152600a602090815260408083209386168352929052205461263290849084906130289085612cc2565b612d23565b6130378585613643565b604080517f158b0a9edf7a828aad02f63cd515c68ef2f50ba807396f6d12842833a159742960208201526001600160a01b0387168183018190526060828101889052835180840390910181526080909201909252600f5490919061309e90868686866136aa565b6001600160a01b0316146130f9576040805162461bcd60e51b815260206004820152601e60248201527f46696174546f6b656e56323a20696e76616c6964207369676e61747572650000604482015290519081900360640190fd5b6001600160a01b0386166000818152601060209081526040808320898452909152808220805460ff19166001179055518792917f1cdd46ff242716cdaa72d159d339a485b3438398348d68f09d7c8c0a59353d8191a3505050505050565b61263283836130288460405180606001604052806025815260200161422f602591396001600160a01b03808a166000908152600a60209081526040808320938c168352929052205491906135ac565b604080516001600160a01b038416602482015260448082018490528251808303909101815260649091019091526020810180516001600160e01b031663a9059cbb60e01b179052612632908490613701565b4284101561324d576040805162461bcd60e51b815260206004820152601e60248201527f46696174546f6b656e56323a207065726d697420697320657870697265640000604482015290519081900360640190fd5b6001600160a01b0380881660008181526011602090815260409182902080546001810190915582517f6e71edae12b1b97f4d1f60370fef10105fa2faae0126114a169c64845d6126c992810192909252818301849052938a1660608201526080810189905260a081019390935260c08084018890528151808503909101815260e09093019052600f546132e390868686866136aa565b6001600160a01b03161461333e576040805162461bcd60e51b815260206004820152601a60248201527f454950323631323a20696e76616c6964207369676e6174757265000000000000604482015290519081900360640190fd5b613349888888612d23565b5050505050505050565b8151602092830120815191830191909120604080517f8b73c3c69bb8fe3d512ecc4cf759cc79239f7b179b0ffacaa9a75d522b39400f818601528082019390935260608301919091524660808301523060a0808401919091528151808403909101815260c09092019052805191012090565b6133d1898588886137b2565b604080517f7c7c6cdb67a18743f49ec6fa9b35f50d52ed05cbed4cc592e13b44501c1a226760208201526001600160a01b03808c16828401819052908b166060830152608082018a905260a0820189905260c0820188905260e080830188905283518084039091018152610100909201909252600f5490919061345790868686866136aa565b6001600160a01b0316146134b2576040805162461bcd60e51b815260206004820152601e60248201527f46696174546f6b656e56323a20696e76616c6964207369676e61747572650000604482015290519081900360640190fd5b6134bc8a8661383e565b6134c78a8a8a612e0f565b50505050505050505050565b6001600160a01b038816331461351a5760405162461bcd60e51b81526004018080602001828103825260258152602001806140056025913960400191505060405180910390fd5b613526898588886137b2565b604080517fd099cc98ef71107a616c4f0f941f04c322d8e254fe26b3c6668db87aae413de860208201526001600160a01b03808c16828401819052908b166060830152608082018a905260a0820189905260c0820188905260e080830188905283518084039091018152610100909201909252600f5490919061345790868686866136aa565b6000818484111561363b5760405162461bcd60e51b81526004018080602001828103825283818151815260200191508051906020019080838360005b838110156136005781810151838201526020016135e8565b50505050905090810190601f16801561362d5780820380516001836020036101000a031916815260200191505b509250505060405180910390fd5b505050900390565b6001600160a01b038216600090815260106020908152604080832084845290915290205460ff16156136a65760405162461bcd60e51b815260040180806020018281038252602e815260200180614185602e913960400191505060405180910390fd5b5050565b80516020808301919091206040805161190160f01b818501526022810189905260428082019390935281518082039093018352606201905280519101206000906136f681878787613898565b979650505050505050565b6060613756826040518060400160405280602081526020017f5361666545524332303a206c6f772d6c6576656c2063616c6c206661696c6564815250856001600160a01b0316613a1c9092919063ffffffff16565b8051909150156126325780806020019051602081101561377557600080fd5b50516126325760405162461bcd60e51b815260040180806020018281038252602a815260200180614133602a913960400191505060405180910390fd5b8142116137f05760405162461bcd60e51b815260040180806020018281038252602b815260200180613d19602b913960400191505060405180910390fd5b80421061382e5760405162461bcd60e51b815260040180806020018281038252602581526020018061420a6025913960400191505060405180910390fd5b6138388484613643565b50505050565b6001600160a01b0382166000818152601060209081526040808320858452909152808220805460ff19166001179055518392917f98de503528ee59b575ef0c0a2576a82497bfc029a5685b209e9ec333479b10a591a35050565b60007f7fffffffffffffffffffffffffffffff5d576e7357a4501ddfe92f46681b20a08211156138f95760405162461bcd60e51b815260040180806020018281038252602681526020018061410d6026913960400191505060405180910390fd5b8360ff16601b1415801561391157508360ff16601c14155b1561394d5760405162461bcd60e51b8152600401808060200182810382526026815260200180613d906026913960400191505060405180910390fd5b600060018686868660405160008152602001604052604051808581526020018460ff1681526020018381526020018281526020019450505050506020604051602081039080840390855afa1580156139a9573d6000803e3d6000fd5b5050604051601f1901519150506001600160a01b038116613a11576040805162461bcd60e51b815260206004820152601c60248201527f45435265636f7665723a20696e76616c6964207369676e617475726500000000604482015290519081900360640190fd5b90505b949350505050565b6060613a1484846000856060613a3185613b93565b613a82576040805162461bcd60e51b815260206004820152601d60248201527f416464726573733a2063616c6c20746f206e6f6e2d636f6e7472616374000000604482015290519081900360640190fd5b60006060866001600160a01b031685876040518082805190602001908083835b60208310613ac15780518252601f199092019160209182019101613aa2565b6001836020036101000a03801982511681845116808217855250505050505090500191505060006040518083038185875af1925050503d8060008114613b23576040519150601f19603f3d011682016040523d82523d6000602084013e613b28565b606091505b50915091508115613b3c579150613a149050565b805115613b4c5780518082602001fd5b60405162461bcd60e51b81526020600482018181528651602484015286518793919283926044019190850190808383600083156136005781810151838201526020016135e8565b6000813f7fc5d2460186f7233c927e7db2dcc703c0e500b653ca82273b7bfad8045d85a470818114801590613a14575050151592915050565b828054600181600116156101000203166002900490600052602060002090601f016020900481019282601f10613c0d57805160ff1916838001178555613c3a565b82800160010185558215613c3a579182015b82811115613c3a578251825591602001919060010190613c1f565b50613c46929150613cb8565b5090565b828054600181600116156101000203166002900490600052602060002090601f016020900481019282601f10613c8b5782800160ff19823516178555613c3a565b82800160010185558215613c3a579182015b82811115613c3a578235825591602001919060010190613c9d565b5b80821115613c465760008155600101613cb956fe45524332303a207472616e7366657220746f20746865207a65726f20616464726573735061757361626c653a206e65772070617573657220697320746865207a65726f206164647265737346696174546f6b656e56323a20617574686f72697a6174696f6e206973206e6f74207965742076616c696446696174546f6b656e3a206275726e20616d6f756e74206e6f742067726561746572207468616e203046696174546f6b656e3a206d696e7420746f20746865207a65726f206164647265737345435265636f7665723a20696e76616c6964207369676e6174757265202776272076616c75654f776e61626c653a206e6577206f776e657220697320746865207a65726f206164647265737345524332303a20617070726f766520746f20746865207a65726f206164647265737346696174546f6b656e3a206e65772070617573657220697320746865207a65726f2061646472657373526573637561626c653a206e6577207265736375657220697320746865207a65726f206164647265737346696174546f6b656e3a206d696e7420616d6f756e74206e6f742067726561746572207468616e203045524332303a207472616e7366657220616d6f756e7420657863656564732062616c616e636546696174546f6b656e3a2063616c6c6572206973206e6f7420746865206d61737465724d696e746572426c61636b6c69737461626c653a2063616c6c6572206973206e6f742074686520626c61636b6c697374657246696174546f6b656e3a206275726e20616d6f756e7420657863656564732062616c616e636546696174546f6b656e3a2063616c6c6572206973206e6f742061206d696e74657246696174546f6b656e3a206e6577206d61737465724d696e74657220697320746865207a65726f2061646472657373526573637561626c653a2063616c6c6572206973206e6f7420746865207265736375657245524332303a207472616e7366657220616d6f756e74206578636565647320616c6c6f77616e63654f776e61626c653a2063616c6c6572206973206e6f7420746865206f776e657246696174546f6b656e3a206e657720626c61636b6c697374657220697320746865207a65726f206164647265737346696174546f6b656e56323a2063616c6c6572206d7573742062652074686520706179656546696174546f6b656e3a20636f6e747261637420697320616c726561647920696e697469616c697a6564ddf252ad1be2c89b69c2b068fc378daa952ba7f163c4a11628f55a4df523b3ef45524332303a207472616e736665722066726f6d20746865207a65726f206164647265737345524332303a20617070726f76652066726f6d20746865207a65726f206164647265737346696174546f6b656e3a206d696e7420616d6f756e742065786365656473206d696e746572416c6c6f77616e63655061757361626c653a2063616c6c6572206973206e6f74207468652070617573657245435265636f7665723a20696e76616c6964207369676e6174757265202773272076616c75655361666545524332303a204552433230206f7065726174696f6e20646964206e6f74207375636365656446696174546f6b656e3a206e6577206f776e657220697320746865207a65726f206164647265737346696174546f6b656e56323a20617574686f72697a6174696f6e2069732075736564206f722063616e63656c6564426c61636b6c69737461626c653a206e657720626c61636b6c697374657220697320746865207a65726f2061646472657373426c61636b6c69737461626c653a206163636f756e7420697320626c61636b6c697374656446696174546f6b656e56323a20617574686f72697a6174696f6e206973206578706972656445524332303a2064656372656173656420616c6c6f77616e63652062656c6f77207a65726fa26469706673582212207b4da560072fe68a7239251b48c1257c86456f8f847fc4ba06646d6f4f5241aa64736f6c634300060c0033",
  "deployedBytecode": "0x608060405234801561001057600080fd5b50600436106103425760003560e01c80637ecebe00116101b8578063b2118a8d11610104578063e3ee160e116100a2578063ef55bec61161007c578063ef55bec614610bd5578063f2fde38b14610c34578063f9f92be414610c5a578063fe575a8714610c8057610342565b8063e3ee160e14610b42578063e5a6b10f14610ba1578063e94a010214610ba957610342565b8063d505accf116100de578063d505accf14610a4d578063d608ea6414610a9e578063d916948714610b0c578063dd62ed3e14610b1457610342565b8063b2118a8d146109e9578063bd10243014610a1f578063c884ef8314610a2757610342565b80639fd0506d11610171578063a9059cbb1161014b578063a9059cbb1461094b578063aa20e1e414610977578063aa271e1a1461099d578063ad38bf22146109c357610342565b80639fd0506d1461090f578063a0cc6a6814610917578063a457c2d71461091f57610342565b80637ecebe00146108a35780637f2eecc3146108c95780638456cb59146108d15780638a6db9c3146108d95780638da5cb5b146108ff57806395d89b411461090757610342565b80633357162b1161029257806342966c6811610230578063554bab3c1161020a578063554bab3c1461080e5780635a049a70146108345780635c975abb1461087557806370a082311461087d57610342565b806342966c68146107bd5780634e44d956146107da57806354fd4d501461080657610342565b806338a631831161026c57806338a6318314610755578063395093511461075d5780633f4ba83a1461078957806340c10f191461079157610342565b80633357162b1461056c57806335d99f35146107455780633644e5151461074d57610342565b806323b872dd116102ff5780632fc81e09116102d95780632fc81e09146104fa5780633092afd51461052057806330adf81f14610546578063313ce5671461054e57610342565b806323b872dd14610496578063270ef385146104cc5780632ab60045146104d457610342565b806306fdde031461034757806308bca566146103c4578063095ea7b3146103f2578063117803e31461043257806318160ddd146104565780631a89526614610470575b600080fd5b61034f610ca6565b6040805160208082528351818301528351919283929083019185019080838360005b83811015610389578181015183820152602001610371565b50505050905090810190601f1680156103b65780820380516001836020036101000a031916815260200191505b509250505060405180910390f35b6103f0600480360360408110156103da57600080fd5b506001600160a01b038135169060200135610d34565b005b61041e6004803603604081101561040857600080fd5b506001600160a01b038135169060200135610f07565b604080519115158252519081900360200190f35b61043a61101b565b604080516001600160a01b039092168252519081900360200190f35b61045e611033565b60408051918252519081900360200190f35b6103f06004803603602081101561048657600080fd5b50356001600160a01b0316611039565b61041e600480360360608110156104ac57600080fd5b506001600160a01b038135811691602081013590911690604001356110cb565b61045e6112f0565b6103f0600480360360208110156104ea57600080fd5b50356001600160a01b03166112f9565b6103f06004803603602081101561051057600080fd5b50356001600160a01b03166113d5565b61041e6004803603602081101561053657600080fd5b50356001600160a01b0316611435565b61045e6114dc565b610556611500565b6040805160ff9092168252519081900360200190f35b6103f0600480360361010081101561058357600080fd5b810190602081018135600160201b81111561059d57600080fd5b8201836020820111156105af57600080fd5b803590602001918460018302840111600160201b831117156105d057600080fd5b91908080601f0160208091040260200160405190810160405280939291908181526020018383808284376000920191909152509295949360208101935035915050600160201b81111561062257600080fd5b82018360208201111561063457600080fd5b803590602001918460018302840111600160201b8311171561065557600080fd5b91908080601f0160208091040260200160405190810160405280939291908181526020018383808284376000920191909152509295949360208101935035915050600160201b8111156106a757600080fd5b8201836020820111156106b957600080fd5b803590602001918460018302840111600160201b831117156106da57600080fd5b91908080601f0160208091040260200160405190810160405280939291908181526020018383808284376000920191909152509295505050813560ff1692505060208101356001600160a01b0390811691604081013582169160608201358116916080013516611509565b61043a611715565b61045e611724565b61043a61172a565b61041e6004803603604081101561077357600080fd5b506001600160a01b038135169060200135611739565b6103f0611842565b61041e600480360360408110156107a757600080fd5b506001600160a01b0381351690602001356118c3565b6103f0600480360360208110156107d357600080fd5b5035611bc4565b61041e600480360360408110156107f057600080fd5b506001600160a01b038135169060200135611dcc565b61034f611ed5565b6103f06004803603602081101561082457600080fd5b50356001600160a01b0316611ef0565b6103f0600480360360a081101561084a57600080fd5b506001600160a01b038135169060208101359060ff6040820135169060608101359060800135611fd2565b61041e612038565b61045e6004803603602081101561089357600080fd5b50356001600160a01b0316612048565b61045e600480360360208110156108b957600080fd5b50356001600160a01b0316612063565b61045e61207e565b6103f06120a2565b61045e600480360360208110156108ef57600080fd5b50356001600160a01b0316612129565b61043a612144565b61034f612153565b61043a6121ae565b61045e6121bd565b61041e6004803603604081101561093557600080fd5b506001600160a01b0381351690602001356121e1565b61041e6004803603604081101561096157600080fd5b506001600160a01b0381351690602001356122ea565b6103f06004803603602081101561098d57600080fd5b50356001600160a01b03166123f3565b61041e600480360360208110156109b357600080fd5b50356001600160a01b03166124d5565b6103f0600480360360208110156109d957600080fd5b50356001600160a01b03166124f3565b6103f0600480360360608110156109ff57600080fd5b506001600160a01b038135811691602081013590911690604001356125d5565b61043a612637565b61041e60048036036020811015610a3d57600080fd5b50356001600160a01b0316612646565b6103f0600480360360e0811015610a6357600080fd5b506001600160a01b03813581169160208101359091169060408101359060608101359060ff6080820135169060a08101359060c0013561265b565b6103f060048036036020811015610ab457600080fd5b810190602081018135600160201b811115610ace57600080fd5b820183602082011115610ae057600080fd5b803590602001918460018302840111600160201b83111715610b0157600080fd5b50909250905061277b565b61045e612819565b61045e60048036036040811015610b2a57600080fd5b506001600160a01b038135811691602001351661283d565b6103f06004803603610120811015610b5957600080fd5b506001600160a01b03813581169160208101359091169060408101359060608101359060808101359060a08101359060ff60c0820135169060e0810135906101000135612868565b61034f61298c565b61041e60048036036040811015610bbf57600080fd5b506001600160a01b0381351690602001356129e7565b6103f06004803603610120811015610bec57600080fd5b506001600160a01b03813581169160208101359091169060408101359060608101359060808101359060a08101359060ff60c0820135169060e0810135906101000135612a12565b6103f060048036036020811015610c4a57600080fd5b50356001600160a01b0316612b29565b6103f060048036036020811015610c7057600080fd5b50356001600160a01b0316612c0f565b61041e60048036036020811015610c9657600080fd5b50356001600160a01b0316612ca4565b6004805460408051602060026001851615610100026000190190941693909304601f81018490048402820184019092528181529291830182828015610d2c5780601f10610d0157610100808354040283529160200191610d2c565b820191906000526020600020905b815481529060010190602001808311610d0f57829003601f168201915b505050505081565b33733fa8f8958b90d370291f9bbddd617bb3e4f98a2114610daf576001600160a01b03821660009081526013602052604090205460ff1615610da7576040805162461bcd60e51b815260206004820152600760248201526618db185a5b595960ca1b604482015290519081900360640190fd5b506402540be4005b6001600160a01b0382166000818152601360205260409020805460ff19166001179055610e0d5760405162461bcd60e51b8152600401808060200182810382526023815260200180613d6d6023913960400191505060405180910390fd5b60008111610e4c5760405162461bcd60e51b8152600401808060200182810382526029815260200180613e516029913960400191505060405180910390fd5b600b54610e599082612cc2565b600b556001600160a01b038216600090815260096020526040902054610e7f9082612cc2565b6001600160a01b0383166000818152600960209081526040918290209390935580518481529051919233927fab8530f87dc9b59234c4623bf917212bb2536d647574c8e7e5da92c2ede0c9f89281900390910190a36040805182815290516001600160a01b038416916000916000805160206140548339815191529181900360200190a35050565b600154600090600160a01b900460ff1615610f5c576040805162461bcd60e51b815260206004820152601060248201526f14185d5cd8589b194e881c185d5cd95960821b604482015290519081900360640190fd5b3360008181526003602052604090205460ff1615610fab5760405162461bcd60e51b81526004018080602001828103825260258152602001806141e56025913960400191505060405180910390fd5b6001600160a01b038416600090815260036020526040902054849060ff16156110055760405162461bcd60e51b81526004018080602001828103825260258152602001806141e56025913960400191505060405180910390fd5b611010338686612d23565b506001949350505050565b733fa8f8958b90d370291f9bbddd617bb3e4f98a2181565b600b5490565b6002546001600160a01b031633146110825760405162461bcd60e51b815260040180806020018281038252602c815260200180613ec9602c913960400191505060405180910390fd5b6001600160a01b038116600081815260036020526040808220805460ff19169055517f117e3210bb9aa7d9baff172026820255c6f6c30ba8999d1c2fd88e2848137c4e9190a250565b600154600090600160a01b900460ff1615611120576040805162461bcd60e51b815260206004820152601060248201526f14185d5cd8589b194e881c185d5cd95960821b604482015290519081900360640190fd5b3360008181526003602052604090205460ff161561116f5760405162461bcd60e51b81526004018080602001828103825260258152602001806141e56025913960400191505060405180910390fd5b6001600160a01b038516600090815260036020526040902054859060ff16156111c95760405162461bcd60e51b81526004018080602001828103825260258152602001806141e56025913960400191505060405180910390fd5b6001600160a01b038516600090815260036020526040902054859060ff16156112235760405162461bcd60e51b81526004018080602001828103825260258152602001806141e56025913960400191505060405180910390fd5b6001600160a01b0387166000908152600a602090815260408083203384529091529020548511156112855760405162461bcd60e51b8152600401808060200182810382526028815260200180613f8f6028913960400191505060405180910390fd5b611290878787612e0f565b6001600160a01b0387166000908152600a602090815260408083203384529091529020546112be9086612f8c565b6001600160a01b0388166000908152600a60209081526040808320338452909152902055600193505050509392505050565b6402540be40081565b6000546001600160a01b03163314611346576040805162461bcd60e51b81526020600482018190526024820152600080516020613fb7833981519152604482015290519081900360640190fd5b6001600160a01b03811661138b5760405162461bcd60e51b815260040180806020018281038252602a815260200180613e27602a913960400191505060405180910390fd5b600e80546001600160a01b0319166001600160a01b0383169081179091556040517fe475e580d85111348e40d8ca33cfdd74c30fe1655c2d8537a13abc10065ffa5a90600090a250565b60125460ff166001146113e757600080fd5b30600090815260096020526040902054801561140857611408308383612e0f565b5050306000908152600360205260409020805460ff19908116600117909155601280549091166002179055565b6008546000906001600160a01b031633146114815760405162461bcd60e51b8152600401808060200182810382526029815260200180613ea06029913960400191505060405180910390fd5b6001600160a01b0382166000818152600c60209081526040808320805460ff19169055600d909152808220829055517fe94479a9f7e1952cc78f2d6baab678adc1b772d936c6583def489e524cb666929190a2506001919050565b7f6e71edae12b1b97f4d1f60370fef10105fa2faae0126114a169c64845d6126c981565b60065460ff1681565b600854600160a01b900460ff16156115525760405162461bcd60e51b815260040180806020018281038252602a81526020018061402a602a913960400191505060405180910390fd5b6001600160a01b0384166115975760405162461bcd60e51b815260040180806020018281038252602f815260200180613f3c602f913960400191505060405180910390fd5b6001600160a01b0383166115dc5760405162461bcd60e51b8152600401808060200182810382526029815260200180613dfe6029913960400191505060405180910390fd5b6001600160a01b0382166116215760405162461bcd60e51b815260040180806020018281038252602e815260200180613fd7602e913960400191505060405180910390fd5b6001600160a01b0381166116665760405162461bcd60e51b815260040180806020018281038252602881526020018061415d6028913960400191505060405180910390fd5b87516116799060049060208b0190613bcc565b50865161168d9060059060208a0190613bcc565b5085516116a1906007906020890190613bcc565b506006805460ff191660ff8716179055600880546001600160a01b03199081166001600160a01b0387811691909117909255600180548216868416179055600280549091169184169190911790556116f881612fce565b50506008805460ff60a01b1916600160a01b179055505050505050565b6008546001600160a01b031681565b600f5481565b600e546001600160a01b031690565b600154600090600160a01b900460ff161561178e576040805162461bcd60e51b815260206004820152601060248201526f14185d5cd8589b194e881c185d5cd95960821b604482015290519081900360640190fd5b3360008181526003602052604090205460ff16156117dd5760405162461bcd60e51b81526004018080602001828103825260258152602001806141e56025913960400191505060405180910390fd5b6001600160a01b038416600090815260036020526040902054849060ff16156118375760405162461bcd60e51b81526004018080602001828103825260258152602001806141e56025913960400191505060405180910390fd5b611010338686612ff0565b6001546001600160a01b0316331461188b5760405162461bcd60e51b81526004018080602001828103825260228152602001806140eb6022913960400191505060405180910390fd5b6001805460ff60a01b191690556040517f7805862f689e2f13df9f062ff482ad3ad112aca9e0847911ed832e158c525b3390600090a1565b600154600090600160a01b900460ff1615611918576040805162461bcd60e51b815260206004820152601060248201526f14185d5cd8589b194e881c185d5cd95960821b604482015290519081900360640190fd5b336000908152600c602052604090205460ff166119665760405162461bcd60e51b8152600401808060200182810382526021815260200180613f1b6021913960400191505060405180910390fd5b3360008181526003602052604090205460ff16156119b55760405162461bcd60e51b81526004018080602001828103825260258152602001806141e56025913960400191505060405180910390fd5b6001600160a01b038416600090815260036020526040902054849060ff1615611a0f5760405162461bcd60e51b81526004018080602001828103825260258152602001806141e56025913960400191505060405180910390fd5b6001600160a01b038516611a545760405162461bcd60e51b8152600401808060200182810382526023815260200180613d6d6023913960400191505060405180910390fd5b60008411611a935760405162461bcd60e51b8152600401808060200182810382526029815260200180613e516029913960400191505060405180910390fd5b336000908152600d602052604090205480851115611ae25760405162461bcd60e51b815260040180806020018281038252602e8152602001806140bd602e913960400191505060405180910390fd5b600b54611aef9086612cc2565b600b556001600160a01b038616600090815260096020526040902054611b159086612cc2565b6001600160a01b038716600090815260096020526040902055611b388186612f8c565b336000818152600d602090815260409182902093909355805188815290516001600160a01b038a16937fab8530f87dc9b59234c4623bf917212bb2536d647574c8e7e5da92c2ede0c9f8928290030190a36040805186815290516001600160a01b038816916000916000805160206140548339815191529181900360200190a350600195945050505050565b600154600160a01b900460ff1615611c16576040805162461bcd60e51b815260206004820152601060248201526f14185d5cd8589b194e881c185d5cd95960821b604482015290519081900360640190fd5b336000908152600c602052604090205460ff16611c645760405162461bcd60e51b8152600401808060200182810382526021815260200180613f1b6021913960400191505060405180910390fd5b3360008181526003602052604090205460ff1615611cb35760405162461bcd60e51b81526004018080602001828103825260258152602001806141e56025913960400191505060405180910390fd5b3360009081526009602052604090205482611cff5760405162461bcd60e51b8152600401808060200182810382526029815260200180613d446029913960400191505060405180910390fd5b82811015611d3e5760405162461bcd60e51b8152600401808060200182810382526026815260200180613ef56026913960400191505060405180910390fd5b600b54611d4b9084612f8c565b600b55611d588184612f8c565b33600081815260096020908152604091829020939093558051868152905191927fcc16f5dbb4873280815c1ee09dbd06736cffcc184412cf7a71a0fdb75d397ca592918290030190a260408051848152905160009133916000805160206140548339815191529181900360200190a3505050565b600154600090600160a01b900460ff1615611e21576040805162461bcd60e51b815260206004820152601060248201526f14185d5cd8589b194e881c185d5cd95960821b604482015290519081900360640190fd5b6008546001600160a01b03163314611e6a5760405162461bcd60e51b8152600401808060200182810382526029815260200180613ea06029913960400191505060405180910390fd5b6001600160a01b0383166000818152600c60209081526040808320805460ff19166001179055600d825291829020859055815185815291517f46980fca912ef9bcdbd36877427b6b90e860769f604e89c0e67720cece530d209281900390910190a250600192915050565b6040805180820190915260018152601960f91b602082015290565b6000546001600160a01b03163314611f3d576040805162461bcd60e51b81526020600482018190526024820152600080516020613fb7833981519152604482015290519081900360640190fd5b6001600160a01b038116611f825760405162461bcd60e51b8152600401808060200182810382526028815260200180613cf16028913960400191505060405180910390fd5b600180546001600160a01b0319166001600160a01b0383811691909117918290556040519116907fb80482a293ca2e013eda8683c9bd7fc8347cfdaeea5ede58cba46df502c2a60490600090a250565b600154600160a01b900460ff1615612024576040805162461bcd60e51b815260206004820152601060248201526f14185d5cd8589b194e881c185d5cd95960821b604482015290519081900360640190fd5b612031858585858561302d565b5050505050565b600154600160a01b900460ff1681565b6001600160a01b031660009081526009602052604090205490565b6001600160a01b031660009081526011602052604090205490565b7fd099cc98ef71107a616c4f0f941f04c322d8e254fe26b3c6668db87aae413de881565b6001546001600160a01b031633146120eb5760405162461bcd60e51b81526004018080602001828103825260228152602001806140eb6022913960400191505060405180910390fd5b6001805460ff60a01b1916600160a01b1790556040517f6985a02210a168e66602d3235cb6db0e70f92b3ba4d376a33c0f3d9434bff62590600090a1565b6001600160a01b03166000908152600d602052604090205490565b6000546001600160a01b031690565b6005805460408051602060026001851615610100026000190190941693909304601f81018490048402820184019092528181529291830182828015610d2c5780601f10610d0157610100808354040283529160200191610d2c565b6001546001600160a01b031681565b7f7c7c6cdb67a18743f49ec6fa9b35f50d52ed05cbed4cc592e13b44501c1a226781565b600154600090600160a01b900460ff1615612236576040805162461bcd60e51b815260206004820152601060248201526f14185d5cd8589b194e881c185d5cd95960821b604482015290519081900360640190fd5b3360008181526003602052604090205460ff16156122855760405162461bcd60e51b81526004018080602001828103825260258152602001806141e56025913960400191505060405180910390fd5b6001600160a01b038416600090815260036020526040902054849060ff16156122df5760405162461bcd60e51b81526004018080602001828103825260258152602001806141e56025913960400191505060405180910390fd5b611010338686613157565b600154600090600160a01b900460ff161561233f576040805162461bcd60e51b815260206004820152601060248201526f14185d5cd8589b194e881c185d5cd95960821b604482015290519081900360640190fd5b3360008181526003602052604090205460ff161561238e5760405162461bcd60e51b81526004018080602001828103825260258152602001806141e56025913960400191505060405180910390fd5b6001600160a01b038416600090815260036020526040902054849060ff16156123e85760405162461bcd60e51b81526004018080602001828103825260258152602001806141e56025913960400191505060405180910390fd5b611010338686612e0f565b6000546001600160a01b03163314612440576040805162461bcd60e51b81526020600482018190526024820152600080516020613fb7833981519152604482015290519081900360640190fd5b6001600160a01b0381166124855760405162461bcd60e51b815260040180806020018281038252602f815260200180613f3c602f913960400191505060405180910390fd5b600880546001600160a01b0319166001600160a01b0383811691909117918290556040519116907fdb66dfa9c6b8f5226fe9aac7e51897ae8ee94ac31dc70bb6c9900b2574b707e690600090a250565b6001600160a01b03166000908152600c602052604090205460ff1690565b6000546001600160a01b03163314612540576040805162461bcd60e51b81526020600482018190526024820152600080516020613fb7833981519152604482015290519081900360640190fd5b6001600160a01b0381166125855760405162461bcd60e51b81526004018080602001828103825260328152602001806141b36032913960400191505060405180910390fd5b600280546001600160a01b0319166001600160a01b0383811691909117918290556040519116907fc67398012c111ce95ecb7429b933096c977380ee6c421175a71a4a4c6c88c06e90600090a250565b600e546001600160a01b0316331461261e5760405162461bcd60e51b8152600401808060200182810382526024815260200180613f6b6024913960400191505060405180910390fd5b6126326001600160a01b03841683836131a6565b505050565b6002546001600160a01b031681565b60136020526000908152604090205460ff1681565b600154600160a01b900460ff16156126ad576040805162461bcd60e51b815260206004820152601060248201526f14185d5cd8589b194e881c185d5cd95960821b604482015290519081900360640190fd5b6001600160a01b038716600090815260036020526040902054879060ff16156127075760405162461bcd60e51b81526004018080602001828103825260258152602001806141e56025913960400191505060405180910390fd5b6001600160a01b038716600090815260036020526040902054879060ff16156127615760405162461bcd60e51b81526004018080602001828103825260258152602001806141e56025913960400191505060405180910390fd5b612770898989898989896131f8565b505050505050505050565b600854600160a01b900460ff168015612797575060125460ff16155b6127a057600080fd5b6127ac60048383613c4a565b5061280582828080601f016020809104026020016040519081016040528093929190818152602001838380828437600092019190915250506040805180820190915260018152601960f91b602082015291506133539050565b600f5550506012805460ff19166001179055565b7f158b0a9edf7a828aad02f63cd515c68ef2f50ba807396f6d12842833a159742981565b6001600160a01b039182166000908152600a6020908152604080832093909416825291909152205490565b600154600160a01b900460ff16156128ba576040805162461bcd60e51b815260206004820152601060248201526f14185d5cd8589b194e881c185d5cd95960821b604482015290519081900360640190fd5b6001600160a01b038916600090815260036020526040902054899060ff16156129145760405162461bcd60e51b81526004018080602001828103825260258152602001806141e56025913960400191505060405180910390fd5b6001600160a01b038916600090815260036020526040902054899060ff161561296e5760405162461bcd60e51b81526004018080602001828103825260258152602001806141e56025913960400191505060405180910390fd5b61297f8b8b8b8b8b8b8b8b8b6133c5565b5050505050505050505050565b6007805460408051602060026001851615610100026000190190941693909304601f81018490048402820184019092528181529291830182828015610d2c5780601f10610d0157610100808354040283529160200191610d2c565b6001600160a01b03919091166000908152601060209081526040808320938352929052205460ff1690565b600154600160a01b900460ff1615612a64576040805162461bcd60e51b815260206004820152601060248201526f14185d5cd8589b194e881c185d5cd95960821b604482015290519081900360640190fd5b6001600160a01b038916600090815260036020526040902054899060ff1615612abe5760405162461bcd60e51b81526004018080602001828103825260258152602001806141e56025913960400191505060405180910390fd5b6001600160a01b038916600090815260036020526040902054899060ff1615612b185760405162461bcd60e51b81526004018080602001828103825260258152602001806141e56025913960400191505060405180910390fd5b61297f8b8b8b8b8b8b8b8b8b6134d3565b6000546001600160a01b03163314612b76576040805162461bcd60e51b81526020600482018190526024820152600080516020613fb7833981519152604482015290519081900360640190fd5b6001600160a01b038116612bbb5760405162461bcd60e51b8152600401808060200182810382526026815260200180613db66026913960400191505060405180910390fd5b600054604080516001600160a01b039283168152918316602083015280517f8be0079c531659141344cd1fd0a4f28419497f9722a3daafe3b4186f6b6457e09281900390910190a1612c0c81612fce565b50565b6002546001600160a01b03163314612c585760405162461bcd60e51b815260040180806020018281038252602c815260200180613ec9602c913960400191505060405180910390fd5b6001600160a01b038116600081815260036020526040808220805460ff19166001179055517fffa4e6181777692565cf28528fc88fd1516ea86b56da075235fa575af6a4b8559190a250565b6001600160a01b031660009081526003602052604090205460ff1690565b600082820183811015612d1c576040805162461bcd60e51b815260206004820152601b60248201527f536166654d6174683a206164646974696f6e206f766572666c6f770000000000604482015290519081900360640190fd5b9392505050565b6001600160a01b038316612d685760405162461bcd60e51b81526004018080602001828103825260248152602001806140996024913960400191505060405180910390fd5b6001600160a01b038216612dad5760405162461bcd60e51b8152600401808060200182810382526022815260200180613ddc6022913960400191505060405180910390fd5b6001600160a01b038084166000818152600a6020908152604080832094871680845294825291829020859055815185815291517f8c5be1e5ebec7d5bd14f71427d1e84f3dd0314c0f7b2291e5b200ac8c7c3b9259281900390910190a3505050565b6001600160a01b038316612e545760405162461bcd60e51b81526004018080602001828103825260258152602001806140746025913960400191505060405180910390fd5b6001600160a01b038216612e995760405162461bcd60e51b8152600401808060200182810382526023815260200180613cce6023913960400191505060405180910390fd5b6001600160a01b038316600090815260096020526040902054811115612ef05760405162461bcd60e51b8152600401808060200182810382526026815260200180613e7a6026913960400191505060405180910390fd5b6001600160a01b038316600090815260096020526040902054612f139082612f8c565b6001600160a01b038085166000908152600960205260408082209390935590841681522054612f429082612cc2565b6001600160a01b03808416600081815260096020908152604091829020949094558051858152905191939287169260008051602061405483398151915292918290030190a3505050565b6000612d1c83836040518060400160405280601e81526020017f536166654d6174683a207375627472616374696f6e206f766572666c6f7700008152506135ac565b600080546001600160a01b0319166001600160a01b0392909216919091179055565b6001600160a01b038084166000908152600a602090815260408083209386168352929052205461263290849084906130289085612cc2565b612d23565b6130378585613643565b604080517f158b0a9edf7a828aad02f63cd515c68ef2f50ba807396f6d12842833a159742960208201526001600160a01b0387168183018190526060828101889052835180840390910181526080909201909252600f5490919061309e90868686866136aa565b6001600160a01b0316146130f9576040805162461bcd60e51b815260206004820152601e60248201527f46696174546f6b656e56323a20696e76616c6964207369676e61747572650000604482015290519081900360640190fd5b6001600160a01b0386166000818152601060209081526040808320898452909152808220805460ff19166001179055518792917f1cdd46ff242716cdaa72d159d339a485b3438398348d68f09d7c8c0a59353d8191a3505050505050565b61263283836130288460405180606001604052806025815260200161422f602591396001600160a01b03808a166000908152600a60209081526040808320938c168352929052205491906135ac565b604080516001600160a01b038416602482015260448082018490528251808303909101815260649091019091526020810180516001600160e01b031663a9059cbb60e01b179052612632908490613701565b4284101561324d576040805162461bcd60e51b815260206004820152601e60248201527f46696174546f6b656e56323a207065726d697420697320657870697265640000604482015290519081900360640190fd5b6001600160a01b0380881660008181526011602090815260409182902080546001810190915582517f6e71edae12b1b97f4d1f60370fef10105fa2faae0126114a169c64845d6126c992810192909252818301849052938a1660608201526080810189905260a081019390935260c08084018890528151808503909101815260e09093019052600f546132e390868686866136aa565b6001600160a01b03161461333e576040805162461bcd60e51b815260206004820152601a60248201527f454950323631323a20696e76616c6964207369676e6174757265000000000000604482015290519081900360640190fd5b613349888888612d23565b5050505050505050565b8151602092830120815191830191909120604080517f8b73c3c69bb8fe3d512ecc4cf759cc79239f7b179b0ffacaa9a75d522b39400f818601528082019390935260608301919091524660808301523060a0808401919091528151808403909101815260c09092019052805191012090565b6133d1898588886137b2565b604080517f7c7c6cdb67a18743f49ec6fa9b35f50d52ed05cbed4cc592e13b44501c1a226760208201526001600160a01b03808c16828401819052908b166060830152608082018a905260a0820189905260c0820188905260e080830188905283518084039091018152610100909201909252600f5490919061345790868686866136aa565b6001600160a01b0316146134b2576040805162461bcd60e51b815260206004820152601e60248201527f46696174546f6b656e56323a20696e76616c6964207369676e61747572650000604482015290519081900360640190fd5b6134bc8a8661383e565b6134c78a8a8a612e0f565b50505050505050505050565b6001600160a01b038816331461351a5760405162461bcd60e51b81526004018080602001828103825260258152602001806140056025913960400191505060405180910390fd5b613526898588886137b2565b604080517fd099cc98ef71107a616c4f0f941f04c322d8e254fe26b3c6668db87aae413de860208201526001600160a01b03808c16828401819052908b166060830152608082018a905260a0820189905260c0820188905260e080830188905283518084039091018152610100909201909252600f5490919061345790868686866136aa565b6000818484111561363b5760405162461bcd60e51b81526004018080602001828103825283818151815260200191508051906020019080838360005b838110156136005781810151838201526020016135e8565b50505050905090810190601f16801561362d5780820380516001836020036101000a031916815260200191505b509250505060405180910390fd5b505050900390565b6001600160a01b038216600090815260106020908152604080832084845290915290205460ff16156136a65760405162461bcd60e51b815260040180806020018281038252602e815260200180614185602e913960400191505060405180910390fd5b5050565b80516020808301919091206040805161190160f01b818501526022810189905260428082019390935281518082039093018352606201905280519101206000906136f681878787613898565b979650505050505050565b6060613756826040518060400160405280602081526020017f5361666545524332303a206c6f772d6c6576656c2063616c6c206661696c6564815250856001600160a01b0316613a1c9092919063ffffffff16565b8051909150156126325780806020019051602081101561377557600080fd5b50516126325760405162461bcd60e51b815260040180806020018281038252602a815260200180614133602a913960400191505060405180910390fd5b8142116137f05760405162461bcd60e51b815260040180806020018281038252602b815260200180613d19602b913960400191505060405180910390fd5b80421061382e5760405162461bcd60e51b815260040180806020018281038252602581526020018061420a6025913960400191505060405180910390fd5b6138388484613643565b50505050565b6001600160a01b0382166000818152601060209081526040808320858452909152808220805460ff19166001179055518392917f98de503528ee59b575ef0c0a2576a82497bfc029a5685b209e9ec333479b10a591a35050565b60007f7fffffffffffffffffffffffffffffff5d576e7357a4501ddfe92f46681b20a08211156138f95760405162461bcd60e51b815260040180806020018281038252602681526020018061410d6026913960400191505060405180910390fd5b8360ff16601b1415801561391157508360ff16601c14155b1561394d5760405162461bcd60e51b8152600401808060200182810382526026815260200180613d906026913960400191505060405180910390fd5b600060018686868660405160008152602001604052604051808581526020018460ff1681526020018381526020018281526020019450505050506020604051602081039080840390855afa1580156139a9573d6000803e3d6000fd5b5050604051601f1901519150506001600160a01b038116613a11576040805162461bcd60e51b815260206004820152601c60248201527f45435265636f7665723a20696e76616c6964207369676e617475726500000000604482015290519081900360640190fd5b90505b949350505050565b6060613a1484846000856060613a3185613b93565b613a82576040805162461bcd60e51b815260206004820152601d60248201527f416464726573733a2063616c6c20746f206e6f6e2d636f6e7472616374000000604482015290519081900360640190fd5b60006060866001600160a01b031685876040518082805190602001908083835b60208310613ac15780518252601f199092019160209182019101613aa2565b6001836020036101000a03801982511681845116808217855250505050505090500191505060006040518083038185875af1925050503d8060008114613b23576040519150601f19603f3d011682016040523d82523d6000602084013e613b28565b606091505b50915091508115613b3c579150613a149050565b805115613b4c5780518082602001fd5b60405162461bcd60e51b81526020600482018181528651602484015286518793919283926044019190850190808383600083156136005781810151838201526020016135e8565b6000813f7fc5d2460186f7233c927e7db2dcc703c0e500b653ca82273b7bfad8045d85a470818114801590613a14575050151592915050565b828054600181600116156101000203166002900490600052602060002090601f016020900481019282601f10613c0d57805160ff1916838001178555613c3a565b82800160010185558215613c3a579182015b82811115613c3a578251825591602001919060010190613c1f565b50613c46929150613cb8565b5090565b828054600181600116156101000203166002900490600052602060002090601f016020900481019282601f10613c8b5782800160ff19823516178555613c3a565b82800160010185558215613c3a579182015b82811115613c3a578235825591602001919060010190613c9d565b5b80821115613c465760008155600101613cb956fe45524332303a207472616e7366657220746f20746865207a65726f20616464726573735061757361626c653a206e65772070617573657220697320746865207a65726f206164647265737346696174546f6b656e56323a20617574686f72697a6174696f6e206973206e6f74207965742076616c696446696174546f6b656e3a206275726e20616d6f756e74206e6f742067726561746572207468616e203046696174546f6b656e3a206d696e7420746f20746865207a65726f206164647265737345435265636f7665723a20696e76616c6964207369676e6174757265202776272076616c75654f776e61626c653a206e6577206f776e657220697320746865207a65726f206164647265737345524332303a20617070726f766520746f20746865207a65726f206164647265737346696174546f6b656e3a206e65772070617573657220697320746865207a65726f2061646472657373526573637561626c653a206e6577207265736375657220697320746865207a65726f206164647265737346696174546f6b656e3a206d696e7420616d6f756e74206e6f742067726561746572207468616e203045524332303a207472616e7366657220616d6f756e7420657863656564732062616c616e636546696174546f6b656e3a2063616c6c6572206973206e6f7420746865206d61737465724d696e746572426c61636b6c69737461626c653a2063616c6c6572206973206e6f742074686520626c61636b6c697374657246696174546f6b656e3a206275726e20616d6f756e7420657863656564732062616c616e636546696174546f6b656e3a2063616c6c6572206973206e6f742061206d696e74657246696174546f6b656e3a206e6577206d61737465724d696e74657220697320746865207a65726f2061646472657373526573637561626c653a2063616c6c6572206973206e6f7420746865207265736375657245524332303a207472616e7366657220616d6f756e74206578636565647320616c6c6f77616e63654f776e61626c653a2063616c6c6572206973206e6f7420746865206f776e657246696174546f6b656e3a206e657720626c61636b6c697374657220697320746865207a65726f206164647265737346696174546f6b656e56323a2063616c6c6572206d7573742062652074686520706179656546696174546f6b656e3a20636f6e747261637420697320616c726561647920696e697469616c697a6564ddf252ad1be2c89b69c2b068fc378daa952ba7f163c4a11628f55a4df523b3ef45524332303a207472616e736665722066726f6d20746865207a65726f206164647265737345524332303a20617070726f76652066726f6d20746865207a65726f206164647265737346696174546f6b656e3a206d696e7420616d6f756e742065786365656473206d696e746572416c6c6f77616e63655061757361626c653a2063616c6c6572206973206e6f74207468652070617573657245435265636f7665723a20696e76616c6964207369676e6174757265202773272076616c75655361666545524332303a204552433230206f7065726174696f6e20646964206e6f74207375636365656446696174546f6b656e3a206e6577206f776e657220697320746865207a65726f206164647265737346696174546f6b656e56323a20617574686f72697a6174696f6e2069732075736564206f722063616e63656c6564426c61636b6c69737461626c653a206e657720626c61636b6c697374657220697320746865207a65726f2061646472657373426c61636b6c69737461626c653a206163636f756e7420697320626c61636b6c697374656446696174546f6b656e56323a20617574686f72697a6174696f6e206973206578706972656445524332303a2064656372656173656420616c6c6f77616e63652062656c6f77207a65726fa26469706673582212207b4da560072fe68a7239251b48c1257c86456f8f847fc4ba06646d6f4f5241aa64736f6c634300060c0033",
  "devdoc": {
    "kind": "dev",
    "methods": {
      "allocateTo(address,uint256)": {
        "details": "Function to mint tokens",
        "params": {
          "_amount": "The amount of tokens to mint. Must be less than or equal to the minterAllowance of the caller.",
          "_to": "The address that will receive the minted tokens."
        }
      },
      "allowance(address,address)": {
        "params": {
          "owner": "Token owner's address",
          "spender": "Spender's address"
        },
        "returns": {
          "_0": "Allowance amount"
        }
      },
      "approve(address,uint256)": {
        "params": {
          "spender": "Spender's address",
          "value": "Allowance amount"
        },
        "returns": {
          "_0": "True if successful"
        }
      },
      "authorizationState(address,bytes32)": {
        "details": "Nonces are randomly generated 32-byte data unique to the authorizer's address",
        "params": {
          "authorizer": "Authorizer's address",
          "nonce": "Nonce of the authorization"
        },
        "returns": {
          "_0": "True if the nonce is used"
        }
      },
      "balanceOf(address)": {
        "details": "Get token balance of an account",
        "params": {
          "account": "address The account"
        }
      },
      "blacklist(address)": {
        "details": "Adds account to blacklist",
        "params": {
          "_account": "The address to blacklist"
        }
      },
      "burn(uint256)": {
        "details": "allows a minter to burn some of its own tokens Validates that caller is a minter and that sender is not blacklisted amount is less than or equal to the minter's account balance",
        "params": {
          "_amount": "uint256 the amount of tokens to be burned"
        }
      },
      "cancelAuthorization(address,bytes32,uint8,bytes32,bytes32)": {
        "details": "Works only if the authorization is not yet used.",
        "params": {
          "authorizer": "Authorizer's address",
          "nonce": "Nonce of the authorization",
          "r": "r of the signature",
          "s": "s of the signature",
          "v": "v of the signature"
        }
      },
      "configureMinter(address,uint256)": {
        "details": "Function to add/update a new minter",
        "params": {
          "minter": "The address of the minter",
          "minterAllowedAmount": "The minting amount allowed for the minter"
        },
        "returns": {
          "_0": "True if the operation was successful."
        }
      },
      "decreaseAllowance(address,uint256)": {
        "params": {
          "decrement": "Amount of decrease in allowance",
          "spender": "Spender's address"
        },
        "returns": {
          "_0": "True if successful"
        }
      },
      "increaseAllowance(address,uint256)": {
        "params": {
          "increment": "Amount of increase in allowance",
          "spender": "Spender's address"
        },
        "returns": {
          "_0": "True if successful"
        }
      },
      "initializeV2(string)": {
        "params": {
          "newName": "New token name"
        }
      },
      "initializeV2_1(address)": {
        "params": {
          "lostAndFound": "The address to which the locked funds are sent"
        }
      },
      "isBlacklisted(address)": {
        "details": "Checks if account is blacklisted",
        "params": {
          "_account": "The address to check"
        }
      },
      "isMinter(address)": {
        "details": "Checks if account is a minter",
        "params": {
          "account": "The address to check"
        }
      },
      "mint(address,uint256)": {
        "details": "Function to mint tokens",
        "params": {
          "_amount": "The amount of tokens to mint. Must be less than or equal to the minterAllowance of the caller.",
          "_to": "The address that will receive the minted tokens."
        },
        "returns": {
          "_0": "A boolean that indicates if the operation was successful."
        }
      },
      "minterAllowance(address)": {
        "details": "Get minter allowance for an account",
        "params": {
          "minter": "The address of the minter"
        }
      },
      "nonces(address)": {
        "params": {
          "owner": "Token owner's address (Authorizer)"
        },
        "returns": {
          "_0": "Next nonce"
        }
      },
      "owner()": {
        "details": "Tells the address of the owner",
        "returns": {
          "_0": "the address of the owner"
        }
      },
      "pause()": {
        "details": "called by the owner to pause, triggers stopped state"
      },
      "permit(address,address,uint256,uint256,uint8,bytes32,bytes32)": {
        "params": {
          "deadline": "Expiration time, seconds since the epoch",
          "owner": "Token owner's address (Authorizer)",
          "r": "r of the signature",
          "s": "s of the signature",
          "spender": "Spender's address",
          "v": "v of the signature",
          "value": "Amount of allowance"
        }
      },
      "receiveWithAuthorization(address,address,uint256,uint256,uint256,bytes32,uint8,bytes32,bytes32)": {
        "details": "This has an additional check to ensure that the payee's address matches the caller of this function to prevent front-running attacks.",
        "params": {
          "from": "Payer's address (Authorizer)",
          "nonce": "Unique nonce",
          "r": "r of the signature",
          "s": "s of the signature",
          "to": "Payee's address",
          "v": "v of the signature",
          "validAfter": "The time after which this is valid (unix time)",
          "validBefore": "The time before which this is valid (unix time)",
          "value": "Amount to be transferred"
        }
      },
      "removeMinter(address)": {
        "details": "Function to remove a minter",
        "params": {
          "minter": "The address of the minter to remove"
        },
        "returns": {
          "_0": "True if the operation was successful."
        }
      },
      "rescueERC20(address,address,uint256)": {
        "params": {
          "amount": "Amount to withdraw",
          "to": "Recipient address",
          "tokenContract": "ERC20 token contract address"
        }
      },
      "rescuer()": {
        "returns": {
          "_0": "Rescuer's address"
        }
      },
      "totalSupply()": {
        "details": "Get totalSupply of token"
      },
      "transfer(address,uint256)": {
        "params": {
          "to": "Payee's address",
          "value": "Transfer amount"
        },
        "returns": {
          "_0": "True if successful"
        }
      },
      "transferFrom(address,address,uint256)": {
        "params": {
          "from": "Payer's address",
          "to": "Payee's address",
          "value": "Transfer amount"
        },
        "returns": {
          "_0": "True if successful"
        }
      },
      "transferOwnership(address)": {
        "details": "Allows the current owner to transfer control of the contract to a newOwner.",
        "params": {
          "newOwner": "The address to transfer ownership to."
        }
      },
      "transferWithAuthorization(address,address,uint256,uint256,uint256,bytes32,uint8,bytes32,bytes32)": {
        "params": {
          "from": "Payer's address (Authorizer)",
          "nonce": "Unique nonce",
          "r": "r of the signature",
          "s": "s of the signature",
          "to": "Payee's address",
          "v": "v of the signature",
          "validAfter": "The time after which this is valid (unix time)",
          "validBefore": "The time before which this is valid (unix time)",
          "value": "Amount to be transferred"
        }
      },
      "unBlacklist(address)": {
        "details": "Removes account from blacklist",
        "params": {
          "_account": "The address to remove from the blacklist"
        }
      },
      "unpause()": {
        "details": "called by the owner to unpause, returns to normal state"
      },
      "updatePauser(address)": {
        "details": "update the pauser role"
      },
      "updateRescuer(address)": {
        "params": {
          "newRescuer": "New rescuer's address"
        }
      },
      "version()": {
        "returns": {
          "_0": "Version string"
        }
      }
    },
    "title": "FiatToken V2.1",
    "version": 1
  },
  "userdoc": {
    "kind": "user",
    "methods": {
      "allowance(address,address)": {
        "notice": "Amount of remaining tokens spender is allowed to transfer on behalf of the token owner"
      },
      "approve(address,uint256)": {
        "notice": "Set spender's allowance over the caller's tokens to be a given value."
      },
      "authorizationState(address,bytes32)": {
        "notice": "Returns the state of an authorization"
      },
      "cancelAuthorization(address,bytes32,uint8,bytes32,bytes32)": {
        "notice": "Attempt to cancel an authorization"
      },
      "decreaseAllowance(address,uint256)": {
        "notice": "Decrease the allowance by a given decrement"
      },
      "increaseAllowance(address,uint256)": {
        "notice": "Increase the allowance by a given increment"
      },
      "initializeV2(string)": {
        "notice": "Initialize v2"
      },
      "initializeV2_1(address)": {
        "notice": "Initialize v2.1"
      },
      "nonces(address)": {
        "notice": "Nonces for permit"
      },
      "permit(address,address,uint256,uint256,uint8,bytes32,bytes32)": {
        "notice": "Update allowance with a signed permit"
      },
      "receiveWithAuthorization(address,address,uint256,uint256,uint256,bytes32,uint8,bytes32,bytes32)": {
        "notice": "Receive a transfer with a signed authorization from the payer"
      },
      "rescueERC20(address,address,uint256)": {
        "notice": "Rescue ERC20 tokens locked up in this contract."
      },
      "rescuer()": {
        "notice": "Returns current rescuer"
      },
      "transfer(address,uint256)": {
        "notice": "Transfer tokens from the caller"
      },
      "transferFrom(address,address,uint256)": {
        "notice": "Transfer tokens by spending allowance"
      },
      "transferWithAuthorization(address,address,uint256,uint256,uint256,bytes32,uint8,bytes32,bytes32)": {
        "notice": "Execute a transfer with a signed authorization"
      },
      "updateRescuer(address)": {
        "notice": "Assign the rescuer role to a given address."
      },
      "version()": {
        "notice": "Version string for the EIP712 domain separator"
      }
    },
    "notice": "ERC20 Token backed by fiat reserves, version 2.1",
    "version": 1
  },
  "storageLayout": {
    "storage": [
      {
        "astId": 298,
        "contract": "contracts/test/USDC.sol:FiatTokenV2_1",
        "label": "_owner",
        "offset": 0,
        "slot": "0",
        "type": "t_address"
      },
      {
        "astId": 391,
        "contract": "contracts/test/USDC.sol:FiatTokenV2_1",
        "label": "pauser",
        "offset": 0,
        "slot": "1",
        "type": "t_address"
      },
      {
        "astId": 394,
        "contract": "contracts/test/USDC.sol:FiatTokenV2_1",
        "label": "paused",
        "offset": 20,
        "slot": "1",
        "type": "t_bool"
      },
      {
        "astId": 480,
        "contract": "contracts/test/USDC.sol:FiatTokenV2_1",
        "label": "blacklister",
        "offset": 0,
        "slot": "2",
        "type": "t_address"
      },
      {
        "astId": 484,
        "contract": "contracts/test/USDC.sol:FiatTokenV2_1",
        "label": "blacklisted",
        "offset": 0,
        "slot": "3",
        "type": "t_mapping(t_address,t_bool)"
      },
      {
        "astId": 617,
        "contract": "contracts/test/USDC.sol:FiatTokenV2_1",
        "label": "name",
        "offset": 0,
        "slot": "4",
        "type": "t_string_storage"
      },
      {
        "astId": 619,
        "contract": "contracts/test/USDC.sol:FiatTokenV2_1",
        "label": "symbol",
        "offset": 0,
        "slot": "5",
        "type": "t_string_storage"
      },
      {
        "astId": 621,
        "contract": "contracts/test/USDC.sol:FiatTokenV2_1",
        "label": "decimals",
        "offset": 0,
        "slot": "6",
        "type": "t_uint8"
      },
      {
        "astId": 623,
        "contract": "contracts/test/USDC.sol:FiatTokenV2_1",
        "label": "currency",
        "offset": 0,
        "slot": "7",
        "type": "t_string_storage"
      },
      {
        "astId": 625,
        "contract": "contracts/test/USDC.sol:FiatTokenV2_1",
        "label": "masterMinter",
        "offset": 0,
        "slot": "8",
        "type": "t_address"
      },
      {
        "astId": 627,
        "contract": "contracts/test/USDC.sol:FiatTokenV2_1",
        "label": "initialized",
        "offset": 20,
        "slot": "8",
        "type": "t_bool"
      },
      {
        "astId": 631,
        "contract": "contracts/test/USDC.sol:FiatTokenV2_1",
        "label": "balances",
        "offset": 0,
        "slot": "9",
        "type": "t_mapping(t_address,t_uint256)"
      },
      {
        "astId": 637,
        "contract": "contracts/test/USDC.sol:FiatTokenV2_1",
        "label": "allowed",
        "offset": 0,
        "slot": "10",
        "type": "t_mapping(t_address,t_mapping(t_address,t_uint256))"
      },
      {
        "astId": 640,
        "contract": "contracts/test/USDC.sol:FiatTokenV2_1",
        "label": "totalSupply_",
        "offset": 0,
        "slot": "11",
        "type": "t_uint256"
      },
      {
        "astId": 644,
        "contract": "contracts/test/USDC.sol:FiatTokenV2_1",
        "label": "minters",
        "offset": 0,
        "slot": "12",
        "type": "t_mapping(t_address,t_bool)"
      },
      {
        "astId": 648,
        "contract": "contracts/test/USDC.sol:FiatTokenV2_1",
        "label": "minterAllowed",
        "offset": 0,
        "slot": "13",
        "type": "t_mapping(t_address,t_uint256)"
      },
      {
        "astId": 1788,
        "contract": "contracts/test/USDC.sol:FiatTokenV2_1",
        "label": "_rescuer",
        "offset": 0,
        "slot": "14",
        "type": "t_address"
      },
      {
        "astId": 2040,
        "contract": "contracts/test/USDC.sol:FiatTokenV2_1",
        "label": "DOMAIN_SEPARATOR",
        "offset": 0,
        "slot": "15",
        "type": "t_bytes32"
      },
      {
        "astId": 2063,
        "contract": "contracts/test/USDC.sol:FiatTokenV2_1",
        "label": "_authorizationStates",
        "offset": 0,
        "slot": "16",
        "type": "t_mapping(t_address,t_mapping(t_bytes32,t_bool))"
      },
      {
        "astId": 2379,
        "contract": "contracts/test/USDC.sol:FiatTokenV2_1",
        "label": "_permitNonces",
        "offset": 0,
        "slot": "17",
        "type": "t_mapping(t_address,t_uint256)"
      },
      {
        "astId": 2464,
        "contract": "contracts/test/USDC.sol:FiatTokenV2_1",
        "label": "_initializedVersion",
        "offset": 0,
        "slot": "18",
        "type": "t_uint8"
      },
      {
        "astId": 2829,
        "contract": "contracts/test/USDC.sol:FiatTokenV2_1",
        "label": "claimed",
        "offset": 0,
        "slot": "19",
        "type": "t_mapping(t_address,t_bool)"
      }
    ],
    "types": {
      "t_address": {
        "encoding": "inplace",
        "label": "address",
        "numberOfBytes": "20"
      },
      "t_bool": {
        "encoding": "inplace",
        "label": "bool",
        "numberOfBytes": "1"
      },
      "t_bytes32": {
        "encoding": "inplace",
        "label": "bytes32",
        "numberOfBytes": "32"
      },
      "t_mapping(t_address,t_bool)": {
        "encoding": "mapping",
        "key": "t_address",
        "label": "mapping(address => bool)",
        "numberOfBytes": "32",
        "value": "t_bool"
      },
      "t_mapping(t_address,t_mapping(t_address,t_uint256))": {
        "encoding": "mapping",
        "key": "t_address",
        "label": "mapping(address => mapping(address => uint256))",
        "numberOfBytes": "32",
        "value": "t_mapping(t_address,t_uint256)"
      },
      "t_mapping(t_address,t_mapping(t_bytes32,t_bool))": {
        "encoding": "mapping",
        "key": "t_address",
        "label": "mapping(address => mapping(bytes32 => bool))",
        "numberOfBytes": "32",
        "value": "t_mapping(t_bytes32,t_bool)"
      },
      "t_mapping(t_address,t_uint256)": {
        "encoding": "mapping",
        "key": "t_address",
        "label": "mapping(address => uint256)",
        "numberOfBytes": "32",
        "value": "t_uint256"
      },
      "t_mapping(t_bytes32,t_bool)": {
        "encoding": "mapping",
        "key": "t_bytes32",
        "label": "mapping(bytes32 => bool)",
        "numberOfBytes": "32",
        "value": "t_bool"
      },
      "t_string_storage": {
        "encoding": "bytes",
        "label": "string",
        "numberOfBytes": "32"
      },
      "t_uint256": {
        "encoding": "inplace",
        "label": "uint256",
        "numberOfBytes": "32"
      },
      "t_uint8": {
        "encoding": "inplace",
        "label": "uint8",
        "numberOfBytes": "1"
      }
    }
  }
}