{
  "address": "0x96B1352873D143e797b9F1d2832C167cc692eE95",
  "abi": [
    {
      "anonymous": false,
      "inputs": [
        {
          "indexed": true,
          "internalType": "address",
          "name": "owner",
          "type": "address"
        },
        {
          "indexed": true,
          "internalType": "address",
          "name": "spender",
          "type": "address"
        },
        {
          "indexed": false,
          "internalType": "uint256",
          "name": "value",
          "type": "uint256"
        }
      ],
      "name": "Approval",
      "type": "event"
    },
    {
      "anonymous": false,
      "inputs": [
        {
          "indexed": true,
          "internalType": "address",
          "name": "authorizer",
          "type": "address"
        },
        {
          "indexed": true,
          "internalType": "bytes32",
          "name": "nonce",
          "type": "bytes32"
        }
      ],
      "name": "AuthorizationCanceled",
      "type": "event"
    },
    {
      "anonymous": false,
      "inputs": [
        {
          "indexed": true,
          "internalType": "address",
          "name": "authorizer",
          "type": "address"
        },
        {
          "indexed": true,
          "internalType": "bytes32",
          "name": "nonce",
          "type": "bytes32"
        }
      ],
      "name": "AuthorizationUsed",
      "type": "event"
    },
    {
      "anonymous": false,
      "inputs": [
        {
          "indexed": true,
          "internalType": "address",
          "name": "_account",
          "type": "address"
        }
      ],
      "name": "Blacklisted",
      "type": "event"
    },
    {
      "anonymous": false,
      "inputs": [
        {
          "indexed": true,
          "internalType": "address",
          "name": "newBlacklister",
          "type": "address"
        }
      ],
      "name": "BlacklisterChanged",
      "type": "event"
    },
    {
      "anonymous": false,
      "inputs": [
        {
          "indexed": true,
          "internalType": "address",
          "name": "burner",
          "type": "address"
        },
        {
          "indexed": false,
          "internalType": "uint256",
          "name": "amount",
          "type": "uint256"
        }
      ],
      "name": "Burn",
      "type": "event"
    },
    {
      "anonymous": false,
      "inputs": [
        {
          "indexed": true,
          "internalType": "address",
          "name": "newMasterMinter",
          "type": "address"
        }
      ],
      "name": "MasterMinterChanged",
      "type": "event"
    },
    {
      "anonymous": false,
      "inputs": [
        {
          "indexed": true,
          "internalType": "address",
          "name": "minter",
          "type": "address"
        },
        {
          "indexed": true,
          "internalType": "address",
          "name": "to",
          "type": "address"
        },
        {
          "indexed": false,
          "internalType": "uint256",
          "name": "amount",
          "type": "uint256"
        }
      ],
      "name": "Mint",
      "type": "event"
    },
    {
      "anonymous": false,
      "inputs": [
        {
          "indexed": true,
          "internalType": "address",
          "name": "minter",
          "type": "address"
        },
        {
          "indexed": false,
          "internalType": "uint256",
          "name": "minterAllowedAmount",
          "type": "uint256"
        }
      ],
      "name": "MinterConfigured",
      "type": "event"
    },
    {
      "anonymous": false,
      "inputs": [
        {
          "indexed": true,
          "internalType": "address",
          "name": "oldMinter",
          "type": "address"
        }
      ],
      "name": "MinterRemoved",
      "type": "event"
    },
    {
      "anonymous": false,
      "inputs": [
        {
          "indexed": false,
          "internalType": "address",
          "name": "previousOwner",
          "type": "address"
        },
        {
          "indexed": false,
          "internalType": "address",
          "name": "newOwner",
          "type": "address"
        }
      ],
      "name": "OwnershipTransferred",
      "type": "event"
    },
    {
      "anonymous": false,
      "inputs": [],
      "name": "Pause",
      "type": "event"
    },
    {
      "anonymous": false,
      "inputs": [
        {
          "indexed": true,
          "internalType": "address",
          "name": "newAddress",
          "type": "address"
        }
      ],
      "name": "PauserChanged",
      "type": "event"
    },
    {
      "anonymous": false,
      "inputs": [
        {
          "indexed": true,
          "internalType": "address",
          "name": "newRescuer",
          "type": "address"
        }
      ],
      "name": "RescuerChanged",
      "type": "event"
    },
    {
      "anonymous": false,
      "inputs": [
        {
          "indexed": true,
          "internalType": "address",
          "name": "from",
          "type": "address"
        },
        {
          "indexed": true,
          "internalType": "address",
          "name": "to",
          "type": "address"
        },
        {
          "indexed": false,
          "internalType": "uint256",
          "name": "value",
          "type": "uint256"
        }
      ],
      "name": "Transfer",
      "type": "event"
    },
    {
      "anonymous": false,
      "inputs": [
        {
          "indexed": true,
          "internalType": "address",
          "name": "_account",
          "type": "address"
        }
      ],
      "name": "UnBlacklisted",
      "type": "event"
    },
    {
      "anonymous": false,
      "inputs": [],
      "name": "Unpause",
      "type": "event"
    },
    {
      "inputs": [],
      "name": "CANCEL_AUTHORIZATION_TYPEHASH",
      "outputs": [
        {
          "internalType": "bytes32",
          "name": "",
          "type": "bytes32"
        }
      ],
      "stateMutability": "view",
      "type": "function"
    },
    {
      "inputs": [],
      "name": "DOMAIN_SEPARATOR",
      "outputs": [
        {
          "internalType": "bytes32",
          "name": "",
          "type": "bytes32"
        }
      ],
      "stateMutability": "view",
      "type": "function"
    },
    {
      "inputs": [],
      "name": "PERMIT_TYPEHASH",
      "outputs": [
        {
          "internalType": "bytes32",
          "name": "",
          "type": "bytes32"
        }
      ],
      "stateMutability": "view",
      "type": "function"
    },
    {
      "inputs": [],
      "name": "RECEIVE_WITH_AUTHORIZATION_TYPEHASH",
      "outputs": [
        {
          "internalType": "bytes32",
          "name": "",
          "type": "bytes32"
        }
      ],
      "stateMutability": "view",
      "type": "function"
    },
    {
      "inputs": [],
      "name": "TRANSFER_WITH_AUTHORIZATION_TYPEHASH",
      "outputs": [
        {
          "internalType": "bytes32",
          "name": "",
          "type": "bytes32"
        }
      ],
      "stateMutability": "view",
      "type": "function"
    },
    {
      "inputs": [
        {
          "internalType": "address",
          "name": "_to",
          "type": "address"
        },
        {
          "internalType": "uint256",
          "name": "_amount",
          "type": "uint256"
        }
      ],
      "name": "allocateTo",
      "outputs": [],
      "stateMutability": "nonpayable",
      "type": "function"
    },
    {
      "inputs": [
        {
          "internalType": "address",
          "name": "owner",
          "type": "address"
        },
        {
          "internalType": "address",
          "name": "spender",
          "type": "address"
        }
      ],
      "name": "allowance",
      "outputs": [
        {
          "internalType": "uint256",
          "name": "",
          "type": "uint256"
        }
      ],
      "stateMutability": "view",
      "type": "function"
    },
    {
      "inputs": [
        {
          "internalType": "address",
          "name": "spender",
          "type": "address"
        },
        {
          "internalType": "uint256",
          "name": "value",
          "type": "uint256"
        }
      ],
      "name": "approve",
      "outputs": [
        {
          "internalType": "bool",
          "name": "",
          "type": "bool"
        }
      ],
      "stateMutability": "nonpayable",
      "type": "function"
    },
    {
      "inputs": [
        {
          "internalType": "address",
          "name": "authorizer",
          "type": "address"
        },
        {
          "internalType": "bytes32",
          "name": "nonce",
          "type": "bytes32"
        }
      ],
      "name": "authorizationState",
      "outputs": [
        {
          "internalType": "bool",
          "name": "",
          "type": "bool"
        }
      ],
      "stateMutability": "view",
      "type": "function"
    },
    {
      "inputs": [
        {
          "internalType": "address",
          "name": "account",
          "type": "address"
        }
      ],
      "name": "balanceOf",
      "outputs": [
        {
          "internalType": "uint256",
          "name": "",
          "type": "uint256"
        }
      ],
      "stateMutability": "view",
      "type": "function"
    },
    {
      "inputs": [
        {
          "internalType": "address",
          "name": "_account",
          "type": "address"
        }
      ],
      "name": "blacklist",
      "outputs": [],
      "stateMutability": "nonpayable",
      "type": "function"
    },
    {
      "inputs": [],
      "name": "blacklister",
      "outputs": [
        {
          "internalType": "address",
          "name": "",
          "type": "address"
        }
      ],
      "stateMutability": "view",
      "type": "function"
    },
    {
      "inputs": [
        {
          "internalType": "uint256",
          "name": "_amount",
          "type": "uint256"
        }
      ],
      "name": "burn",
      "outputs": [],
      "stateMutability": "nonpayable",
      "type": "function"
    },
    {
      "inputs": [
        {
          "internalType": "address",
          "name": "authorizer",
          "type": "address"
        },
        {
          "internalType": "bytes32",
          "name": "nonce",
          "type": "bytes32"
        },
        {
          "internalType": "uint8",
          "name": "v",
          "type": "uint8"
        },
        {
          "internalType": "bytes32",
          "name": "r",
          "type": "bytes32"
        },
        {
          "internalType": "bytes32",
          "name": "s",
          "type": "bytes32"
        }
      ],
      "name": "cancelAuthorization",
      "outputs": [],
      "stateMutability": "nonpayable",
      "type": "function"
    },
    {
      "inputs": [
        {
          "internalType": "address",
          "name": "minter",
          "type": "address"
        },
        {
          "internalType": "uint256",
          "name": "minterAllowedAmount",
          "type": "uint256"
        }
      ],
      "name": "configureMinter",
      "outputs": [
        {
          "internalType": "bool",
          "name": "",
          "type": "bool"
        }
      ],
      "stateMutability": "nonpayable",
      "type": "function"
    },
    {
      "inputs": [],
      "name": "currency",
      "outputs": [
        {
          "internalType": "string",
          "name": "",
          "type": "string"
        }
      ],
      "stateMutability": "view",
      "type": "function"
    },
    {
      "inputs": [],
      "name": "decimals",
      "outputs": [
        {
          "internalType": "uint8",
          "name": "",
          "type": "uint8"
        }
      ],
      "stateMutability": "view",
      "type": "function"
    },
    {
      "inputs": [
        {
          "internalType": "address",
          "name": "spender",
          "type": "address"
        },
        {
          "internalType": "uint256",
          "name": "decrement",
          "type": "uint256"
        }
      ],
      "name": "decreaseAllowance",
      "outputs": [
        {
          "internalType": "bool",
          "name": "",
          "type": "bool"
        }
      ],
      "stateMutability": "nonpayable",
      "type": "function"
    },
    {
      "inputs": [
        {
          "internalType": "address",
          "name": "spender",
          "type": "address"
        },
        {
          "internalType": "uint256",
          "name": "increment",
          "type": "uint256"
        }
      ],
      "name": "increaseAllowance",
      "outputs": [
        {
          "internalType": "bool",
          "name": "",
          "type": "bool"
        }
      ],
      "stateMutability": "nonpayable",
      "type": "function"
    },
    {
      "inputs": [
        {
          "internalType": "string",
          "name": "tokenName",
          "type": "string"
        },
        {
          "internalType": "string",
          "name": "tokenSymbol",
          "type": "string"
        },
        {
          "internalType": "string",
          "name": "tokenCurrency",
          "type": "string"
        },
        {
          "internalType": "uint8",
          "name": "tokenDecimals",
          "type": "uint8"
        },
        {
          "internalType": "address",
          "name": "newMasterMinter",
          "type": "address"
        },
        {
          "internalType": "address",
          "name": "newPauser",
          "type": "address"
        },
        {
          "internalType": "address",
          "name": "newBlacklister",
          "type": "address"
        },
        {
          "internalType": "address",
          "name": "newOwner",
          "type": "address"
        }
      ],
      "name": "initialize",
      "outputs": [],
      "stateMutability": "nonpayable",
      "type": "function"
    },
    {
      "inputs": [
        {
          "internalType": "string",
          "name": "newName",
          "type": "string"
        }
      ],
      "name": "initializeV2",
      "outputs": [],
      "stateMutability": "nonpayable",
      "type": "function"
    },
    {
      "inputs": [
        {
          "internalType": "address",
          "name": "lostAndFound",
          "type": "address"
        }
      ],
      "name": "initializeV2_1",
      "outputs": [],
      "stateMutability": "nonpayable",
      "type": "function"
    },
    {
      "inputs": [
        {
          "internalType": "address",
          "name": "_account",
          "type": "address"
        }
      ],
      "name": "isBlacklisted",
      "outputs": [
        {
          "internalType": "bool",
          "name": "",
          "type": "bool"
        }
      ],
      "stateMutability": "view",
      "type": "function"
    },
    {
      "inputs": [
        {
          "internalType": "address",
          "name": "account",
          "type": "address"
        }
      ],
      "name": "isMinter",
      "outputs": [
        {
          "internalType": "bool",
          "name": "",
          "type": "bool"
        }
      ],
      "stateMutability": "view",
      "type": "function"
    },
    {
      "inputs": [],
      "name": "masterMinter",
      "outputs": [
        {
          "internalType": "address",
          "name": "",
          "type": "address"
        }
      ],
      "stateMutability": "view",
      "type": "function"
    },
    {
      "inputs": [
        {
          "internalType": "address",
          "name": "_to",
          "type": "address"
        },
        {
          "internalType": "uint256",
          "name": "_amount",
          "type": "uint256"
        }
      ],
      "name": "mint",
      "outputs": [
        {
          "internalType": "bool",
          "name": "",
          "type": "bool"
        }
      ],
      "stateMutability": "nonpayable",
      "type": "function"
    },
    {
      "inputs": [
        {
          "internalType": "address",
          "name": "minter",
          "type": "address"
        }
      ],
      "name": "minterAllowance",
      "outputs": [
        {
          "internalType": "uint256",
          "name": "",
          "type": "uint256"
        }
      ],
      "stateMutability": "view",
      "type": "function"
    },
    {
      "inputs": [],
      "name": "name",
      "outputs": [
        {
          "internalType": "string",
          "name": "",
          "type": "string"
        }
      ],
      "stateMutability": "view",
      "type": "function"
    },
    {
      "inputs": [
        {
          "internalType": "address",
          "name": "owner",
          "type": "address"
        }
      ],
      "name": "nonces",
      "outputs": [
        {
          "internalType": "uint256",
          "name": "",
          "type": "uint256"
        }
      ],
      "stateMutability": "view",
      "type": "function"
    },
    {
      "inputs": [],
      "name": "owner",
      "outputs": [
        {
          "internalType": "address",
          "name": "",
          "type": "address"
        }
      ],
      "stateMutability": "view",
      "type": "function"
    },
    {
      "inputs": [],
      "name": "pause",
      "outputs": [],
      "stateMutability": "nonpayable",
      "type": "function"
    },
    {
      "inputs": [],
      "name": "paused",
      "outputs": [
        {
          "internalType": "bool",
          "name": "",
          "type": "bool"
        }
      ],
      "stateMutability": "view",
      "type": "function"
    },
    {
      "inputs": [],
      "name": "pauser",
      "outputs": [
        {
          "internalType": "address",
          "name": "",
          "type": "address"
        }
      ],
      "stateMutability": "view",
      "type": "function"
    },
    {
      "inputs": [
        {
          "internalType": "address",
          "name": "owner",
          "type": "address"
        },
        {
          "internalType": "address",
          "name": "spender",
          "type": "address"
        },
        {
          "internalType": "uint256",
          "name": "value",
          "type": "uint256"
        },
        {
          "internalType": "uint256",
          "name": "deadline",
          "type": "uint256"
        },
        {
          "internalType": "uint8",
          "name": "v",
          "type": "uint8"
        },
        {
          "internalType": "bytes32",
          "name": "r",
          "type": "bytes32"
        },
        {
          "internalType": "bytes32",
          "name": "s",
          "type": "bytes32"
        }
      ],
      "name": "permit",
      "outputs": [],
      "stateMutability": "nonpayable",
      "type": "function"
    },
    {
      "inputs": [
        {
          "internalType": "address",
          "name": "from",
          "type": "address"
        },
        {
          "internalType": "address",
          "name": "to",
          "type": "address"
        },
        {
          "internalType": "uint256",
          "name": "value",
          "type": "uint256"
        },
        {
          "internalType": "uint256",
          "name": "validAfter",
          "type": "uint256"
        },
        {
          "internalType": "uint256",
          "name": "validBefore",
          "type": "uint256"
        },
        {
          "internalType": "bytes32",
          "name": "nonce",
          "type": "bytes32"
        },
        {
          "internalType": "uint8",
          "name": "v",
          "type": "uint8"
        },
        {
          "internalType": "bytes32",
          "name": "r",
          "type": "bytes32"
        },
        {
          "internalType": "bytes32",
          "name": "s",
          "type": "bytes32"
        }
      ],
      "name": "receiveWithAuthorization",
      "outputs": [],
      "stateMutability": "nonpayable",
      "type": "function"
    },
    {
      "inputs": [
        {
          "internalType": "address",
          "name": "minter",
          "type": "address"
        }
      ],
      "name": "removeMinter",
      "outputs": [
        {
          "internalType": "bool",
          "name": "",
          "type": "bool"
        }
      ],
      "stateMutability": "nonpayable",
      "type": "function"
    },
    {
      "inputs": [
        {
          "internalType": "contract IERC20",
          "name": "tokenContract",
          "type": "address"
        },
        {
          "internalType": "address",
          "name": "to",
          "type": "address"
        },
        {
          "internalType": "uint256",
          "name": "amount",
          "type": "uint256"
        }
      ],
      "name": "rescueERC20",
      "outputs": [],
      "stateMutability": "nonpayable",
      "type": "function"
    },
    {
      "inputs": [],
      "name": "rescuer",
      "outputs": [
        {
          "internalType": "address",
          "name": "",
          "type": "address"
        }
      ],
      "stateMutability": "view",
      "type": "function"
    },
    {
      "inputs": [],
      "name": "symbol",
      "outputs": [
        {
          "internalType": "string",
          "name": "",
          "type": "string"
        }
      ],
      "stateMutability": "view",
      "type": "function"
    },
    {
      "inputs": [],
      "name": "totalSupply",
      "outputs": [
        {
          "internalType": "uint256",
          "name": "",
          "type": "uint256"
        }
      ],
      "stateMutability": "view",
      "type": "function"
    },
    {
      "inputs": [
        {
          "internalType": "address",
          "name": "to",
          "type": "address"
        },
        {
          "internalType": "uint256",
          "name": "value",
          "type": "uint256"
        }
      ],
      "name": "transfer",
      "outputs": [
        {
          "internalType": "bool",
          "name": "",
          "type": "bool"
        }
      ],
      "stateMutability": "nonpayable",
      "type": "function"
    },
    {
      "inputs": [
        {
          "internalType": "address",
          "name": "from",
          "type": "address"
        },
        {
          "internalType": "address",
          "name": "to",
          "type": "address"
        },
        {
          "internalType": "uint256",
          "name": "value",
          "type": "uint256"
        }
      ],
      "name": "transferFrom",
      "outputs": [
        {
          "internalType": "bool",
          "name": "",
          "type": "bool"
        }
      ],
      "stateMutability": "nonpayable",
      "type": "function"
    },
    {
      "inputs": [
        {
          "internalType": "address",
          "name": "newOwner",
          "type": "address"
        }
      ],
      "name": "transferOwnership",
      "outputs": [],
      "stateMutability": "nonpayable",
      "type": "function"
    },
    {
      "inputs": [
        {
          "internalType": "address",
          "name": "from",
          "type": "address"
        },
        {
          "internalType": "address",
          "name": "to",
          "type": "address"
        },
        {
          "internalType": "uint256",
          "name": "value",
          "type": "uint256"
        },
        {
          "internalType": "uint256",
          "name": "validAfter",
          "type": "uint256"
        },
        {
          "internalType": "uint256",
          "name": "validBefore",
          "type": "uint256"
        },
        {
          "internalType": "bytes32",
          "name": "nonce",
          "type": "bytes32"
        },
        {
          "internalType": "uint8",
          "name": "v",
          "type": "uint8"
        },
        {
          "internalType": "bytes32",
          "name": "r",
          "type": "bytes32"
        },
        {
          "internalType": "bytes32",
          "name": "s",
          "type": "bytes32"
        }
      ],
      "name": "transferWithAuthorization",
      "outputs": [],
      "stateMutability": "nonpayable",
      "type": "function"
    },
    {
      "inputs": [
        {
          "internalType": "address",
          "name": "_account",
          "type": "address"
        }
      ],
      "name": "unBlacklist",
      "outputs": [],
      "stateMutability": "nonpayable",
      "type": "function"
    },
    {
      "inputs": [],
      "name": "unpause",
      "outputs": [],
      "stateMutability": "nonpayable",
      "type": "function"
    },
    {
      "inputs": [
        {
          "internalType": "address",
          "name": "_newBlacklister",
          "type": "address"
        }
      ],
      "name": "updateBlacklister",
      "outputs": [],
      "stateMutability": "nonpayable",
      "type": "function"
    },
    {
      "inputs": [
        {
          "internalType": "address",
          "name": "_newMasterMinter",
          "type": "address"
        }
      ],
      "name": "updateMasterMinter",
      "outputs": [],
      "stateMutability": "nonpayable",
      "type": "function"
    },
    {
      "inputs": [
        {
          "internalType": "address",
          "name": "_newPauser",
          "type": "address"
        }
      ],
      "name": "updatePauser",
      "outputs": [],
      "stateMutability": "nonpayable",
      "type": "function"
    },
    {
      "inputs": [
        {
          "internalType": "address",
          "name": "newRescuer",
          "type": "address"
        }
      ],
      "name": "updateRescuer",
      "outputs": [],
      "stateMutability": "nonpayable",
      "type": "function"
    },
    {
      "inputs": [],
      "name": "version",
      "outputs": [
        {
          "internalType": "string",
          "name": "",
          "type": "string"
        }
      ],
      "stateMutability": "pure",
      "type": "function"
    }
  ],
  "transactionHash": "0xf2b4429939facb245ccfd0492aa3e4707f30ca5fa9b714d9bafeb8d954fc5c4c",
  "receipt": {
    "to": null,
    "from": "0xAE4bdBb0824C9B602589a5DaD2aD96C8A2AcC607",
    "contractAddress": "0x96B1352873D143e797b9F1d2832C167cc692eE95",
    "transactionIndex": 32,
    "gasUsed": "3688360",
    "logsBloom": "0x00000000000000000000000000000000000000000000000000000000000000000000000000000000000000000000000000000000000000000000000000000000000000000000000000000000000000000000000000000000000000000000000000000000000000000000000000000000000000000000000000000000000000000000000000000000000000000000000000000000000000000000000000000000000000000000000000000000000000000000000000000000000000000000000000000000000000000000000000000000000000000000000000000000000000000000000000000000000000000000000000000000000000000000000000000000",
    "blockHash": "0x75b66d75042ee2ef86ac419ed5dbe343290eacd9e3f513f03d84fddda73b25f4",
    "transactionHash": "0xf2b4429939facb245ccfd0492aa3e4707f30ca5fa9b714d9bafeb8d954fc5c4c",
    "logs": [],
    "blockNumber": 8529586,
    "cumulativeGasUsed": "12620697",
    "status": 1,
    "byzantium": true
  },
  "args": [],
  "numDeployments": 1,
  "solcInputHash": "68767b0af6a652b4aa31514f011a808c",
  "metadata": "{\"compiler\":{\"version\":\"0.6.12+commit.27d51765\"},\"language\":\"Solidity\",\"output\":{\"abi\":[{\"anonymous\":false,\"inputs\":[{\"indexed\":true,\"internalType\":\"address\",\"name\":\"owner\",\"type\":\"address\"},{\"indexed\":true,\"internalType\":\"address\",\"name\":\"spender\",\"type\":\"address\"},{\"indexed\":false,\"internalType\":\"uint256\",\"name\":\"value\",\"type\":\"uint256\"}],\"name\":\"Approval\",\"type\":\"event\"},{\"anonymous\":false,\"inputs\":[{\"indexed\":true,\"internalType\":\"address\",\"name\":\"authorizer\",\"type\":\"address\"},{\"indexed\":true,\"internalType\":\"bytes32\",\"name\":\"nonce\",\"type\":\"bytes32\"}],\"name\":\"AuthorizationCanceled\",\"type\":\"event\"},{\"anonymous\":false,\"inputs\":[{\"indexed\":true,\"internalType\":\"address\",\"name\":\"authorizer\",\"type\":\"address\"},{\"indexed\":true,\"internalType\":\"bytes32\",\"name\":\"nonce\",\"type\":\"bytes32\"}],\"name\":\"AuthorizationUsed\",\"type\":\"event\"},{\"anonymous\":false,\"inputs\":[{\"indexed\":true,\"internalType\":\"address\",\"name\":\"_account\",\"type\":\"address\"}],\"name\":\"Blacklisted\",\"type\":\"event\"},{\"anonymous\":false,\"inputs\":[{\"indexed\":true,\"internalType\":\"address\",\"name\":\"newBlacklister\",\"type\":\"address\"}],\"name\":\"BlacklisterChanged\",\"type\":\"event\"},{\"anonymous\":false,\"inputs\":[{\"indexed\":true,\"internalType\":\"address\",\"name\":\"burner\",\"type\":\"address\"},{\"indexed\":false,\"internalType\":\"uint256\",\"name\":\"amount\",\"type\":\"uint256\"}],\"name\":\"Burn\",\"type\":\"event\"},{\"anonymous\":false,\"inputs\":[{\"indexed\":true,\"internalType\":\"address\",\"name\":\"newMasterMinter\",\"type\":\"address\"}],\"name\":\"MasterMinterChanged\",\"type\":\"event\"},{\"anonymous\":false,\"inputs\":[{\"indexed\":true,\"internalType\":\"address\",\"name\":\"minter\",\"type\":\"address\"},{\"indexed\":true,\"internalType\":\"address\",\"name\":\"to\",\"type\":\"address\"},{\"indexed\":false,\"internalType\":\"uint256\",\"name\":\"amount\",\"type\":\"uint256\"}],\"name\":\"Mint\",\"type\":\"event\"},{\"anonymous\":false,\"inputs\":[{\"indexed\":true,\"internalType\":\"address\",\"name\":\"minter\",\"type\":\"address\"},{\"indexed\":false,\"internalType\":\"uint256\",\"name\":\"minterAllowedAmount\",\"type\":\"uint256\"}],\"name\":\"MinterConfigured\",\"type\":\"event\"},{\"anonymous\":false,\"inputs\":[{\"indexed\":true,\"internalType\":\"address\",\"name\":\"oldMinter\",\"type\":\"address\"}],\"name\":\"MinterRemoved\",\"type\":\"event\"},{\"anonymous\":false,\"inputs\":[{\"indexed\":false,\"internalType\":\"address\",\"name\":\"previousOwner\",\"type\":\"address\"},{\"indexed\":false,\"internalType\":\"address\",\"name\":\"newOwner\",\"type\":\"address\"}],\"name\":\"OwnershipTransferred\",\"type\":\"event\"},{\"anonymous\":false,\"inputs\":[],\"name\":\"Pause\",\"type\":\"event\"},{\"anonymous\":false,\"inputs\":[{\"indexed\":true,\"internalType\":\"address\",\"name\":\"newAddress\",\"type\":\"address\"}],\"name\":\"PauserChanged\",\"type\":\"event\"},{\"anonymous\":false,\"inputs\":[{\"indexed\":true,\"internalType\":\"address\",\"name\":\"newRescuer\",\"type\":\"address\"}],\"name\":\"RescuerChanged\",\"type\":\"event\"},{\"anonymous\":false,\"inputs\":[{\"indexed\":true,\"internalType\":\"address\",\"name\":\"from\",\"type\":\"address\"},{\"indexed\":true,\"internalType\":\"address\",\"name\":\"to\",\"type\":\"address\"},{\"indexed\":false,\"internalType\":\"uint256\",\"name\":\"value\",\"type\":\"uint256\"}],\"name\":\"Transfer\",\"type\":\"event\"},{\"anonymous\":false,\"inputs\":[{\"indexed\":true,\"internalType\":\"address\",\"name\":\"_account\",\"type\":\"address\"}],\"name\":\"UnBlacklisted\",\"type\":\"event\"},{\"anonymous\":false,\"inputs\":[],\"name\":\"Unpause\",\"type\":\"event\"},{\"inputs\":[],\"name\":\"CANCEL_AUTHORIZATION_TYPEHASH\",\"outputs\":[{\"internalType\":\"bytes32\",\"name\":\"\",\"type\":\"bytes32\"}],\"stateMutability\":\"view\",\"type\":\"function\"},{\"inputs\":[],\"name\":\"DOMAIN_SEPARATOR\",\"outputs\":[{\"internalType\":\"bytes32\",\"name\":\"\",\"type\":\"bytes32\"}],\"stateMutability\":\"view\",\"type\":\"function\"},{\"inputs\":[],\"name\":\"PERMIT_TYPEHASH\",\"outputs\":[{\"internalType\":\"bytes32\",\"name\":\"\",\"type\":\"bytes32\"}],\"stateMutability\":\"view\",\"type\":\"function\"},{\"inputs\":[],\"name\":\"RECEIVE_WITH_AUTHORIZATION_TYPEHASH\",\"outputs\":[{\"internalType\":\"bytes32\",\"name\":\"\",\"type\":\"bytes32\"}],\"stateMutability\":\"view\",\"type\":\"function\"},{\"inputs\":[],\"name\":\"TRANSFER_WITH_AUTHORIZATION_TYPEHASH\",\"outputs\":[{\"internalType\":\"bytes32\",\"name\":\"\",\"type\":\"bytes32\"}],\"stateMutability\":\"view\",\"type\":\"function\"},{\"inputs\":[{\"internalType\":\"address\",\"name\":\"_to\",\"type\":\"address\"},{\"internalType\":\"uint256\",\"name\":\"_amount\",\"type\":\"uint256\"}],\"name\":\"allocateTo\",\"outputs\":[],\"stateMutability\":\"nonpayable\",\"type\":\"function\"},{\"inputs\":[{\"internalType\":\"address\",\"name\":\"owner\",\"type\":\"address\"},{\"internalType\":\"address\",\"name\":\"spender\",\"type\":\"address\"}],\"name\":\"allowance\",\"outputs\":[{\"internalType\":\"uint256\",\"name\":\"\",\"type\":\"uint256\"}],\"stateMutability\":\"view\",\"type\":\"function\"},{\"inputs\":[{\"internalType\":\"address\",\"name\":\"spender\",\"type\":\"address\"},{\"internalType\":\"uint256\",\"name\":\"value\",\"type\":\"uint256\"}],\"name\":\"approve\",\"outputs\":[{\"internalType\":\"bool\",\"name\":\"\",\"type\":\"bool\"}],\"stateMutability\":\"nonpayable\",\"type\":\"function\"},{\"inputs\":[{\"internalType\":\"address\",\"name\":\"authorizer\",\"type\":\"address\"},{\"internalType\":\"bytes32\",\"name\":\"nonce\",\"type\":\"bytes32\"}],\"name\":\"authorizationState\",\"outputs\":[{\"internalType\":\"bool\",\"name\":\"\",\"type\":\"bool\"}],\"stateMutability\":\"view\",\"type\":\"function\"},{\"inputs\":[{\"internalType\":\"address\",\"name\":\"account\",\"type\":\"address\"}],\"name\":\"balanceOf\",\"outputs\":[{\"internalType\":\"uint256\",\"name\":\"\",\"type\":\"uint256\"}],\"stateMutability\":\"view\",\"type\":\"function\"},{\"inputs\":[{\"internalType\":\"address\",\"name\":\"_account\",\"type\":\"address\"}],\"name\":\"blacklist\",\"outputs\":[],\"stateMutability\":\"nonpayable\",\"type\":\"function\"},{\"inputs\":[],\"name\":\"blacklister\",\"outputs\":[{\"internalType\":\"address\",\"name\":\"\",\"type\":\"address\"}],\"stateMutability\":\"view\",\"type\":\"function\"},{\"inputs\":[{\"internalType\":\"uint256\",\"name\":\"_amount\",\"type\":\"uint256\"}],\"name\":\"burn\",\"outputs\":[],\"stateMutability\":\"nonpayable\",\"type\":\"function\"},{\"inputs\":[{\"internalType\":\"address\",\"name\":\"authorizer\",\"type\":\"address\"},{\"internalType\":\"bytes32\",\"name\":\"nonce\",\"type\":\"bytes32\"},{\"internalType\":\"uint8\",\"name\":\"v\",\"type\":\"uint8\"},{\"internalType\":\"bytes32\",\"name\":\"r\",\"type\":\"bytes32\"},{\"internalType\":\"bytes32\",\"name\":\"s\",\"type\":\"bytes32\"}],\"name\":\"cancelAuthorization\",\"outputs\":[],\"stateMutability\":\"nonpayable\",\"type\":\"function\"},{\"inputs\":[{\"internalType\":\"address\",\"name\":\"minter\",\"type\":\"address\"},{\"internalType\":\"uint256\",\"name\":\"minterAllowedAmount\",\"type\":\"uint256\"}],\"name\":\"configureMinter\",\"outputs\":[{\"internalType\":\"bool\",\"name\":\"\",\"type\":\"bool\"}],\"stateMutability\":\"nonpayable\",\"type\":\"function\"},{\"inputs\":[],\"name\":\"currency\",\"outputs\":[{\"internalType\":\"string\",\"name\":\"\",\"type\":\"string\"}],\"stateMutability\":\"view\",\"type\":\"function\"},{\"inputs\":[],\"name\":\"decimals\",\"outputs\":[{\"internalType\":\"uint8\",\"name\":\"\",\"type\":\"uint8\"}],\"stateMutability\":\"view\",\"type\":\"function\"},{\"inputs\":[{\"internalType\":\"address\",\"name\":\"spender\",\"type\":\"address\"},{\"internalType\":\"uint256\",\"name\":\"decrement\",\"type\":\"uint256\"}],\"name\":\"decreaseAllowance\",\"outputs\":[{\"internalType\":\"bool\",\"name\":\"\",\"type\":\"bool\"}],\"stateMutability\":\"nonpayable\",\"type\":\"function\"},{\"inputs\":[{\"internalType\":\"address\",\"name\":\"spender\",\"type\":\"address\"},{\"internalType\":\"uint256\",\"name\":\"increment\",\"type\":\"uint256\"}],\"name\":\"increaseAllowance\",\"outputs\":[{\"internalType\":\"bool\",\"name\":\"\",\"type\":\"bool\"}],\"stateMutability\":\"nonpayable\",\"type\":\"function\"},{\"inputs\":[{\"internalType\":\"string\",\"name\":\"tokenName\",\"type\":\"string\"},{\"internalType\":\"string\",\"name\":\"tokenSymbol\",\"type\":\"string\"},{\"internalType\":\"string\",\"name\":\"tokenCurrency\",\"type\":\"string\"},{\"internalType\":\"uint8\",\"name\":\"tokenDecimals\",\"type\":\"uint8\"},{\"internalType\":\"address\",\"name\":\"newMasterMinter\",\"type\":\"address\"},{\"internalType\":\"address\",\"name\":\"newPauser\",\"type\":\"address\"},{\"internalType\":\"address\",\"name\":\"newBlacklister\",\"type\":\"address\"},{\"internalType\":\"address\",\"name\":\"newOwner\",\"type\":\"address\"}],\"name\":\"initialize\",\"outputs\":[],\"stateMutability\":\"nonpayable\",\"type\":\"function\"},{\"inputs\":[{\"internalType\":\"string\",\"name\":\"newName\",\"type\":\"string\"}],\"name\":\"initializeV2\",\"outputs\":[],\"stateMutability\":\"nonpayable\",\"type\":\"function\"},{\"inputs\":[{\"internalType\":\"address\",\"name\":\"lostAndFound\",\"type\":\"address\"}],\"name\":\"initializeV2_1\",\"outputs\":[],\"stateMutability\":\"nonpayable\",\"type\":\"function\"},{\"inputs\":[{\"internalType\":\"address\",\"name\":\"_account\",\"type\":\"address\"}],\"name\":\"isBlacklisted\",\"outputs\":[{\"internalType\":\"bool\",\"name\":\"\",\"type\":\"bool\"}],\"stateMutability\":\"view\",\"type\":\"function\"},{\"inputs\":[{\"internalType\":\"address\",\"name\":\"account\",\"type\":\"address\"}],\"name\":\"isMinter\",\"outputs\":[{\"internalType\":\"bool\",\"name\":\"\",\"type\":\"bool\"}],\"stateMutability\":\"view\",\"type\":\"function\"},{\"inputs\":[],\"name\":\"masterMinter\",\"outputs\":[{\"internalType\":\"address\",\"name\":\"\",\"type\":\"address\"}],\"stateMutability\":\"view\",\"type\":\"function\"},{\"inputs\":[{\"internalType\":\"address\",\"name\":\"_to\",\"type\":\"address\"},{\"internalType\":\"uint256\",\"name\":\"_amount\",\"type\":\"uint256\"}],\"name\":\"mint\",\"outputs\":[{\"internalType\":\"bool\",\"name\":\"\",\"type\":\"bool\"}],\"stateMutability\":\"nonpayable\",\"type\":\"function\"},{\"inputs\":[{\"internalType\":\"address\",\"name\":\"minter\",\"type\":\"address\"}],\"name\":\"minterAllowance\",\"outputs\":[{\"internalType\":\"uint256\",\"name\":\"\",\"type\":\"uint256\"}],\"stateMutability\":\"view\",\"type\":\"function\"},{\"inputs\":[],\"name\":\"name\",\"outputs\":[{\"internalType\":\"string\",\"name\":\"\",\"type\":\"string\"}],\"stateMutability\":\"view\",\"type\":\"function\"},{\"inputs\":[{\"internalType\":\"address\",\"name\":\"owner\",\"type\":\"address\"}],\"name\":\"nonces\",\"outputs\":[{\"internalType\":\"uint256\",\"name\":\"\",\"type\":\"uint256\"}],\"stateMutability\":\"view\",\"type\":\"function\"},{\"inputs\":[],\"name\":\"owner\",\"outputs\":[{\"internalType\":\"address\",\"name\":\"\",\"type\":\"address\"}],\"stateMutability\":\"view\",\"type\":\"function\"},{\"inputs\":[],\"name\":\"pause\",\"outputs\":[],\"stateMutability\":\"nonpayable\",\"type\":\"function\"},{\"inputs\":[],\"name\":\"paused\",\"outputs\":[{\"internalType\":\"bool\",\"name\":\"\",\"type\":\"bool\"}],\"stateMutability\":\"view\",\"type\":\"function\"},{\"inputs\":[],\"name\":\"pauser\",\"outputs\":[{\"internalType\":\"address\",\"name\":\"\",\"type\":\"address\"}],\"stateMutability\":\"view\",\"type\":\"function\"},{\"inputs\":[{\"internalType\":\"address\",\"name\":\"owner\",\"type\":\"address\"},{\"internalType\":\"address\",\"name\":\"spender\",\"type\":\"address\"},{\"internalType\":\"uint256\",\"name\":\"value\",\"type\":\"uint256\"},{\"internalType\":\"uint256\",\"name\":\"deadline\",\"type\":\"uint256\"},{\"internalType\":\"uint8\",\"name\":\"v\",\"type\":\"uint8\"},{\"internalType\":\"bytes32\",\"name\":\"r\",\"type\":\"bytes32\"},{\"internalType\":\"bytes32\",\"name\":\"s\",\"type\":\"bytes32\"}],\"name\":\"permit\",\"outputs\":[],\"stateMutability\":\"nonpayable\",\"type\":\"function\"},{\"inputs\":[{\"internalType\":\"address\",\"name\":\"from\",\"type\":\"address\"},{\"internalType\":\"address\",\"name\":\"to\",\"type\":\"address\"},{\"internalType\":\"uint256\",\"name\":\"value\",\"type\":\"uint256\"},{\"internalType\":\"uint256\",\"name\":\"validAfter\",\"type\":\"uint256\"},{\"internalType\":\"uint256\",\"name\":\"validBefore\",\"type\":\"uint256\"},{\"internalType\":\"bytes32\",\"name\":\"nonce\",\"type\":\"bytes32\"},{\"internalType\":\"uint8\",\"name\":\"v\",\"type\":\"uint8\"},{\"internalType\":\"bytes32\",\"name\":\"r\",\"type\":\"bytes32\"},{\"internalType\":\"bytes32\",\"name\":\"s\",\"type\":\"bytes32\"}],\"name\":\"receiveWithAuthorization\",\"outputs\":[],\"stateMutability\":\"nonpayable\",\"type\":\"function\"},{\"inputs\":[{\"internalType\":\"address\",\"name\":\"minter\",\"type\":\"address\"}],\"name\":\"removeMinter\",\"outputs\":[{\"internalType\":\"bool\",\"name\":\"\",\"type\":\"bool\"}],\"stateMutability\":\"nonpayable\",\"type\":\"function\"},{\"inputs\":[{\"internalType\":\"contract IERC20\",\"name\":\"tokenContract\",\"type\":\"address\"},{\"internalType\":\"address\",\"name\":\"to\",\"type\":\"address\"},{\"internalType\":\"uint256\",\"name\":\"amount\",\"type\":\"uint256\"}],\"name\":\"rescueERC20\",\"outputs\":[],\"stateMutability\":\"nonpayable\",\"type\":\"function\"},{\"inputs\":[],\"name\":\"rescuer\",\"outputs\":[{\"internalType\":\"address\",\"name\":\"\",\"type\":\"address\"}],\"stateMutability\":\"view\",\"type\":\"function\"},{\"inputs\":[],\"name\":\"symbol\",\"outputs\":[{\"internalType\":\"string\",\"name\":\"\",\"type\":\"string\"}],\"stateMutability\":\"view\",\"type\":\"function\"},{\"inputs\":[],\"name\":\"totalSupply\",\"outputs\":[{\"internalType\":\"uint256\",\"name\":\"\",\"type\":\"uint256\"}],\"stateMutability\":\"view\",\"type\":\"function\"},{\"inputs\":[{\"internalType\":\"address\",\"name\":\"to\",\"type\":\"address\"},{\"internalType\":\"uint256\",\"name\":\"value\",\"type\":\"uint256\"}],\"name\":\"transfer\",\"outputs\":[{\"internalType\":\"bool\",\"name\":\"\",\"type\":\"bool\"}],\"stateMutability\":\"nonpayable\",\"type\":\"function\"},{\"inputs\":[{\"internalType\":\"address\",\"name\":\"from\",\"type\":\"address\"},{\"internalType\":\"address\",\"name\":\"to\",\"type\":\"address\"},{\"internalType\":\"uint256\",\"name\":\"value\",\"type\":\"uint256\"}],\"name\":\"transferFrom\",\"outputs\":[{\"internalType\":\"bool\",\"name\":\"\",\"type\":\"bool\"}],\"stateMutability\":\"nonpayable\",\"type\":\"function\"},{\"inputs\":[{\"internalType\":\"address\",\"name\":\"newOwner\",\"type\":\"address\"}],\"name\":\"transferOwnership\",\"outputs\":[],\"stateMutability\":\"nonpayable\",\"type\":\"function\"},{\"inputs\":[{\"internalType\":\"address\",\"name\":\"from\",\"type\":\"address\"},{\"internalType\":\"address\",\"name\":\"to\",\"type\":\"address\"},{\"internalType\":\"uint256\",\"name\":\"value\",\"type\":\"uint256\"},{\"internalType\":\"uint256\",\"name\":\"validAfter\",\"type\":\"uint256\"},{\"internalType\":\"uint256\",\"name\":\"validBefore\",\"type\":\"uint256\"},{\"internalType\":\"bytes32\",\"name\":\"nonce\",\"type\":\"bytes32\"},{\"internalType\":\"uint8\",\"name\":\"v\",\"type\":\"uint8\"},{\"internalType\":\"bytes32\",\"name\":\"r\",\"type\":\"bytes32\"},{\"internalType\":\"bytes32\",\"name\":\"s\",\"type\":\"bytes32\"}],\"name\":\"transferWithAuthorization\",\"outputs\":[],\"stateMutability\":\"nonpayable\",\"type\":\"function\"},{\"inputs\":[{\"internalType\":\"address\",\"name\":\"_account\",\"type\":\"address\"}],\"name\":\"unBlacklist\",\"outputs\":[],\"stateMutability\":\"nonpayable\",\"type\":\"function\"},{\"inputs\":[],\"name\":\"unpause\",\"outputs\":[],\"stateMutability\":\"nonpayable\",\"type\":\"function\"},{\"inputs\":[{\"internalType\":\"address\",\"name\":\"_newBlacklister\",\"type\":\"address\"}],\"name\":\"updateBlacklister\",\"outputs\":[],\"stateMutability\":\"nonpayable\",\"type\":\"function\"},{\"inputs\":[{\"internalType\":\"address\",\"name\":\"_newMasterMinter\",\"type\":\"address\"}],\"name\":\"updateMasterMinter\",\"outputs\":[],\"stateMutability\":\"nonpayable\",\"type\":\"function\"},{\"inputs\":[{\"internalType\":\"address\",\"name\":\"_newPauser\",\"type\":\"address\"}],\"name\":\"updatePauser\",\"outputs\":[],\"stateMutability\":\"nonpayable\",\"type\":\"function\"},{\"inputs\":[{\"internalType\":\"address\",\"name\":\"newRescuer\",\"type\":\"address\"}],\"name\":\"updateRescuer\",\"outputs\":[],\"stateMutability\":\"nonpayable\",\"type\":\"function\"},{\"inputs\":[],\"name\":\"version\",\"outputs\":[{\"internalType\":\"string\",\"name\":\"\",\"type\":\"string\"}],\"stateMutability\":\"pure\",\"type\":\"function\"}],\"devdoc\":{\"kind\":\"dev\",\"methods\":{\"allocateTo(address,uint256)\":{\"details\":\"Function to mint tokens\",\"params\":{\"_amount\":\"The amount of tokens to mint. Must be less than or equal to the minterAllowance of the caller.\",\"_to\":\"The address that will receive the minted tokens.\"}},\"allowance(address,address)\":{\"params\":{\"owner\":\"Token owner's address\",\"spender\":\"Spender's address\"},\"returns\":{\"_0\":\"Allowance amount\"}},\"approve(address,uint256)\":{\"params\":{\"spender\":\"Spender's address\",\"value\":\"Allowance amount\"},\"returns\":{\"_0\":\"True if successful\"}},\"authorizationState(address,bytes32)\":{\"details\":\"Nonces are randomly generated 32-byte data unique to the authorizer's address\",\"params\":{\"authorizer\":\"Authorizer's address\",\"nonce\":\"Nonce of the authorization\"},\"returns\":{\"_0\":\"True if the nonce is used\"}},\"balanceOf(address)\":{\"details\":\"Get token balance of an account\",\"params\":{\"account\":\"address The account\"}},\"blacklist(address)\":{\"details\":\"Adds account to blacklist\",\"params\":{\"_account\":\"The address to blacklist\"}},\"burn(uint256)\":{\"details\":\"allows a minter to burn some of its own tokens Validates that caller is a minter and that sender is not blacklisted amount is less than or equal to the minter's account balance\",\"params\":{\"_amount\":\"uint256 the amount of tokens to be burned\"}},\"cancelAuthorization(address,bytes32,uint8,bytes32,bytes32)\":{\"details\":\"Works only if the authorization is not yet used.\",\"params\":{\"authorizer\":\"Authorizer's address\",\"nonce\":\"Nonce of the authorization\",\"r\":\"r of the signature\",\"s\":\"s of the signature\",\"v\":\"v of the signature\"}},\"configureMinter(address,uint256)\":{\"details\":\"Function to add/update a new minter\",\"params\":{\"minter\":\"The address of the minter\",\"minterAllowedAmount\":\"The minting amount allowed for the minter\"},\"returns\":{\"_0\":\"True if the operation was successful.\"}},\"decreaseAllowance(address,uint256)\":{\"params\":{\"decrement\":\"Amount of decrease in allowance\",\"spender\":\"Spender's address\"},\"returns\":{\"_0\":\"True if successful\"}},\"increaseAllowance(address,uint256)\":{\"params\":{\"increment\":\"Amount of increase in allowance\",\"spender\":\"Spender's address\"},\"returns\":{\"_0\":\"True if successful\"}},\"initializeV2(string)\":{\"params\":{\"newName\":\"New token name\"}},\"initializeV2_1(address)\":{\"params\":{\"lostAndFound\":\"The address to which the locked funds are sent\"}},\"isBlacklisted(address)\":{\"details\":\"Checks if account is blacklisted\",\"params\":{\"_account\":\"The address to check\"}},\"isMinter(address)\":{\"details\":\"Checks if account is a minter\",\"params\":{\"account\":\"The address to check\"}},\"mint(address,uint256)\":{\"details\":\"Function to mint tokens\",\"params\":{\"_amount\":\"The amount of tokens to mint. Must be less than or equal to the minterAllowance of the caller.\",\"_to\":\"The address that will receive the minted tokens.\"},\"returns\":{\"_0\":\"A boolean that indicates if the operation was successful.\"}},\"minterAllowance(address)\":{\"details\":\"Get minter allowance for an account\",\"params\":{\"minter\":\"The address of the minter\"}},\"nonces(address)\":{\"params\":{\"owner\":\"Token owner's address (Authorizer)\"},\"returns\":{\"_0\":\"Next nonce\"}},\"owner()\":{\"details\":\"Tells the address of the owner\",\"returns\":{\"_0\":\"the address of the owner\"}},\"pause()\":{\"details\":\"called by the owner to pause, triggers stopped state\"},\"permit(address,address,uint256,uint256,uint8,bytes32,bytes32)\":{\"params\":{\"deadline\":\"Expiration time, seconds since the epoch\",\"owner\":\"Token owner's address (Authorizer)\",\"r\":\"r of the signature\",\"s\":\"s of the signature\",\"spender\":\"Spender's address\",\"v\":\"v of the signature\",\"value\":\"Amount of allowance\"}},\"receiveWithAuthorization(address,address,uint256,uint256,uint256,bytes32,uint8,bytes32,bytes32)\":{\"details\":\"This has an additional check to ensure that the payee's address matches the caller of this function to prevent front-running attacks.\",\"params\":{\"from\":\"Payer's address (Authorizer)\",\"nonce\":\"Unique nonce\",\"r\":\"r of the signature\",\"s\":\"s of the signature\",\"to\":\"Payee's address\",\"v\":\"v of the signature\",\"validAfter\":\"The time after which this is valid (unix time)\",\"validBefore\":\"The time before which this is valid (unix time)\",\"value\":\"Amount to be transferred\"}},\"removeMinter(address)\":{\"details\":\"Function to remove a minter\",\"params\":{\"minter\":\"The address of the minter to remove\"},\"returns\":{\"_0\":\"True if the operation was successful.\"}},\"rescueERC20(address,address,uint256)\":{\"params\":{\"amount\":\"Amount to withdraw\",\"to\":\"Recipient address\",\"tokenContract\":\"ERC20 token contract address\"}},\"rescuer()\":{\"returns\":{\"_0\":\"Rescuer's address\"}},\"totalSupply()\":{\"details\":\"Get totalSupply of token\"},\"transfer(address,uint256)\":{\"params\":{\"to\":\"Payee's address\",\"value\":\"Transfer amount\"},\"returns\":{\"_0\":\"True if successful\"}},\"transferFrom(address,address,uint256)\":{\"params\":{\"from\":\"Payer's address\",\"to\":\"Payee's address\",\"value\":\"Transfer amount\"},\"returns\":{\"_0\":\"True if successful\"}},\"transferOwnership(address)\":{\"details\":\"Allows the current owner to transfer control of the contract to a newOwner.\",\"params\":{\"newOwner\":\"The address to transfer ownership to.\"}},\"transferWithAuthorization(address,address,uint256,uint256,uint256,bytes32,uint8,bytes32,bytes32)\":{\"params\":{\"from\":\"Payer's address (Authorizer)\",\"nonce\":\"Unique nonce\",\"r\":\"r of the signature\",\"s\":\"s of the signature\",\"to\":\"Payee's address\",\"v\":\"v of the signature\",\"validAfter\":\"The time after which this is valid (unix time)\",\"validBefore\":\"The time before which this is valid (unix time)\",\"value\":\"Amount to be transferred\"}},\"unBlacklist(address)\":{\"details\":\"Removes account from blacklist\",\"params\":{\"_account\":\"The address to remove from the blacklist\"}},\"unpause()\":{\"details\":\"called by the owner to unpause, returns to normal state\"},\"updatePauser(address)\":{\"details\":\"update the pauser role\"},\"updateRescuer(address)\":{\"params\":{\"newRescuer\":\"New rescuer's address\"}},\"version()\":{\"returns\":{\"_0\":\"Version string\"}}},\"title\":\"FiatToken V2.1\",\"version\":1},\"userdoc\":{\"kind\":\"user\",\"methods\":{\"allowance(address,address)\":{\"notice\":\"Amount of remaining tokens spender is allowed to transfer on behalf of the token owner\"},\"approve(address,uint256)\":{\"notice\":\"Set spender's allowance over the caller's tokens to be a given value.\"},\"authorizationState(address,bytes32)\":{\"notice\":\"Returns the state of an authorization\"},\"cancelAuthorization(address,bytes32,uint8,bytes32,bytes32)\":{\"notice\":\"Attempt to cancel an authorization\"},\"decreaseAllowance(address,uint256)\":{\"notice\":\"Decrease the allowance by a given decrement\"},\"increaseAllowance(address,uint256)\":{\"notice\":\"Increase the allowance by a given increment\"},\"initializeV2(string)\":{\"notice\":\"Initialize v2\"},\"initializeV2_1(address)\":{\"notice\":\"Initialize v2.1\"},\"nonces(address)\":{\"notice\":\"Nonces for permit\"},\"permit(address,address,uint256,uint256,uint8,bytes32,bytes32)\":{\"notice\":\"Update allowance with a signed permit\"},\"receiveWithAuthorization(address,address,uint256,uint256,uint256,bytes32,uint8,bytes32,bytes32)\":{\"notice\":\"Receive a transfer with a signed authorization from the payer\"},\"rescueERC20(address,address,uint256)\":{\"notice\":\"Rescue ERC20 tokens locked up in this contract.\"},\"rescuer()\":{\"notice\":\"Returns current rescuer\"},\"transfer(address,uint256)\":{\"notice\":\"Transfer tokens from the caller\"},\"transferFrom(address,address,uint256)\":{\"notice\":\"Transfer tokens by spending allowance\"},\"transferWithAuthorization(address,address,uint256,uint256,uint256,bytes32,uint8,bytes32,bytes32)\":{\"notice\":\"Execute a transfer with a signed authorization\"},\"updateRescuer(address)\":{\"notice\":\"Assign the rescuer role to a given address.\"},\"version()\":{\"notice\":\"Version string for the EIP712 domain separator\"}},\"notice\":\"ERC20 Token backed by fiat reserves, version 2.1\",\"version\":1}},\"settings\":{\"compilationTarget\":{\"contracts/test/USDC.sol\":\"FiatTokenV2_1\"},\"evmVersion\":\"istanbul\",\"libraries\":{},\"metadata\":{\"bytecodeHash\":\"ipfs\",\"useLiteralContent\":true},\"optimizer\":{\"enabled\":true,\"runs\":200},\"remappings\":[]},\"sources\":{\"contracts/test/USDC.sol\":{\"content\":\"/**\\r\\n *Submitted for verification at Etherscan.io on 2021-04-17\\r\\n*/\\r\\n\\r\\n// File: @openzeppelin/contracts/math/SafeMath.sol\\r\\n\\r\\n// SPDX-License-Identifier: MIT\\r\\n\\r\\npragma solidity ^0.6.0;\\r\\n\\r\\n/**\\r\\n * @dev Wrappers over Solidity's arithmetic operations with added overflow\\r\\n * checks.\\r\\n *\\r\\n * Arithmetic operations in Solidity wrap on overflow. This can easily result\\r\\n * in bugs, because programmers usually assume that an overflow raises an\\r\\n * error, which is the standard behavior in high level programming languages.\\r\\n * `SafeMath` restores this intuition by reverting the transaction when an\\r\\n * operation overflows.\\r\\n *\\r\\n * Using this library instead of the unchecked operations eliminates an entire\\r\\n * class of bugs, so it's recommended to use it always.\\r\\n */\\r\\nlibrary SafeMath {\\r\\n    /**\\r\\n     * @dev Returns the addition of two unsigned integers, reverting on\\r\\n     * overflow.\\r\\n     *\\r\\n     * Counterpart to Solidity's `+` operator.\\r\\n     *\\r\\n     * Requirements:\\r\\n     *\\r\\n     * - Addition cannot overflow.\\r\\n     */\\r\\n    function add(uint256 a, uint256 b) internal pure returns (uint256) {\\r\\n        uint256 c = a + b;\\r\\n        require(c >= a, \\\"SafeMath: addition overflow\\\");\\r\\n\\r\\n        return c;\\r\\n    }\\r\\n\\r\\n    /**\\r\\n     * @dev Returns the subtraction of two unsigned integers, reverting on\\r\\n     * overflow (when the result is negative).\\r\\n     *\\r\\n     * Counterpart to Solidity's `-` operator.\\r\\n     *\\r\\n     * Requirements:\\r\\n     *\\r\\n     * - Subtraction cannot overflow.\\r\\n     */\\r\\n    function sub(uint256 a, uint256 b) internal pure returns (uint256) {\\r\\n        return sub(a, b, \\\"SafeMath: subtraction overflow\\\");\\r\\n    }\\r\\n\\r\\n    /**\\r\\n     * @dev Returns the subtraction of two unsigned integers, reverting with custom message on\\r\\n     * overflow (when the result is negative).\\r\\n     *\\r\\n     * Counterpart to Solidity's `-` operator.\\r\\n     *\\r\\n     * Requirements:\\r\\n     *\\r\\n     * - Subtraction cannot overflow.\\r\\n     */\\r\\n    function sub(\\r\\n        uint256 a,\\r\\n        uint256 b,\\r\\n        string memory errorMessage\\r\\n    ) internal pure returns (uint256) {\\r\\n        require(b <= a, errorMessage);\\r\\n        uint256 c = a - b;\\r\\n\\r\\n        return c;\\r\\n    }\\r\\n\\r\\n    /**\\r\\n     * @dev Returns the multiplication of two unsigned integers, reverting on\\r\\n     * overflow.\\r\\n     *\\r\\n     * Counterpart to Solidity's `*` operator.\\r\\n     *\\r\\n     * Requirements:\\r\\n     *\\r\\n     * - Multiplication cannot overflow.\\r\\n     */\\r\\n    function mul(uint256 a, uint256 b) internal pure returns (uint256) {\\r\\n        // Gas optimization: this is cheaper than requiring 'a' not being zero, but the\\r\\n        // benefit is lost if 'b' is also tested.\\r\\n        // See: https://github.com/OpenZeppelin/openzeppelin-contracts/pull/522\\r\\n        if (a == 0) {\\r\\n            return 0;\\r\\n        }\\r\\n\\r\\n        uint256 c = a * b;\\r\\n        require(c / a == b, \\\"SafeMath: multiplication overflow\\\");\\r\\n\\r\\n        return c;\\r\\n    }\\r\\n\\r\\n    /**\\r\\n     * @dev Returns the integer division of two unsigned integers. Reverts on\\r\\n     * division by zero. The result is rounded towards zero.\\r\\n     *\\r\\n     * Counterpart to Solidity's `/` operator. Note: this function uses a\\r\\n     * `revert` opcode (which leaves remaining gas untouched) while Solidity\\r\\n     * uses an invalid opcode to revert (consuming all remaining gas).\\r\\n     *\\r\\n     * Requirements:\\r\\n     *\\r\\n     * - The divisor cannot be zero.\\r\\n     */\\r\\n    function div(uint256 a, uint256 b) internal pure returns (uint256) {\\r\\n        return div(a, b, \\\"SafeMath: division by zero\\\");\\r\\n    }\\r\\n\\r\\n    /**\\r\\n     * @dev Returns the integer division of two unsigned integers. Reverts with custom message on\\r\\n     * division by zero. The result is rounded towards zero.\\r\\n     *\\r\\n     * Counterpart to Solidity's `/` operator. Note: this function uses a\\r\\n     * `revert` opcode (which leaves remaining gas untouched) while Solidity\\r\\n     * uses an invalid opcode to revert (consuming all remaining gas).\\r\\n     *\\r\\n     * Requirements:\\r\\n     *\\r\\n     * - The divisor cannot be zero.\\r\\n     */\\r\\n    function div(\\r\\n        uint256 a,\\r\\n        uint256 b,\\r\\n        string memory errorMessage\\r\\n    ) internal pure returns (uint256) {\\r\\n        require(b > 0, errorMessage);\\r\\n        uint256 c = a / b;\\r\\n        // assert(a == b * c + a % b); // There is no case in which this doesn't hold\\r\\n\\r\\n        return c;\\r\\n    }\\r\\n\\r\\n    /**\\r\\n     * @dev Returns the remainder of dividing two unsigned integers. (unsigned integer modulo),\\r\\n     * Reverts when dividing by zero.\\r\\n     *\\r\\n     * Counterpart to Solidity's `%` operator. This function uses a `revert`\\r\\n     * opcode (which leaves remaining gas untouched) while Solidity uses an\\r\\n     * invalid opcode to revert (consuming all remaining gas).\\r\\n     *\\r\\n     * Requirements:\\r\\n     *\\r\\n     * - The divisor cannot be zero.\\r\\n     */\\r\\n    function mod(uint256 a, uint256 b) internal pure returns (uint256) {\\r\\n        return mod(a, b, \\\"SafeMath: modulo by zero\\\");\\r\\n    }\\r\\n\\r\\n    /**\\r\\n     * @dev Returns the remainder of dividing two unsigned integers. (unsigned integer modulo),\\r\\n     * Reverts with custom message when dividing by zero.\\r\\n     *\\r\\n     * Counterpart to Solidity's `%` operator. This function uses a `revert`\\r\\n     * opcode (which leaves remaining gas untouched) while Solidity uses an\\r\\n     * invalid opcode to revert (consuming all remaining gas).\\r\\n     *\\r\\n     * Requirements:\\r\\n     *\\r\\n     * - The divisor cannot be zero.\\r\\n     */\\r\\n    function mod(\\r\\n        uint256 a,\\r\\n        uint256 b,\\r\\n        string memory errorMessage\\r\\n    ) internal pure returns (uint256) {\\r\\n        require(b != 0, errorMessage);\\r\\n        return a % b;\\r\\n    }\\r\\n}\\r\\n\\r\\n// File: @openzeppelin/contracts/token/ERC20/IERC20.sol\\r\\n\\r\\npragma solidity ^0.6.0;\\r\\n\\r\\n/**\\r\\n * @dev Interface of the ERC20 standard as defined in the EIP.\\r\\n */\\r\\ninterface IERC20 {\\r\\n    /**\\r\\n     * @dev Returns the amount of tokens in existence.\\r\\n     */\\r\\n    function totalSupply() external view returns (uint256);\\r\\n\\r\\n    /**\\r\\n     * @dev Returns the amount of tokens owned by `account`.\\r\\n     */\\r\\n    function balanceOf(address account) external view returns (uint256);\\r\\n\\r\\n    /**\\r\\n     * @dev Moves `amount` tokens from the caller's account to `recipient`.\\r\\n     *\\r\\n     * Returns a boolean value indicating whether the operation succeeded.\\r\\n     *\\r\\n     * Emits a {Transfer} event.\\r\\n     */\\r\\n    function transfer(address recipient, uint256 amount)\\r\\n        external\\r\\n        returns (bool);\\r\\n\\r\\n    /**\\r\\n     * @dev Returns the remaining number of tokens that `spender` will be\\r\\n     * allowed to spend on behalf of `owner` through {transferFrom}. This is\\r\\n     * zero by default.\\r\\n     *\\r\\n     * This value changes when {approve} or {transferFrom} are called.\\r\\n     */\\r\\n    function allowance(address owner, address spender)\\r\\n        external\\r\\n        view\\r\\n        returns (uint256);\\r\\n\\r\\n    /**\\r\\n     * @dev Sets `amount` as the allowance of `spender` over the caller's tokens.\\r\\n     *\\r\\n     * Returns a boolean value indicating whether the operation succeeded.\\r\\n     *\\r\\n     * IMPORTANT: Beware that changing an allowance with this method brings the risk\\r\\n     * that someone may use both the old and the new allowance by unfortunate\\r\\n     * transaction ordering. One possible solution to mitigate this race\\r\\n     * condition is to first reduce the spender's allowance to 0 and set the\\r\\n     * desired value afterwards:\\r\\n     * https://github.com/ethereum/EIPs/issues/20#issuecomment-263524729\\r\\n     *\\r\\n     * Emits an {Approval} event.\\r\\n     */\\r\\n    function approve(address spender, uint256 amount) external returns (bool);\\r\\n\\r\\n    /**\\r\\n     * @dev Moves `amount` tokens from `sender` to `recipient` using the\\r\\n     * allowance mechanism. `amount` is then deducted from the caller's\\r\\n     * allowance.\\r\\n     *\\r\\n     * Returns a boolean value indicating whether the operation succeeded.\\r\\n     *\\r\\n     * Emits a {Transfer} event.\\r\\n     */\\r\\n    function transferFrom(\\r\\n        address sender,\\r\\n        address recipient,\\r\\n        uint256 amount\\r\\n    ) external returns (bool);\\r\\n\\r\\n    /**\\r\\n     * @dev Emitted when `value` tokens are moved from one account (`from`) to\\r\\n     * another (`to`).\\r\\n     *\\r\\n     * Note that `value` may be zero.\\r\\n     */\\r\\n    event Transfer(address indexed from, address indexed to, uint256 value);\\r\\n\\r\\n    /**\\r\\n     * @dev Emitted when the allowance of a `spender` for an `owner` is set by\\r\\n     * a call to {approve}. `value` is the new allowance.\\r\\n     */\\r\\n    event Approval(\\r\\n        address indexed owner,\\r\\n        address indexed spender,\\r\\n        uint256 value\\r\\n    );\\r\\n}\\r\\n\\r\\n// File: contracts/v1/AbstractFiatTokenV1.sol\\r\\n\\r\\n/**\\r\\n * Copyright (c) 2018-2020 CENTRE SECZ\\r\\n *\\r\\n * Permission is hereby granted, free of charge, to any person obtaining a copy\\r\\n * of this software and associated documentation files (the \\\"Software\\\"), to deal\\r\\n * in the Software without restriction, including without limitation the rights\\r\\n * to use, copy, modify, merge, publish, distribute, sublicense, and/or sell\\r\\n * copies of the Software, and to permit persons to whom the Software is\\r\\n * furnished to do so, subject to the following conditions:\\r\\n *\\r\\n * The above copyright notice and this permission notice shall be included in\\r\\n * copies or substantial portions of the Software.\\r\\n *\\r\\n * THE SOFTWARE IS PROVIDED \\\"AS IS\\\", WITHOUT WARRANTY OF ANY KIND, EXPRESS OR\\r\\n * IMPLIED, INCLUDING BUT NOT LIMITED TO THE WARRANTIES OF MERCHANTABILITY,\\r\\n * FITNESS FOR A PARTICULAR PURPOSE AND NONINFRINGEMENT. IN NO EVENT SHALL THE\\r\\n * AUTHORS OR COPYRIGHT HOLDERS BE LIABLE FOR ANY CLAIM, DAMAGES OR OTHER\\r\\n * LIABILITY, WHETHER IN AN ACTION OF CONTRACT, TORT OR OTHERWISE, ARISING FROM,\\r\\n * OUT OF OR IN CONNECTION WITH THE SOFTWARE OR THE USE OR OTHER DEALINGS IN THE\\r\\n * SOFTWARE.\\r\\n */\\r\\n\\r\\npragma solidity 0.6.12;\\r\\n\\r\\nabstract contract AbstractFiatTokenV1 is IERC20 {\\r\\n    function _approve(\\r\\n        address owner,\\r\\n        address spender,\\r\\n        uint256 value\\r\\n    ) internal virtual;\\r\\n\\r\\n    function _transfer(\\r\\n        address from,\\r\\n        address to,\\r\\n        uint256 value\\r\\n    ) internal virtual;\\r\\n}\\r\\n\\r\\n// File: contracts/v1/Ownable.sol\\r\\n\\r\\n/**\\r\\n * Copyright (c) 2018 zOS Global Limited.\\r\\n * Copyright (c) 2018-2020 CENTRE SECZ\\r\\n *\\r\\n * Permission is hereby granted, free of charge, to any person obtaining a copy\\r\\n * of this software and associated documentation files (the \\\"Software\\\"), to deal\\r\\n * in the Software without restriction, including without limitation the rights\\r\\n * to use, copy, modify, merge, publish, distribute, sublicense, and/or sell\\r\\n * copies of the Software, and to permit persons to whom the Software is\\r\\n * furnished to do so, subject to the following conditions:\\r\\n *\\r\\n * The above copyright notice and this permission notice shall be included in\\r\\n * copies or substantial portions of the Software.\\r\\n *\\r\\n * THE SOFTWARE IS PROVIDED \\\"AS IS\\\", WITHOUT WARRANTY OF ANY KIND, EXPRESS OR\\r\\n * IMPLIED, INCLUDING BUT NOT LIMITED TO THE WARRANTIES OF MERCHANTABILITY,\\r\\n * FITNESS FOR A PARTICULAR PURPOSE AND NONINFRINGEMENT. IN NO EVENT SHALL THE\\r\\n * AUTHORS OR COPYRIGHT HOLDERS BE LIABLE FOR ANY CLAIM, DAMAGES OR OTHER\\r\\n * LIABILITY, WHETHER IN AN ACTION OF CONTRACT, TORT OR OTHERWISE, ARISING FROM,\\r\\n * OUT OF OR IN CONNECTION WITH THE SOFTWARE OR THE USE OR OTHER DEALINGS IN THE\\r\\n * SOFTWARE.\\r\\n */\\r\\npragma solidity 0.6.12;\\r\\n\\r\\n/**\\r\\n * @notice The Ownable contract has an owner address, and provides basic\\r\\n * authorization control functions\\r\\n * @dev Forked from https://github.com/OpenZeppelin/openzeppelin-labs/blob/3887ab77b8adafba4a26ace002f3a684c1a3388b/upgradeability_ownership/contracts/ownership/Ownable.sol\\r\\n * Modifications:\\r\\n * 1. Consolidate OwnableStorage into this contract (7/13/18)\\r\\n * 2. Reformat, conform to Solidity 0.6 syntax, and add error messages (5/13/20)\\r\\n * 3. Make public functions external (5/27/20)\\r\\n */\\r\\ncontract Ownable {\\r\\n    // Owner of the contract\\r\\n    address private _owner;\\r\\n\\r\\n    /**\\r\\n     * @dev Event to show ownership has been transferred\\r\\n     * @param previousOwner representing the address of the previous owner\\r\\n     * @param newOwner representing the address of the new owner\\r\\n     */\\r\\n    event OwnershipTransferred(address previousOwner, address newOwner);\\r\\n\\r\\n    /**\\r\\n     * @dev The constructor sets the original owner of the contract to the sender account.\\r\\n     */\\r\\n    constructor() public {\\r\\n        setOwner(msg.sender);\\r\\n    }\\r\\n\\r\\n    /**\\r\\n     * @dev Tells the address of the owner\\r\\n     * @return the address of the owner\\r\\n     */\\r\\n    function owner() external view returns (address) {\\r\\n        return _owner;\\r\\n    }\\r\\n\\r\\n    /**\\r\\n     * @dev Sets a new owner address\\r\\n     */\\r\\n    function setOwner(address newOwner) internal {\\r\\n        _owner = newOwner;\\r\\n    }\\r\\n\\r\\n    /**\\r\\n     * @dev Throws if called by any account other than the owner.\\r\\n     */\\r\\n    modifier onlyOwner() {\\r\\n        require(msg.sender == _owner, \\\"Ownable: caller is not the owner\\\");\\r\\n        _;\\r\\n    }\\r\\n\\r\\n    /**\\r\\n     * @dev Allows the current owner to transfer control of the contract to a newOwner.\\r\\n     * @param newOwner The address to transfer ownership to.\\r\\n     */\\r\\n    function transferOwnership(address newOwner) external onlyOwner {\\r\\n        require(\\r\\n            newOwner != address(0),\\r\\n            \\\"Ownable: new owner is the zero address\\\"\\r\\n        );\\r\\n        emit OwnershipTransferred(_owner, newOwner);\\r\\n        setOwner(newOwner);\\r\\n    }\\r\\n}\\r\\n\\r\\n// File: contracts/v1/Pausable.sol\\r\\n\\r\\n/**\\r\\n * Copyright (c) 2016 Smart Contract Solutions, Inc.\\r\\n * Copyright (c) 2018-2020 CENTRE SECZ0\\r\\n *\\r\\n * Permission is hereby granted, free of charge, to any person obtaining a copy\\r\\n * of this software and associated documentation files (the \\\"Software\\\"), to deal\\r\\n * in the Software without restriction, including without limitation the rights\\r\\n * to use, copy, modify, merge, publish, distribute, sublicense, and/or sell\\r\\n * copies of the Software, and to permit persons to whom the Software is\\r\\n * furnished to do so, subject to the following conditions:\\r\\n *\\r\\n * The above copyright notice and this permission notice shall be included in\\r\\n * copies or substantial portions of the Software.\\r\\n *\\r\\n * THE SOFTWARE IS PROVIDED \\\"AS IS\\\", WITHOUT WARRANTY OF ANY KIND, EXPRESS OR\\r\\n * IMPLIED, INCLUDING BUT NOT LIMITED TO THE WARRANTIES OF MERCHANTABILITY,\\r\\n * FITNESS FOR A PARTICULAR PURPOSE AND NONINFRINGEMENT. IN NO EVENT SHALL THE\\r\\n * AUTHORS OR COPYRIGHT HOLDERS BE LIABLE FOR ANY CLAIM, DAMAGES OR OTHER\\r\\n * LIABILITY, WHETHER IN AN ACTION OF CONTRACT, TORT OR OTHERWISE, ARISING FROM,\\r\\n * OUT OF OR IN CONNECTION WITH THE SOFTWARE OR THE USE OR OTHER DEALINGS IN THE\\r\\n * SOFTWARE.\\r\\n */\\r\\n\\r\\npragma solidity 0.6.12;\\r\\n\\r\\n/**\\r\\n * @notice Base contract which allows children to implement an emergency stop\\r\\n * mechanism\\r\\n * @dev Forked from https://github.com/OpenZeppelin/openzeppelin-contracts/blob/feb665136c0dae9912e08397c1a21c4af3651ef3/contracts/lifecycle/Pausable.sol\\r\\n * Modifications:\\r\\n * 1. Added pauser role, switched pause/unpause to be onlyPauser (6/14/2018)\\r\\n * 2. Removed whenNotPause/whenPaused from pause/unpause (6/14/2018)\\r\\n * 3. Removed whenPaused (6/14/2018)\\r\\n * 4. Switches ownable library to use ZeppelinOS (7/12/18)\\r\\n * 5. Remove constructor (7/13/18)\\r\\n * 6. Reformat, conform to Solidity 0.6 syntax and add error messages (5/13/20)\\r\\n * 7. Make public functions external (5/27/20)\\r\\n */\\r\\ncontract Pausable is Ownable {\\r\\n    event Pause();\\r\\n    event Unpause();\\r\\n    event PauserChanged(address indexed newAddress);\\r\\n\\r\\n    address public pauser;\\r\\n    bool public paused = false;\\r\\n\\r\\n    /**\\r\\n     * @dev Modifier to make a function callable only when the contract is not paused.\\r\\n     */\\r\\n    modifier whenNotPaused() {\\r\\n        require(!paused, \\\"Pausable: paused\\\");\\r\\n        _;\\r\\n    }\\r\\n\\r\\n    /**\\r\\n     * @dev throws if called by any account other than the pauser\\r\\n     */\\r\\n    modifier onlyPauser() {\\r\\n        require(msg.sender == pauser, \\\"Pausable: caller is not the pauser\\\");\\r\\n        _;\\r\\n    }\\r\\n\\r\\n    /**\\r\\n     * @dev called by the owner to pause, triggers stopped state\\r\\n     */\\r\\n    function pause() external onlyPauser {\\r\\n        paused = true;\\r\\n        emit Pause();\\r\\n    }\\r\\n\\r\\n    /**\\r\\n     * @dev called by the owner to unpause, returns to normal state\\r\\n     */\\r\\n    function unpause() external onlyPauser {\\r\\n        paused = false;\\r\\n        emit Unpause();\\r\\n    }\\r\\n\\r\\n    /**\\r\\n     * @dev update the pauser role\\r\\n     */\\r\\n    function updatePauser(address _newPauser) external onlyOwner {\\r\\n        require(\\r\\n            _newPauser != address(0),\\r\\n            \\\"Pausable: new pauser is the zero address\\\"\\r\\n        );\\r\\n        pauser = _newPauser;\\r\\n        emit PauserChanged(pauser);\\r\\n    }\\r\\n}\\r\\n\\r\\n// File: contracts/v1/Blacklistable.sol\\r\\n\\r\\n/**\\r\\n * Copyright (c) 2018-2020 CENTRE SECZ\\r\\n *\\r\\n * Permission is hereby granted, free of charge, to any person obtaining a copy\\r\\n * of this software and associated documentation files (the \\\"Software\\\"), to deal\\r\\n * in the Software without restriction, including without limitation the rights\\r\\n * to use, copy, modify, merge, publish, distribute, sublicense, and/or sell\\r\\n * copies of the Software, and to permit persons to whom the Software is\\r\\n * furnished to do so, subject to the following conditions:\\r\\n *\\r\\n * The above copyright notice and this permission notice shall be included in\\r\\n * copies or substantial portions of the Software.\\r\\n *\\r\\n * THE SOFTWARE IS PROVIDED \\\"AS IS\\\", WITHOUT WARRANTY OF ANY KIND, EXPRESS OR\\r\\n * IMPLIED, INCLUDING BUT NOT LIMITED TO THE WARRANTIES OF MERCHANTABILITY,\\r\\n * FITNESS FOR A PARTICULAR PURPOSE AND NONINFRINGEMENT. IN NO EVENT SHALL THE\\r\\n * AUTHORS OR COPYRIGHT HOLDERS BE LIABLE FOR ANY CLAIM, DAMAGES OR OTHER\\r\\n * LIABILITY, WHETHER IN AN ACTION OF CONTRACT, TORT OR OTHERWISE, ARISING FROM,\\r\\n * OUT OF OR IN CONNECTION WITH THE SOFTWARE OR THE USE OR OTHER DEALINGS IN THE\\r\\n * SOFTWARE.\\r\\n */\\r\\n\\r\\npragma solidity 0.6.12;\\r\\n\\r\\n/**\\r\\n * @title Blacklistable Token\\r\\n * @dev Allows accounts to be blacklisted by a \\\"blacklister\\\" role\\r\\n */\\r\\ncontract Blacklistable is Ownable {\\r\\n    address public blacklister;\\r\\n    mapping(address => bool) internal blacklisted;\\r\\n\\r\\n    event Blacklisted(address indexed _account);\\r\\n    event UnBlacklisted(address indexed _account);\\r\\n    event BlacklisterChanged(address indexed newBlacklister);\\r\\n\\r\\n    /**\\r\\n     * @dev Throws if called by any account other than the blacklister\\r\\n     */\\r\\n    modifier onlyBlacklister() {\\r\\n        require(\\r\\n            msg.sender == blacklister,\\r\\n            \\\"Blacklistable: caller is not the blacklister\\\"\\r\\n        );\\r\\n        _;\\r\\n    }\\r\\n\\r\\n    /**\\r\\n     * @dev Throws if argument account is blacklisted\\r\\n     * @param _account The address to check\\r\\n     */\\r\\n    modifier notBlacklisted(address _account) {\\r\\n        require(\\r\\n            !blacklisted[_account],\\r\\n            \\\"Blacklistable: account is blacklisted\\\"\\r\\n        );\\r\\n        _;\\r\\n    }\\r\\n\\r\\n    /**\\r\\n     * @dev Checks if account is blacklisted\\r\\n     * @param _account The address to check\\r\\n     */\\r\\n    function isBlacklisted(address _account) external view returns (bool) {\\r\\n        return blacklisted[_account];\\r\\n    }\\r\\n\\r\\n    /**\\r\\n     * @dev Adds account to blacklist\\r\\n     * @param _account The address to blacklist\\r\\n     */\\r\\n    function blacklist(address _account) external onlyBlacklister {\\r\\n        blacklisted[_account] = true;\\r\\n        emit Blacklisted(_account);\\r\\n    }\\r\\n\\r\\n    /**\\r\\n     * @dev Removes account from blacklist\\r\\n     * @param _account The address to remove from the blacklist\\r\\n     */\\r\\n    function unBlacklist(address _account) external onlyBlacklister {\\r\\n        blacklisted[_account] = false;\\r\\n        emit UnBlacklisted(_account);\\r\\n    }\\r\\n\\r\\n    function updateBlacklister(address _newBlacklister) external onlyOwner {\\r\\n        require(\\r\\n            _newBlacklister != address(0),\\r\\n            \\\"Blacklistable: new blacklister is the zero address\\\"\\r\\n        );\\r\\n        blacklister = _newBlacklister;\\r\\n        emit BlacklisterChanged(blacklister);\\r\\n    }\\r\\n}\\r\\n\\r\\n// File: contracts/v1/FiatTokenV1.sol\\r\\n\\r\\n/**\\r\\n *\\r\\n * Copyright (c) 2018-2020 CENTRE SECZ\\r\\n *\\r\\n * Permission is hereby granted, free of charge, to any person obtaining a copy\\r\\n * of this software and associated documentation files (the \\\"Software\\\"), to deal\\r\\n * in the Software without restriction, including without limitation the rights\\r\\n * to use, copy, modify, merge, publish, distribute, sublicense, and/or sell\\r\\n * copies of the Software, and to permit persons to whom the Software is\\r\\n * furnished to do so, subject to the following conditions:\\r\\n *\\r\\n * The above copyright notice and this permission notice shall be included in\\r\\n * copies or substantial portions of the Software.\\r\\n *\\r\\n * THE SOFTWARE IS PROVIDED \\\"AS IS\\\", WITHOUT WARRANTY OF ANY KIND, EXPRESS OR\\r\\n * IMPLIED, INCLUDING BUT NOT LIMITED TO THE WARRANTIES OF MERCHANTABILITY,\\r\\n * FITNESS FOR A PARTICULAR PURPOSE AND NONINFRINGEMENT. IN NO EVENT SHALL THE\\r\\n * AUTHORS OR COPYRIGHT HOLDERS BE LIABLE FOR ANY CLAIM, DAMAGES OR OTHER\\r\\n * LIABILITY, WHETHER IN AN ACTION OF CONTRACT, TORT OR OTHERWISE, ARISING FROM,\\r\\n * OUT OF OR IN CONNECTION WITH THE SOFTWARE OR THE USE OR OTHER DEALINGS IN THE\\r\\n * SOFTWARE.\\r\\n */\\r\\n\\r\\npragma solidity 0.6.12;\\r\\n\\r\\n/**\\r\\n * @title FiatToken\\r\\n * @dev ERC20 Token backed by fiat reserves\\r\\n */\\r\\ncontract FiatTokenV1 is AbstractFiatTokenV1, Ownable, Pausable, Blacklistable {\\r\\n    using SafeMath for uint256;\\r\\n\\r\\n    string public name;\\r\\n    string public symbol;\\r\\n    uint8 public decimals;\\r\\n    string public currency;\\r\\n    address public masterMinter;\\r\\n    bool internal initialized;\\r\\n\\r\\n    mapping(address => uint256) internal balances;\\r\\n    mapping(address => mapping(address => uint256)) internal allowed;\\r\\n    uint256 internal totalSupply_ = 0;\\r\\n    mapping(address => bool) internal minters;\\r\\n    mapping(address => uint256) internal minterAllowed;\\r\\n\\r\\n    event Mint(address indexed minter, address indexed to, uint256 amount);\\r\\n    event Burn(address indexed burner, uint256 amount);\\r\\n    event MinterConfigured(address indexed minter, uint256 minterAllowedAmount);\\r\\n    event MinterRemoved(address indexed oldMinter);\\r\\n    event MasterMinterChanged(address indexed newMasterMinter);\\r\\n\\r\\n    function initialize(\\r\\n        string memory tokenName,\\r\\n        string memory tokenSymbol,\\r\\n        string memory tokenCurrency,\\r\\n        uint8 tokenDecimals,\\r\\n        address newMasterMinter,\\r\\n        address newPauser,\\r\\n        address newBlacklister,\\r\\n        address newOwner\\r\\n    ) public {\\r\\n        require(!initialized, \\\"FiatToken: contract is already initialized\\\");\\r\\n        require(\\r\\n            newMasterMinter != address(0),\\r\\n            \\\"FiatToken: new masterMinter is the zero address\\\"\\r\\n        );\\r\\n        require(\\r\\n            newPauser != address(0),\\r\\n            \\\"FiatToken: new pauser is the zero address\\\"\\r\\n        );\\r\\n        require(\\r\\n            newBlacklister != address(0),\\r\\n            \\\"FiatToken: new blacklister is the zero address\\\"\\r\\n        );\\r\\n        require(\\r\\n            newOwner != address(0),\\r\\n            \\\"FiatToken: new owner is the zero address\\\"\\r\\n        );\\r\\n\\r\\n        name = tokenName;\\r\\n        symbol = tokenSymbol;\\r\\n        currency = tokenCurrency;\\r\\n        decimals = tokenDecimals;\\r\\n        masterMinter = newMasterMinter;\\r\\n        pauser = newPauser;\\r\\n        blacklister = newBlacklister;\\r\\n        setOwner(newOwner);\\r\\n        initialized = true;\\r\\n    }\\r\\n\\r\\n    /**\\r\\n     * @dev Throws if called by any account other than a minter\\r\\n     */\\r\\n    modifier onlyMinters() {\\r\\n        require(minters[msg.sender], \\\"FiatToken: caller is not a minter\\\");\\r\\n        _;\\r\\n    }\\r\\n\\r\\n    /**\\r\\n     * @dev Function to mint tokens\\r\\n     * @param _to The address that will receive the minted tokens.\\r\\n     * @param _amount The amount of tokens to mint. Must be less than or equal\\r\\n     * to the minterAllowance of the caller.\\r\\n     * @return A boolean that indicates if the operation was successful.\\r\\n     */\\r\\n    function mint(address _to, uint256 _amount)\\r\\n        external\\r\\n        whenNotPaused\\r\\n        onlyMinters\\r\\n        notBlacklisted(msg.sender)\\r\\n        notBlacklisted(_to)\\r\\n        returns (bool)\\r\\n    {\\r\\n        require(_to != address(0), \\\"FiatToken: mint to the zero address\\\");\\r\\n        require(_amount > 0, \\\"FiatToken: mint amount not greater than 0\\\");\\r\\n\\r\\n        uint256 mintingAllowedAmount = minterAllowed[msg.sender];\\r\\n        require(\\r\\n            _amount <= mintingAllowedAmount,\\r\\n            \\\"FiatToken: mint amount exceeds minterAllowance\\\"\\r\\n        );\\r\\n\\r\\n        totalSupply_ = totalSupply_.add(_amount);\\r\\n        balances[_to] = balances[_to].add(_amount);\\r\\n        minterAllowed[msg.sender] = mintingAllowedAmount.sub(_amount);\\r\\n        emit Mint(msg.sender, _to, _amount);\\r\\n        emit Transfer(address(0), _to, _amount);\\r\\n        return true;\\r\\n    }\\r\\n\\r\\n    /**\\r\\n     * @dev Throws if called by any account other than the masterMinter\\r\\n     */\\r\\n    modifier onlyMasterMinter() {\\r\\n        require(\\r\\n            msg.sender == masterMinter,\\r\\n            \\\"FiatToken: caller is not the masterMinter\\\"\\r\\n        );\\r\\n        _;\\r\\n    }\\r\\n\\r\\n    /**\\r\\n     * @dev Get minter allowance for an account\\r\\n     * @param minter The address of the minter\\r\\n     */\\r\\n    function minterAllowance(address minter) external view returns (uint256) {\\r\\n        return minterAllowed[minter];\\r\\n    }\\r\\n\\r\\n    /**\\r\\n     * @dev Checks if account is a minter\\r\\n     * @param account The address to check\\r\\n     */\\r\\n    function isMinter(address account) external view returns (bool) {\\r\\n        return minters[account];\\r\\n    }\\r\\n\\r\\n    /**\\r\\n     * @notice Amount of remaining tokens spender is allowed to transfer on\\r\\n     * behalf of the token owner\\r\\n     * @param owner     Token owner's address\\r\\n     * @param spender   Spender's address\\r\\n     * @return Allowance amount\\r\\n     */\\r\\n    function allowance(address owner, address spender)\\r\\n        external\\r\\n        override\\r\\n        view\\r\\n        returns (uint256)\\r\\n    {\\r\\n        return allowed[owner][spender];\\r\\n    }\\r\\n\\r\\n    /**\\r\\n     * @dev Get totalSupply of token\\r\\n     */\\r\\n    function totalSupply() external override view returns (uint256) {\\r\\n        return totalSupply_;\\r\\n    }\\r\\n\\r\\n    /**\\r\\n     * @dev Get token balance of an account\\r\\n     * @param account address The account\\r\\n     */\\r\\n    function balanceOf(address account)\\r\\n        external\\r\\n        override\\r\\n        view\\r\\n        returns (uint256)\\r\\n    {\\r\\n        return balances[account];\\r\\n    }\\r\\n\\r\\n    /**\\r\\n     * @notice Set spender's allowance over the caller's tokens to be a given\\r\\n     * value.\\r\\n     * @param spender   Spender's address\\r\\n     * @param value     Allowance amount\\r\\n     * @return True if successful\\r\\n     */\\r\\n    function approve(address spender, uint256 value)\\r\\n        external\\r\\n        override\\r\\n        whenNotPaused\\r\\n        notBlacklisted(msg.sender)\\r\\n        notBlacklisted(spender)\\r\\n        returns (bool)\\r\\n    {\\r\\n        _approve(msg.sender, spender, value);\\r\\n        return true;\\r\\n    }\\r\\n\\r\\n    /**\\r\\n     * @dev Internal function to set allowance\\r\\n     * @param owner     Token owner's address\\r\\n     * @param spender   Spender's address\\r\\n     * @param value     Allowance amount\\r\\n     */\\r\\n    function _approve(\\r\\n        address owner,\\r\\n        address spender,\\r\\n        uint256 value\\r\\n    ) internal override {\\r\\n        require(owner != address(0), \\\"ERC20: approve from the zero address\\\");\\r\\n        require(spender != address(0), \\\"ERC20: approve to the zero address\\\");\\r\\n        allowed[owner][spender] = value;\\r\\n        emit Approval(owner, spender, value);\\r\\n    }\\r\\n\\r\\n    /**\\r\\n     * @notice Transfer tokens by spending allowance\\r\\n     * @param from  Payer's address\\r\\n     * @param to    Payee's address\\r\\n     * @param value Transfer amount\\r\\n     * @return True if successful\\r\\n     */\\r\\n    function transferFrom(\\r\\n        address from,\\r\\n        address to,\\r\\n        uint256 value\\r\\n    )\\r\\n        external\\r\\n        override\\r\\n        whenNotPaused\\r\\n        notBlacklisted(msg.sender)\\r\\n        notBlacklisted(from)\\r\\n        notBlacklisted(to)\\r\\n        returns (bool)\\r\\n    {\\r\\n        require(\\r\\n            value <= allowed[from][msg.sender],\\r\\n            \\\"ERC20: transfer amount exceeds allowance\\\"\\r\\n        );\\r\\n        _transfer(from, to, value);\\r\\n        allowed[from][msg.sender] = allowed[from][msg.sender].sub(value);\\r\\n        return true;\\r\\n    }\\r\\n\\r\\n    /**\\r\\n     * @notice Transfer tokens from the caller\\r\\n     * @param to    Payee's address\\r\\n     * @param value Transfer amount\\r\\n     * @return True if successful\\r\\n     */\\r\\n    function transfer(address to, uint256 value)\\r\\n        external\\r\\n        override\\r\\n        whenNotPaused\\r\\n        notBlacklisted(msg.sender)\\r\\n        notBlacklisted(to)\\r\\n        returns (bool)\\r\\n    {\\r\\n        _transfer(msg.sender, to, value);\\r\\n        return true;\\r\\n    }\\r\\n\\r\\n    /**\\r\\n     * @notice Internal function to process transfers\\r\\n     * @param from  Payer's address\\r\\n     * @param to    Payee's address\\r\\n     * @param value Transfer amount\\r\\n     */\\r\\n    function _transfer(\\r\\n        address from,\\r\\n        address to,\\r\\n        uint256 value\\r\\n    ) internal override {\\r\\n        require(from != address(0), \\\"ERC20: transfer from the zero address\\\");\\r\\n        require(to != address(0), \\\"ERC20: transfer to the zero address\\\");\\r\\n        require(\\r\\n            value <= balances[from],\\r\\n            \\\"ERC20: transfer amount exceeds balance\\\"\\r\\n        );\\r\\n\\r\\n        balances[from] = balances[from].sub(value);\\r\\n        balances[to] = balances[to].add(value);\\r\\n        emit Transfer(from, to, value);\\r\\n    }\\r\\n\\r\\n    /**\\r\\n     * @dev Function to add/update a new minter\\r\\n     * @param minter The address of the minter\\r\\n     * @param minterAllowedAmount The minting amount allowed for the minter\\r\\n     * @return True if the operation was successful.\\r\\n     */\\r\\n    function configureMinter(address minter, uint256 minterAllowedAmount)\\r\\n        external\\r\\n        whenNotPaused\\r\\n        onlyMasterMinter\\r\\n        returns (bool)\\r\\n    {\\r\\n        minters[minter] = true;\\r\\n        minterAllowed[minter] = minterAllowedAmount;\\r\\n        emit MinterConfigured(minter, minterAllowedAmount);\\r\\n        return true;\\r\\n    }\\r\\n\\r\\n    /**\\r\\n     * @dev Function to remove a minter\\r\\n     * @param minter The address of the minter to remove\\r\\n     * @return True if the operation was successful.\\r\\n     */\\r\\n    function removeMinter(address minter)\\r\\n        external\\r\\n        onlyMasterMinter\\r\\n        returns (bool)\\r\\n    {\\r\\n        minters[minter] = false;\\r\\n        minterAllowed[minter] = 0;\\r\\n        emit MinterRemoved(minter);\\r\\n        return true;\\r\\n    }\\r\\n\\r\\n    /**\\r\\n     * @dev allows a minter to burn some of its own tokens\\r\\n     * Validates that caller is a minter and that sender is not blacklisted\\r\\n     * amount is less than or equal to the minter's account balance\\r\\n     * @param _amount uint256 the amount of tokens to be burned\\r\\n     */\\r\\n    function burn(uint256 _amount)\\r\\n        external\\r\\n        whenNotPaused\\r\\n        onlyMinters\\r\\n        notBlacklisted(msg.sender)\\r\\n    {\\r\\n        uint256 balance = balances[msg.sender];\\r\\n        require(_amount > 0, \\\"FiatToken: burn amount not greater than 0\\\");\\r\\n        require(balance >= _amount, \\\"FiatToken: burn amount exceeds balance\\\");\\r\\n\\r\\n        totalSupply_ = totalSupply_.sub(_amount);\\r\\n        balances[msg.sender] = balance.sub(_amount);\\r\\n        emit Burn(msg.sender, _amount);\\r\\n        emit Transfer(msg.sender, address(0), _amount);\\r\\n    }\\r\\n\\r\\n    function updateMasterMinter(address _newMasterMinter) external onlyOwner {\\r\\n        require(\\r\\n            _newMasterMinter != address(0),\\r\\n            \\\"FiatToken: new masterMinter is the zero address\\\"\\r\\n        );\\r\\n        masterMinter = _newMasterMinter;\\r\\n        emit MasterMinterChanged(masterMinter);\\r\\n    }\\r\\n}\\r\\n\\r\\n// File: @openzeppelin/contracts/utils/Address.sol\\r\\n\\r\\npragma solidity ^0.6.2;\\r\\n\\r\\n/**\\r\\n * @dev Collection of functions related to the address type\\r\\n */\\r\\nlibrary Address {\\r\\n    /**\\r\\n     * @dev Returns true if `account` is a contract.\\r\\n     *\\r\\n     * [IMPORTANT]\\r\\n     * ====\\r\\n     * It is unsafe to assume that an address for which this function returns\\r\\n     * false is an externally-owned account (EOA) and not a contract.\\r\\n     *\\r\\n     * Among others, `isContract` will return false for the following\\r\\n     * types of addresses:\\r\\n     *\\r\\n     *  - an externally-owned account\\r\\n     *  - a contract in construction\\r\\n     *  - an address where a contract will be created\\r\\n     *  - an address where a contract lived, but was destroyed\\r\\n     * ====\\r\\n     */\\r\\n    function isContract(address account) internal view returns (bool) {\\r\\n        // According to EIP-1052, 0x0 is the value returned for not-yet created accounts\\r\\n        // and 0xc5d2460186f7233c927e7db2dcc703c0e500b653ca82273b7bfad8045d85a470 is returned\\r\\n        // for accounts without code, i.e. `keccak256('')`\\r\\n        bytes32 codehash;\\r\\n\\r\\n            bytes32 accountHash\\r\\n         = 0xc5d2460186f7233c927e7db2dcc703c0e500b653ca82273b7bfad8045d85a470;\\r\\n        // solhint-disable-next-line no-inline-assembly\\r\\n        assembly {\\r\\n            codehash := extcodehash(account)\\r\\n        }\\r\\n        return (codehash != accountHash && codehash != 0x0);\\r\\n    }\\r\\n\\r\\n    /**\\r\\n     * @dev Replacement for Solidity's `transfer`: sends `amount` wei to\\r\\n     * `recipient`, forwarding all available gas and reverting on errors.\\r\\n     *\\r\\n     * https://eips.ethereum.org/EIPS/eip-1884[EIP1884] increases the gas cost\\r\\n     * of certain opcodes, possibly making contracts go over the 2300 gas limit\\r\\n     * imposed by `transfer`, making them unable to receive funds via\\r\\n     * `transfer`. {sendValue} removes this limitation.\\r\\n     *\\r\\n     * https://diligence.consensys.net/posts/2019/09/stop-using-soliditys-transfer-now/[Learn more].\\r\\n     *\\r\\n     * IMPORTANT: because control is transferred to `recipient`, care must be\\r\\n     * taken to not create reentrancy vulnerabilities. Consider using\\r\\n     * {ReentrancyGuard} or the\\r\\n     * https://solidity.readthedocs.io/en/v0.5.11/security-considerations.html#use-the-checks-effects-interactions-pattern[checks-effects-interactions pattern].\\r\\n     */\\r\\n    function sendValue(address payable recipient, uint256 amount) internal {\\r\\n        require(\\r\\n            address(this).balance >= amount,\\r\\n            \\\"Address: insufficient balance\\\"\\r\\n        );\\r\\n\\r\\n        // solhint-disable-next-line avoid-low-level-calls, avoid-call-value\\r\\n        (bool success, ) = recipient.call{ value: amount }(\\\"\\\");\\r\\n        require(\\r\\n            success,\\r\\n            \\\"Address: unable to send value, recipient may have reverted\\\"\\r\\n        );\\r\\n    }\\r\\n\\r\\n    /**\\r\\n     * @dev Performs a Solidity function call using a low level `call`. A\\r\\n     * plain`call` is an unsafe replacement for a function call: use this\\r\\n     * function instead.\\r\\n     *\\r\\n     * If `target` reverts with a revert reason, it is bubbled up by this\\r\\n     * function (like regular Solidity function calls).\\r\\n     *\\r\\n     * Returns the raw returned data. To convert to the expected return value,\\r\\n     * use https://solidity.readthedocs.io/en/latest/units-and-global-variables.html?highlight=abi.decode#abi-encoding-and-decoding-functions[`abi.decode`].\\r\\n     *\\r\\n     * Requirements:\\r\\n     *\\r\\n     * - `target` must be a contract.\\r\\n     * - calling `target` with `data` must not revert.\\r\\n     *\\r\\n     * _Available since v3.1._\\r\\n     */\\r\\n    function functionCall(address target, bytes memory data)\\r\\n        internal\\r\\n        returns (bytes memory)\\r\\n    {\\r\\n        return functionCall(target, data, \\\"Address: low-level call failed\\\");\\r\\n    }\\r\\n\\r\\n    /**\\r\\n     * @dev Same as {xref-Address-functionCall-address-bytes-}[`functionCall`], but with\\r\\n     * `errorMessage` as a fallback revert reason when `target` reverts.\\r\\n     *\\r\\n     * _Available since v3.1._\\r\\n     */\\r\\n    function functionCall(\\r\\n        address target,\\r\\n        bytes memory data,\\r\\n        string memory errorMessage\\r\\n    ) internal returns (bytes memory) {\\r\\n        return _functionCallWithValue(target, data, 0, errorMessage);\\r\\n    }\\r\\n\\r\\n    /**\\r\\n     * @dev Same as {xref-Address-functionCall-address-bytes-}[`functionCall`],\\r\\n     * but also transferring `value` wei to `target`.\\r\\n     *\\r\\n     * Requirements:\\r\\n     *\\r\\n     * - the calling contract must have an ETH balance of at least `value`.\\r\\n     * - the called Solidity function must be `payable`.\\r\\n     *\\r\\n     * _Available since v3.1._\\r\\n     */\\r\\n    function functionCallWithValue(\\r\\n        address target,\\r\\n        bytes memory data,\\r\\n        uint256 value\\r\\n    ) internal returns (bytes memory) {\\r\\n        return\\r\\n            functionCallWithValue(\\r\\n                target,\\r\\n                data,\\r\\n                value,\\r\\n                \\\"Address: low-level call with value failed\\\"\\r\\n            );\\r\\n    }\\r\\n\\r\\n    /**\\r\\n     * @dev Same as {xref-Address-functionCallWithValue-address-bytes-uint256-}[`functionCallWithValue`], but\\r\\n     * with `errorMessage` as a fallback revert reason when `target` reverts.\\r\\n     *\\r\\n     * _Available since v3.1._\\r\\n     */\\r\\n    function functionCallWithValue(\\r\\n        address target,\\r\\n        bytes memory data,\\r\\n        uint256 value,\\r\\n        string memory errorMessage\\r\\n    ) internal returns (bytes memory) {\\r\\n        require(\\r\\n            address(this).balance >= value,\\r\\n            \\\"Address: insufficient balance for call\\\"\\r\\n        );\\r\\n        return _functionCallWithValue(target, data, value, errorMessage);\\r\\n    }\\r\\n\\r\\n    function _functionCallWithValue(\\r\\n        address target,\\r\\n        bytes memory data,\\r\\n        uint256 weiValue,\\r\\n        string memory errorMessage\\r\\n    ) private returns (bytes memory) {\\r\\n        require(isContract(target), \\\"Address: call to non-contract\\\");\\r\\n\\r\\n        // solhint-disable-next-line avoid-low-level-calls\\r\\n        (bool success, bytes memory returndata) = target.call{\\r\\n            value: weiValue\\r\\n        }(data);\\r\\n        if (success) {\\r\\n            return returndata;\\r\\n        } else {\\r\\n            // Look for revert reason and bubble it up if present\\r\\n            if (returndata.length > 0) {\\r\\n                // The easiest way to bubble the revert reason is using memory via assembly\\r\\n\\r\\n                // solhint-disable-next-line no-inline-assembly\\r\\n                assembly {\\r\\n                    let returndata_size := mload(returndata)\\r\\n                    revert(add(32, returndata), returndata_size)\\r\\n                }\\r\\n            } else {\\r\\n                revert(errorMessage);\\r\\n            }\\r\\n        }\\r\\n    }\\r\\n}\\r\\n\\r\\n// File: @openzeppelin/contracts/token/ERC20/SafeERC20.sol\\r\\n\\r\\npragma solidity ^0.6.0;\\r\\n\\r\\n/**\\r\\n * @title SafeERC20\\r\\n * @dev Wrappers around ERC20 operations that throw on failure (when the token\\r\\n * contract returns false). Tokens that return no value (and instead revert or\\r\\n * throw on failure) are also supported, non-reverting calls are assumed to be\\r\\n * successful.\\r\\n * To use this library you can add a `using SafeERC20 for IERC20;` statement to your contract,\\r\\n * which allows you to call the safe operations as `token.safeTransfer(...)`, etc.\\r\\n */\\r\\nlibrary SafeERC20 {\\r\\n    using SafeMath for uint256;\\r\\n    using Address for address;\\r\\n\\r\\n    function safeTransfer(\\r\\n        IERC20 token,\\r\\n        address to,\\r\\n        uint256 value\\r\\n    ) internal {\\r\\n        _callOptionalReturn(\\r\\n            token,\\r\\n            abi.encodeWithSelector(token.transfer.selector, to, value)\\r\\n        );\\r\\n    }\\r\\n\\r\\n    function safeTransferFrom(\\r\\n        IERC20 token,\\r\\n        address from,\\r\\n        address to,\\r\\n        uint256 value\\r\\n    ) internal {\\r\\n        _callOptionalReturn(\\r\\n            token,\\r\\n            abi.encodeWithSelector(token.transferFrom.selector, from, to, value)\\r\\n        );\\r\\n    }\\r\\n\\r\\n    /**\\r\\n     * @dev Deprecated. This function has issues similar to the ones found in\\r\\n     * {IERC20-approve}, and its usage is discouraged.\\r\\n     *\\r\\n     * Whenever possible, use {safeIncreaseAllowance} and\\r\\n     * {safeDecreaseAllowance} instead.\\r\\n     */\\r\\n    function safeApprove(\\r\\n        IERC20 token,\\r\\n        address spender,\\r\\n        uint256 value\\r\\n    ) internal {\\r\\n        // safeApprove should only be called when setting an initial allowance,\\r\\n        // or when resetting it to zero. To increase and decrease it, use\\r\\n        // 'safeIncreaseAllowance' and 'safeDecreaseAllowance'\\r\\n        // solhint-disable-next-line max-line-length\\r\\n        require(\\r\\n            (value == 0) || (token.allowance(address(this), spender) == 0),\\r\\n            \\\"SafeERC20: approve from non-zero to non-zero allowance\\\"\\r\\n        );\\r\\n        _callOptionalReturn(\\r\\n            token,\\r\\n            abi.encodeWithSelector(token.approve.selector, spender, value)\\r\\n        );\\r\\n    }\\r\\n\\r\\n    function safeIncreaseAllowance(\\r\\n        IERC20 token,\\r\\n        address spender,\\r\\n        uint256 value\\r\\n    ) internal {\\r\\n        uint256 newAllowance = token.allowance(address(this), spender).add(\\r\\n            value\\r\\n        );\\r\\n        _callOptionalReturn(\\r\\n            token,\\r\\n            abi.encodeWithSelector(\\r\\n                token.approve.selector,\\r\\n                spender,\\r\\n                newAllowance\\r\\n            )\\r\\n        );\\r\\n    }\\r\\n\\r\\n    function safeDecreaseAllowance(\\r\\n        IERC20 token,\\r\\n        address spender,\\r\\n        uint256 value\\r\\n    ) internal {\\r\\n        uint256 newAllowance = token.allowance(address(this), spender).sub(\\r\\n            value,\\r\\n            \\\"SafeERC20: decreased allowance below zero\\\"\\r\\n        );\\r\\n        _callOptionalReturn(\\r\\n            token,\\r\\n            abi.encodeWithSelector(\\r\\n                token.approve.selector,\\r\\n                spender,\\r\\n                newAllowance\\r\\n            )\\r\\n        );\\r\\n    }\\r\\n\\r\\n    /**\\r\\n     * @dev Imitates a Solidity high-level call (i.e. a regular function call to a contract), relaxing the requirement\\r\\n     * on the return value: the return value is optional (but if data is returned, it must not be false).\\r\\n     * @param token The token targeted by the call.\\r\\n     * @param data The call data (encoded using abi.encode or one of its variants).\\r\\n     */\\r\\n    function _callOptionalReturn(IERC20 token, bytes memory data) private {\\r\\n        // We need to perform a low level call here, to bypass Solidity's return data size checking mechanism, since\\r\\n        // we're implementing it ourselves. We use {Address.functionCall} to perform this call, which verifies that\\r\\n        // the target address contains contract code and also asserts for success in the low-level call.\\r\\n\\r\\n        bytes memory returndata = address(token).functionCall(\\r\\n            data,\\r\\n            \\\"SafeERC20: low-level call failed\\\"\\r\\n        );\\r\\n        if (returndata.length > 0) {\\r\\n            // Return data is optional\\r\\n            // solhint-disable-next-line max-line-length\\r\\n            require(\\r\\n                abi.decode(returndata, (bool)),\\r\\n                \\\"SafeERC20: ERC20 operation did not succeed\\\"\\r\\n            );\\r\\n        }\\r\\n    }\\r\\n}\\r\\n\\r\\n// File: contracts/v1.1/Rescuable.sol\\r\\n\\r\\n/**\\r\\n * Copyright (c) 2018-2020 CENTRE SECZ\\r\\n *\\r\\n * Permission is hereby granted, free of charge, to any person obtaining a copy\\r\\n * of this software and associated documentation files (the \\\"Software\\\"), to deal\\r\\n * in the Software without restriction, including without limitation the rights\\r\\n * to use, copy, modify, merge, publish, distribute, sublicense, and/or sell\\r\\n * copies of the Software, and to permit persons to whom the Software is\\r\\n * furnished to do so, subject to the following conditions:\\r\\n *\\r\\n * The above copyright notice and this permission notice shall be included in\\r\\n * copies or substantial portions of the Software.\\r\\n *\\r\\n * THE SOFTWARE IS PROVIDED \\\"AS IS\\\", WITHOUT WARRANTY OF ANY KIND, EXPRESS OR\\r\\n * IMPLIED, INCLUDING BUT NOT LIMITED TO THE WARRANTIES OF MERCHANTABILITY,\\r\\n * FITNESS FOR A PARTICULAR PURPOSE AND NONINFRINGEMENT. IN NO EVENT SHALL THE\\r\\n * AUTHORS OR COPYRIGHT HOLDERS BE LIABLE FOR ANY CLAIM, DAMAGES OR OTHER\\r\\n * LIABILITY, WHETHER IN AN ACTION OF CONTRACT, TORT OR OTHERWISE, ARISING FROM,\\r\\n * OUT OF OR IN CONNECTION WITH THE SOFTWARE OR THE USE OR OTHER DEALINGS IN THE\\r\\n * SOFTWARE.\\r\\n */\\r\\n\\r\\npragma solidity 0.6.12;\\r\\n\\r\\ncontract Rescuable is Ownable {\\r\\n    using SafeERC20 for IERC20;\\r\\n\\r\\n    address private _rescuer;\\r\\n\\r\\n    event RescuerChanged(address indexed newRescuer);\\r\\n\\r\\n    /**\\r\\n     * @notice Returns current rescuer\\r\\n     * @return Rescuer's address\\r\\n     */\\r\\n    function rescuer() external view returns (address) {\\r\\n        return _rescuer;\\r\\n    }\\r\\n\\r\\n    /**\\r\\n     * @notice Revert if called by any account other than the rescuer.\\r\\n     */\\r\\n    modifier onlyRescuer() {\\r\\n        require(msg.sender == _rescuer, \\\"Rescuable: caller is not the rescuer\\\");\\r\\n        _;\\r\\n    }\\r\\n\\r\\n    /**\\r\\n     * @notice Rescue ERC20 tokens locked up in this contract.\\r\\n     * @param tokenContract ERC20 token contract address\\r\\n     * @param to        Recipient address\\r\\n     * @param amount    Amount to withdraw\\r\\n     */\\r\\n    function rescueERC20(\\r\\n        IERC20 tokenContract,\\r\\n        address to,\\r\\n        uint256 amount\\r\\n    ) external onlyRescuer {\\r\\n        tokenContract.safeTransfer(to, amount);\\r\\n    }\\r\\n\\r\\n    /**\\r\\n     * @notice Assign the rescuer role to a given address.\\r\\n     * @param newRescuer New rescuer's address\\r\\n     */\\r\\n    function updateRescuer(address newRescuer) external onlyOwner {\\r\\n        require(\\r\\n            newRescuer != address(0),\\r\\n            \\\"Rescuable: new rescuer is the zero address\\\"\\r\\n        );\\r\\n        _rescuer = newRescuer;\\r\\n        emit RescuerChanged(newRescuer);\\r\\n    }\\r\\n}\\r\\n\\r\\n// File: contracts/v1.1/FiatTokenV1_1.sol\\r\\n\\r\\n/**\\r\\n * Copyright (c) 2018-2020 CENTRE SECZ\\r\\n *\\r\\n * Permission is hereby granted, free of charge, to any person obtaining a copy\\r\\n * of this software and associated documentation files (the \\\"Software\\\"), to deal\\r\\n * in the Software without restriction, including without limitation the rights\\r\\n * to use, copy, modify, merge, publish, distribute, sublicense, and/or sell\\r\\n * copies of the Software, and to permit persons to whom the Software is\\r\\n * furnished to do so, subject to the following conditions:\\r\\n *\\r\\n * The above copyright notice and this permission notice shall be included in\\r\\n * copies or substantial portions of the Software.\\r\\n *\\r\\n * THE SOFTWARE IS PROVIDED \\\"AS IS\\\", WITHOUT WARRANTY OF ANY KIND, EXPRESS OR\\r\\n * IMPLIED, INCLUDING BUT NOT LIMITED TO THE WARRANTIES OF MERCHANTABILITY,\\r\\n * FITNESS FOR A PARTICULAR PURPOSE AND NONINFRINGEMENT. IN NO EVENT SHALL THE\\r\\n * AUTHORS OR COPYRIGHT HOLDERS BE LIABLE FOR ANY CLAIM, DAMAGES OR OTHER\\r\\n * LIABILITY, WHETHER IN AN ACTION OF CONTRACT, TORT OR OTHERWISE, ARISING FROM,\\r\\n * OUT OF OR IN CONNECTION WITH THE SOFTWARE OR THE USE OR OTHER DEALINGS IN THE\\r\\n * SOFTWARE.\\r\\n */\\r\\n\\r\\npragma solidity 0.6.12;\\r\\n\\r\\n/**\\r\\n * @title FiatTokenV1_1\\r\\n * @dev ERC20 Token backed by fiat reserves\\r\\n */\\r\\ncontract FiatTokenV1_1 is FiatTokenV1, Rescuable {\\r\\n\\r\\n}\\r\\n\\r\\n// File: contracts/v2/AbstractFiatTokenV2.sol\\r\\n\\r\\n/**\\r\\n * Copyright (c) 2018-2020 CENTRE SECZ\\r\\n *\\r\\n * Permission is hereby granted, free of charge, to any person obtaining a copy\\r\\n * of this software and associated documentation files (the \\\"Software\\\"), to deal\\r\\n * in the Software without restriction, including without limitation the rights\\r\\n * to use, copy, modify, merge, publish, distribute, sublicense, and/or sell\\r\\n * copies of the Software, and to permit persons to whom the Software is\\r\\n * furnished to do so, subject to the following conditions:\\r\\n *\\r\\n * The above copyright notice and this permission notice shall be included in\\r\\n * copies or substantial portions of the Software.\\r\\n *\\r\\n * THE SOFTWARE IS PROVIDED \\\"AS IS\\\", WITHOUT WARRANTY OF ANY KIND, EXPRESS OR\\r\\n * IMPLIED, INCLUDING BUT NOT LIMITED TO THE WARRANTIES OF MERCHANTABILITY,\\r\\n * FITNESS FOR A PARTICULAR PURPOSE AND NONINFRINGEMENT. IN NO EVENT SHALL THE\\r\\n * AUTHORS OR COPYRIGHT HOLDERS BE LIABLE FOR ANY CLAIM, DAMAGES OR OTHER\\r\\n * LIABILITY, WHETHER IN AN ACTION OF CONTRACT, TORT OR OTHERWISE, ARISING FROM,\\r\\n * OUT OF OR IN CONNECTION WITH THE SOFTWARE OR THE USE OR OTHER DEALINGS IN THE\\r\\n * SOFTWARE.\\r\\n */\\r\\n\\r\\npragma solidity 0.6.12;\\r\\n\\r\\nabstract contract AbstractFiatTokenV2 is AbstractFiatTokenV1 {\\r\\n    function _increaseAllowance(\\r\\n        address owner,\\r\\n        address spender,\\r\\n        uint256 increment\\r\\n    ) internal virtual;\\r\\n\\r\\n    function _decreaseAllowance(\\r\\n        address owner,\\r\\n        address spender,\\r\\n        uint256 decrement\\r\\n    ) internal virtual;\\r\\n}\\r\\n\\r\\n// File: contracts/util/ECRecover.sol\\r\\n\\r\\n/**\\r\\n * Copyright (c) 2016-2019 zOS Global Limited\\r\\n * Copyright (c) 2018-2020 CENTRE SECZ\\r\\n *\\r\\n * Permission is hereby granted, free of charge, to any person obtaining a copy\\r\\n * of this software and associated documentation files (the \\\"Software\\\"), to deal\\r\\n * in the Software without restriction, including without limitation the rights\\r\\n * to use, copy, modify, merge, publish, distribute, sublicense, and/or sell\\r\\n * copies of the Software, and to permit persons to whom the Software is\\r\\n * furnished to do so, subject to the following conditions:\\r\\n *\\r\\n * The above copyright notice and this permission notice shall be included in\\r\\n * copies or substantial portions of the Software.\\r\\n *\\r\\n * THE SOFTWARE IS PROVIDED \\\"AS IS\\\", WITHOUT WARRANTY OF ANY KIND, EXPRESS OR\\r\\n * IMPLIED, INCLUDING BUT NOT LIMITED TO THE WARRANTIES OF MERCHANTABILITY,\\r\\n * FITNESS FOR A PARTICULAR PURPOSE AND NONINFRINGEMENT. IN NO EVENT SHALL THE\\r\\n * AUTHORS OR COPYRIGHT HOLDERS BE LIABLE FOR ANY CLAIM, DAMAGES OR OTHER\\r\\n * LIABILITY, WHETHER IN AN ACTION OF CONTRACT, TORT OR OTHERWISE, ARISING FROM,\\r\\n * OUT OF OR IN CONNECTION WITH THE SOFTWARE OR THE USE OR OTHER DEALINGS IN THE\\r\\n * SOFTWARE.\\r\\n */\\r\\n\\r\\npragma solidity 0.6.12;\\r\\n\\r\\n/**\\r\\n * @title ECRecover\\r\\n * @notice A library that provides a safe ECDSA recovery function\\r\\n */\\r\\nlibrary ECRecover {\\r\\n    /**\\r\\n     * @notice Recover signer's address from a signed message\\r\\n     * @dev Adapted from: https://github.com/OpenZeppelin/openzeppelin-contracts/blob/65e4ffde586ec89af3b7e9140bdc9235d1254853/contracts/cryptography/ECDSA.sol\\r\\n     * Modifications: Accept v, r, and s as separate arguments\\r\\n     * @param digest    Keccak-256 hash digest of the signed message\\r\\n     * @param v         v of the signature\\r\\n     * @param r         r of the signature\\r\\n     * @param s         s of the signature\\r\\n     * @return Signer address\\r\\n     */\\r\\n    function recover(\\r\\n        bytes32 digest,\\r\\n        uint8 v,\\r\\n        bytes32 r,\\r\\n        bytes32 s\\r\\n    ) internal pure returns (address) {\\r\\n        // EIP-2 still allows signature malleability for ecrecover(). Remove this possibility and make the signature\\r\\n        // unique. Appendix F in the Ethereum Yellow paper (https://ethereum.github.io/yellowpaper/paper.pdf), defines\\r\\n        // the valid range for s in (281): 0 < s < secp256k1n \\u00f7 2 + 1, and for v in (282): v \\u2208 {27, 28}. Most\\r\\n        // signatures from current libraries generate a unique signature with an s-value in the lower half order.\\r\\n        //\\r\\n        // If your library generates malleable signatures, such as s-values in the upper range, calculate a new s-value\\r\\n        // with 0xFFFFFFFFFFFFFFFFFFFFFFFFFFFFFFFEBAAEDCE6AF48A03BBFD25E8CD0364141 - s1 and flip v from 27 to 28 or\\r\\n        // vice versa. If your library also generates signatures with 0/1 for v instead 27/28, add 27 to v to accept\\r\\n        // these malleable signatures as well.\\r\\n        if (\\r\\n            uint256(s) >\\r\\n            0x7FFFFFFFFFFFFFFFFFFFFFFFFFFFFFFF5D576E7357A4501DDFE92F46681B20A0\\r\\n        ) {\\r\\n            revert(\\\"ECRecover: invalid signature 's' value\\\");\\r\\n        }\\r\\n\\r\\n        if (v != 27 && v != 28) {\\r\\n            revert(\\\"ECRecover: invalid signature 'v' value\\\");\\r\\n        }\\r\\n\\r\\n        // If the signature is valid (and not malleable), return the signer address\\r\\n        address signer = ecrecover(digest, v, r, s);\\r\\n        require(signer != address(0), \\\"ECRecover: invalid signature\\\");\\r\\n\\r\\n        return signer;\\r\\n    }\\r\\n}\\r\\n\\r\\n// File: contracts/util/EIP712.sol\\r\\n\\r\\n/**\\r\\n * Copyright (c) 2018-2020 CENTRE SECZ\\r\\n *\\r\\n * Permission is hereby granted, free of charge, to any person obtaining a copy\\r\\n * of this software and associated documentation files (the \\\"Software\\\"), to deal\\r\\n * in the Software without restriction, including without limitation the rights\\r\\n * to use, copy, modify, merge, publish, distribute, sublicense, and/or sell\\r\\n * copies of the Software, and to permit persons to whom the Software is\\r\\n * furnished to do so, subject to the following conditions:\\r\\n *\\r\\n * The above copyright notice and this permission notice shall be included in\\r\\n * copies or substantial portions of the Software.\\r\\n *\\r\\n * THE SOFTWARE IS PROVIDED \\\"AS IS\\\", WITHOUT WARRANTY OF ANY KIND, EXPRESS OR\\r\\n * IMPLIED, INCLUDING BUT NOT LIMITED TO THE WARRANTIES OF MERCHANTABILITY,\\r\\n * FITNESS FOR A PARTICULAR PURPOSE AND NONINFRINGEMENT. IN NO EVENT SHALL THE\\r\\n * AUTHORS OR COPYRIGHT HOLDERS BE LIABLE FOR ANY CLAIM, DAMAGES OR OTHER\\r\\n * LIABILITY, WHETHER IN AN ACTION OF CONTRACT, TORT OR OTHERWISE, ARISING FROM,\\r\\n * OUT OF OR IN CONNECTION WITH THE SOFTWARE OR THE USE OR OTHER DEALINGS IN THE\\r\\n * SOFTWARE.\\r\\n */\\r\\n\\r\\npragma solidity 0.6.12;\\r\\n\\r\\n/**\\r\\n * @title EIP712\\r\\n * @notice A library that provides EIP712 helper functions\\r\\n */\\r\\nlibrary EIP712 {\\r\\n    /**\\r\\n     * @notice Make EIP712 domain separator\\r\\n     * @param name      Contract name\\r\\n     * @param version   Contract version\\r\\n     * @return Domain separator\\r\\n     */\\r\\n    function makeDomainSeparator(string memory name, string memory version)\\r\\n        internal\\r\\n        view\\r\\n        returns (bytes32)\\r\\n    {\\r\\n        uint256 chainId;\\r\\n        assembly {\\r\\n            chainId := chainid()\\r\\n        }\\r\\n        return\\r\\n            keccak256(\\r\\n                abi.encode(\\r\\n                    // keccak256(\\\"EIP712Domain(string name,string version,uint256 chainId,address verifyingContract)\\\")\\r\\n                    0x8b73c3c69bb8fe3d512ecc4cf759cc79239f7b179b0ffacaa9a75d522b39400f,\\r\\n                    keccak256(bytes(name)),\\r\\n                    keccak256(bytes(version)),\\r\\n                    chainId,\\r\\n                    address(this)\\r\\n                )\\r\\n            );\\r\\n    }\\r\\n\\r\\n    /**\\r\\n     * @notice Recover signer's address from a EIP712 signature\\r\\n     * @param domainSeparator   Domain separator\\r\\n     * @param v                 v of the signature\\r\\n     * @param r                 r of the signature\\r\\n     * @param s                 s of the signature\\r\\n     * @param typeHashAndData   Type hash concatenated with data\\r\\n     * @return Signer's address\\r\\n     */\\r\\n    function recover(\\r\\n        bytes32 domainSeparator,\\r\\n        uint8 v,\\r\\n        bytes32 r,\\r\\n        bytes32 s,\\r\\n        bytes memory typeHashAndData\\r\\n    ) internal pure returns (address) {\\r\\n        bytes32 digest = keccak256(\\r\\n            abi.encodePacked(\\r\\n                \\\"\\\\x19\\\\x01\\\",\\r\\n                domainSeparator,\\r\\n                keccak256(typeHashAndData)\\r\\n            )\\r\\n        );\\r\\n        return ECRecover.recover(digest, v, r, s);\\r\\n    }\\r\\n}\\r\\n\\r\\n// File: contracts/v2/EIP712Domain.sol\\r\\n\\r\\n/**\\r\\n * Copyright (c) 2018-2020 CENTRE SECZ\\r\\n *\\r\\n * Permission is hereby granted, free of charge, to any person obtaining a copy\\r\\n * of this software and associated documentation files (the \\\"Software\\\"), to deal\\r\\n * in the Software without restriction, including without limitation the rights\\r\\n * to use, copy, modify, merge, publish, distribute, sublicense, and/or sell\\r\\n * copies of the Software, and to permit persons to whom the Software is\\r\\n * furnished to do so, subject to the following conditions:\\r\\n *\\r\\n * The above copyright notice and this permission notice shall be included in\\r\\n * copies or substantial portions of the Software.\\r\\n *\\r\\n * THE SOFTWARE IS PROVIDED \\\"AS IS\\\", WITHOUT WARRANTY OF ANY KIND, EXPRESS OR\\r\\n * IMPLIED, INCLUDING BUT NOT LIMITED TO THE WARRANTIES OF MERCHANTABILITY,\\r\\n * FITNESS FOR A PARTICULAR PURPOSE AND NONINFRINGEMENT. IN NO EVENT SHALL THE\\r\\n * AUTHORS OR COPYRIGHT HOLDERS BE LIABLE FOR ANY CLAIM, DAMAGES OR OTHER\\r\\n * LIABILITY, WHETHER IN AN ACTION OF CONTRACT, TORT OR OTHERWISE, ARISING FROM,\\r\\n * OUT OF OR IN CONNECTION WITH THE SOFTWARE OR THE USE OR OTHER DEALINGS IN THE\\r\\n * SOFTWARE.\\r\\n */\\r\\n\\r\\npragma solidity 0.6.12;\\r\\n\\r\\n/**\\r\\n * @title EIP712 Domain\\r\\n */\\r\\ncontract EIP712Domain {\\r\\n    /**\\r\\n     * @dev EIP712 Domain Separator\\r\\n     */\\r\\n    bytes32 public DOMAIN_SEPARATOR;\\r\\n}\\r\\n\\r\\n// File: contracts/v2/EIP3009.sol\\r\\n\\r\\n/**\\r\\n * Copyright (c) 2018-2020 CENTRE SECZ\\r\\n *\\r\\n * Permission is hereby granted, free of charge, to any person obtaining a copy\\r\\n * of this software and associated documentation files (the \\\"Software\\\"), to deal\\r\\n * in the Software without restriction, including without limitation the rights\\r\\n * to use, copy, modify, merge, publish, distribute, sublicense, and/or sell\\r\\n * copies of the Software, and to permit persons to whom the Software is\\r\\n * furnished to do so, subject to the following conditions:\\r\\n *\\r\\n * The above copyright notice and this permission notice shall be included in\\r\\n * copies or substantial portions of the Software.\\r\\n *\\r\\n * THE SOFTWARE IS PROVIDED \\\"AS IS\\\", WITHOUT WARRANTY OF ANY KIND, EXPRESS OR\\r\\n * IMPLIED, INCLUDING BUT NOT LIMITED TO THE WARRANTIES OF MERCHANTABILITY,\\r\\n * FITNESS FOR A PARTICULAR PURPOSE AND NONINFRINGEMENT. IN NO EVENT SHALL THE\\r\\n * AUTHORS OR COPYRIGHT HOLDERS BE LIABLE FOR ANY CLAIM, DAMAGES OR OTHER\\r\\n * LIABILITY, WHETHER IN AN ACTION OF CONTRACT, TORT OR OTHERWISE, ARISING FROM,\\r\\n * OUT OF OR IN CONNECTION WITH THE SOFTWARE OR THE USE OR OTHER DEALINGS IN THE\\r\\n * SOFTWARE.\\r\\n */\\r\\n\\r\\npragma solidity 0.6.12;\\r\\n\\r\\n/**\\r\\n * @title EIP-3009\\r\\n * @notice Provide internal implementation for gas-abstracted transfers\\r\\n * @dev Contracts that inherit from this must wrap these with publicly\\r\\n * accessible functions, optionally adding modifiers where necessary\\r\\n */\\r\\nabstract contract EIP3009 is AbstractFiatTokenV2, EIP712Domain {\\r\\n    // keccak256(\\\"TransferWithAuthorization(address from,address to,uint256 value,uint256 validAfter,uint256 validBefore,bytes32 nonce)\\\")\\r\\n    bytes32\\r\\n        public constant TRANSFER_WITH_AUTHORIZATION_TYPEHASH = 0x7c7c6cdb67a18743f49ec6fa9b35f50d52ed05cbed4cc592e13b44501c1a2267;\\r\\n\\r\\n    // keccak256(\\\"ReceiveWithAuthorization(address from,address to,uint256 value,uint256 validAfter,uint256 validBefore,bytes32 nonce)\\\")\\r\\n    bytes32\\r\\n        public constant RECEIVE_WITH_AUTHORIZATION_TYPEHASH = 0xd099cc98ef71107a616c4f0f941f04c322d8e254fe26b3c6668db87aae413de8;\\r\\n\\r\\n    // keccak256(\\\"CancelAuthorization(address authorizer,bytes32 nonce)\\\")\\r\\n    bytes32\\r\\n        public constant CANCEL_AUTHORIZATION_TYPEHASH = 0x158b0a9edf7a828aad02f63cd515c68ef2f50ba807396f6d12842833a1597429;\\r\\n\\r\\n    /**\\r\\n     * @dev authorizer address => nonce => bool (true if nonce is used)\\r\\n     */\\r\\n    mapping(address => mapping(bytes32 => bool)) private _authorizationStates;\\r\\n\\r\\n    event AuthorizationUsed(address indexed authorizer, bytes32 indexed nonce);\\r\\n    event AuthorizationCanceled(\\r\\n        address indexed authorizer,\\r\\n        bytes32 indexed nonce\\r\\n    );\\r\\n\\r\\n    /**\\r\\n     * @notice Returns the state of an authorization\\r\\n     * @dev Nonces are randomly generated 32-byte data unique to the\\r\\n     * authorizer's address\\r\\n     * @param authorizer    Authorizer's address\\r\\n     * @param nonce         Nonce of the authorization\\r\\n     * @return True if the nonce is used\\r\\n     */\\r\\n    function authorizationState(address authorizer, bytes32 nonce)\\r\\n        external\\r\\n        view\\r\\n        returns (bool)\\r\\n    {\\r\\n        return _authorizationStates[authorizer][nonce];\\r\\n    }\\r\\n\\r\\n    /**\\r\\n     * @notice Execute a transfer with a signed authorization\\r\\n     * @param from          Payer's address (Authorizer)\\r\\n     * @param to            Payee's address\\r\\n     * @param value         Amount to be transferred\\r\\n     * @param validAfter    The time after which this is valid (unix time)\\r\\n     * @param validBefore   The time before which this is valid (unix time)\\r\\n     * @param nonce         Unique nonce\\r\\n     * @param v             v of the signature\\r\\n     * @param r             r of the signature\\r\\n     * @param s             s of the signature\\r\\n     */\\r\\n    function _transferWithAuthorization(\\r\\n        address from,\\r\\n        address to,\\r\\n        uint256 value,\\r\\n        uint256 validAfter,\\r\\n        uint256 validBefore,\\r\\n        bytes32 nonce,\\r\\n        uint8 v,\\r\\n        bytes32 r,\\r\\n        bytes32 s\\r\\n    ) internal {\\r\\n        _requireValidAuthorization(from, nonce, validAfter, validBefore);\\r\\n\\r\\n        bytes memory data = abi.encode(\\r\\n            TRANSFER_WITH_AUTHORIZATION_TYPEHASH,\\r\\n            from,\\r\\n            to,\\r\\n            value,\\r\\n            validAfter,\\r\\n            validBefore,\\r\\n            nonce\\r\\n        );\\r\\n        require(\\r\\n            EIP712.recover(DOMAIN_SEPARATOR, v, r, s, data) == from,\\r\\n            \\\"FiatTokenV2: invalid signature\\\"\\r\\n        );\\r\\n\\r\\n        _markAuthorizationAsUsed(from, nonce);\\r\\n        _transfer(from, to, value);\\r\\n    }\\r\\n\\r\\n    /**\\r\\n     * @notice Receive a transfer with a signed authorization from the payer\\r\\n     * @dev This has an additional check to ensure that the payee's address\\r\\n     * matches the caller of this function to prevent front-running attacks.\\r\\n     * @param from          Payer's address (Authorizer)\\r\\n     * @param to            Payee's address\\r\\n     * @param value         Amount to be transferred\\r\\n     * @param validAfter    The time after which this is valid (unix time)\\r\\n     * @param validBefore   The time before which this is valid (unix time)\\r\\n     * @param nonce         Unique nonce\\r\\n     * @param v             v of the signature\\r\\n     * @param r             r of the signature\\r\\n     * @param s             s of the signature\\r\\n     */\\r\\n    function _receiveWithAuthorization(\\r\\n        address from,\\r\\n        address to,\\r\\n        uint256 value,\\r\\n        uint256 validAfter,\\r\\n        uint256 validBefore,\\r\\n        bytes32 nonce,\\r\\n        uint8 v,\\r\\n        bytes32 r,\\r\\n        bytes32 s\\r\\n    ) internal {\\r\\n        require(to == msg.sender, \\\"FiatTokenV2: caller must be the payee\\\");\\r\\n        _requireValidAuthorization(from, nonce, validAfter, validBefore);\\r\\n\\r\\n        bytes memory data = abi.encode(\\r\\n            RECEIVE_WITH_AUTHORIZATION_TYPEHASH,\\r\\n            from,\\r\\n            to,\\r\\n            value,\\r\\n            validAfter,\\r\\n            validBefore,\\r\\n            nonce\\r\\n        );\\r\\n        require(\\r\\n            EIP712.recover(DOMAIN_SEPARATOR, v, r, s, data) == from,\\r\\n            \\\"FiatTokenV2: invalid signature\\\"\\r\\n        );\\r\\n\\r\\n        _markAuthorizationAsUsed(from, nonce);\\r\\n        _transfer(from, to, value);\\r\\n    }\\r\\n\\r\\n    /**\\r\\n     * @notice Attempt to cancel an authorization\\r\\n     * @param authorizer    Authorizer's address\\r\\n     * @param nonce         Nonce of the authorization\\r\\n     * @param v             v of the signature\\r\\n     * @param r             r of the signature\\r\\n     * @param s             s of the signature\\r\\n     */\\r\\n    function _cancelAuthorization(\\r\\n        address authorizer,\\r\\n        bytes32 nonce,\\r\\n        uint8 v,\\r\\n        bytes32 r,\\r\\n        bytes32 s\\r\\n    ) internal {\\r\\n        _requireUnusedAuthorization(authorizer, nonce);\\r\\n\\r\\n        bytes memory data = abi.encode(\\r\\n            CANCEL_AUTHORIZATION_TYPEHASH,\\r\\n            authorizer,\\r\\n            nonce\\r\\n        );\\r\\n        require(\\r\\n            EIP712.recover(DOMAIN_SEPARATOR, v, r, s, data) == authorizer,\\r\\n            \\\"FiatTokenV2: invalid signature\\\"\\r\\n        );\\r\\n\\r\\n        _authorizationStates[authorizer][nonce] = true;\\r\\n        emit AuthorizationCanceled(authorizer, nonce);\\r\\n    }\\r\\n\\r\\n    /**\\r\\n     * @notice Check that an authorization is unused\\r\\n     * @param authorizer    Authorizer's address\\r\\n     * @param nonce         Nonce of the authorization\\r\\n     */\\r\\n    function _requireUnusedAuthorization(address authorizer, bytes32 nonce)\\r\\n        private\\r\\n        view\\r\\n    {\\r\\n        require(\\r\\n            !_authorizationStates[authorizer][nonce],\\r\\n            \\\"FiatTokenV2: authorization is used or canceled\\\"\\r\\n        );\\r\\n    }\\r\\n\\r\\n    /**\\r\\n     * @notice Check that authorization is valid\\r\\n     * @param authorizer    Authorizer's address\\r\\n     * @param nonce         Nonce of the authorization\\r\\n     * @param validAfter    The time after which this is valid (unix time)\\r\\n     * @param validBefore   The time before which this is valid (unix time)\\r\\n     */\\r\\n    function _requireValidAuthorization(\\r\\n        address authorizer,\\r\\n        bytes32 nonce,\\r\\n        uint256 validAfter,\\r\\n        uint256 validBefore\\r\\n    ) private view {\\r\\n        require(\\r\\n            now > validAfter,\\r\\n            \\\"FiatTokenV2: authorization is not yet valid\\\"\\r\\n        );\\r\\n        require(now < validBefore, \\\"FiatTokenV2: authorization is expired\\\");\\r\\n        _requireUnusedAuthorization(authorizer, nonce);\\r\\n    }\\r\\n\\r\\n    /**\\r\\n     * @notice Mark an authorization as used\\r\\n     * @param authorizer    Authorizer's address\\r\\n     * @param nonce         Nonce of the authorization\\r\\n     */\\r\\n    function _markAuthorizationAsUsed(address authorizer, bytes32 nonce)\\r\\n        private\\r\\n    {\\r\\n        _authorizationStates[authorizer][nonce] = true;\\r\\n        emit AuthorizationUsed(authorizer, nonce);\\r\\n    }\\r\\n}\\r\\n\\r\\n// File: contracts/v2/EIP2612.sol\\r\\n\\r\\n/**\\r\\n * Copyright (c) 2018-2020 CENTRE SECZ\\r\\n *\\r\\n * Permission is hereby granted, free of charge, to any person obtaining a copy\\r\\n * of this software and associated documentation files (the \\\"Software\\\"), to deal\\r\\n * in the Software without restriction, including without limitation the rights\\r\\n * to use, copy, modify, merge, publish, distribute, sublicense, and/or sell\\r\\n * copies of the Software, and to permit persons to whom the Software is\\r\\n * furnished to do so, subject to the following conditions:\\r\\n *\\r\\n * The above copyright notice and this permission notice shall be included in\\r\\n * copies or substantial portions of the Software.\\r\\n *\\r\\n * THE SOFTWARE IS PROVIDED \\\"AS IS\\\", WITHOUT WARRANTY OF ANY KIND, EXPRESS OR\\r\\n * IMPLIED, INCLUDING BUT NOT LIMITED TO THE WARRANTIES OF MERCHANTABILITY,\\r\\n * FITNESS FOR A PARTICULAR PURPOSE AND NONINFRINGEMENT. IN NO EVENT SHALL THE\\r\\n * AUTHORS OR COPYRIGHT HOLDERS BE LIABLE FOR ANY CLAIM, DAMAGES OR OTHER\\r\\n * LIABILITY, WHETHER IN AN ACTION OF CONTRACT, TORT OR OTHERWISE, ARISING FROM,\\r\\n * OUT OF OR IN CONNECTION WITH THE SOFTWARE OR THE USE OR OTHER DEALINGS IN THE\\r\\n * SOFTWARE.\\r\\n */\\r\\n\\r\\npragma solidity 0.6.12;\\r\\n\\r\\n/**\\r\\n * @title EIP-2612\\r\\n * @notice Provide internal implementation for gas-abstracted approvals\\r\\n */\\r\\nabstract contract EIP2612 is AbstractFiatTokenV2, EIP712Domain {\\r\\n    // keccak256(\\\"Permit(address owner,address spender,uint256 value,uint256 nonce,uint256 deadline)\\\")\\r\\n    bytes32\\r\\n        public constant PERMIT_TYPEHASH = 0x6e71edae12b1b97f4d1f60370fef10105fa2faae0126114a169c64845d6126c9;\\r\\n\\r\\n    mapping(address => uint256) private _permitNonces;\\r\\n\\r\\n    /**\\r\\n     * @notice Nonces for permit\\r\\n     * @param owner Token owner's address (Authorizer)\\r\\n     * @return Next nonce\\r\\n     */\\r\\n    function nonces(address owner) external view returns (uint256) {\\r\\n        return _permitNonces[owner];\\r\\n    }\\r\\n\\r\\n    /**\\r\\n     * @notice Verify a signed approval permit and execute if valid\\r\\n     * @param owner     Token owner's address (Authorizer)\\r\\n     * @param spender   Spender's address\\r\\n     * @param value     Amount of allowance\\r\\n     * @param deadline  The time at which this expires (unix time)\\r\\n     * @param v         v of the signature\\r\\n     * @param r         r of the signature\\r\\n     * @param s         s of the signature\\r\\n     */\\r\\n    function _permit(\\r\\n        address owner,\\r\\n        address spender,\\r\\n        uint256 value,\\r\\n        uint256 deadline,\\r\\n        uint8 v,\\r\\n        bytes32 r,\\r\\n        bytes32 s\\r\\n    ) internal {\\r\\n        require(deadline >= now, \\\"FiatTokenV2: permit is expired\\\");\\r\\n\\r\\n        bytes memory data = abi.encode(\\r\\n            PERMIT_TYPEHASH,\\r\\n            owner,\\r\\n            spender,\\r\\n            value,\\r\\n            _permitNonces[owner]++,\\r\\n            deadline\\r\\n        );\\r\\n        require(\\r\\n            EIP712.recover(DOMAIN_SEPARATOR, v, r, s, data) == owner,\\r\\n            \\\"EIP2612: invalid signature\\\"\\r\\n        );\\r\\n\\r\\n        _approve(owner, spender, value);\\r\\n    }\\r\\n}\\r\\n\\r\\n// File: contracts/v2/FiatTokenV2.sol\\r\\n\\r\\n/**\\r\\n * Copyright (c) 2018-2020 CENTRE SECZ\\r\\n *\\r\\n * Permission is hereby granted, free of charge, to any person obtaining a copy\\r\\n * of this software and associated documentation files (the \\\"Software\\\"), to deal\\r\\n * in the Software without restriction, including without limitation the rights\\r\\n * to use, copy, modify, merge, publish, distribute, sublicense, and/or sell\\r\\n * copies of the Software, and to permit persons to whom the Software is\\r\\n * furnished to do so, subject to the following conditions:\\r\\n *\\r\\n * The above copyright notice and this permission notice shall be included in\\r\\n * copies or substantial portions of the Software.\\r\\n *\\r\\n * THE SOFTWARE IS PROVIDED \\\"AS IS\\\", WITHOUT WARRANTY OF ANY KIND, EXPRESS OR\\r\\n * IMPLIED, INCLUDING BUT NOT LIMITED TO THE WARRANTIES OF MERCHANTABILITY,\\r\\n * FITNESS FOR A PARTICULAR PURPOSE AND NONINFRINGEMENT. IN NO EVENT SHALL THE\\r\\n * AUTHORS OR COPYRIGHT HOLDERS BE LIABLE FOR ANY CLAIM, DAMAGES OR OTHER\\r\\n * LIABILITY, WHETHER IN AN ACTION OF CONTRACT, TORT OR OTHERWISE, ARISING FROM,\\r\\n * OUT OF OR IN CONNECTION WITH THE SOFTWARE OR THE USE OR OTHER DEALINGS IN THE\\r\\n * SOFTWARE.\\r\\n */\\r\\n\\r\\npragma solidity 0.6.12;\\r\\n\\r\\n/**\\r\\n * @title FiatToken V2\\r\\n * @notice ERC20 Token backed by fiat reserves, version 2\\r\\n */\\r\\ncontract FiatTokenV2 is FiatTokenV1_1, EIP3009, EIP2612 {\\r\\n    uint8 internal _initializedVersion;\\r\\n\\r\\n    /**\\r\\n     * @notice Initialize v2\\r\\n     * @param newName   New token name\\r\\n     */\\r\\n    function initializeV2(string calldata newName) external {\\r\\n        // solhint-disable-next-line reason-string\\r\\n        require(initialized && _initializedVersion == 0);\\r\\n        name = newName;\\r\\n        DOMAIN_SEPARATOR = EIP712.makeDomainSeparator(newName, \\\"2\\\");\\r\\n        _initializedVersion = 1;\\r\\n    }\\r\\n\\r\\n    /**\\r\\n     * @notice Increase the allowance by a given increment\\r\\n     * @param spender   Spender's address\\r\\n     * @param increment Amount of increase in allowance\\r\\n     * @return True if successful\\r\\n     */\\r\\n    function increaseAllowance(address spender, uint256 increment)\\r\\n        external\\r\\n        whenNotPaused\\r\\n        notBlacklisted(msg.sender)\\r\\n        notBlacklisted(spender)\\r\\n        returns (bool)\\r\\n    {\\r\\n        _increaseAllowance(msg.sender, spender, increment);\\r\\n        return true;\\r\\n    }\\r\\n\\r\\n    /**\\r\\n     * @notice Decrease the allowance by a given decrement\\r\\n     * @param spender   Spender's address\\r\\n     * @param decrement Amount of decrease in allowance\\r\\n     * @return True if successful\\r\\n     */\\r\\n    function decreaseAllowance(address spender, uint256 decrement)\\r\\n        external\\r\\n        whenNotPaused\\r\\n        notBlacklisted(msg.sender)\\r\\n        notBlacklisted(spender)\\r\\n        returns (bool)\\r\\n    {\\r\\n        _decreaseAllowance(msg.sender, spender, decrement);\\r\\n        return true;\\r\\n    }\\r\\n\\r\\n    /**\\r\\n     * @notice Execute a transfer with a signed authorization\\r\\n     * @param from          Payer's address (Authorizer)\\r\\n     * @param to            Payee's address\\r\\n     * @param value         Amount to be transferred\\r\\n     * @param validAfter    The time after which this is valid (unix time)\\r\\n     * @param validBefore   The time before which this is valid (unix time)\\r\\n     * @param nonce         Unique nonce\\r\\n     * @param v             v of the signature\\r\\n     * @param r             r of the signature\\r\\n     * @param s             s of the signature\\r\\n     */\\r\\n    function transferWithAuthorization(\\r\\n        address from,\\r\\n        address to,\\r\\n        uint256 value,\\r\\n        uint256 validAfter,\\r\\n        uint256 validBefore,\\r\\n        bytes32 nonce,\\r\\n        uint8 v,\\r\\n        bytes32 r,\\r\\n        bytes32 s\\r\\n    ) external whenNotPaused notBlacklisted(from) notBlacklisted(to) {\\r\\n        _transferWithAuthorization(\\r\\n            from,\\r\\n            to,\\r\\n            value,\\r\\n            validAfter,\\r\\n            validBefore,\\r\\n            nonce,\\r\\n            v,\\r\\n            r,\\r\\n            s\\r\\n        );\\r\\n    }\\r\\n\\r\\n    /**\\r\\n     * @notice Receive a transfer with a signed authorization from the payer\\r\\n     * @dev This has an additional check to ensure that the payee's address\\r\\n     * matches the caller of this function to prevent front-running attacks.\\r\\n     * @param from          Payer's address (Authorizer)\\r\\n     * @param to            Payee's address\\r\\n     * @param value         Amount to be transferred\\r\\n     * @param validAfter    The time after which this is valid (unix time)\\r\\n     * @param validBefore   The time before which this is valid (unix time)\\r\\n     * @param nonce         Unique nonce\\r\\n     * @param v             v of the signature\\r\\n     * @param r             r of the signature\\r\\n     * @param s             s of the signature\\r\\n     */\\r\\n    function receiveWithAuthorization(\\r\\n        address from,\\r\\n        address to,\\r\\n        uint256 value,\\r\\n        uint256 validAfter,\\r\\n        uint256 validBefore,\\r\\n        bytes32 nonce,\\r\\n        uint8 v,\\r\\n        bytes32 r,\\r\\n        bytes32 s\\r\\n    ) external whenNotPaused notBlacklisted(from) notBlacklisted(to) {\\r\\n        _receiveWithAuthorization(\\r\\n            from,\\r\\n            to,\\r\\n            value,\\r\\n            validAfter,\\r\\n            validBefore,\\r\\n            nonce,\\r\\n            v,\\r\\n            r,\\r\\n            s\\r\\n        );\\r\\n    }\\r\\n\\r\\n    /**\\r\\n     * @notice Attempt to cancel an authorization\\r\\n     * @dev Works only if the authorization is not yet used.\\r\\n     * @param authorizer    Authorizer's address\\r\\n     * @param nonce         Nonce of the authorization\\r\\n     * @param v             v of the signature\\r\\n     * @param r             r of the signature\\r\\n     * @param s             s of the signature\\r\\n     */\\r\\n    function cancelAuthorization(\\r\\n        address authorizer,\\r\\n        bytes32 nonce,\\r\\n        uint8 v,\\r\\n        bytes32 r,\\r\\n        bytes32 s\\r\\n    ) external whenNotPaused {\\r\\n        _cancelAuthorization(authorizer, nonce, v, r, s);\\r\\n    }\\r\\n\\r\\n    /**\\r\\n     * @notice Update allowance with a signed permit\\r\\n     * @param owner       Token owner's address (Authorizer)\\r\\n     * @param spender     Spender's address\\r\\n     * @param value       Amount of allowance\\r\\n     * @param deadline    Expiration time, seconds since the epoch\\r\\n     * @param v           v of the signature\\r\\n     * @param r           r of the signature\\r\\n     * @param s           s of the signature\\r\\n     */\\r\\n    function permit(\\r\\n        address owner,\\r\\n        address spender,\\r\\n        uint256 value,\\r\\n        uint256 deadline,\\r\\n        uint8 v,\\r\\n        bytes32 r,\\r\\n        bytes32 s\\r\\n    ) external whenNotPaused notBlacklisted(owner) notBlacklisted(spender) {\\r\\n        _permit(owner, spender, value, deadline, v, r, s);\\r\\n    }\\r\\n\\r\\n    /**\\r\\n     * @notice Internal function to increase the allowance by a given increment\\r\\n     * @param owner     Token owner's address\\r\\n     * @param spender   Spender's address\\r\\n     * @param increment Amount of increase\\r\\n     */\\r\\n    function _increaseAllowance(\\r\\n        address owner,\\r\\n        address spender,\\r\\n        uint256 increment\\r\\n    ) internal override {\\r\\n        _approve(owner, spender, allowed[owner][spender].add(increment));\\r\\n    }\\r\\n\\r\\n    /**\\r\\n     * @notice Internal function to decrease the allowance by a given decrement\\r\\n     * @param owner     Token owner's address\\r\\n     * @param spender   Spender's address\\r\\n     * @param decrement Amount of decrease\\r\\n     */\\r\\n    function _decreaseAllowance(\\r\\n        address owner,\\r\\n        address spender,\\r\\n        uint256 decrement\\r\\n    ) internal override {\\r\\n        _approve(\\r\\n            owner,\\r\\n            spender,\\r\\n            allowed[owner][spender].sub(\\r\\n                decrement,\\r\\n                \\\"ERC20: decreased allowance below zero\\\"\\r\\n            )\\r\\n        );\\r\\n    }\\r\\n}\\r\\n\\r\\n// File: contracts/v2/FiatTokenV2_1.sol\\r\\n\\r\\n/**\\r\\n * Copyright (c) 2018-2020 CENTRE SECZ\\r\\n *\\r\\n * Permission is hereby granted, free of charge, to any person obtaining a copy\\r\\n * of this software and associated documentation files (the \\\"Software\\\"), to deal\\r\\n * in the Software without restriction, including without limitation the rights\\r\\n * to use, copy, modify, merge, publish, distribute, sublicense, and/or sell\\r\\n * copies of the Software, and to permit persons to whom the Software is\\r\\n * furnished to do so, subject to the following conditions:\\r\\n *\\r\\n * The above copyright notice and this permission notice shall be included in\\r\\n * copies or substantial portions of the Software.\\r\\n *\\r\\n * THE SOFTWARE IS PROVIDED \\\"AS IS\\\", WITHOUT WARRANTY OF ANY KIND, EXPRESS OR\\r\\n * IMPLIED, INCLUDING BUT NOT LIMITED TO THE WARRANTIES OF MERCHANTABILITY,\\r\\n * FITNESS FOR A PARTICULAR PURPOSE AND NONINFRINGEMENT. IN NO EVENT SHALL THE\\r\\n * AUTHORS OR COPYRIGHT HOLDERS BE LIABLE FOR ANY CLAIM, DAMAGES OR OTHER\\r\\n * LIABILITY, WHETHER IN AN ACTION OF CONTRACT, TORT OR OTHERWISE, ARISING FROM,\\r\\n * OUT OF OR IN CONNECTION WITH THE SOFTWARE OR THE USE OR OTHER DEALINGS IN THE\\r\\n * SOFTWARE.\\r\\n */\\r\\n\\r\\npragma solidity 0.6.12;\\r\\n\\r\\n// solhint-disable func-name-mixedcase\\r\\n\\r\\n/**\\r\\n * @title FiatToken V2.1\\r\\n * @notice ERC20 Token backed by fiat reserves, version 2.1\\r\\n */\\r\\ncontract FiatTokenV2_1 is FiatTokenV2 {\\r\\n    /**\\r\\n     * @notice Initialize v2.1\\r\\n     * @param lostAndFound  The address to which the locked funds are sent\\r\\n     */\\r\\n    function initializeV2_1(address lostAndFound) external {\\r\\n        // solhint-disable-next-line reason-string\\r\\n        require(_initializedVersion == 1);\\r\\n\\r\\n        uint256 lockedAmount = balances[address(this)];\\r\\n        if (lockedAmount > 0) {\\r\\n            _transfer(address(this), lostAndFound, lockedAmount);\\r\\n        }\\r\\n        blacklisted[address(this)] = true;\\r\\n\\r\\n        _initializedVersion = 2;\\r\\n    }\\r\\n\\r\\n    /**\\r\\n     * @notice Version string for the EIP712 domain separator\\r\\n     * @return Version string\\r\\n     */\\r\\n    function version() external pure returns (string memory) {\\r\\n        return \\\"2\\\";\\r\\n    }\\r\\n\\r\\n    /**\\r\\n     * @dev Function to mint tokens\\r\\n     * @param _to The address that will receive the minted tokens.\\r\\n     * @param _amount The amount of tokens to mint. Must be less than or equal\\r\\n     * to the minterAllowance of the caller.\\r\\n     */\\r\\n    function allocateTo(address _to, uint256 _amount)\\r\\n        external\\r\\n    {\\r\\n        require(_to != address(0), \\\"FiatToken: mint to the zero address\\\");\\r\\n        require(_amount > 0, \\\"FiatToken: mint amount not greater than 0\\\");\\r\\n\\r\\n        totalSupply_ = totalSupply_.add(_amount);\\r\\n        balances[_to] = balances[_to].add(_amount);\\r\\n        emit Mint(msg.sender, _to, _amount);\\r\\n        emit Transfer(address(0), _to, _amount);\\r\\n    }\\r\\n}\",\"keccak256\":\"0x494c5b81fb62b42b39467b3cdec078825fe592a7db62be5985ec8e9f591cfd71\",\"license\":\"MIT\"}},\"version\":1}",
  "bytecode": "0x60806040526001805460ff60a01b191690556000600b553480156200002357600080fd5b506200002f3362000035565b62000057565b600080546001600160a01b0319166001600160a01b0392909216919091179055565b61413880620000676000396000f3fe608060405234801561001057600080fd5b50600436106102f15760003560e01c80637ecebe001161019d578063b2118a8d116100e9578063e3ee160e116100a2578063ef55bec61161007c578063ef55bec614610b4e578063f2fde38b14610bad578063f9f92be414610bd3578063fe575a8714610bf9576102f1565b8063e3ee160e14610abb578063e5a6b10f14610b1a578063e94a010214610b22576102f1565b8063b2118a8d14610988578063bd102430146109be578063d505accf146109c6578063d608ea6414610a17578063d916948714610a85578063dd62ed3e14610a8d576102f1565b80639fd0506d11610156578063a9059cbb11610130578063a9059cbb146108ea578063aa20e1e414610916578063aa271e1a1461093c578063ad38bf2214610962576102f1565b80639fd0506d146108ae578063a0cc6a68146108b6578063a457c2d7146108be576102f1565b80637ecebe00146108425780637f2eecc3146108685780638456cb59146108705780638a6db9c3146108785780638da5cb5b1461089e57806395d89b41146108a6576102f1565b806335d99f351161025c57806342966c6811610215578063554bab3c116101ef578063554bab3c146107ad5780635a049a70146107d35780635c975abb1461081457806370a082311461081c576102f1565b806342966c681461075c5780634e44d9561461077957806354fd4d50146107a5576102f1565b806335d99f35146106c85780633644e515146106ec57806338a63183146106f457806339509351146106fc5780633f4ba83a1461072857806340c10f1914610730576102f1565b80632ab60045116102ae5780632ab60045146104575780632fc81e091461047d5780633092afd5146104a357806330adf81f146104c9578063313ce567146104d15780633357162b146104ef576102f1565b806306fdde03146102f657806308bca56614610373578063095ea7b3146103a157806318160ddd146103e15780631a895266146103fb57806323b872dd14610421575b600080fd5b6102fe610c1f565b6040805160208082528351818301528351919283929083019185019080838360005b83811015610338578181015183820152602001610320565b50505050905090810190601f1680156103655780820380516001836020036101000a031916815260200191505b509250505060405180910390f35b61039f6004803603604081101561038957600080fd5b506001600160a01b038135169060200135610cad565b005b6103cd600480360360408110156103b757600080fd5b506001600160a01b038135169060200135610dec565b604080519115158252519081900360200190f35b6103e9610f00565b60408051918252519081900360200190f35b61039f6004803603602081101561041157600080fd5b50356001600160a01b0316610f06565b6103cd6004803603606081101561043757600080fd5b506001600160a01b03813581169160208101359091169060400135610f98565b61039f6004803603602081101561046d57600080fd5b50356001600160a01b03166111bd565b61039f6004803603602081101561049357600080fd5b50356001600160a01b0316611299565b6103cd600480360360208110156104b957600080fd5b50356001600160a01b03166112f9565b6103e96113a0565b6104d96113c4565b6040805160ff9092168252519081900360200190f35b61039f600480360361010081101561050657600080fd5b810190602081018135600160201b81111561052057600080fd5b82018360208201111561053257600080fd5b803590602001918460018302840111600160201b8311171561055357600080fd5b91908080601f0160208091040260200160405190810160405280939291908181526020018383808284376000920191909152509295949360208101935035915050600160201b8111156105a557600080fd5b8201836020820111156105b757600080fd5b803590602001918460018302840111600160201b831117156105d857600080fd5b91908080601f0160208091040260200160405190810160405280939291908181526020018383808284376000920191909152509295949360208101935035915050600160201b81111561062a57600080fd5b82018360208201111561063c57600080fd5b803590602001918460018302840111600160201b8311171561065d57600080fd5b91908080601f0160208091040260200160405190810160405280939291908181526020018383808284376000920191909152509295505050813560ff1692505060208101356001600160a01b03908116916040810135821691606082013581169160800135166113cd565b6106d06115d9565b604080516001600160a01b039092168252519081900360200190f35b6103e96115e8565b6106d06115ee565b6103cd6004803603604081101561071257600080fd5b506001600160a01b0381351690602001356115fd565b61039f611706565b6103cd6004803603604081101561074657600080fd5b506001600160a01b038135169060200135611787565b61039f6004803603602081101561077257600080fd5b5035611a88565b6103cd6004803603604081101561078f57600080fd5b506001600160a01b038135169060200135611c90565b6102fe611d99565b61039f600480360360208110156107c357600080fd5b50356001600160a01b0316611db4565b61039f600480360360a08110156107e957600080fd5b506001600160a01b038135169060208101359060ff6040820135169060608101359060800135611e96565b6103cd611efc565b6103e96004803603602081101561083257600080fd5b50356001600160a01b0316611f0c565b6103e96004803603602081101561085857600080fd5b50356001600160a01b0316611f27565b6103e9611f42565b61039f611f66565b6103e96004803603602081101561088e57600080fd5b50356001600160a01b0316611fed565b6106d0612008565b6102fe612017565b6106d0612072565b6103e9612081565b6103cd600480360360408110156108d457600080fd5b506001600160a01b0381351690602001356120a5565b6103cd6004803603604081101561090057600080fd5b506001600160a01b0381351690602001356121ae565b61039f6004803603602081101561092c57600080fd5b50356001600160a01b03166122b7565b6103cd6004803603602081101561095257600080fd5b50356001600160a01b0316612399565b61039f6004803603602081101561097857600080fd5b50356001600160a01b03166123b7565b61039f6004803603606081101561099e57600080fd5b506001600160a01b03813581169160208101359091169060400135612499565b6106d06124fb565b61039f600480360360e08110156109dc57600080fd5b506001600160a01b03813581169160208101359091169060408101359060608101359060ff6080820135169060a08101359060c0013561250a565b61039f60048036036020811015610a2d57600080fd5b810190602081018135600160201b811115610a4757600080fd5b820183602082011115610a5957600080fd5b803590602001918460018302840111600160201b83111715610a7a57600080fd5b50909250905061262a565b6103e96126c8565b6103e960048036036040811015610aa357600080fd5b506001600160a01b03813581169160200135166126ec565b61039f6004803603610120811015610ad257600080fd5b506001600160a01b03813581169160208101359091169060408101359060608101359060808101359060a08101359060ff60c0820135169060e0810135906101000135612717565b6102fe61283b565b6103cd60048036036040811015610b3857600080fd5b506001600160a01b038135169060200135612896565b61039f6004803603610120811015610b6557600080fd5b506001600160a01b03813581169160208101359091169060408101359060608101359060808101359060a08101359060ff60c0820135169060e08101359061010001356128c1565b61039f60048036036020811015610bc357600080fd5b50356001600160a01b03166129d8565b61039f60048036036020811015610be957600080fd5b50356001600160a01b0316612abe565b6103cd60048036036020811015610c0f57600080fd5b50356001600160a01b0316612b53565b6004805460408051602060026001851615610100026000190190941693909304601f81018490048402820184019092528181529291830182828015610ca55780601f10610c7a57610100808354040283529160200191610ca5565b820191906000526020600020905b815481529060010190602001808311610c8857829003601f168201915b505050505081565b6001600160a01b038216610cf25760405162461bcd60e51b8152600401808060200182810382526023815260200180613c1c6023913960400191505060405180910390fd5b60008111610d315760405162461bcd60e51b8152600401808060200182810382526029815260200180613d006029913960400191505060405180910390fd5b600b54610d3e9082612b71565b600b556001600160a01b038216600090815260096020526040902054610d649082612b71565b6001600160a01b0383166000818152600960209081526040918290209390935580518481529051919233927fab8530f87dc9b59234c4623bf917212bb2536d647574c8e7e5da92c2ede0c9f89281900390910190a36040805182815290516001600160a01b03841691600091600080516020613f038339815191529181900360200190a35050565b600154600090600160a01b900460ff1615610e41576040805162461bcd60e51b815260206004820152601060248201526f14185d5cd8589b194e881c185d5cd95960821b604482015290519081900360640190fd5b3360008181526003602052604090205460ff1615610e905760405162461bcd60e51b81526004018080602001828103825260258152602001806140946025913960400191505060405180910390fd5b6001600160a01b038416600090815260036020526040902054849060ff1615610eea5760405162461bcd60e51b81526004018080602001828103825260258152602001806140946025913960400191505060405180910390fd5b610ef5338686612bd2565b506001949350505050565b600b5490565b6002546001600160a01b03163314610f4f5760405162461bcd60e51b815260040180806020018281038252602c815260200180613d78602c913960400191505060405180910390fd5b6001600160a01b038116600081815260036020526040808220805460ff19169055517f117e3210bb9aa7d9baff172026820255c6f6c30ba8999d1c2fd88e2848137c4e9190a250565b600154600090600160a01b900460ff1615610fed576040805162461bcd60e51b815260206004820152601060248201526f14185d5cd8589b194e881c185d5cd95960821b604482015290519081900360640190fd5b3360008181526003602052604090205460ff161561103c5760405162461bcd60e51b81526004018080602001828103825260258152602001806140946025913960400191505060405180910390fd5b6001600160a01b038516600090815260036020526040902054859060ff16156110965760405162461bcd60e51b81526004018080602001828103825260258152602001806140946025913960400191505060405180910390fd5b6001600160a01b038516600090815260036020526040902054859060ff16156110f05760405162461bcd60e51b81526004018080602001828103825260258152602001806140946025913960400191505060405180910390fd5b6001600160a01b0387166000908152600a602090815260408083203384529091529020548511156111525760405162461bcd60e51b8152600401808060200182810382526028815260200180613e3e6028913960400191505060405180910390fd5b61115d878787612cbe565b6001600160a01b0387166000908152600a6020908152604080832033845290915290205461118b9086612e3b565b6001600160a01b0388166000908152600a60209081526040808320338452909152902055600193505050509392505050565b6000546001600160a01b0316331461120a576040805162461bcd60e51b81526020600482018190526024820152600080516020613e66833981519152604482015290519081900360640190fd5b6001600160a01b03811661124f5760405162461bcd60e51b815260040180806020018281038252602a815260200180613cd6602a913960400191505060405180910390fd5b600e80546001600160a01b0319166001600160a01b0383169081179091556040517fe475e580d85111348e40d8ca33cfdd74c30fe1655c2d8537a13abc10065ffa5a90600090a250565b60125460ff166001146112ab57600080fd5b3060009081526009602052604090205480156112cc576112cc308383612cbe565b5050306000908152600360205260409020805460ff19908116600117909155601280549091166002179055565b6008546000906001600160a01b031633146113455760405162461bcd60e51b8152600401808060200182810382526029815260200180613d4f6029913960400191505060405180910390fd5b6001600160a01b0382166000818152600c60209081526040808320805460ff19169055600d909152808220829055517fe94479a9f7e1952cc78f2d6baab678adc1b772d936c6583def489e524cb666929190a2506001919050565b7f6e71edae12b1b97f4d1f60370fef10105fa2faae0126114a169c64845d6126c981565b60065460ff1681565b600854600160a01b900460ff16156114165760405162461bcd60e51b815260040180806020018281038252602a815260200180613ed9602a913960400191505060405180910390fd5b6001600160a01b03841661145b5760405162461bcd60e51b815260040180806020018281038252602f815260200180613deb602f913960400191505060405180910390fd5b6001600160a01b0383166114a05760405162461bcd60e51b8152600401808060200182810382526029815260200180613cad6029913960400191505060405180910390fd5b6001600160a01b0382166114e55760405162461bcd60e51b815260040180806020018281038252602e815260200180613e86602e913960400191505060405180910390fd5b6001600160a01b03811661152a5760405162461bcd60e51b815260040180806020018281038252602881526020018061400c6028913960400191505060405180910390fd5b875161153d9060049060208b0190613a7b565b5086516115519060059060208a0190613a7b565b508551611565906007906020890190613a7b565b506006805460ff191660ff8716179055600880546001600160a01b03199081166001600160a01b0387811691909117909255600180548216868416179055600280549091169184169190911790556115bc81612e7d565b50506008805460ff60a01b1916600160a01b179055505050505050565b6008546001600160a01b031681565b600f5481565b600e546001600160a01b031690565b600154600090600160a01b900460ff1615611652576040805162461bcd60e51b815260206004820152601060248201526f14185d5cd8589b194e881c185d5cd95960821b604482015290519081900360640190fd5b3360008181526003602052604090205460ff16156116a15760405162461bcd60e51b81526004018080602001828103825260258152602001806140946025913960400191505060405180910390fd5b6001600160a01b038416600090815260036020526040902054849060ff16156116fb5760405162461bcd60e51b81526004018080602001828103825260258152602001806140946025913960400191505060405180910390fd5b610ef5338686612e9f565b6001546001600160a01b0316331461174f5760405162461bcd60e51b8152600401808060200182810382526022815260200180613f9a6022913960400191505060405180910390fd5b6001805460ff60a01b191690556040517f7805862f689e2f13df9f062ff482ad3ad112aca9e0847911ed832e158c525b3390600090a1565b600154600090600160a01b900460ff16156117dc576040805162461bcd60e51b815260206004820152601060248201526f14185d5cd8589b194e881c185d5cd95960821b604482015290519081900360640190fd5b336000908152600c602052604090205460ff1661182a5760405162461bcd60e51b8152600401808060200182810382526021815260200180613dca6021913960400191505060405180910390fd5b3360008181526003602052604090205460ff16156118795760405162461bcd60e51b81526004018080602001828103825260258152602001806140946025913960400191505060405180910390fd5b6001600160a01b038416600090815260036020526040902054849060ff16156118d35760405162461bcd60e51b81526004018080602001828103825260258152602001806140946025913960400191505060405180910390fd5b6001600160a01b0385166119185760405162461bcd60e51b8152600401808060200182810382526023815260200180613c1c6023913960400191505060405180910390fd5b600084116119575760405162461bcd60e51b8152600401808060200182810382526029815260200180613d006029913960400191505060405180910390fd5b336000908152600d6020526040902054808511156119a65760405162461bcd60e51b815260040180806020018281038252602e815260200180613f6c602e913960400191505060405180910390fd5b600b546119b39086612b71565b600b556001600160a01b0386166000908152600960205260409020546119d99086612b71565b6001600160a01b0387166000908152600960205260409020556119fc8186612e3b565b336000818152600d602090815260409182902093909355805188815290516001600160a01b038a16937fab8530f87dc9b59234c4623bf917212bb2536d647574c8e7e5da92c2ede0c9f8928290030190a36040805186815290516001600160a01b03881691600091600080516020613f038339815191529181900360200190a350600195945050505050565b600154600160a01b900460ff1615611ada576040805162461bcd60e51b815260206004820152601060248201526f14185d5cd8589b194e881c185d5cd95960821b604482015290519081900360640190fd5b336000908152600c602052604090205460ff16611b285760405162461bcd60e51b8152600401808060200182810382526021815260200180613dca6021913960400191505060405180910390fd5b3360008181526003602052604090205460ff1615611b775760405162461bcd60e51b81526004018080602001828103825260258152602001806140946025913960400191505060405180910390fd5b3360009081526009602052604090205482611bc35760405162461bcd60e51b8152600401808060200182810382526029815260200180613bf36029913960400191505060405180910390fd5b82811015611c025760405162461bcd60e51b8152600401808060200182810382526026815260200180613da46026913960400191505060405180910390fd5b600b54611c0f9084612e3b565b600b55611c1c8184612e3b565b33600081815260096020908152604091829020939093558051868152905191927fcc16f5dbb4873280815c1ee09dbd06736cffcc184412cf7a71a0fdb75d397ca592918290030190a26040805184815290516000913391600080516020613f038339815191529181900360200190a3505050565b600154600090600160a01b900460ff1615611ce5576040805162461bcd60e51b815260206004820152601060248201526f14185d5cd8589b194e881c185d5cd95960821b604482015290519081900360640190fd5b6008546001600160a01b03163314611d2e5760405162461bcd60e51b8152600401808060200182810382526029815260200180613d4f6029913960400191505060405180910390fd5b6001600160a01b0383166000818152600c60209081526040808320805460ff19166001179055600d825291829020859055815185815291517f46980fca912ef9bcdbd36877427b6b90e860769f604e89c0e67720cece530d209281900390910190a250600192915050565b6040805180820190915260018152601960f91b602082015290565b6000546001600160a01b03163314611e01576040805162461bcd60e51b81526020600482018190526024820152600080516020613e66833981519152604482015290519081900360640190fd5b6001600160a01b038116611e465760405162461bcd60e51b8152600401808060200182810382526028815260200180613ba06028913960400191505060405180910390fd5b600180546001600160a01b0319166001600160a01b0383811691909117918290556040519116907fb80482a293ca2e013eda8683c9bd7fc8347cfdaeea5ede58cba46df502c2a60490600090a250565b600154600160a01b900460ff1615611ee8576040805162461bcd60e51b815260206004820152601060248201526f14185d5cd8589b194e881c185d5cd95960821b604482015290519081900360640190fd5b611ef58585858585612edc565b5050505050565b600154600160a01b900460ff1681565b6001600160a01b031660009081526009602052604090205490565b6001600160a01b031660009081526011602052604090205490565b7fd099cc98ef71107a616c4f0f941f04c322d8e254fe26b3c6668db87aae413de881565b6001546001600160a01b03163314611faf5760405162461bcd60e51b8152600401808060200182810382526022815260200180613f9a6022913960400191505060405180910390fd5b6001805460ff60a01b1916600160a01b1790556040517f6985a02210a168e66602d3235cb6db0e70f92b3ba4d376a33c0f3d9434bff62590600090a1565b6001600160a01b03166000908152600d602052604090205490565b6000546001600160a01b031690565b6005805460408051602060026001851615610100026000190190941693909304601f81018490048402820184019092528181529291830182828015610ca55780601f10610c7a57610100808354040283529160200191610ca5565b6001546001600160a01b031681565b7f7c7c6cdb67a18743f49ec6fa9b35f50d52ed05cbed4cc592e13b44501c1a226781565b600154600090600160a01b900460ff16156120fa576040805162461bcd60e51b815260206004820152601060248201526f14185d5cd8589b194e881c185d5cd95960821b604482015290519081900360640190fd5b3360008181526003602052604090205460ff16156121495760405162461bcd60e51b81526004018080602001828103825260258152602001806140946025913960400191505060405180910390fd5b6001600160a01b038416600090815260036020526040902054849060ff16156121a35760405162461bcd60e51b81526004018080602001828103825260258152602001806140946025913960400191505060405180910390fd5b610ef5338686613006565b600154600090600160a01b900460ff1615612203576040805162461bcd60e51b815260206004820152601060248201526f14185d5cd8589b194e881c185d5cd95960821b604482015290519081900360640190fd5b3360008181526003602052604090205460ff16156122525760405162461bcd60e51b81526004018080602001828103825260258152602001806140946025913960400191505060405180910390fd5b6001600160a01b038416600090815260036020526040902054849060ff16156122ac5760405162461bcd60e51b81526004018080602001828103825260258152602001806140946025913960400191505060405180910390fd5b610ef5338686612cbe565b6000546001600160a01b03163314612304576040805162461bcd60e51b81526020600482018190526024820152600080516020613e66833981519152604482015290519081900360640190fd5b6001600160a01b0381166123495760405162461bcd60e51b815260040180806020018281038252602f815260200180613deb602f913960400191505060405180910390fd5b600880546001600160a01b0319166001600160a01b0383811691909117918290556040519116907fdb66dfa9c6b8f5226fe9aac7e51897ae8ee94ac31dc70bb6c9900b2574b707e690600090a250565b6001600160a01b03166000908152600c602052604090205460ff1690565b6000546001600160a01b03163314612404576040805162461bcd60e51b81526020600482018190526024820152600080516020613e66833981519152604482015290519081900360640190fd5b6001600160a01b0381166124495760405162461bcd60e51b81526004018080602001828103825260328152602001806140626032913960400191505060405180910390fd5b600280546001600160a01b0319166001600160a01b0383811691909117918290556040519116907fc67398012c111ce95ecb7429b933096c977380ee6c421175a71a4a4c6c88c06e90600090a250565b600e546001600160a01b031633146124e25760405162461bcd60e51b8152600401808060200182810382526024815260200180613e1a6024913960400191505060405180910390fd5b6124f66001600160a01b0384168383613055565b505050565b6002546001600160a01b031681565b600154600160a01b900460ff161561255c576040805162461bcd60e51b815260206004820152601060248201526f14185d5cd8589b194e881c185d5cd95960821b604482015290519081900360640190fd5b6001600160a01b038716600090815260036020526040902054879060ff16156125b65760405162461bcd60e51b81526004018080602001828103825260258152602001806140946025913960400191505060405180910390fd5b6001600160a01b038716600090815260036020526040902054879060ff16156126105760405162461bcd60e51b81526004018080602001828103825260258152602001806140946025913960400191505060405180910390fd5b61261f898989898989896130a7565b505050505050505050565b600854600160a01b900460ff168015612646575060125460ff16155b61264f57600080fd5b61265b60048383613af9565b506126b482828080601f016020809104026020016040519081016040528093929190818152602001838380828437600092019190915250506040805180820190915260018152601960f91b602082015291506132029050565b600f5550506012805460ff19166001179055565b7f158b0a9edf7a828aad02f63cd515c68ef2f50ba807396f6d12842833a159742981565b6001600160a01b039182166000908152600a6020908152604080832093909416825291909152205490565b600154600160a01b900460ff1615612769576040805162461bcd60e51b815260206004820152601060248201526f14185d5cd8589b194e881c185d5cd95960821b604482015290519081900360640190fd5b6001600160a01b038916600090815260036020526040902054899060ff16156127c35760405162461bcd60e51b81526004018080602001828103825260258152602001806140946025913960400191505060405180910390fd5b6001600160a01b038916600090815260036020526040902054899060ff161561281d5760405162461bcd60e51b81526004018080602001828103825260258152602001806140946025913960400191505060405180910390fd5b61282e8b8b8b8b8b8b8b8b8b613274565b5050505050505050505050565b6007805460408051602060026001851615610100026000190190941693909304601f81018490048402820184019092528181529291830182828015610ca55780601f10610c7a57610100808354040283529160200191610ca5565b6001600160a01b03919091166000908152601060209081526040808320938352929052205460ff1690565b600154600160a01b900460ff1615612913576040805162461bcd60e51b815260206004820152601060248201526f14185d5cd8589b194e881c185d5cd95960821b604482015290519081900360640190fd5b6001600160a01b038916600090815260036020526040902054899060ff161561296d5760405162461bcd60e51b81526004018080602001828103825260258152602001806140946025913960400191505060405180910390fd5b6001600160a01b038916600090815260036020526040902054899060ff16156129c75760405162461bcd60e51b81526004018080602001828103825260258152602001806140946025913960400191505060405180910390fd5b61282e8b8b8b8b8b8b8b8b8b613382565b6000546001600160a01b03163314612a25576040805162461bcd60e51b81526020600482018190526024820152600080516020613e66833981519152604482015290519081900360640190fd5b6001600160a01b038116612a6a5760405162461bcd60e51b8152600401808060200182810382526026815260200180613c656026913960400191505060405180910390fd5b600054604080516001600160a01b039283168152918316602083015280517f8be0079c531659141344cd1fd0a4f28419497f9722a3daafe3b4186f6b6457e09281900390910190a1612abb81612e7d565b50565b6002546001600160a01b03163314612b075760405162461bcd60e51b815260040180806020018281038252602c815260200180613d78602c913960400191505060405180910390fd5b6001600160a01b038116600081815260036020526040808220805460ff19166001179055517fffa4e6181777692565cf28528fc88fd1516ea86b56da075235fa575af6a4b8559190a250565b6001600160a01b031660009081526003602052604090205460ff1690565b600082820183811015612bcb576040805162461bcd60e51b815260206004820152601b60248201527f536166654d6174683a206164646974696f6e206f766572666c6f770000000000604482015290519081900360640190fd5b9392505050565b6001600160a01b038316612c175760405162461bcd60e51b8152600401808060200182810382526024815260200180613f486024913960400191505060405180910390fd5b6001600160a01b038216612c5c5760405162461bcd60e51b8152600401808060200182810382526022815260200180613c8b6022913960400191505060405180910390fd5b6001600160a01b038084166000818152600a6020908152604080832094871680845294825291829020859055815185815291517f8c5be1e5ebec7d5bd14f71427d1e84f3dd0314c0f7b2291e5b200ac8c7c3b9259281900390910190a3505050565b6001600160a01b038316612d035760405162461bcd60e51b8152600401808060200182810382526025815260200180613f236025913960400191505060405180910390fd5b6001600160a01b038216612d485760405162461bcd60e51b8152600401808060200182810382526023815260200180613b7d6023913960400191505060405180910390fd5b6001600160a01b038316600090815260096020526040902054811115612d9f5760405162461bcd60e51b8152600401808060200182810382526026815260200180613d296026913960400191505060405180910390fd5b6001600160a01b038316600090815260096020526040902054612dc29082612e3b565b6001600160a01b038085166000908152600960205260408082209390935590841681522054612df19082612b71565b6001600160a01b038084166000818152600960209081526040918290209490945580518581529051919392871692600080516020613f0383398151915292918290030190a3505050565b6000612bcb83836040518060400160405280601e81526020017f536166654d6174683a207375627472616374696f6e206f766572666c6f77000081525061345b565b600080546001600160a01b0319166001600160a01b0392909216919091179055565b6001600160a01b038084166000908152600a60209081526040808320938616835292905220546124f69084908490612ed79085612b71565b612bd2565b612ee685856134f2565b604080517f158b0a9edf7a828aad02f63cd515c68ef2f50ba807396f6d12842833a159742960208201526001600160a01b0387168183018190526060828101889052835180840390910181526080909201909252600f54909190612f4d9086868686613559565b6001600160a01b031614612fa8576040805162461bcd60e51b815260206004820152601e60248201527f46696174546f6b656e56323a20696e76616c6964207369676e61747572650000604482015290519081900360640190fd5b6001600160a01b0386166000818152601060209081526040808320898452909152808220805460ff19166001179055518792917f1cdd46ff242716cdaa72d159d339a485b3438398348d68f09d7c8c0a59353d8191a3505050505050565b6124f68383612ed7846040518060600160405280602581526020016140de602591396001600160a01b03808a166000908152600a60209081526040808320938c1683529290522054919061345b565b604080516001600160a01b038416602482015260448082018490528251808303909101815260649091019091526020810180516001600160e01b031663a9059cbb60e01b1790526124f69084906135b0565b428410156130fc576040805162461bcd60e51b815260206004820152601e60248201527f46696174546f6b656e56323a207065726d697420697320657870697265640000604482015290519081900360640190fd5b6001600160a01b0380881660008181526011602090815260409182902080546001810190915582517f6e71edae12b1b97f4d1f60370fef10105fa2faae0126114a169c64845d6126c992810192909252818301849052938a1660608201526080810189905260a081019390935260c08084018890528151808503909101815260e09093019052600f546131929086868686613559565b6001600160a01b0316146131ed576040805162461bcd60e51b815260206004820152601a60248201527f454950323631323a20696e76616c6964207369676e6174757265000000000000604482015290519081900360640190fd5b6131f8888888612bd2565b5050505050505050565b8151602092830120815191830191909120604080517f8b73c3c69bb8fe3d512ecc4cf759cc79239f7b179b0ffacaa9a75d522b39400f818601528082019390935260608301919091524660808301523060a0808401919091528151808403909101815260c09092019052805191012090565b61328089858888613661565b604080517f7c7c6cdb67a18743f49ec6fa9b35f50d52ed05cbed4cc592e13b44501c1a226760208201526001600160a01b03808c16828401819052908b166060830152608082018a905260a0820189905260c0820188905260e080830188905283518084039091018152610100909201909252600f549091906133069086868686613559565b6001600160a01b031614613361576040805162461bcd60e51b815260206004820152601e60248201527f46696174546f6b656e56323a20696e76616c6964207369676e61747572650000604482015290519081900360640190fd5b61336b8a866136ed565b6133768a8a8a612cbe565b50505050505050505050565b6001600160a01b03881633146133c95760405162461bcd60e51b8152600401808060200182810382526025815260200180613eb46025913960400191505060405180910390fd5b6133d589858888613661565b604080517fd099cc98ef71107a616c4f0f941f04c322d8e254fe26b3c6668db87aae413de860208201526001600160a01b03808c16828401819052908b166060830152608082018a905260a0820189905260c0820188905260e080830188905283518084039091018152610100909201909252600f549091906133069086868686613559565b600081848411156134ea5760405162461bcd60e51b81526004018080602001828103825283818151815260200191508051906020019080838360005b838110156134af578181015183820152602001613497565b50505050905090810190601f1680156134dc5780820380516001836020036101000a031916815260200191505b509250505060405180910390fd5b505050900390565b6001600160a01b038216600090815260106020908152604080832084845290915290205460ff16156135555760405162461bcd60e51b815260040180806020018281038252602e815260200180614034602e913960400191505060405180910390fd5b5050565b80516020808301919091206040805161190160f01b818501526022810189905260428082019390935281518082039093018352606201905280519101206000906135a581878787613747565b979650505050505050565b6060613605826040518060400160405280602081526020017f5361666545524332303a206c6f772d6c6576656c2063616c6c206661696c6564815250856001600160a01b03166138cb9092919063ffffffff16565b8051909150156124f65780806020019051602081101561362457600080fd5b50516124f65760405162461bcd60e51b815260040180806020018281038252602a815260200180613fe2602a913960400191505060405180910390fd5b81421161369f5760405162461bcd60e51b815260040180806020018281038252602b815260200180613bc8602b913960400191505060405180910390fd5b8042106136dd5760405162461bcd60e51b81526004018080602001828103825260258152602001806140b96025913960400191505060405180910390fd5b6136e784846134f2565b50505050565b6001600160a01b0382166000818152601060209081526040808320858452909152808220805460ff19166001179055518392917f98de503528ee59b575ef0c0a2576a82497bfc029a5685b209e9ec333479b10a591a35050565b60007f7fffffffffffffffffffffffffffffff5d576e7357a4501ddfe92f46681b20a08211156137a85760405162461bcd60e51b8152600401808060200182810382526026815260200180613fbc6026913960400191505060405180910390fd5b8360ff16601b141580156137c057508360ff16601c14155b156137fc5760405162461bcd60e51b8152600401808060200182810382526026815260200180613c3f6026913960400191505060405180910390fd5b600060018686868660405160008152602001604052604051808581526020018460ff1681526020018381526020018281526020019450505050506020604051602081039080840390855afa158015613858573d6000803e3d6000fd5b5050604051601f1901519150506001600160a01b0381166138c0576040805162461bcd60e51b815260206004820152601c60248201527f45435265636f7665723a20696e76616c6964207369676e617475726500000000604482015290519081900360640190fd5b90505b949350505050565b60606138c3848460008560606138e085613a42565b613931576040805162461bcd60e51b815260206004820152601d60248201527f416464726573733a2063616c6c20746f206e6f6e2d636f6e7472616374000000604482015290519081900360640190fd5b60006060866001600160a01b031685876040518082805190602001908083835b602083106139705780518252601f199092019160209182019101613951565b6001836020036101000a03801982511681845116808217855250505050505090500191505060006040518083038185875af1925050503d80600081146139d2576040519150601f19603f3d011682016040523d82523d6000602084013e6139d7565b606091505b509150915081156139eb5791506138c39050565b8051156139fb5780518082602001fd5b60405162461bcd60e51b81526020600482018181528651602484015286518793919283926044019190850190808383600083156134af578181015183820152602001613497565b6000813f7fc5d2460186f7233c927e7db2dcc703c0e500b653ca82273b7bfad8045d85a4708181148015906138c3575050151592915050565b828054600181600116156101000203166002900490600052602060002090601f016020900481019282601f10613abc57805160ff1916838001178555613ae9565b82800160010185558215613ae9579182015b82811115613ae9578251825591602001919060010190613ace565b50613af5929150613b67565b5090565b828054600181600116156101000203166002900490600052602060002090601f016020900481019282601f10613b3a5782800160ff19823516178555613ae9565b82800160010185558215613ae9579182015b82811115613ae9578235825591602001919060010190613b4c565b5b80821115613af55760008155600101613b6856fe45524332303a207472616e7366657220746f20746865207a65726f20616464726573735061757361626c653a206e65772070617573657220697320746865207a65726f206164647265737346696174546f6b656e56323a20617574686f72697a6174696f6e206973206e6f74207965742076616c696446696174546f6b656e3a206275726e20616d6f756e74206e6f742067726561746572207468616e203046696174546f6b656e3a206d696e7420746f20746865207a65726f206164647265737345435265636f7665723a20696e76616c6964207369676e6174757265202776272076616c75654f776e61626c653a206e6577206f776e657220697320746865207a65726f206164647265737345524332303a20617070726f766520746f20746865207a65726f206164647265737346696174546f6b656e3a206e65772070617573657220697320746865207a65726f2061646472657373526573637561626c653a206e6577207265736375657220697320746865207a65726f206164647265737346696174546f6b656e3a206d696e7420616d6f756e74206e6f742067726561746572207468616e203045524332303a207472616e7366657220616d6f756e7420657863656564732062616c616e636546696174546f6b656e3a2063616c6c6572206973206e6f7420746865206d61737465724d696e746572426c61636b6c69737461626c653a2063616c6c6572206973206e6f742074686520626c61636b6c697374657246696174546f6b656e3a206275726e20616d6f756e7420657863656564732062616c616e636546696174546f6b656e3a2063616c6c6572206973206e6f742061206d696e74657246696174546f6b656e3a206e6577206d61737465724d696e74657220697320746865207a65726f2061646472657373526573637561626c653a2063616c6c6572206973206e6f7420746865207265736375657245524332303a207472616e7366657220616d6f756e74206578636565647320616c6c6f77616e63654f776e61626c653a2063616c6c6572206973206e6f7420746865206f776e657246696174546f6b656e3a206e657720626c61636b6c697374657220697320746865207a65726f206164647265737346696174546f6b656e56323a2063616c6c6572206d7573742062652074686520706179656546696174546f6b656e3a20636f6e747261637420697320616c726561647920696e697469616c697a6564ddf252ad1be2c89b69c2b068fc378daa952ba7f163c4a11628f55a4df523b3ef45524332303a207472616e736665722066726f6d20746865207a65726f206164647265737345524332303a20617070726f76652066726f6d20746865207a65726f206164647265737346696174546f6b656e3a206d696e7420616d6f756e742065786365656473206d696e746572416c6c6f77616e63655061757361626c653a2063616c6c6572206973206e6f74207468652070617573657245435265636f7665723a20696e76616c6964207369676e6174757265202773272076616c75655361666545524332303a204552433230206f7065726174696f6e20646964206e6f74207375636365656446696174546f6b656e3a206e6577206f776e657220697320746865207a65726f206164647265737346696174546f6b656e56323a20617574686f72697a6174696f6e2069732075736564206f722063616e63656c6564426c61636b6c69737461626c653a206e657720626c61636b6c697374657220697320746865207a65726f2061646472657373426c61636b6c69737461626c653a206163636f756e7420697320626c61636b6c697374656446696174546f6b656e56323a20617574686f72697a6174696f6e206973206578706972656445524332303a2064656372656173656420616c6c6f77616e63652062656c6f77207a65726fa26469706673582212200ca85a14d132a5e6ebb94958e79264428d9a0fe0a0cc1818ed0edf04e65aeef364736f6c634300060c0033",
  "deployedBytecode": "0x608060405234801561001057600080fd5b50600436106102f15760003560e01c80637ecebe001161019d578063b2118a8d116100e9578063e3ee160e116100a2578063ef55bec61161007c578063ef55bec614610b4e578063f2fde38b14610bad578063f9f92be414610bd3578063fe575a8714610bf9576102f1565b8063e3ee160e14610abb578063e5a6b10f14610b1a578063e94a010214610b22576102f1565b8063b2118a8d14610988578063bd102430146109be578063d505accf146109c6578063d608ea6414610a17578063d916948714610a85578063dd62ed3e14610a8d576102f1565b80639fd0506d11610156578063a9059cbb11610130578063a9059cbb146108ea578063aa20e1e414610916578063aa271e1a1461093c578063ad38bf2214610962576102f1565b80639fd0506d146108ae578063a0cc6a68146108b6578063a457c2d7146108be576102f1565b80637ecebe00146108425780637f2eecc3146108685780638456cb59146108705780638a6db9c3146108785780638da5cb5b1461089e57806395d89b41146108a6576102f1565b806335d99f351161025c57806342966c6811610215578063554bab3c116101ef578063554bab3c146107ad5780635a049a70146107d35780635c975abb1461081457806370a082311461081c576102f1565b806342966c681461075c5780634e44d9561461077957806354fd4d50146107a5576102f1565b806335d99f35146106c85780633644e515146106ec57806338a63183146106f457806339509351146106fc5780633f4ba83a1461072857806340c10f1914610730576102f1565b80632ab60045116102ae5780632ab60045146104575780632fc81e091461047d5780633092afd5146104a357806330adf81f146104c9578063313ce567146104d15780633357162b146104ef576102f1565b806306fdde03146102f657806308bca56614610373578063095ea7b3146103a157806318160ddd146103e15780631a895266146103fb57806323b872dd14610421575b600080fd5b6102fe610c1f565b6040805160208082528351818301528351919283929083019185019080838360005b83811015610338578181015183820152602001610320565b50505050905090810190601f1680156103655780820380516001836020036101000a031916815260200191505b509250505060405180910390f35b61039f6004803603604081101561038957600080fd5b506001600160a01b038135169060200135610cad565b005b6103cd600480360360408110156103b757600080fd5b506001600160a01b038135169060200135610dec565b604080519115158252519081900360200190f35b6103e9610f00565b60408051918252519081900360200190f35b61039f6004803603602081101561041157600080fd5b50356001600160a01b0316610f06565b6103cd6004803603606081101561043757600080fd5b506001600160a01b03813581169160208101359091169060400135610f98565b61039f6004803603602081101561046d57600080fd5b50356001600160a01b03166111bd565b61039f6004803603602081101561049357600080fd5b50356001600160a01b0316611299565b6103cd600480360360208110156104b957600080fd5b50356001600160a01b03166112f9565b6103e96113a0565b6104d96113c4565b6040805160ff9092168252519081900360200190f35b61039f600480360361010081101561050657600080fd5b810190602081018135600160201b81111561052057600080fd5b82018360208201111561053257600080fd5b803590602001918460018302840111600160201b8311171561055357600080fd5b91908080601f0160208091040260200160405190810160405280939291908181526020018383808284376000920191909152509295949360208101935035915050600160201b8111156105a557600080fd5b8201836020820111156105b757600080fd5b803590602001918460018302840111600160201b831117156105d857600080fd5b91908080601f0160208091040260200160405190810160405280939291908181526020018383808284376000920191909152509295949360208101935035915050600160201b81111561062a57600080fd5b82018360208201111561063c57600080fd5b803590602001918460018302840111600160201b8311171561065d57600080fd5b91908080601f0160208091040260200160405190810160405280939291908181526020018383808284376000920191909152509295505050813560ff1692505060208101356001600160a01b03908116916040810135821691606082013581169160800135166113cd565b6106d06115d9565b604080516001600160a01b039092168252519081900360200190f35b6103e96115e8565b6106d06115ee565b6103cd6004803603604081101561071257600080fd5b506001600160a01b0381351690602001356115fd565b61039f611706565b6103cd6004803603604081101561074657600080fd5b506001600160a01b038135169060200135611787565b61039f6004803603602081101561077257600080fd5b5035611a88565b6103cd6004803603604081101561078f57600080fd5b506001600160a01b038135169060200135611c90565b6102fe611d99565b61039f600480360360208110156107c357600080fd5b50356001600160a01b0316611db4565b61039f600480360360a08110156107e957600080fd5b506001600160a01b038135169060208101359060ff6040820135169060608101359060800135611e96565b6103cd611efc565b6103e96004803603602081101561083257600080fd5b50356001600160a01b0316611f0c565b6103e96004803603602081101561085857600080fd5b50356001600160a01b0316611f27565b6103e9611f42565b61039f611f66565b6103e96004803603602081101561088e57600080fd5b50356001600160a01b0316611fed565b6106d0612008565b6102fe612017565b6106d0612072565b6103e9612081565b6103cd600480360360408110156108d457600080fd5b506001600160a01b0381351690602001356120a5565b6103cd6004803603604081101561090057600080fd5b506001600160a01b0381351690602001356121ae565b61039f6004803603602081101561092c57600080fd5b50356001600160a01b03166122b7565b6103cd6004803603602081101561095257600080fd5b50356001600160a01b0316612399565b61039f6004803603602081101561097857600080fd5b50356001600160a01b03166123b7565b61039f6004803603606081101561099e57600080fd5b506001600160a01b03813581169160208101359091169060400135612499565b6106d06124fb565b61039f600480360360e08110156109dc57600080fd5b506001600160a01b03813581169160208101359091169060408101359060608101359060ff6080820135169060a08101359060c0013561250a565b61039f60048036036020811015610a2d57600080fd5b810190602081018135600160201b811115610a4757600080fd5b820183602082011115610a5957600080fd5b803590602001918460018302840111600160201b83111715610a7a57600080fd5b50909250905061262a565b6103e96126c8565b6103e960048036036040811015610aa357600080fd5b506001600160a01b03813581169160200135166126ec565b61039f6004803603610120811015610ad257600080fd5b506001600160a01b03813581169160208101359091169060408101359060608101359060808101359060a08101359060ff60c0820135169060e0810135906101000135612717565b6102fe61283b565b6103cd60048036036040811015610b3857600080fd5b506001600160a01b038135169060200135612896565b61039f6004803603610120811015610b6557600080fd5b506001600160a01b03813581169160208101359091169060408101359060608101359060808101359060a08101359060ff60c0820135169060e08101359061010001356128c1565b61039f60048036036020811015610bc357600080fd5b50356001600160a01b03166129d8565b61039f60048036036020811015610be957600080fd5b50356001600160a01b0316612abe565b6103cd60048036036020811015610c0f57600080fd5b50356001600160a01b0316612b53565b6004805460408051602060026001851615610100026000190190941693909304601f81018490048402820184019092528181529291830182828015610ca55780601f10610c7a57610100808354040283529160200191610ca5565b820191906000526020600020905b815481529060010190602001808311610c8857829003601f168201915b505050505081565b6001600160a01b038216610cf25760405162461bcd60e51b8152600401808060200182810382526023815260200180613c1c6023913960400191505060405180910390fd5b60008111610d315760405162461bcd60e51b8152600401808060200182810382526029815260200180613d006029913960400191505060405180910390fd5b600b54610d3e9082612b71565b600b556001600160a01b038216600090815260096020526040902054610d649082612b71565b6001600160a01b0383166000818152600960209081526040918290209390935580518481529051919233927fab8530f87dc9b59234c4623bf917212bb2536d647574c8e7e5da92c2ede0c9f89281900390910190a36040805182815290516001600160a01b03841691600091600080516020613f038339815191529181900360200190a35050565b600154600090600160a01b900460ff1615610e41576040805162461bcd60e51b815260206004820152601060248201526f14185d5cd8589b194e881c185d5cd95960821b604482015290519081900360640190fd5b3360008181526003602052604090205460ff1615610e905760405162461bcd60e51b81526004018080602001828103825260258152602001806140946025913960400191505060405180910390fd5b6001600160a01b038416600090815260036020526040902054849060ff1615610eea5760405162461bcd60e51b81526004018080602001828103825260258152602001806140946025913960400191505060405180910390fd5b610ef5338686612bd2565b506001949350505050565b600b5490565b6002546001600160a01b03163314610f4f5760405162461bcd60e51b815260040180806020018281038252602c815260200180613d78602c913960400191505060405180910390fd5b6001600160a01b038116600081815260036020526040808220805460ff19169055517f117e3210bb9aa7d9baff172026820255c6f6c30ba8999d1c2fd88e2848137c4e9190a250565b600154600090600160a01b900460ff1615610fed576040805162461bcd60e51b815260206004820152601060248201526f14185d5cd8589b194e881c185d5cd95960821b604482015290519081900360640190fd5b3360008181526003602052604090205460ff161561103c5760405162461bcd60e51b81526004018080602001828103825260258152602001806140946025913960400191505060405180910390fd5b6001600160a01b038516600090815260036020526040902054859060ff16156110965760405162461bcd60e51b81526004018080602001828103825260258152602001806140946025913960400191505060405180910390fd5b6001600160a01b038516600090815260036020526040902054859060ff16156110f05760405162461bcd60e51b81526004018080602001828103825260258152602001806140946025913960400191505060405180910390fd5b6001600160a01b0387166000908152600a602090815260408083203384529091529020548511156111525760405162461bcd60e51b8152600401808060200182810382526028815260200180613e3e6028913960400191505060405180910390fd5b61115d878787612cbe565b6001600160a01b0387166000908152600a6020908152604080832033845290915290205461118b9086612e3b565b6001600160a01b0388166000908152600a60209081526040808320338452909152902055600193505050509392505050565b6000546001600160a01b0316331461120a576040805162461bcd60e51b81526020600482018190526024820152600080516020613e66833981519152604482015290519081900360640190fd5b6001600160a01b03811661124f5760405162461bcd60e51b815260040180806020018281038252602a815260200180613cd6602a913960400191505060405180910390fd5b600e80546001600160a01b0319166001600160a01b0383169081179091556040517fe475e580d85111348e40d8ca33cfdd74c30fe1655c2d8537a13abc10065ffa5a90600090a250565b60125460ff166001146112ab57600080fd5b3060009081526009602052604090205480156112cc576112cc308383612cbe565b5050306000908152600360205260409020805460ff19908116600117909155601280549091166002179055565b6008546000906001600160a01b031633146113455760405162461bcd60e51b8152600401808060200182810382526029815260200180613d4f6029913960400191505060405180910390fd5b6001600160a01b0382166000818152600c60209081526040808320805460ff19169055600d909152808220829055517fe94479a9f7e1952cc78f2d6baab678adc1b772d936c6583def489e524cb666929190a2506001919050565b7f6e71edae12b1b97f4d1f60370fef10105fa2faae0126114a169c64845d6126c981565b60065460ff1681565b600854600160a01b900460ff16156114165760405162461bcd60e51b815260040180806020018281038252602a815260200180613ed9602a913960400191505060405180910390fd5b6001600160a01b03841661145b5760405162461bcd60e51b815260040180806020018281038252602f815260200180613deb602f913960400191505060405180910390fd5b6001600160a01b0383166114a05760405162461bcd60e51b8152600401808060200182810382526029815260200180613cad6029913960400191505060405180910390fd5b6001600160a01b0382166114e55760405162461bcd60e51b815260040180806020018281038252602e815260200180613e86602e913960400191505060405180910390fd5b6001600160a01b03811661152a5760405162461bcd60e51b815260040180806020018281038252602881526020018061400c6028913960400191505060405180910390fd5b875161153d9060049060208b0190613a7b565b5086516115519060059060208a0190613a7b565b508551611565906007906020890190613a7b565b506006805460ff191660ff8716179055600880546001600160a01b03199081166001600160a01b0387811691909117909255600180548216868416179055600280549091169184169190911790556115bc81612e7d565b50506008805460ff60a01b1916600160a01b179055505050505050565b6008546001600160a01b031681565b600f5481565b600e546001600160a01b031690565b600154600090600160a01b900460ff1615611652576040805162461bcd60e51b815260206004820152601060248201526f14185d5cd8589b194e881c185d5cd95960821b604482015290519081900360640190fd5b3360008181526003602052604090205460ff16156116a15760405162461bcd60e51b81526004018080602001828103825260258152602001806140946025913960400191505060405180910390fd5b6001600160a01b038416600090815260036020526040902054849060ff16156116fb5760405162461bcd60e51b81526004018080602001828103825260258152602001806140946025913960400191505060405180910390fd5b610ef5338686612e9f565b6001546001600160a01b0316331461174f5760405162461bcd60e51b8152600401808060200182810382526022815260200180613f9a6022913960400191505060405180910390fd5b6001805460ff60a01b191690556040517f7805862f689e2f13df9f062ff482ad3ad112aca9e0847911ed832e158c525b3390600090a1565b600154600090600160a01b900460ff16156117dc576040805162461bcd60e51b815260206004820152601060248201526f14185d5cd8589b194e881c185d5cd95960821b604482015290519081900360640190fd5b336000908152600c602052604090205460ff1661182a5760405162461bcd60e51b8152600401808060200182810382526021815260200180613dca6021913960400191505060405180910390fd5b3360008181526003602052604090205460ff16156118795760405162461bcd60e51b81526004018080602001828103825260258152602001806140946025913960400191505060405180910390fd5b6001600160a01b038416600090815260036020526040902054849060ff16156118d35760405162461bcd60e51b81526004018080602001828103825260258152602001806140946025913960400191505060405180910390fd5b6001600160a01b0385166119185760405162461bcd60e51b8152600401808060200182810382526023815260200180613c1c6023913960400191505060405180910390fd5b600084116119575760405162461bcd60e51b8152600401808060200182810382526029815260200180613d006029913960400191505060405180910390fd5b336000908152600d6020526040902054808511156119a65760405162461bcd60e51b815260040180806020018281038252602e815260200180613f6c602e913960400191505060405180910390fd5b600b546119b39086612b71565b600b556001600160a01b0386166000908152600960205260409020546119d99086612b71565b6001600160a01b0387166000908152600960205260409020556119fc8186612e3b565b336000818152600d602090815260409182902093909355805188815290516001600160a01b038a16937fab8530f87dc9b59234c4623bf917212bb2536d647574c8e7e5da92c2ede0c9f8928290030190a36040805186815290516001600160a01b03881691600091600080516020613f038339815191529181900360200190a350600195945050505050565b600154600160a01b900460ff1615611ada576040805162461bcd60e51b815260206004820152601060248201526f14185d5cd8589b194e881c185d5cd95960821b604482015290519081900360640190fd5b336000908152600c602052604090205460ff16611b285760405162461bcd60e51b8152600401808060200182810382526021815260200180613dca6021913960400191505060405180910390fd5b3360008181526003602052604090205460ff1615611b775760405162461bcd60e51b81526004018080602001828103825260258152602001806140946025913960400191505060405180910390fd5b3360009081526009602052604090205482611bc35760405162461bcd60e51b8152600401808060200182810382526029815260200180613bf36029913960400191505060405180910390fd5b82811015611c025760405162461bcd60e51b8152600401808060200182810382526026815260200180613da46026913960400191505060405180910390fd5b600b54611c0f9084612e3b565b600b55611c1c8184612e3b565b33600081815260096020908152604091829020939093558051868152905191927fcc16f5dbb4873280815c1ee09dbd06736cffcc184412cf7a71a0fdb75d397ca592918290030190a26040805184815290516000913391600080516020613f038339815191529181900360200190a3505050565b600154600090600160a01b900460ff1615611ce5576040805162461bcd60e51b815260206004820152601060248201526f14185d5cd8589b194e881c185d5cd95960821b604482015290519081900360640190fd5b6008546001600160a01b03163314611d2e5760405162461bcd60e51b8152600401808060200182810382526029815260200180613d4f6029913960400191505060405180910390fd5b6001600160a01b0383166000818152600c60209081526040808320805460ff19166001179055600d825291829020859055815185815291517f46980fca912ef9bcdbd36877427b6b90e860769f604e89c0e67720cece530d209281900390910190a250600192915050565b6040805180820190915260018152601960f91b602082015290565b6000546001600160a01b03163314611e01576040805162461bcd60e51b81526020600482018190526024820152600080516020613e66833981519152604482015290519081900360640190fd5b6001600160a01b038116611e465760405162461bcd60e51b8152600401808060200182810382526028815260200180613ba06028913960400191505060405180910390fd5b600180546001600160a01b0319166001600160a01b0383811691909117918290556040519116907fb80482a293ca2e013eda8683c9bd7fc8347cfdaeea5ede58cba46df502c2a60490600090a250565b600154600160a01b900460ff1615611ee8576040805162461bcd60e51b815260206004820152601060248201526f14185d5cd8589b194e881c185d5cd95960821b604482015290519081900360640190fd5b611ef58585858585612edc565b5050505050565b600154600160a01b900460ff1681565b6001600160a01b031660009081526009602052604090205490565b6001600160a01b031660009081526011602052604090205490565b7fd099cc98ef71107a616c4f0f941f04c322d8e254fe26b3c6668db87aae413de881565b6001546001600160a01b03163314611faf5760405162461bcd60e51b8152600401808060200182810382526022815260200180613f9a6022913960400191505060405180910390fd5b6001805460ff60a01b1916600160a01b1790556040517f6985a02210a168e66602d3235cb6db0e70f92b3ba4d376a33c0f3d9434bff62590600090a1565b6001600160a01b03166000908152600d602052604090205490565b6000546001600160a01b031690565b6005805460408051602060026001851615610100026000190190941693909304601f81018490048402820184019092528181529291830182828015610ca55780601f10610c7a57610100808354040283529160200191610ca5565b6001546001600160a01b031681565b7f7c7c6cdb67a18743f49ec6fa9b35f50d52ed05cbed4cc592e13b44501c1a226781565b600154600090600160a01b900460ff16156120fa576040805162461bcd60e51b815260206004820152601060248201526f14185d5cd8589b194e881c185d5cd95960821b604482015290519081900360640190fd5b3360008181526003602052604090205460ff16156121495760405162461bcd60e51b81526004018080602001828103825260258152602001806140946025913960400191505060405180910390fd5b6001600160a01b038416600090815260036020526040902054849060ff16156121a35760405162461bcd60e51b81526004018080602001828103825260258152602001806140946025913960400191505060405180910390fd5b610ef5338686613006565b600154600090600160a01b900460ff1615612203576040805162461bcd60e51b815260206004820152601060248201526f14185d5cd8589b194e881c185d5cd95960821b604482015290519081900360640190fd5b3360008181526003602052604090205460ff16156122525760405162461bcd60e51b81526004018080602001828103825260258152602001806140946025913960400191505060405180910390fd5b6001600160a01b038416600090815260036020526040902054849060ff16156122ac5760405162461bcd60e51b81526004018080602001828103825260258152602001806140946025913960400191505060405180910390fd5b610ef5338686612cbe565b6000546001600160a01b03163314612304576040805162461bcd60e51b81526020600482018190526024820152600080516020613e66833981519152604482015290519081900360640190fd5b6001600160a01b0381166123495760405162461bcd60e51b815260040180806020018281038252602f815260200180613deb602f913960400191505060405180910390fd5b600880546001600160a01b0319166001600160a01b0383811691909117918290556040519116907fdb66dfa9c6b8f5226fe9aac7e51897ae8ee94ac31dc70bb6c9900b2574b707e690600090a250565b6001600160a01b03166000908152600c602052604090205460ff1690565b6000546001600160a01b03163314612404576040805162461bcd60e51b81526020600482018190526024820152600080516020613e66833981519152604482015290519081900360640190fd5b6001600160a01b0381166124495760405162461bcd60e51b81526004018080602001828103825260328152602001806140626032913960400191505060405180910390fd5b600280546001600160a01b0319166001600160a01b0383811691909117918290556040519116907fc67398012c111ce95ecb7429b933096c977380ee6c421175a71a4a4c6c88c06e90600090a250565b600e546001600160a01b031633146124e25760405162461bcd60e51b8152600401808060200182810382526024815260200180613e1a6024913960400191505060405180910390fd5b6124f66001600160a01b0384168383613055565b505050565b6002546001600160a01b031681565b600154600160a01b900460ff161561255c576040805162461bcd60e51b815260206004820152601060248201526f14185d5cd8589b194e881c185d5cd95960821b604482015290519081900360640190fd5b6001600160a01b038716600090815260036020526040902054879060ff16156125b65760405162461bcd60e51b81526004018080602001828103825260258152602001806140946025913960400191505060405180910390fd5b6001600160a01b038716600090815260036020526040902054879060ff16156126105760405162461bcd60e51b81526004018080602001828103825260258152602001806140946025913960400191505060405180910390fd5b61261f898989898989896130a7565b505050505050505050565b600854600160a01b900460ff168015612646575060125460ff16155b61264f57600080fd5b61265b60048383613af9565b506126b482828080601f016020809104026020016040519081016040528093929190818152602001838380828437600092019190915250506040805180820190915260018152601960f91b602082015291506132029050565b600f5550506012805460ff19166001179055565b7f158b0a9edf7a828aad02f63cd515c68ef2f50ba807396f6d12842833a159742981565b6001600160a01b039182166000908152600a6020908152604080832093909416825291909152205490565b600154600160a01b900460ff1615612769576040805162461bcd60e51b815260206004820152601060248201526f14185d5cd8589b194e881c185d5cd95960821b604482015290519081900360640190fd5b6001600160a01b038916600090815260036020526040902054899060ff16156127c35760405162461bcd60e51b81526004018080602001828103825260258152602001806140946025913960400191505060405180910390fd5b6001600160a01b038916600090815260036020526040902054899060ff161561281d5760405162461bcd60e51b81526004018080602001828103825260258152602001806140946025913960400191505060405180910390fd5b61282e8b8b8b8b8b8b8b8b8b613274565b5050505050505050505050565b6007805460408051602060026001851615610100026000190190941693909304601f81018490048402820184019092528181529291830182828015610ca55780601f10610c7a57610100808354040283529160200191610ca5565b6001600160a01b03919091166000908152601060209081526040808320938352929052205460ff1690565b600154600160a01b900460ff1615612913576040805162461bcd60e51b815260206004820152601060248201526f14185d5cd8589b194e881c185d5cd95960821b604482015290519081900360640190fd5b6001600160a01b038916600090815260036020526040902054899060ff161561296d5760405162461bcd60e51b81526004018080602001828103825260258152602001806140946025913960400191505060405180910390fd5b6001600160a01b038916600090815260036020526040902054899060ff16156129c75760405162461bcd60e51b81526004018080602001828103825260258152602001806140946025913960400191505060405180910390fd5b61282e8b8b8b8b8b8b8b8b8b613382565b6000546001600160a01b03163314612a25576040805162461bcd60e51b81526020600482018190526024820152600080516020613e66833981519152604482015290519081900360640190fd5b6001600160a01b038116612a6a5760405162461bcd60e51b8152600401808060200182810382526026815260200180613c656026913960400191505060405180910390fd5b600054604080516001600160a01b039283168152918316602083015280517f8be0079c531659141344cd1fd0a4f28419497f9722a3daafe3b4186f6b6457e09281900390910190a1612abb81612e7d565b50565b6002546001600160a01b03163314612b075760405162461bcd60e51b815260040180806020018281038252602c815260200180613d78602c913960400191505060405180910390fd5b6001600160a01b038116600081815260036020526040808220805460ff19166001179055517fffa4e6181777692565cf28528fc88fd1516ea86b56da075235fa575af6a4b8559190a250565b6001600160a01b031660009081526003602052604090205460ff1690565b600082820183811015612bcb576040805162461bcd60e51b815260206004820152601b60248201527f536166654d6174683a206164646974696f6e206f766572666c6f770000000000604482015290519081900360640190fd5b9392505050565b6001600160a01b038316612c175760405162461bcd60e51b8152600401808060200182810382526024815260200180613f486024913960400191505060405180910390fd5b6001600160a01b038216612c5c5760405162461bcd60e51b8152600401808060200182810382526022815260200180613c8b6022913960400191505060405180910390fd5b6001600160a01b038084166000818152600a6020908152604080832094871680845294825291829020859055815185815291517f8c5be1e5ebec7d5bd14f71427d1e84f3dd0314c0f7b2291e5b200ac8c7c3b9259281900390910190a3505050565b6001600160a01b038316612d035760405162461bcd60e51b8152600401808060200182810382526025815260200180613f236025913960400191505060405180910390fd5b6001600160a01b038216612d485760405162461bcd60e51b8152600401808060200182810382526023815260200180613b7d6023913960400191505060405180910390fd5b6001600160a01b038316600090815260096020526040902054811115612d9f5760405162461bcd60e51b8152600401808060200182810382526026815260200180613d296026913960400191505060405180910390fd5b6001600160a01b038316600090815260096020526040902054612dc29082612e3b565b6001600160a01b038085166000908152600960205260408082209390935590841681522054612df19082612b71565b6001600160a01b038084166000818152600960209081526040918290209490945580518581529051919392871692600080516020613f0383398151915292918290030190a3505050565b6000612bcb83836040518060400160405280601e81526020017f536166654d6174683a207375627472616374696f6e206f766572666c6f77000081525061345b565b600080546001600160a01b0319166001600160a01b0392909216919091179055565b6001600160a01b038084166000908152600a60209081526040808320938616835292905220546124f69084908490612ed79085612b71565b612bd2565b612ee685856134f2565b604080517f158b0a9edf7a828aad02f63cd515c68ef2f50ba807396f6d12842833a159742960208201526001600160a01b0387168183018190526060828101889052835180840390910181526080909201909252600f54909190612f4d9086868686613559565b6001600160a01b031614612fa8576040805162461bcd60e51b815260206004820152601e60248201527f46696174546f6b656e56323a20696e76616c6964207369676e61747572650000604482015290519081900360640190fd5b6001600160a01b0386166000818152601060209081526040808320898452909152808220805460ff19166001179055518792917f1cdd46ff242716cdaa72d159d339a485b3438398348d68f09d7c8c0a59353d8191a3505050505050565b6124f68383612ed7846040518060600160405280602581526020016140de602591396001600160a01b03808a166000908152600a60209081526040808320938c1683529290522054919061345b565b604080516001600160a01b038416602482015260448082018490528251808303909101815260649091019091526020810180516001600160e01b031663a9059cbb60e01b1790526124f69084906135b0565b428410156130fc576040805162461bcd60e51b815260206004820152601e60248201527f46696174546f6b656e56323a207065726d697420697320657870697265640000604482015290519081900360640190fd5b6001600160a01b0380881660008181526011602090815260409182902080546001810190915582517f6e71edae12b1b97f4d1f60370fef10105fa2faae0126114a169c64845d6126c992810192909252818301849052938a1660608201526080810189905260a081019390935260c08084018890528151808503909101815260e09093019052600f546131929086868686613559565b6001600160a01b0316146131ed576040805162461bcd60e51b815260206004820152601a60248201527f454950323631323a20696e76616c6964207369676e6174757265000000000000604482015290519081900360640190fd5b6131f8888888612bd2565b5050505050505050565b8151602092830120815191830191909120604080517f8b73c3c69bb8fe3d512ecc4cf759cc79239f7b179b0ffacaa9a75d522b39400f818601528082019390935260608301919091524660808301523060a0808401919091528151808403909101815260c09092019052805191012090565b61328089858888613661565b604080517f7c7c6cdb67a18743f49ec6fa9b35f50d52ed05cbed4cc592e13b44501c1a226760208201526001600160a01b03808c16828401819052908b166060830152608082018a905260a0820189905260c0820188905260e080830188905283518084039091018152610100909201909252600f549091906133069086868686613559565b6001600160a01b031614613361576040805162461bcd60e51b815260206004820152601e60248201527f46696174546f6b656e56323a20696e76616c6964207369676e61747572650000604482015290519081900360640190fd5b61336b8a866136ed565b6133768a8a8a612cbe565b50505050505050505050565b6001600160a01b03881633146133c95760405162461bcd60e51b8152600401808060200182810382526025815260200180613eb46025913960400191505060405180910390fd5b6133d589858888613661565b604080517fd099cc98ef71107a616c4f0f941f04c322d8e254fe26b3c6668db87aae413de860208201526001600160a01b03808c16828401819052908b166060830152608082018a905260a0820189905260c0820188905260e080830188905283518084039091018152610100909201909252600f549091906133069086868686613559565b600081848411156134ea5760405162461bcd60e51b81526004018080602001828103825283818151815260200191508051906020019080838360005b838110156134af578181015183820152602001613497565b50505050905090810190601f1680156134dc5780820380516001836020036101000a031916815260200191505b509250505060405180910390fd5b505050900390565b6001600160a01b038216600090815260106020908152604080832084845290915290205460ff16156135555760405162461bcd60e51b815260040180806020018281038252602e815260200180614034602e913960400191505060405180910390fd5b5050565b80516020808301919091206040805161190160f01b818501526022810189905260428082019390935281518082039093018352606201905280519101206000906135a581878787613747565b979650505050505050565b6060613605826040518060400160405280602081526020017f5361666545524332303a206c6f772d6c6576656c2063616c6c206661696c6564815250856001600160a01b03166138cb9092919063ffffffff16565b8051909150156124f65780806020019051602081101561362457600080fd5b50516124f65760405162461bcd60e51b815260040180806020018281038252602a815260200180613fe2602a913960400191505060405180910390fd5b81421161369f5760405162461bcd60e51b815260040180806020018281038252602b815260200180613bc8602b913960400191505060405180910390fd5b8042106136dd5760405162461bcd60e51b81526004018080602001828103825260258152602001806140b96025913960400191505060405180910390fd5b6136e784846134f2565b50505050565b6001600160a01b0382166000818152601060209081526040808320858452909152808220805460ff19166001179055518392917f98de503528ee59b575ef0c0a2576a82497bfc029a5685b209e9ec333479b10a591a35050565b60007f7fffffffffffffffffffffffffffffff5d576e7357a4501ddfe92f46681b20a08211156137a85760405162461bcd60e51b8152600401808060200182810382526026815260200180613fbc6026913960400191505060405180910390fd5b8360ff16601b141580156137c057508360ff16601c14155b156137fc5760405162461bcd60e51b8152600401808060200182810382526026815260200180613c3f6026913960400191505060405180910390fd5b600060018686868660405160008152602001604052604051808581526020018460ff1681526020018381526020018281526020019450505050506020604051602081039080840390855afa158015613858573d6000803e3d6000fd5b5050604051601f1901519150506001600160a01b0381166138c0576040805162461bcd60e51b815260206004820152601c60248201527f45435265636f7665723a20696e76616c6964207369676e617475726500000000604482015290519081900360640190fd5b90505b949350505050565b60606138c3848460008560606138e085613a42565b613931576040805162461bcd60e51b815260206004820152601d60248201527f416464726573733a2063616c6c20746f206e6f6e2d636f6e7472616374000000604482015290519081900360640190fd5b60006060866001600160a01b031685876040518082805190602001908083835b602083106139705780518252601f199092019160209182019101613951565b6001836020036101000a03801982511681845116808217855250505050505090500191505060006040518083038185875af1925050503d80600081146139d2576040519150601f19603f3d011682016040523d82523d6000602084013e6139d7565b606091505b509150915081156139eb5791506138c39050565b8051156139fb5780518082602001fd5b60405162461bcd60e51b81526020600482018181528651602484015286518793919283926044019190850190808383600083156134af578181015183820152602001613497565b6000813f7fc5d2460186f7233c927e7db2dcc703c0e500b653ca82273b7bfad8045d85a4708181148015906138c3575050151592915050565b828054600181600116156101000203166002900490600052602060002090601f016020900481019282601f10613abc57805160ff1916838001178555613ae9565b82800160010185558215613ae9579182015b82811115613ae9578251825591602001919060010190613ace565b50613af5929150613b67565b5090565b828054600181600116156101000203166002900490600052602060002090601f016020900481019282601f10613b3a5782800160ff19823516178555613ae9565b82800160010185558215613ae9579182015b82811115613ae9578235825591602001919060010190613b4c565b5b80821115613af55760008155600101613b6856fe45524332303a207472616e7366657220746f20746865207a65726f20616464726573735061757361626c653a206e65772070617573657220697320746865207a65726f206164647265737346696174546f6b656e56323a20617574686f72697a6174696f6e206973206e6f74207965742076616c696446696174546f6b656e3a206275726e20616d6f756e74206e6f742067726561746572207468616e203046696174546f6b656e3a206d696e7420746f20746865207a65726f206164647265737345435265636f7665723a20696e76616c6964207369676e6174757265202776272076616c75654f776e61626c653a206e6577206f776e657220697320746865207a65726f206164647265737345524332303a20617070726f766520746f20746865207a65726f206164647265737346696174546f6b656e3a206e65772070617573657220697320746865207a65726f2061646472657373526573637561626c653a206e6577207265736375657220697320746865207a65726f206164647265737346696174546f6b656e3a206d696e7420616d6f756e74206e6f742067726561746572207468616e203045524332303a207472616e7366657220616d6f756e7420657863656564732062616c616e636546696174546f6b656e3a2063616c6c6572206973206e6f7420746865206d61737465724d696e746572426c61636b6c69737461626c653a2063616c6c6572206973206e6f742074686520626c61636b6c697374657246696174546f6b656e3a206275726e20616d6f756e7420657863656564732062616c616e636546696174546f6b656e3a2063616c6c6572206973206e6f742061206d696e74657246696174546f6b656e3a206e6577206d61737465724d696e74657220697320746865207a65726f2061646472657373526573637561626c653a2063616c6c6572206973206e6f7420746865207265736375657245524332303a207472616e7366657220616d6f756e74206578636565647320616c6c6f77616e63654f776e61626c653a2063616c6c6572206973206e6f7420746865206f776e657246696174546f6b656e3a206e657720626c61636b6c697374657220697320746865207a65726f206164647265737346696174546f6b656e56323a2063616c6c6572206d7573742062652074686520706179656546696174546f6b656e3a20636f6e747261637420697320616c726561647920696e697469616c697a6564ddf252ad1be2c89b69c2b068fc378daa952ba7f163c4a11628f55a4df523b3ef45524332303a207472616e736665722066726f6d20746865207a65726f206164647265737345524332303a20617070726f76652066726f6d20746865207a65726f206164647265737346696174546f6b656e3a206d696e7420616d6f756e742065786365656473206d696e746572416c6c6f77616e63655061757361626c653a2063616c6c6572206973206e6f74207468652070617573657245435265636f7665723a20696e76616c6964207369676e6174757265202773272076616c75655361666545524332303a204552433230206f7065726174696f6e20646964206e6f74207375636365656446696174546f6b656e3a206e6577206f776e657220697320746865207a65726f206164647265737346696174546f6b656e56323a20617574686f72697a6174696f6e2069732075736564206f722063616e63656c6564426c61636b6c69737461626c653a206e657720626c61636b6c697374657220697320746865207a65726f2061646472657373426c61636b6c69737461626c653a206163636f756e7420697320626c61636b6c697374656446696174546f6b656e56323a20617574686f72697a6174696f6e206973206578706972656445524332303a2064656372656173656420616c6c6f77616e63652062656c6f77207a65726fa26469706673582212200ca85a14d132a5e6ebb94958e79264428d9a0fe0a0cc1818ed0edf04e65aeef364736f6c634300060c0033",
  "devdoc": {
    "kind": "dev",
    "methods": {
      "allocateTo(address,uint256)": {
        "details": "Function to mint tokens",
        "params": {
          "_amount": "The amount of tokens to mint. Must be less than or equal to the minterAllowance of the caller.",
          "_to": "The address that will receive the minted tokens."
        }
      },
      "allowance(address,address)": {
        "params": {
          "owner": "Token owner's address",
          "spender": "Spender's address"
        },
        "returns": {
          "_0": "Allowance amount"
        }
      },
      "approve(address,uint256)": {
        "params": {
          "spender": "Spender's address",
          "value": "Allowance amount"
        },
        "returns": {
          "_0": "True if successful"
        }
      },
      "authorizationState(address,bytes32)": {
        "details": "Nonces are randomly generated 32-byte data unique to the authorizer's address",
        "params": {
          "authorizer": "Authorizer's address",
          "nonce": "Nonce of the authorization"
        },
        "returns": {
          "_0": "True if the nonce is used"
        }
      },
      "balanceOf(address)": {
        "details": "Get token balance of an account",
        "params": {
          "account": "address The account"
        }
      },
      "blacklist(address)": {
        "details": "Adds account to blacklist",
        "params": {
          "_account": "The address to blacklist"
        }
      },
      "burn(uint256)": {
        "details": "allows a minter to burn some of its own tokens Validates that caller is a minter and that sender is not blacklisted amount is less than or equal to the minter's account balance",
        "params": {
          "_amount": "uint256 the amount of tokens to be burned"
        }
      },
      "cancelAuthorization(address,bytes32,uint8,bytes32,bytes32)": {
        "details": "Works only if the authorization is not yet used.",
        "params": {
          "authorizer": "Authorizer's address",
          "nonce": "Nonce of the authorization",
          "r": "r of the signature",
          "s": "s of the signature",
          "v": "v of the signature"
        }
      },
      "configureMinter(address,uint256)": {
        "details": "Function to add/update a new minter",
        "params": {
          "minter": "The address of the minter",
          "minterAllowedAmount": "The minting amount allowed for the minter"
        },
        "returns": {
          "_0": "True if the operation was successful."
        }
      },
      "decreaseAllowance(address,uint256)": {
        "params": {
          "decrement": "Amount of decrease in allowance",
          "spender": "Spender's address"
        },
        "returns": {
          "_0": "True if successful"
        }
      },
      "increaseAllowance(address,uint256)": {
        "params": {
          "increment": "Amount of increase in allowance",
          "spender": "Spender's address"
        },
        "returns": {
          "_0": "True if successful"
        }
      },
      "initializeV2(string)": {
        "params": {
          "newName": "New token name"
        }
      },
      "initializeV2_1(address)": {
        "params": {
          "lostAndFound": "The address to which the locked funds are sent"
        }
      },
      "isBlacklisted(address)": {
        "details": "Checks if account is blacklisted",
        "params": {
          "_account": "The address to check"
        }
      },
      "isMinter(address)": {
        "details": "Checks if account is a minter",
        "params": {
          "account": "The address to check"
        }
      },
      "mint(address,uint256)": {
        "details": "Function to mint tokens",
        "params": {
          "_amount": "The amount of tokens to mint. Must be less than or equal to the minterAllowance of the caller.",
          "_to": "The address that will receive the minted tokens."
        },
        "returns": {
          "_0": "A boolean that indicates if the operation was successful."
        }
      },
      "minterAllowance(address)": {
        "details": "Get minter allowance for an account",
        "params": {
          "minter": "The address of the minter"
        }
      },
      "nonces(address)": {
        "params": {
          "owner": "Token owner's address (Authorizer)"
        },
        "returns": {
          "_0": "Next nonce"
        }
      },
      "owner()": {
        "details": "Tells the address of the owner",
        "returns": {
          "_0": "the address of the owner"
        }
      },
      "pause()": {
        "details": "called by the owner to pause, triggers stopped state"
      },
      "permit(address,address,uint256,uint256,uint8,bytes32,bytes32)": {
        "params": {
          "deadline": "Expiration time, seconds since the epoch",
          "owner": "Token owner's address (Authorizer)",
          "r": "r of the signature",
          "s": "s of the signature",
          "spender": "Spender's address",
          "v": "v of the signature",
          "value": "Amount of allowance"
        }
      },
      "receiveWithAuthorization(address,address,uint256,uint256,uint256,bytes32,uint8,bytes32,bytes32)": {
        "details": "This has an additional check to ensure that the payee's address matches the caller of this function to prevent front-running attacks.",
        "params": {
          "from": "Payer's address (Authorizer)",
          "nonce": "Unique nonce",
          "r": "r of the signature",
          "s": "s of the signature",
          "to": "Payee's address",
          "v": "v of the signature",
          "validAfter": "The time after which this is valid (unix time)",
          "validBefore": "The time before which this is valid (unix time)",
          "value": "Amount to be transferred"
        }
      },
      "removeMinter(address)": {
        "details": "Function to remove a minter",
        "params": {
          "minter": "The address of the minter to remove"
        },
        "returns": {
          "_0": "True if the operation was successful."
        }
      },
      "rescueERC20(address,address,uint256)": {
        "params": {
          "amount": "Amount to withdraw",
          "to": "Recipient address",
          "tokenContract": "ERC20 token contract address"
        }
      },
      "rescuer()": {
        "returns": {
          "_0": "Rescuer's address"
        }
      },
      "totalSupply()": {
        "details": "Get totalSupply of token"
      },
      "transfer(address,uint256)": {
        "params": {
          "to": "Payee's address",
          "value": "Transfer amount"
        },
        "returns": {
          "_0": "True if successful"
        }
      },
      "transferFrom(address,address,uint256)": {
        "params": {
          "from": "Payer's address",
          "to": "Payee's address",
          "value": "Transfer amount"
        },
        "returns": {
          "_0": "True if successful"
        }
      },
      "transferOwnership(address)": {
        "details": "Allows the current owner to transfer control of the contract to a newOwner.",
        "params": {
          "newOwner": "The address to transfer ownership to."
        }
      },
      "transferWithAuthorization(address,address,uint256,uint256,uint256,bytes32,uint8,bytes32,bytes32)": {
        "params": {
          "from": "Payer's address (Authorizer)",
          "nonce": "Unique nonce",
          "r": "r of the signature",
          "s": "s of the signature",
          "to": "Payee's address",
          "v": "v of the signature",
          "validAfter": "The time after which this is valid (unix time)",
          "validBefore": "The time before which this is valid (unix time)",
          "value": "Amount to be transferred"
        }
      },
      "unBlacklist(address)": {
        "details": "Removes account from blacklist",
        "params": {
          "_account": "The address to remove from the blacklist"
        }
      },
      "unpause()": {
        "details": "called by the owner to unpause, returns to normal state"
      },
      "updatePauser(address)": {
        "details": "update the pauser role"
      },
      "updateRescuer(address)": {
        "params": {
          "newRescuer": "New rescuer's address"
        }
      },
      "version()": {
        "returns": {
          "_0": "Version string"
        }
      }
    },
    "title": "FiatToken V2.1",
    "version": 1
  },
  "userdoc": {
    "kind": "user",
    "methods": {
      "allowance(address,address)": {
        "notice": "Amount of remaining tokens spender is allowed to transfer on behalf of the token owner"
      },
      "approve(address,uint256)": {
        "notice": "Set spender's allowance over the caller's tokens to be a given value."
      },
      "authorizationState(address,bytes32)": {
        "notice": "Returns the state of an authorization"
      },
      "cancelAuthorization(address,bytes32,uint8,bytes32,bytes32)": {
        "notice": "Attempt to cancel an authorization"
      },
      "decreaseAllowance(address,uint256)": {
        "notice": "Decrease the allowance by a given decrement"
      },
      "increaseAllowance(address,uint256)": {
        "notice": "Increase the allowance by a given increment"
      },
      "initializeV2(string)": {
        "notice": "Initialize v2"
      },
      "initializeV2_1(address)": {
        "notice": "Initialize v2.1"
      },
      "nonces(address)": {
        "notice": "Nonces for permit"
      },
      "permit(address,address,uint256,uint256,uint8,bytes32,bytes32)": {
        "notice": "Update allowance with a signed permit"
      },
      "receiveWithAuthorization(address,address,uint256,uint256,uint256,bytes32,uint8,bytes32,bytes32)": {
        "notice": "Receive a transfer with a signed authorization from the payer"
      },
      "rescueERC20(address,address,uint256)": {
        "notice": "Rescue ERC20 tokens locked up in this contract."
      },
      "rescuer()": {
        "notice": "Returns current rescuer"
      },
      "transfer(address,uint256)": {
        "notice": "Transfer tokens from the caller"
      },
      "transferFrom(address,address,uint256)": {
        "notice": "Transfer tokens by spending allowance"
      },
      "transferWithAuthorization(address,address,uint256,uint256,uint256,bytes32,uint8,bytes32,bytes32)": {
        "notice": "Execute a transfer with a signed authorization"
      },
      "updateRescuer(address)": {
        "notice": "Assign the rescuer role to a given address."
      },
      "version()": {
        "notice": "Version string for the EIP712 domain separator"
      }
    },
    "notice": "ERC20 Token backed by fiat reserves, version 2.1",
    "version": 1
  },
  "storageLayout": {
    "storage": [
      {
        "astId": 298,
        "contract": "contracts/test/USDC.sol:FiatTokenV2_1",
        "label": "_owner",
        "offset": 0,
        "slot": "0",
        "type": "t_address"
      },
      {
        "astId": 391,
        "contract": "contracts/test/USDC.sol:FiatTokenV2_1",
        "label": "pauser",
        "offset": 0,
        "slot": "1",
        "type": "t_address"
      },
      {
        "astId": 394,
        "contract": "contracts/test/USDC.sol:FiatTokenV2_1",
        "label": "paused",
        "offset": 20,
        "slot": "1",
        "type": "t_bool"
      },
      {
        "astId": 480,
        "contract": "contracts/test/USDC.sol:FiatTokenV2_1",
        "label": "blacklister",
        "offset": 0,
        "slot": "2",
        "type": "t_address"
      },
      {
        "astId": 484,
        "contract": "contracts/test/USDC.sol:FiatTokenV2_1",
        "label": "blacklisted",
        "offset": 0,
        "slot": "3",
        "type": "t_mapping(t_address,t_bool)"
      },
      {
        "astId": 617,
        "contract": "contracts/test/USDC.sol:FiatTokenV2_1",
        "label": "name",
        "offset": 0,
        "slot": "4",
        "type": "t_string_storage"
      },
      {
        "astId": 619,
        "contract": "contracts/test/USDC.sol:FiatTokenV2_1",
        "label": "symbol",
        "offset": 0,
        "slot": "5",
        "type": "t_string_storage"
      },
      {
        "astId": 621,
        "contract": "contracts/test/USDC.sol:FiatTokenV2_1",
        "label": "decimals",
        "offset": 0,
        "slot": "6",
        "type": "t_uint8"
      },
      {
        "astId": 623,
        "contract": "contracts/test/USDC.sol:FiatTokenV2_1",
        "label": "currency",
        "offset": 0,
        "slot": "7",
        "type": "t_string_storage"
      },
      {
        "astId": 625,
        "contract": "contracts/test/USDC.sol:FiatTokenV2_1",
        "label": "masterMinter",
        "offset": 0,
        "slot": "8",
        "type": "t_address"
      },
      {
        "astId": 627,
        "contract": "contracts/test/USDC.sol:FiatTokenV2_1",
        "label": "initialized",
        "offset": 20,
        "slot": "8",
        "type": "t_bool"
      },
      {
        "astId": 631,
        "contract": "contracts/test/USDC.sol:FiatTokenV2_1",
        "label": "balances",
        "offset": 0,
        "slot": "9",
        "type": "t_mapping(t_address,t_uint256)"
      },
      {
        "astId": 637,
        "contract": "contracts/test/USDC.sol:FiatTokenV2_1",
        "label": "allowed",
        "offset": 0,
        "slot": "10",
        "type": "t_mapping(t_address,t_mapping(t_address,t_uint256))"
      },
      {
        "astId": 640,
        "contract": "contracts/test/USDC.sol:FiatTokenV2_1",
        "label": "totalSupply_",
        "offset": 0,
        "slot": "11",
        "type": "t_uint256"
      },
      {
        "astId": 644,
        "contract": "contracts/test/USDC.sol:FiatTokenV2_1",
        "label": "minters",
        "offset": 0,
        "slot": "12",
        "type": "t_mapping(t_address,t_bool)"
      },
      {
        "astId": 648,
        "contract": "contracts/test/USDC.sol:FiatTokenV2_1",
        "label": "minterAllowed",
        "offset": 0,
        "slot": "13",
        "type": "t_mapping(t_address,t_uint256)"
      },
      {
        "astId": 1788,
        "contract": "contracts/test/USDC.sol:FiatTokenV2_1",
        "label": "_rescuer",
        "offset": 0,
        "slot": "14",
        "type": "t_address"
      },
      {
        "astId": 2040,
        "contract": "contracts/test/USDC.sol:FiatTokenV2_1",
        "label": "DOMAIN_SEPARATOR",
        "offset": 0,
        "slot": "15",
        "type": "t_bytes32"
      },
      {
        "astId": 2063,
        "contract": "contracts/test/USDC.sol:FiatTokenV2_1",
        "label": "_authorizationStates",
        "offset": 0,
        "slot": "16",
        "type": "t_mapping(t_address,t_mapping(t_bytes32,t_bool))"
      },
      {
        "astId": 2379,
        "contract": "contracts/test/USDC.sol:FiatTokenV2_1",
        "label": "_permitNonces",
        "offset": 0,
        "slot": "17",
        "type": "t_mapping(t_address,t_uint256)"
      },
      {
        "astId": 2464,
        "contract": "contracts/test/USDC.sol:FiatTokenV2_1",
        "label": "_initializedVersion",
        "offset": 0,
        "slot": "18",
        "type": "t_uint8"
      }
    ],
    "types": {
      "t_address": {
        "encoding": "inplace",
        "label": "address",
        "numberOfBytes": "20"
      },
      "t_bool": {
        "encoding": "inplace",
        "label": "bool",
        "numberOfBytes": "1"
      },
      "t_bytes32": {
        "encoding": "inplace",
        "label": "bytes32",
        "numberOfBytes": "32"
      },
      "t_mapping(t_address,t_bool)": {
        "encoding": "mapping",
        "key": "t_address",
        "label": "mapping(address => bool)",
        "numberOfBytes": "32",
        "value": "t_bool"
      },
      "t_mapping(t_address,t_mapping(t_address,t_uint256))": {
        "encoding": "mapping",
        "key": "t_address",
        "label": "mapping(address => mapping(address => uint256))",
        "numberOfBytes": "32",
        "value": "t_mapping(t_address,t_uint256)"
      },
      "t_mapping(t_address,t_mapping(t_bytes32,t_bool))": {
        "encoding": "mapping",
        "key": "t_address",
        "label": "mapping(address => mapping(bytes32 => bool))",
        "numberOfBytes": "32",
        "value": "t_mapping(t_bytes32,t_bool)"
      },
      "t_mapping(t_address,t_uint256)": {
        "encoding": "mapping",
        "key": "t_address",
        "label": "mapping(address => uint256)",
        "numberOfBytes": "32",
        "value": "t_uint256"
      },
      "t_mapping(t_bytes32,t_bool)": {
        "encoding": "mapping",
        "key": "t_bytes32",
        "label": "mapping(bytes32 => bool)",
        "numberOfBytes": "32",
        "value": "t_bool"
      },
      "t_string_storage": {
        "encoding": "bytes",
        "label": "string",
        "numberOfBytes": "32"
      },
      "t_uint256": {
        "encoding": "inplace",
        "label": "uint256",
        "numberOfBytes": "32"
      },
      "t_uint8": {
        "encoding": "inplace",
        "label": "uint8",
        "numberOfBytes": "1"
      }
    }
  }
}